time,play,score
12:00,Marc Gasol vs. Montrezl Harrell (Mike Conley gains possession),0 - 0
11:38,Mike Conley makes 25-foot  three point jumper  (Marc Gasol assists),3 - 0
11:32,Trevor Ariza  lost ball turnover (Chandler Parsons steals),3 - 0
11:15,Marc Gasol  bad pass (Trevor Ariza steals),3 - 0
11:10,James Harden  bad pass (Marc Gasol steals),3 - 0
11:06,Ryan Anderson shooting foul  (Chandler Parsons draws the foul),3 - 0
11:06,Chandler Parsons makes free throw 1 of 2,4 - 0
11:06,Chandler Parsons makes free throw 2 of 2,5 - 0
10:53,Ryan Anderson makes 6-foot two point shot,5 - 2
10:37,Chandler Parsons  misses 27-foot three point jumper,5 - 2
10:36,Montrezl Harrell defensive rebound,5 - 2
10:26,Ryan Anderson  misses 28-foot three point jumper,5 - 2
10:23,Tony Allen defensive rebound,5 - 2
10:14,Ryan Anderson shooting foul  (Tony Allen draws the foul),5 - 2
10:14,Tony Allen makes free throw 1 of 2,6 - 2
10:14,Eric Gordon enters the game for Ryan Anderson,6 - 2
10:14,Tony Allen makes free throw 2 of 2,7 - 2
10:03,JaMychal Green personal foul  (Eric Gordon draws the foul),7 - 2
9:56,Patrick Beverley makes 3-foot jumper (James Harden assists),7 - 4
9:45,JaMychal Green makes 20-foot jumper (Tony Allen assists),9 - 4
9:36,James Harden makes 24-foot  three point jumper,9 - 7
9:17,Marc Gasol makes 7-foot two point shot,11 - 7
9:06,Eric Gordon makes driving layup,11 - 9
8:56,Mike Conley  bad pass (Montrezl Harrell steals),11 - 9
8:44,Patrick Beverley  misses 23-foot three point jumper,11 - 9
8:44,Rockets offensive team rebound,11 - 9
8:44,Chandler Parsons loose ball foul  (Montrezl Harrell draws the foul),11 - 9
8:38,Patrick Beverley makes two point shot (Montrezl Harrell assists),11 - 11
8:17,Tony Allen offensive Charge  (James Harden draws the foul),11 - 11
8:17,Tony Allen  turnover,11 - 11
8:07,Tony Allen shooting foul  (James Harden draws the foul),11 - 11
8:07,James Harden makes free throw 1 of 3,11 - 12
8:07,James Harden misses free throw 2 of 3,11 - 12
8:07,Rockets offensive team rebound,11 - 12
8:07,James Harden makes free throw 3 of 3,11 - 13
8:03,Grizzlies Full timeout,11 - 13
8:03,Ryan Anderson enters the game for Eric Gordon,11 - 13
7:41,Tony Allen makes 15-foot jumper (Chandler Parsons assists),13 - 13
7:22,Trevor Ariza makes 17-foot two point shot,13 - 15
6:58,Chandler Parsons  misses 18-foot jumper,13 - 15
6:56,Montrezl Harrell defensive rebound,13 - 15
6:35,Trevor Ariza  misses 24-foot three point jumper,13 - 15
6:33,Marc Gasol defensive rebound,13 - 15
6:20,JaMychal Green makes 26-foot  three point jumper  (Mike Conley assists),16 - 15
6:00,James Harden  misses 14-foot jumper,16 - 15
5:58,Marc Gasol defensive rebound,16 - 15
5:50,Tony Allen makes driving layup,18 - 15
5:33,James Harden  bad pass (Mike Conley steals),18 - 15
5:28,Mike Conley makes two point shot,20 - 15
5:18,Ryan Anderson makes 27-foot  three point jumper  (James Harden assists),20 - 18
5:01,James Ennis enters the game for Tony Allen,20 - 18
5:01,Eric Gordon enters the game for Patrick Beverley,20 - 18
5:01,Zach Randolph enters the game for JaMychal Green,20 - 18
5:01,Nene  enters the game for Montrezl Harrell,20 - 18
4:50,Chandler Parsons  misses 14-foot two point shot,20 - 18
4:48,Trevor Ariza defensive rebound,20 - 18
4:41,James Ennis blocks James Harden's  layup,20 - 18
4:41,Chandler Parsons defensive rebound,20 - 18
4:35,Mike Conley  misses 24-foot three point jumper,20 - 18
4:33,Trevor Ariza defensive rebound,20 - 18
4:26,James Harden makes layup,20 - 20
4:13,Zach Randolph Out-of-Bounds Bad Pass Turnover,20 - 20
4:01,James Harden makes driving layup,20 - 22
3:46,Ryan Anderson shooting foul  (Marc Gasol draws the foul),20 - 22
3:46,Marc Gasol misses free throw 1 of 2,20 - 22
3:46,Grizzlies offensive team rebound,20 - 22
3:46,Vince Carter enters the game for Chandler Parsons,20 - 22
3:46,Sam Dekker enters the game for Ryan Anderson,20 - 22
3:46,Marc Gasol makes free throw 2 of 2,21 - 22
3:35,Zach Randolph shooting foul  (Nene  draws the foul),21 - 22
3:35,Nene  makes free throw 1 of 2,21 - 23
3:35,Nene  makes free throw 2 of 2,21 - 24
3:26,Marc Gasol offensive foul  (Nene  draws the foul),21 - 24
3:26,Marc Gasol  turnover,21 - 24
3:13,Sam Dekker  misses 24-foot three point jumper,21 - 24
3:12,Zach Randolph defensive rebound,21 - 24
2:58,Mike Conley  misses 27-foot three point jumper,21 - 24
2:56,Trevor Ariza defensive rebound,21 - 24
2:53,Vince Carter shooting foul  (James Harden draws the foul),21 - 24
2:53,Rockets Full timeout,21 - 24
2:53,James Harden makes free throw 1 of 2,21 - 25
2:53,James Harden makes free throw 2 of 2,21 - 26
2:38,Mike Conley makes 19-foot jumper (Marc Gasol assists),23 - 26
2:19,James Harden  traveling,23 - 26
2:19,Tony Allen enters the game for Mike Conley,23 - 26
2:19,Corey Brewer enters the game for Trevor Ariza,23 - 26
2:04,James Ennis  misses driving layup,23 - 26
2:02,Corey Brewer defensive rebound,23 - 26
1:59,Sam Dekker  misses layup,23 - 26
1:57,Nene  offensive rebound,23 - 26
1:54,Corey Brewer makes dunk (Nene  assists),23 - 28
1:43,Nene  shooting foul  (Vince Carter draws the foul),23 - 28
1:43,Vince Carter misses free throw 1 of 2,23 - 28
1:43,Grizzlies offensive team rebound,23 - 28
1:43,JaMychal Green enters the game for Marc Gasol,23 - 28
1:43,Vince Carter makes free throw 2 of 2,24 - 28
1:32,Corey Brewer  misses 26-foot three point jumper,24 - 28
1:31,James Ennis defensive rebound,24 - 28
1:20,Zach Randolph  misses 16-foot two point shot,24 - 28
1:19,Corey Brewer defensive rebound,24 - 28
1:07,Sam Dekker makes 23-foot  three point jumper  (Nene  assists),24 - 31
49.0,Sam Dekker personal foul  (JaMychal Green draws the foul),24 - 31
49.0,JaMychal Green misses free throw 1 of 2,24 - 31
49.0,Grizzlies offensive team rebound,24 - 31
49.0,JaMychal Green makes free throw 2 of 2,25 - 31
37.0,James Harden Out-of-Bounds Bad Pass Turnover,25 - 31
27.0,Vince Carter  misses 25-foot three point jumper,25 - 31
26.0,Nene  defensive rebound,25 - 31
3.0,James Harden  misses 25-foot three point shot,25 - 31
2.0,Zach Randolph defensive rebound,25 - 31
0.0,End of the 1st Quarter,25 - 31
11:44,Corey Brewer  misses 24-foot three point jumper,25 - 31
11:42,Zach Randolph defensive rebound,25 - 31
11:26,Troy Daniels  misses 28-foot three point pullup jump shot,25 - 31
11:25,Zach Randolph offensive rebound,25 - 31
11:17,Zach Randolph  misses 14-foot step back jumpshot,25 - 31
11:15,Grizzlies offensive team rebound,27 - 31
11:15,Troy Daniels makes free throw 1 of 1,27 - 31
11:15,Troy Daniels makes technical free throw,27 - 31
11:15,technical foul(1st technical foul),27 - 31
11:15,Eric Gordon in bound foul  (Troy Daniels draws the foul),27 - 31
11:00,Nene  blocks Zach Randolph 's 7-foot  shot,27 - 31
10:59,Sam Dekker defensive rebound,27 - 31
10:57,Troy Daniels shooting foul  (Corey Brewer draws the foul),27 - 31
10:57,Corey Brewer misses free throw 1 of 2,27 - 31
10:57,Rockets offensive team rebound,27 - 31
10:57,Corey Brewer makes free throw 2 of 2,27 - 32
10:44,Tony Allen makes driving layup,29 - 32
10:34,Eric Gordon  misses 27-foot three point jumper,29 - 32
10:33,Zach Randolph defensive rebound,29 - 32
10:19,Zach Randolph  misses layup,29 - 32
10:18,Corey Brewer defensive rebound,29 - 32
10:11,Sam Dekker makes 24-foot  three point jumper  (Patrick Beverley assists),29 - 35
9:47,Zach Randolph  misses 6-foot jumper,29 - 35
9:45,JaMychal Green vs. Nene  (Sam Dekker gains possession),29 - 35
9:45,Rockets defensive team rebound,29 - 35
9:30,Tony Allen shooting block foul  (Sam Dekker draws the foul),29 - 35
9:30,Sam Dekker misses free throw 1 of 2,29 - 35
9:30,Rockets offensive team rebound,29 - 35
9:30,Mike Conley enters the game for Tony Allen,29 - 35
9:30,Sam Dekker makes free throw 2 of 2,29 - 36
9:15,Vince Carter makes two point shot (Mike Conley assists),31 - 36
9:03,Patrick Beverley makes driving layup,31 - 38
8:52,Sam Dekker defensive 3-seconds (Technical Foul),31 - 38
8:52,Official timeout,31 - 38
8:52,Zach Randolph misses technical free throw,31 - 38
8:52,Grizzlies offensive team rebound,31 - 38
8:42,JaMychal Green makes two point shot (Zach Randolph assists),33 - 38
8:23,Eric Gordon makes 25-foot  three point jumper  (Sam Dekker assists),33 - 41
8:07,Mike Conley makes driving layup,35 - 41
7:48,Eric Gordon  misses 26-foot three point jumper,35 - 41
7:48,JaMychal Green defensive rebound,35 - 41
7:39,Mike Conley  bad pass,35 - 41
7:28,Mike Conley blocks Eric Gordon 's 4-foot  layup,35 - 41
7:28,Grizzlies defensive team rebound,35 - 41
7:28,James Ennis enters the game for Vince Carter,35 - 41
7:28,Marc Gasol enters the game for Zach Randolph,35 - 41
7:15,Corey Brewer shooting foul  (James Ennis draws the foul),35 - 41
7:15,James Ennis misses free throw 1 of 2,35 - 41
7:15,Grizzlies offensive team rebound,35 - 41
7:15,Montrezl Harrell enters the game for Nene,35 - 41
7:15,Ryan Anderson enters the game for Sam Dekker,35 - 41
7:15,Chandler Parsons enters the game for Troy Daniels,35 - 41
7:15,James Ennis makes free throw 2 of 2,36 - 41
7:07,James Ennis personal foul  (Eric Gordon draws the foul),36 - 41
7:01,Montrezl Harrell makes layup,36 - 43
6:47,James Ennis Out-of-Bounds Bad Pass Turnover,36 - 43
6:37,JaMychal Green shooting foul  (Ryan Anderson draws the foul),36 - 43
6:37,Ryan Anderson makes free throw 1 of 2,36 - 44
6:37,Ryan Anderson makes free throw 2 of 2,36 - 45
6:31,Grizzlies Full timeout,36 - 45
6:31,James Harden enters the game for Eric Gordon,36 - 45
6:31,Trevor Ariza enters the game for Corey Brewer,36 - 45
6:18,James Ennis makes dunk (Marc Gasol assists),38 - 45
6:01,James Harden makes 25-foot  three point jumper  (Montrezl Harrell assists),38 - 48
5:39,Chandler Parsons  misses 26-foot three point jumper,38 - 48
5:37,James Ennis offensive rebound,38 - 48
5:24,James Ennis makes layup (JaMychal Green assists),40 - 48
5:09,Ryan Anderson makes 20-foot two point shot (James Harden assists),40 - 50
4:58,James Harden kicked ball violation,40 - 50
4:47,Marc Gasol  bad pass (Montrezl Harrell steals),40 - 50
4:41,Trevor Ariza makes 25-foot  three point jumper  (James Harden assists),40 - 53
4:07,James Ennis  misses 24-foot three point jumper,40 - 53
4:07,Montrezl Harrell defensive rebound,40 - 53
3:49,James Harden makes driving layup,40 - 55
3:40,Grizzlies 20 Sec. timeout,40 - 55
3:40,Eric Gordon enters the game for Patrick Beverley,40 - 55
3:31,Montrezl Harrell personal foul  (Marc Gasol draws the foul),40 - 55
3:23,Marc Gasol makes 20-foot jumper (Mike Conley assists),42 - 55
3:00,Montrezl Harrell  misses layup,42 - 55
3:00,Chandler Parsons defensive rebound,42 - 55
2:51,Marc Gasol makes dunk (James Ennis assists),44 - 55
2:42,Montrezl Harrell makes dunk (Trevor Ariza assists),44 - 57
2:31,Marc Gasol  misses layup,44 - 57
2:29,James Harden defensive rebound,44 - 57
2:28,James Ennis personal foul  (Trevor Ariza draws the foul),44 - 59
2:28,Patrick Beverley enters the game for Ryan Anderson,44 - 57
2:28,Zach Randolph enters the game for JaMychal Green,44 - 57
2:28,Trevor Ariza makes free throw 1 of 2,44 - 58
2:28,Trevor Ariza makes free throw 2 of 2,44 - 59
2:28,Rockets Full timeout,44 - 59
2:08,Zach Randolph  misses 5-foot jumper,44 - 59
2:06,Zach Randolph offensive rebound,44 - 59
2:03,Zach Randolph makes layup,46 - 59
1:47,Montrezl Harrell makes driving layup,46 - 61
1:31,Chandler Parsons  misses 25-foot three point jumper,46 - 61
1:31,Rockets defensive team rebound,46 - 61
1:31,Zach Randolph loose ball foul  (Trevor Ariza draws the foul),46 - 61
1:31,Trevor Ariza makes free throw 1 of 2,46 - 62
1:31,Nene  enters the game for Montrezl Harrell,46 - 62
1:31,Trevor Ariza misses free throw 2 of 2,46 - 62
1:31,Marc Gasol defensive rebound,46 - 62
1:10,Chandler Parsons makes 25-foot  three pointer,49 - 62
1:01,Chandler Parsons shooting foul  (Nene  draws the foul),49 - 62
1:01,Nene  makes free throw 1 of 2,49 - 63
1:01,Nene  makes free throw 2 of 2,49 - 64
49.0,Mike Conley  misses two point shot,49 - 64
49.0,Rockets defensive team rebound,49 - 64
32.0,James Harden  lost ball turnover (Zach Randolph steals),49 - 64
29.0,Patrick Beverley shooting foul  (James Ennis draws the foul),49 - 64
29.0,James Ennis makes free throw 1 of 2,50 - 64
29.0,Vince Carter enters the game for Mike Conley,50 - 64
29.0,JaMychal Green enters the game for Zach Randolph,50 - 64
29.0,James Ennis makes free throw 2 of 2,51 - 64
5.0,James Harden  misses 25-foot three point jumper,51 - 64
4.0,James Ennis defensive rebound,51 - 64
0.0,End of the 2nd Quarter,51 - 64
11:48,Ryan Anderson  misses 29-foot three point jumper,51 - 64
11:48,Mike Conley defensive rebound,51 - 64
11:33,Chandler Parsons  misses 26-foot three point jumper,51 - 64
11:33,Montrezl Harrell defensive rebound,51 - 64
11:22,Ryan Anderson  misses 19-foot jumper,51 - 64
11:21,Mike Conley defensive rebound,51 - 64
11:11,Marc Gasol  bad pass,51 - 64
10:57,Ryan Anderson  misses 27-foot three point jumper,51 - 64
10:56,Montrezl Harrell offensive rebound,51 - 64
10:56,Montrezl Harrell  misses tip layup,51 - 64
10:56,JaMychal Green defensive rebound,51 - 64
10:42,Tony Allen makes 3-foot layup (Marc Gasol assists),53 - 64
10:27,Marc Gasol shooting foul  (James Harden draws the foul),53 - 64
10:27,James Harden makes free throw 1 of 2,53 - 65
10:27,James Harden makes free throw 2 of 2,53 - 66
10:22,Patrick Beverley personal foul  (Mike Conley draws the foul),53 - 66
10:12,Mike Conley  bad pass (James Harden steals),53 - 66
10:11,Mike Conley personal foul  (Trevor Ariza draws the foul),53 - 66
9:52,Montrezl Harrell  misses 5-foot jumper,53 - 66
9:52,Trevor Ariza offensive rebound,53 - 66
9:52,Trevor Ariza makes two point shot,53 - 68
9:52,Grizzlies Full timeout,53 - 68
9:38,Mike Conley  lost ball turnover (Patrick Beverley steals),53 - 68
9:37,Ryan Anderson  lost ball turnover (Chandler Parsons steals),53 - 68
9:22,Mike Conley  misses 26-foot three point jumper,53 - 68
9:19,JaMychal Green offensive rebound,53 - 68
9:18,Tony Allen makes layup,55 - 68
9:00,Montrezl Harrell makes two point shot (James Harden assists),55 - 70
8:48,JaMychal Green offensive foul  (Patrick Beverley draws the foul),55 - 70
8:48,JaMychal Green  turnover,55 - 70
8:48,Vince Carter enters the game for Chandler Parsons,55 - 70
8:48,Grizzlies delay of game violation,55 - 70
8:22,Ryan Anderson  misses 43-foot three point jumper,55 - 70
8:21,Tony Allen defensive rebound,55 - 70
8:17,Tony Allen Out-of-Bounds Bad Pass Turnover,55 - 70
8:08,James Harden  bad pass (Tony Allen steals),55 - 70
8:03,Tony Allen makes two point shot,57 - 70
7:50,JaMychal Green shooting foul  (Ryan Anderson draws the foul),57 - 70
7:50,Ryan Anderson makes free throw 1 of 2,57 - 71
7:50,James Ennis enters the game for JaMychal Green,57 - 71
7:50,Ryan Anderson misses free throw 2 of 2,57 - 71
7:48,Mike Conley defensive rebound,57 - 71
7:37,Marc Gasol  bad pass,57 - 71
7:37,Tony Allen kicked ball violation,57 - 71
7:13,Patrick Beverley  misses 26-foot three point jumper,57 - 71
7:11,Mike Conley defensive rebound,57 - 71
7:05,Marc Gasol  misses 27-foot three point jumper,57 - 71
7:05,Vince Carter offensive rebound,57 - 71
7:01,Vince Carter  misses layup,57 - 71
7:01,Patrick Beverley defensive rebound,57 - 71
6:54,Ryan Anderson  misses 26-foot three point jumper,57 - 71
6:52,Marc Gasol defensive rebound,57 - 71
6:41,James Ennis makes 26-foot  three point jumper  (Vince Carter assists),60 - 71
6:33,Patrick Beverley  misses 26-foot three point jumper,60 - 71
6:33,Grizzlies defensive team rebound,60 - 71
6:13,Mike Conley makes 2-foot layup (Tony Allen assists),62 - 71
6:07,James Harden  misses 25-foot three point pullup jump shot,62 - 71
6:05,Marc Gasol defensive rebound,62 - 71
5:52,Tony Allen makes two point shot (Marc Gasol assists),64 - 71
5:52,Rockets Full timeout,64 - 71
5:52,Troy Daniels enters the game for Mike Conley,64 - 71
5:52,Eric Gordon enters the game for Patrick Beverley,64 - 71
5:41,Trevor Ariza  misses 6-foot jumper,64 - 71
5:39,Trevor Ariza offensive rebound,64 - 71
5:39,Trevor Ariza  misses tip layup,64 - 71
5:39,Trevor Ariza offensive rebound,64 - 71
5:37,Vince Carter personal foul  (Trevor Ariza draws the foul),64 - 71
5:18,Montrezl Harrell makes jumper (Eric Gordon assists),64 - 73
5:03,Tony Allen makes layup (Marc Gasol assists),66 - 73
4:47,Eric Gordon makes 26-foot  three point jumper  (James Harden assists),66 - 76
4:22,Marc Gasol makes layup,68 - 76
4:03,Eric Gordon makes 25-foot  three point jumper  (James Harden assists),68 - 79
3:48,Marc Gasol makes 26-foot  three point jumper  (Tony Allen assists),71 - 79
3:34,Trevor Ariza  misses 26-foot three point jumper,71 - 79
3:33,Tony Allen defensive rebound,71 - 79
3:29,James Harden shooting foul  (Tony Allen draws the foul),71 - 79
3:29,Tony Allen misses free throw 1 of 2,71 - 79
3:29,Grizzlies offensive team rebound,71 - 79
3:29,Nene  enters the game for Montrezl Harrell,71 - 79
3:29,Sam Dekker enters the game for Ryan Anderson,71 - 79
3:29,Tony Allen misses free throw 2 of 2,71 - 79
3:29,Sam Dekker defensive rebound,71 - 79
3:09,Nene  makes dunk (James Harden assists),71 - 81
2:53,Grizzlies 20 Sec. timeout,71 - 81
2:53,Zach Randolph enters the game for Marc Gasol,71 - 81
2:53,Mike Conley enters the game for Tony Allen,71 - 81
2:53,Corey Brewer enters the game for Nene,71 - 81
2:44,Troy Daniels makes 26-foot  three point jumper  (Zach Randolph assists),74 - 81
2:16,Sam Dekker  misses 23-foot three point jumper,74 - 81
2:15,Vince Carter defensive rebound,74 - 81
2:09,Mike Conley makes driving layup,76 - 81
2:09,James Harden shooting foul  (Mike Conley draws the foul),77 - 81
2:09,Mike Conley makes free throw 1 of 1,77 - 81
1:58,Eric Gordon  misses 26-foot three point pullup jump shot,77 - 81
1:57,Zach Randolph defensive rebound,77 - 81
1:47,Zach Randolph makes 26-foot  three point jumper  (Troy Daniels assists),80 - 81
1:39,Zach Randolph personal foul  (James Harden draws the foul),80 - 81
1:39,James Harden makes free throw 1 of 2,80 - 82
1:39,James Harden makes free throw 2 of 2,80 - 83
1:23,Troy Daniels  misses 28-foot three point jumper,80 - 83
1:22,Rockets defensive team rebound,80 - 83
1:22,James Ennis loose ball foul  (Sam Dekker draws the foul),80 - 83
1:22,Sam Dekker makes free throw 1 of 2,80 - 84
1:22,Nene  enters the game for Trevor Ariza,80 - 84
1:22,Sam Dekker misses free throw 2 of 2,80 - 84
1:22,Zach Randolph defensive rebound,80 - 84
1:07,Troy Daniels makes 24-foot  three point jumper  (Mike Conley assists),83 - 84
46.0,Nene   misses 15-foot jumper,83 - 84
45.0,Sam Dekker offensive rebound,83 - 84
42.0,James Ennis shooting foul  (Sam Dekker draws the foul),83 - 84
42.0,Sam Dekker makes free throw 1 of 2,83 - 85
42.0,JaMychal Green enters the game for James Ennis,83 - 85
42.0,Sam Dekker misses free throw 2 of 2,83 - 85
42.0,Zach Randolph defensive rebound,83 - 85
30.0,Mike Conley  misses 20-foot jumper,83 - 85
29.0,James Harden defensive rebound,83 - 85
26.0,James Harden  misses 26-foot three point pullup jump shot,83 - 85
25.0,Sam Dekker offensive rebound,83 - 85
20.0,Eric Gordon  misses 26-foot three point jumper,83 - 85
19.0,Zach Randolph defensive rebound,83 - 85
7.0,Eric Gordon personal foul  (Mike Conley draws the foul),83 - 85
0.0,JaMychal Green  misses 24-foot three point jumper,83 - 85
0.0,Grizzlies offensive team rebound,83 - 85
0.0,End of the 3rd Quarter,83 - 85
11:40,Patrick Beverley blocks James Ennis 's 4-foot  layup,83 - 85
11:40,Grizzlies offensive team rebound,83 - 85
11:38,James Ennis  bad pass (Patrick Beverley steals),83 - 85
11:34,Eric Gordon  disc dribble turnover,83 - 85
11:26,Zach Randolph makes layup (Mike Conley assists),85 - 85
11:11,Eric Gordon  misses 26-foot three point jumper,85 - 85
11:10,Corey Brewer offensive rebound,85 - 85
11:06,Corey Brewer  misses jumper,85 - 85
11:04,Troy Daniels defensive rebound,85 - 85
11:00,Nene  shooting block foul  (Troy Daniels draws the foul),85 - 85
11:00,Troy Daniels makes free throw 1 of 2,86 - 85
11:00,Troy Daniels makes free throw 2 of 2,87 - 85
10:47,Eric Gordon  lost ball turnover (Zach Randolph steals),87 - 85
10:27,Zach Randolph makes 11-foot two point shot,89 - 85
10:12,Sam Dekker  misses layup,89 - 85
10:10,Mike Conley defensive rebound,89 - 85
9:53,Zach Randolph  misses 26-foot three point jumper,89 - 85
9:52,James Ennis offensive rebound,89 - 85
9:48,Troy Daniels  misses 26-foot,89 - 85
9:47,Zach Randolph offensive rebound,89 - 85
9:41,Nene  personal foul  (Zach Randolph draws the foul),89 - 85
9:41,Trevor Ariza enters the game for Sam Dekker,89 - 85
9:32,Zach Randolph makes 7-foot jumper,91 - 85
9:32,Eric Gordon shooting block foul  (Zach Randolph draws the foul),91 - 85
9:32,Vince Carter enters the game for James Ennis,91 - 85
9:32,Zach Randolph makes free throw 1 of 1,92 - 85
9:19,Patrick Beverley  misses driving layup,92 - 85
9:18,Troy Daniels defensive rebound,92 - 85
9:18,Troy Daniels  bad pass (Nene  steals),92 - 85
9:15,Nene  makes 5-foot jumper,92 - 87
8:45,Zach Randolph  misses 17-foot two point shot,92 - 87
8:44,Trevor Ariza defensive rebound,92 - 87
8:40,Troy Daniels shooting block foul  (Eric Gordon draws the foul),92 - 87
8:40,Official timeout,92 - 87
8:40,Eric Gordon makes free throw 1 of 2,92 - 88
8:40,Eric Gordon makes free throw 2 of 2,92 - 89
8:22,Zach Randolph  misses 10-foot jumper,92 - 89
8:22,Patrick Beverley defensive rebound,92 - 89
8:07,Corey Brewer makes 24-foot  three point jumper  (Patrick Beverley assists),92 - 92
7:54,Mike Conley  misses Driving Floating Jump Shot,92 - 92
7:52,Eric Gordon defensive rebound,92 - 92
7:37,Trevor Ariza  misses 26-foot three point jumper,92 - 92
7:33,Troy Daniels defensive rebound,92 - 92
7:26,Zach Randolph makes layup (Mike Conley assists),94 - 92
7:13,Troy Daniels personal foul  (Eric Gordon draws the foul),94 - 92
7:13,Marc Gasol enters the game for JaMychal Green,94 - 92
7:13,Tony Allen enters the game for Mike Conley,94 - 92
7:09,Corey Brewer  misses 24-foot three point jumper,94 - 92
7:09,Zach Randolph defensive rebound,94 - 92
6:56,Tony Allen offensive foul  (Corey Brewer draws the foul),94 - 92
6:56,Tony Allen  turnover,94 - 92
6:43,Marc Gasol blocks Corey Brewer 's 6-foot  jumper,94 - 92
6:43,Grizzlies defensive team rebound,94 - 92
6:43,Corey Brewer loose ball foul  (Marc Gasol draws the foul),94 - 92
6:20,Troy Daniels  lost ball turnover (Patrick Beverley steals),94 - 92
6:13,Eric Gordon  misses 27-foot three point jumper,94 - 92
6:11,Tony Allen defensive rebound,94 - 92
6:11,Patrick Beverley personal foul  (Tony Allen draws the foul),96 - 92
6:11,Rockets Full timeout,94 - 92
6:11,Montrezl Harrell enters the game for Patrick Beverley,94 - 92
6:11,Ryan Anderson enters the game for Nene,94 - 92
6:11,James Harden enters the game for Corey Brewer,94 - 92
6:11,Mike Conley enters the game for Zach Randolph,94 - 92
6:11,James Ennis enters the game for Vince Carter,94 - 92
6:11,Tony Allen makes free throw 1 of 2,95 - 92
6:11,Tony Allen makes free throw 2 of 2,96 - 92
6:03,Tony Allen shooting foul  (James Harden draws the foul),96 - 92
6:03,James Harden makes free throw 1 of 3,96 - 93
6:03,James Harden makes free throw 2 of 3,96 - 94
6:03,James Harden makes free throw 3 of 3,96 - 95
5:39,Tony Allen  misses 24-foot three point jumper,96 - 95
5:39,Trevor Ariza defensive rebound,96 - 95
5:30,Trevor Ariza  bad pass (Mike Conley steals),96 - 95
5:26,Tony Allen makes dunk (Mike Conley assists),98 - 95
5:09,Trevor Ariza  misses 27-foot three point jumper,98 - 95
5:09,Marc Gasol defensive rebound,98 - 95
4:56,Mike Conley makes 25-foot  three point jumper,101 - 95
4:56,Rockets Full timeout,101 - 95
4:39,Montrezl Harrell  misses jumper,101 - 95
4:37,Trevor Ariza makes tip shot,101 - 97
4:37,Trevor Ariza offensive rebound,101 - 95
4:20,Montrezl Harrell shooting foul  (Tony Allen draws the foul),101 - 97
4:20,Tony Allen misses free throw 1 of 2,101 - 97
4:20,Grizzlies offensive team rebound,101 - 97
4:20,Tony Allen misses free throw 2 of 2,101 - 97
4:20,James Harden defensive rebound,101 - 97
4:07,Ryan Anderson  misses 27-foot three point jumper,101 - 97
4:05,James Ennis defensive rebound,101 - 97
3:45,Marc Gasol  misses 17-foot turnaround fadeaway shot,101 - 97
3:44,James Ennis offensive rebound,101 - 97
3:41,James Ennis makes layup,103 - 97
3:34,Tony Allen shooting foul  (James Harden draws the foul),103 - 98
3:34,Zach Randolph enters the game for Tony Allen,103 - 97
3:34,James Harden makes free throw 1 of 2,103 - 98
3:34,Patrick Beverley enters the game for Eric Gordon,103 - 98
3:34,Nene  enters the game for Montrezl Harrell,103 - 98
3:34,James Harden makes free throw 2 of 2,103 - 99
3:16,Mike Conley offensive Charge  (Patrick Beverley draws the foul),103 - 99
3:16,Mike Conley  turnover,103 - 99
3:04,James Harden  misses driving layup,103 - 99
3:03,Grizzlies defensive team rebound,103 - 99
2:44,Zach Randolph makes 12-foot two point shot,105 - 99
2:31,Nene  makes 3-foot layup (James Harden assists),105 - 101
2:09,James Ennis  bad pass,105 - 101
2:04,James Harden offensive foul  (James Ennis draws the foul),105 - 101
2:04,James Harden  turnover,105 - 101
1:42,Zach Randolph  lost ball turnover (Nene  steals),105 - 101
1:30,Nene  makes 2-foot layup (Patrick Beverley assists),105 - 103
1:30,Grizzlies Full timeout,105 - 103
1:30,Tony Allen enters the game for James Ennis,105 - 103
1:30,James Ennis enters the game for Tony Allen,105 - 103
1:16,Marc Gasol makes 4-foot jumper (Mike Conley assists),107 - 103
56.0,Trevor Ariza  misses 25-foot three point jumper,107 - 103
55.0,Nene  offensive rebound,107 - 103
46.0,Ryan Anderson  misses 27-foot three point jumper,107 - 103
