time,play,score
44.0,Mike Conley defensive rebound,107 - 103
26.0,Troy Daniels makes 29-foot  three point jumper  (Mike Conley assists),110 - 103
26.0,Rockets Full timeout,110 - 103
26.0,Vince Carter enters the game for Zach Randolph,110 - 103
26.0,JaMychal Green enters the game for Troy Daniels,110 - 103
26.0,Eric Gordon enters the game for Patrick Beverley,110 - 103
20.0,James Harden makes driving dunk,110 - 105
20.0,Rockets delay of game violation,110 - 105
20.0,Grizzlies 20 Sec. timeout,110 - 105
20.0,Troy Daniels enters the game for JaMychal Green,110 - 105
20.0,Patrick Beverley enters the game for Ryan Anderson,110 - 105
20.0,Corey Brewer enters the game for Nene,110 - 105
16.0,Marc Gasol offensive foul  (Trevor Ariza draws the foul),110 - 105
16.0,Marc Gasol  turnover,110 - 105
16.0,JaMychal Green enters the game for Troy Daniels,110 - 105
16.0,Nene  enters the game for Patrick Beverley,110 - 105
16.0,Ryan Anderson enters the game for Corey Brewer,110 - 105
9.0,James Harden  misses 28-foot three point pullup jump shot,110 - 105
7.0,Rockets offensive team rebound,110 - 105
7.0,Rockets 20 Sec. timeout,110 - 105
6.0,Nene   misses cutting layup,110 - 105
5.0,JaMychal Green defensive rebound,110 - 105
0.0,Mike Conley  misses 77-foot Regular Jump Shot,110 - 105
0.0,Grizzlies offensive team rebound,110 - 105
0.0,End of the 4th Quarter,110 - 105
0.0,End of Game,110 - 105
