time,play,score
2:00,Jarell Martin defensive rebound,101 - 79
1:42,Deyonta Davis makes dunk (Wade Baldwin IV assists),101 - 81
1:31,Deyonta Davis blocks Brian Roberts's  layup,101 - 81
1:31,Hornets offensive team rebound,101 - 81
1:17,Aaron Harrison  misses 21-foot step back jumpshot,101 - 81
1:17,Hornets offensive team rebound,101 - 81
1:17,shot clock turnover,101 - 81
56.0,Wade Baldwin IV makes driving layup (Deyonta Davis assists),101 - 83
45.0,Brian Roberts  misses 14-foot two point jumper,101 - 83
43.0,Deyonta Davis defensive rebound,101 - 83
36.0,Wade Baldwin IV makes 15-foot two point shot,101 - 85
17.0,Treveon Graham makes 26-foot  three point jumper  (Frank Kaminsky III assists),104 - 85
1.0,Wade Baldwin IV  misses 25-foot three point jumper,104 - 85
0.0,Grizzlies offensive team rebound,104 - 85
0.0,End of the 4th Quarter,104 - 85
0.0,End of Game,104 - 85
