time,play,score
12:00,Cody Zeller vs. Tristan Thompson (Marvin Williams gains possession),0 - 0
11:38,Nicolas Batum makes 22-foot jumper,2 - 0
11:25,Kevin Love makes 17-foot jumper (LeBron James assists),2 - 2
11:10,Cody Zeller  lost ball turnover (LeBron James steals),2 - 2
11:03,J.R. Smith  misses 25-foot three point jumper,2 - 2
11:02,Michael Kidd-Gilchrist defensive rebound,2 - 2
10:52,Michael Kidd-Gilchrist  misses 14-foot two point jumper,2 - 2
10:52,Tristan Thompson defensive rebound,2 - 2
10:37,Kevin Love makes layup,2 - 4
10:26,Tristan Thompson shooting foul  (Kemba Walker draws the foul),2 - 4
10:26,Kemba Walker makes free throw 1 of 2,3 - 4
10:26,Kemba Walker misses free throw 2 of 2,3 - 4
10:26,Kevin Love defensive rebound,3 - 4
10:15,Marvin Williams personal foul  (Kevin Love draws the foul),3 - 4
10:02,shot clock turnover,3 - 4
9:51,Cody Zeller makes 5-foot jumper (Nicolas Batum assists),5 - 4
9:34,LeBron James makes 25-foot  three point jumper  (Kyrie Irving assists),5 - 7
9:18,Kemba Walker makes 26-foot  three point jumper,8 - 7
9:06,Kevin Love makes 8-foot two point shot (Kyrie Irving assists),8 - 9
8:48,Nicolas Batum  misses 24-foot three point jumper,8 - 9
8:48,Kyrie Irving defensive rebound,8 - 9
8:38,J.R. Smith makes 25-foot  three point jumper  (LeBron James assists),8 - 12
8:23,Kemba Walker  lost ball turnover (Kevin Love steals),8 - 12
8:18,Kyrie Irving  misses two point shot,8 - 12
8:18,Cody Zeller defensive rebound,8 - 12
8:10,Kyrie Irving personal foul  (Kemba Walker draws the foul),8 - 12
8:00,Nicolas Batum  lost ball turnover (Tristan Thompson steals),8 - 12
7:54,LeBron James  bad pass (Cody Zeller steals),8 - 12
7:50,Cody Zeller  bad pass (LeBron James steals),8 - 12
7:46,Tristan Thompson makes layup (LeBron James assists),8 - 14
7:41,Hornets Full timeout,8 - 14
7:30,Marvin Williams  misses,8 - 14
7:28,LeBron James defensive rebound,8 - 14
7:22,LeBron James makes 19-foot jumper,8 - 16
7:03,Cody Zeller makes layup (Michael Kidd-Gilchrist assists),10 - 16
6:50,LeBron James  misses 22-foot jumper,10 - 16
6:50,Cody Zeller defensive rebound,10 - 16
6:41,Marvin Williams  misses 24-foot three point jumper,10 - 16
6:41,Kyrie Irving defensive rebound,10 - 16
6:33,Tristan Thompson makes dunk (LeBron James assists),10 - 18
6:07,Kemba Walker makes 26-foot  three point jumper  (Cody Zeller assists),13 - 18
5:52,LeBron James  bad pass (Kemba Walker steals),13 - 18
5:46,Michael Kidd-Gilchrist makes dunk (Cody Zeller assists),15 - 18
5:22,Kyrie Irving  misses 10-foot,15 - 18
5:22,Michael Kidd-Gilchrist defensive rebound,15 - 18
5:13,Nicolas Batum Out-of-Bounds Bad Pass Turnover,15 - 18
5:01,Tristan Thompson makes 4-foot jumper (Kyrie Irving assists),15 - 20
4:52,J.R. Smith shooting foul  (Cody Zeller draws the foul),15 - 20
4:52,Cody Zeller makes free throw 1 of 2,16 - 20
4:52,Frank Kaminsky III enters the game for Marvin Williams,16 - 20
4:52,Marco Belinelli enters the game for Michael Kidd-Gilchrist,16 - 20
4:52,Cody Zeller makes free throw 2 of 2,17 - 20
4:37,Kevin Love  misses 20-foot jump bank shot,17 - 20
4:35,Tristan Thompson offensive rebound,17 - 20
4:33,Kyrie Irving Out-of-Bounds Bad Pass Turnover,17 - 20
4:22,Frank Kaminsky III  misses 6-foot Running Jumper,17 - 20
4:20,Tristan Thompson defensive rebound,17 - 20
4:11,Cody Zeller personal foul  (LeBron James draws the foul),17 - 20
4:11,DeAndre Liggins enters the game for Kyrie Irving,17 - 20
4:11,Iman Shumpert enters the game for LeBron James,17 - 20
3:59,Kevin Love makes 8-foot two point shot,17 - 22
3:53,DeAndre Liggins personal foul  (Kemba Walker draws the foul),17 - 22
3:53,Ramon Sessions enters the game for Kemba Walker,17 - 22
3:47,Nicolas Batum  misses 25-foot three point jumper,17 - 22
3:46,Tristan Thompson defensive rebound,17 - 22
3:39,Cody Zeller shooting foul  (Kevin Love draws the foul),17 - 22
3:39,Kevin Love makes free throw 1 of 2,17 - 23
3:39,Richard Jefferson enters the game for J.R. Smith,17 - 23
3:39,Roy Hibbert enters the game for Cody Zeller,17 - 23
3:39,Kevin Love misses free throw 2 of 2,17 - 23
3:38,Nicolas Batum defensive rebound,17 - 23
3:24,Nicolas Batum makes 11-foot two point shot,19 - 23
3:02,Kevin Love makes two point shot,19 - 25
2:55,Hornets 20 Sec. timeout,19 - 25
2:55,Cavaliers Full timeout,19 - 25
2:43,Ramon Sessions  misses Driving Floating Jump Shot,19 - 25
2:41,Kevin Love defensive rebound,19 - 25
2:31,Tristan Thompson makes layup (DeAndre Liggins assists),19 - 27
2:18,Nicolas Batum  misses 12-foot jumper,19 - 27
2:18,Richard Jefferson defensive rebound,19 - 27
2:08,Iman Shumpert makes 26-foot  three point jumper  (Richard Jefferson assists),19 - 30
1:52,Kevin Love shooting foul  (Roy Hibbert draws the foul),19 - 30
1:52,Roy Hibbert makes free throw 1 of 2,20 - 30
1:52,Kyrie Irving enters the game for Tristan Thompson,20 - 30
1:52,Roy Hibbert makes free throw 2 of 2,21 - 30
1:39,Kevin Love  misses 23-foot three point jumper,21 - 30
1:39,Ramon Sessions defensive rebound,21 - 30
1:30,Frank Kaminsky III  misses 25-foot three point jumper,21 - 30
1:30,Richard Jefferson defensive rebound,21 - 30
1:24,Iman Shumpert  bad pass (Nicolas Batum steals),21 - 30
1:10,Frank Kaminsky III  misses 6-foot two point shot,21 - 30
1:08,Iman Shumpert defensive rebound,21 - 30
56.0,Iman Shumpert makes 26-foot  three point jumper  (Richard Jefferson assists),21 - 33
46.0,DeAndre Liggins shooting foul  (Roy Hibbert draws the foul),23 - 33
46.0,Roy Hibbert makes free throw 1 of 2,22 - 33
46.0,LeBron James enters the game for Kevin Love,22 - 33
46.0,Roy Hibbert makes free throw 2 of 2,23 - 33
45.0,Ramon Sessions personal foul  (Kyrie Irving draws the foul),23 - 33
45.0,Marvin Williams enters the game for Roy Hibbert,23 - 33
33.0,Marvin Williams shooting foul  (LeBron James draws the foul),23 - 33
33.0,LeBron James makes free throw 1 of 2,23 - 34
33.0,LeBron James misses free throw 2 of 2,23 - 34
32.0,Marvin Williams defensive rebound,23 - 34
9.0,Ramon Sessions makes 26-foot  three point jumper  (Marco Belinelli assists),26 - 34
4.0,LeBron James makes driving layup (Kyrie Irving assists),26 - 36
0.0,Frank Kaminsky III  misses 39-foot three point jumper,26 - 36
0.0,Hornets offensive team rebound,26 - 36
0.0,End of the 1st Quarter,26 - 36
11:52,Kyrie Irving makes layup (LeBron James assists),26 - 38
11:52,Ramon Sessions shooting foul  (Kyrie Irving draws the foul),26 - 38
11:52,Kyrie Irving makes free throw 1 of 1,26 - 39
11:33,Frank Kaminsky III  misses 7-foot two point shot,26 - 39
11:32,LeBron James defensive rebound,26 - 39
11:26,DeAndre Liggins  misses two point shot,26 - 39
11:26,Cavaliers offensive team rebound,26 - 39
11:26,DeAndre Liggins  traveling,26 - 39
11:22,Iman Shumpert personal foul  (Marco Belinelli draws the foul),26 - 39
11:11,Marvin Williams  misses 8-foot jumper,26 - 39
11:11,LeBron James defensive rebound,26 - 39
11:00,Richard Jefferson  misses 27-foot three point jumper,26 - 39
11:00,Kyrie Irving offensive rebound,26 - 39
10:55,Kyrie Irving  misses driving layup,26 - 39
10:53,Jeremy Lamb defensive rebound,26 - 39
10:42,Marvin Williams  misses 25-foot three point jumper,26 - 39
10:41,Iman Shumpert defensive rebound,26 - 39
10:26,Kyrie Irving  out of bounds lost ball turnover,26 - 39
10:11,Jeremy Lamb makes 9-foot two point shot,28 - 39
9:49,LeBron James makes two point shot (Iman Shumpert assists),28 - 41
9:37,Kyrie Irving shooting foul  (Ramon Sessions draws the foul),28 - 41
9:37,Ramon Sessions misses free throw 1 of 2,28 - 41
9:37,Hornets offensive team rebound,28 - 41
9:37,Ramon Sessions makes free throw 2 of 2,29 - 41
9:26,Richard Jefferson makes dunk (LeBron James assists),29 - 43
9:19,Hornets Full timeout,29 - 43
9:19,J.R. Smith enters the game for DeAndre Liggins,29 - 43
9:11,Marco Belinelli makes 25-foot  three point jumper  (Frank Kaminsky III assists),32 - 43
8:53,Kyrie Irving makes 15-foot two point shot (Richard Jefferson assists),32 - 45
8:33,Jeremy Lamb makes 26-foot  three point jumper  (Frank Kaminsky III assists),35 - 45
8:14,LeBron James  bad pass (Ramon Sessions steals),35 - 45
7:52,Ramon Sessions  misses 14-foot two point shot,35 - 45
7:50,Iman Shumpert defensive rebound,35 - 45
7:43,Iman Shumpert makes 18-foot two point shot,35 - 47
7:30,Ramon Sessions  misses 5-foot jumper,35 - 47
7:30,Hornets offensive team rebound,35 - 47
7:30,Kemba Walker enters the game for Ramon Sessions,35 - 47
7:30,Michael Kidd-Gilchrist enters the game for Marvin Williams,35 - 47
7:30,Kevin Love enters the game for Richard Jefferson,35 - 47
7:22,Marco Belinelli makes 16-foot two point shot (Kemba Walker assists),37 - 47
6:58,Kyrie Irving makes  three point jumper  (J.R. Smith assists),37 - 50
6:48,Iman Shumpert personal foul  (Marco Belinelli draws the foul),37 - 50
6:39,Marco Belinelli makes 24-foot  three point jumper,40 - 50
6:16,Iman Shumpert makes 26-foot  three point jumper  (J.R. Smith assists),40 - 53
6:05,Frank Kaminsky III  misses 25-foot three point jumper,40 - 53
6:03,J.R. Smith defensive rebound,40 - 53
5:46,Kevin Love offensive Charge  (Kemba Walker draws the foul),40 - 53
5:46,Kevin Love  turnover,40 - 53
5:46,Official timeout,40 - 53
5:46,Tristan Thompson enters the game for Iman Shumpert,40 - 53
5:46,Cody Zeller enters the game for Jeremy Lamb,40 - 53
5:24,Kemba Walker makes layup,42 - 53
5:15,LeBron James makes driving layup,42 - 55
4:54,Kemba Walker makes 9-foot jumper,44 - 55
4:33,J.R. Smith makes  three point jumper  (LeBron James assists),44 - 58
4:18,Kemba Walker  misses driving layup,44 - 58
4:16,Cody Zeller  misses 1-foot,44 - 58
4:16,Cody Zeller offensive rebound,44 - 58
4:16,Tristan Thompson defensive rebound,44 - 58
4:03,Kevin Love makes driving layup (LeBron James assists),44 - 60
3:44,Marco Belinelli makes 7-foot two point shot (Frank Kaminsky III assists),46 - 60
3:33,J.R. Smith  misses 23-foot three point jumper,46 - 60
3:32,Frank Kaminsky III defensive rebound,46 - 60
3:31,J.R. Smith personal foul  (Kemba Walker draws the foul),46 - 60
3:31,Iman Shumpert enters the game for Kyrie Irving,46 - 60
3:31,Nicolas Batum enters the game for Marco Belinelli,46 - 60
3:18,Cody Zeller  bad pass (Kevin Love steals),46 - 60
3:10,Kevin Love  misses 23-foot three point jumper,46 - 60
3:10,Nicolas Batum defensive rebound,46 - 60
3:00,J.R. Smith shooting foul  (Cody Zeller draws the foul),46 - 60
3:00,Cody Zeller misses free throw 1 of 2,46 - 60
3:00,Hornets offensive team rebound,46 - 60
3:00,DeAndre Liggins enters the game for J.R. Smith,46 - 60
3:00,Cody Zeller makes free throw 2 of 2,47 - 60
2:38,LeBron James makes 15-foot two point shot,47 - 62
2:25,Kemba Walker  out of bounds lost ball turnover,47 - 62
2:25,Cavaliers Full timeout,47 - 62
2:25,Roy Hibbert enters the game for Cody Zeller,47 - 62
2:11,LeBron James makes 12-foot two point shot,47 - 64
1:59,Roy Hibbert offensive foul  (Iman Shumpert draws the foul),47 - 64
1:59,Roy Hibbert  turnover,47 - 64
1:44,LeBron James makes 13-foot two point shot,47 - 66
1:25,Nicolas Batum  misses 22-foot jumper,47 - 66
1:24,LeBron James defensive rebound,47 - 66
1:15,DeAndre Liggins  traveling,47 - 66
1:15,Richard Jefferson enters the game for Kevin Love,47 - 66
1:15,Jordan McRae enters the game for Iman Shumpert,47 - 66
58.0,DeAndre Liggins blocks Kemba Walker 's 3-foot  Driving Floating Jump Shot,47 - 66
58.0,Hornets offensive team rebound,47 - 66
56.0,Richard Jefferson shooting foul  (Nicolas Batum draws the foul),47 - 66
56.0,Nicolas Batum makes free throw 1 of 2,48 - 66
56.0,Nicolas Batum misses free throw 2 of 2,48 - 66
55.0,Frank Kaminsky III offensive rebound,48 - 66
48.0,Nicolas Batum  misses 25-foot three point jumper,48 - 66
48.0,LeBron James defensive rebound,48 - 66
44.0,Roy Hibbert shooting foul  (Tristan Thompson draws the foul),48 - 66
44.0,Tristan Thompson makes free throw 1 of 2,48 - 67
44.0,Tristan Thompson misses free throw 2 of 2,48 - 67
42.0,Nicolas Batum defensive rebound,48 - 67
30.0,Nicolas Batum makes 21-foot jumper (Frank Kaminsky III assists),50 - 67
11.0,LeBron James  misses 33-foot three point jumper,50 - 67
11.0,Frank Kaminsky III defensive rebound,50 - 67
3.0,Kemba Walker makes driving layup,52 - 67
0.0,Jordan McRae  misses 47-foot three point jumper,52 - 67
0.0,Cavaliers offensive team rebound,52 - 67
0.0,End of the 2nd Quarter,52 - 67
11:44,Tristan Thompson  traveling,52 - 67
11:36,Cody Zeller offensive foul  (LeBron James draws the foul),52 - 67
11:36,Cody Zeller  turnover,52 - 67
11:22,Kyrie Irving  misses 21-foot jumper,52 - 67
11:22,Marvin Williams defensive rebound,52 - 67
11:06,Nicolas Batum  bad pass (Kevin Love steals),52 - 67
10:49,Tristan Thompson makes two point shot (Kyrie Irving assists),52 - 69
10:33,Kemba Walker makes 24-foot  three point jumper,55 - 69
10:15,Marvin Williams shooting foul  (Tristan Thompson draws the foul),55 - 69
10:15,Tristan Thompson misses free throw 1 of 2,55 - 69
10:15,Cavaliers offensive team rebound,55 - 69
10:15,Tristan Thompson makes free throw 2 of 2,55 - 70
10:00,Marvin Williams makes 7-foot two point shot (Nicolas Batum assists),57 - 70
9:42,Kemba Walker personal foul  (Kyrie Irving draws the foul),57 - 70
9:34,Kevin Love  lost ball turnover (Cody Zeller steals),57 - 70
9:18,Cody Zeller makes 7-foot two point shot (Kemba Walker assists),59 - 70
8:56,Kyrie Irving  misses 7-foot,59 - 70
8:56,Cody Zeller defensive rebound,59 - 70
8:56,Kyrie Irving personal foul  (Cody Zeller draws the foul),59 - 70
8:32,Marvin Williams makes layup (Kemba Walker assists),61 - 70
8:32,Cavaliers Full timeout,61 - 70
8:10,Kyrie Irving  misses 25-foot three point jumper,61 - 70
8:08,Cody Zeller defensive rebound,61 - 70
7:58,Kemba Walker makes driving layup,63 - 70
7:50,Kyrie Irving  misses 11-foot jumper,63 - 70
7:50,Cody Zeller defensive rebound,63 - 70
7:41,Marvin Williams makes 24-foot  three point jumper  (Nicolas Batum assists),66 - 70
7:26,Cody Zeller personal foul  (Tristan Thompson draws the foul),66 - 70
7:26,Iman Shumpert enters the game for Kyrie Irving,66 - 70
7:26,Roy Hibbert enters the game for Cody Zeller,66 - 70
7:16,LeBron James makes 29-foot  three point jumper  (Kevin Love assists),66 - 73
6:54,Marvin Williams  misses 24-foot three point jumper,66 - 73
6:54,Hornets offensive team rebound,66 - 73
6:54,Kevin Love loose ball foul  (Roy Hibbert draws the foul),66 - 73
6:48,Nicolas Batum  misses 25-foot three point jumper,66 - 73
6:47,Kevin Love defensive rebound,66 - 73
6:37,LeBron James  misses 13-foot jumper,66 - 73
6:35,Roy Hibbert defensive rebound,66 - 73
6:24,Kemba Walker makes driving layup,68 - 73
6:11,Marvin Williams personal foul  (Kevin Love draws the foul),68 - 73
6:11,Frank Kaminsky III enters the game for Marvin Williams,68 - 73
6:05,Iman Shumpert  misses 26-foot three point jumper,68 - 73
6:03,Tristan Thompson offensive rebound,68 - 73
6:01,Tristan Thompson  back court turnover,68 - 73
5:46,Kemba Walker makes 16-foot two point shot,70 - 73
5:26,Kevin Love  misses 24-foot three point jumper,70 - 73
5:26,Tristan Thompson offensive rebound,70 - 73
5:18,Michael Kidd-Gilchrist personal foul  (Kevin Love draws the foul),70 - 73
5:18,Kevin Love makes free throw 1 of 2,70 - 74
5:18,Kevin Love makes free throw 2 of 2,70 - 75
5:05,Nicolas Batum makes 10-foot two point shot (Roy Hibbert assists),72 - 75
4:56,Kevin Love  misses 25-foot three point jumper,72 - 75
4:54,Nicolas Batum defensive rebound,72 - 75
4:46,Nicolas Batum  misses jumper,72 - 75
4:45,Tristan Thompson defensive rebound,72 - 75
4:28,Kevin Love makes layup,72 - 77
4:15,Kemba Walker  misses 26-foot three point jumper,72 - 77
4:13,Tristan Thompson defensive rebound,72 - 77
4:01,LeBron James makes  step back jumpshot,72 - 80
3:45,Frank Kaminsky III  misses 25-foot three point jumper,72 - 80
3:44,Tristan Thompson defensive rebound,72 - 80
3:34,LeBron James makes 25-foot  three point jumper,72 - 83
3:34,Hornets Full timeout,72 - 83
3:34,Marco Belinelli enters the game for Michael Kidd-Gilchrist,72 - 83
3:12,Frank Kaminsky III makes 24-foot  three point jumper  (Roy Hibbert assists),75 - 83
2:54,Tristan Thompson offensive foul  (Marco Belinelli draws the foul),75 - 83
2:54,Tristan Thompson  turnover,75 - 83
2:38,Marco Belinelli makes 27-foot  three point jumper  (Frank Kaminsky III assists),78 - 83
2:11,LeBron James  misses 26-foot three point jumper,78 - 83
2:10,LeBron James offensive rebound,78 - 83
2:08,Nicolas Batum shooting foul  (Kevin Love draws the foul),78 - 83
2:08,Kevin Love makes free throw 1 of 2,78 - 84
2:08,Ramon Sessions enters the game for Kemba Walker,78 - 84
2:08,Richard Jefferson enters the game for LeBron James,78 - 84
2:08,Kyrie Irving enters the game for J.R. Smith,78 - 84
2:08,Kevin Love misses free throw 2 of 2,78 - 84
2:06,Nicolas Batum defensive rebound,78 - 84
1:57,Marco Belinelli makes 19-foot two point shot (Ramon Sessions assists),80 - 84
1:42,Kyrie Irving  misses 6-foot two point shot,80 - 84
1:42,Tristan Thompson offensive rebound,80 - 84
1:42,Marco Belinelli personal foul  (Tristan Thompson draws the foul),80 - 84
1:42,Tristan Thompson misses free throw 1 of 2,80 - 84
1:42,Cavaliers offensive team rebound,80 - 84
1:42,Tristan Thompson makes free throw 2 of 2,80 - 85
1:24,Ramon Sessions  misses 26-foot three point jumper,80 - 85
1:24,Cavaliers defensive team rebound,80 - 85
1:24,Roy Hibbert loose ball foul  (Iman Shumpert draws the foul),80 - 87
1:24,Iman Shumpert makes free throw 1 of 2,80 - 86
1:24,Iman Shumpert makes free throw 2 of 2,80 - 87
1:12,Marco Belinelli  misses 20-foot two point shot,80 - 87
1:10,Kyrie Irving defensive rebound,80 - 87
53.0,Iman Shumpert  misses 19-foot jumper,80 - 87
53.0,Kevin Love offensive rebound,80 - 87
53.0,Nicolas Batum personal foul  (Kevin Love draws the foul),80 - 89
53.0,Kevin Love makes free throw 1 of 2,80 - 88
53.0,Kevin Love makes free throw 2 of 2,80 - 89
34.0,Tristan Thompson shooting foul  (Ramon Sessions draws the foul),80 - 89
34.0,Ramon Sessions makes free throw 1 of 2,81 - 89
34.0,Ramon Sessions misses free throw 2 of 2,81 - 89
33.0,Tristan Thompson defensive rebound,81 - 89
16.0,Kyrie Irving makes 25-foot  three point jumper,81 - 92
1.0,Frank Kaminsky III  misses 10-foot Running Jumper,81 - 92
0.0,Roy Hibbert offensive rebound,81 - 92
0.0,End of the 3rd Quarter,81 - 92
11:51,Frank Kaminsky III  misses two point shot,81 - 92
11:51,Frank Kaminsky III offensive rebound,81 - 92
11:48,LeBron James blocks Frank Kaminsky III's  layup,81 - 92
11:48,Iman Shumpert defensive rebound,81 - 92
11:33,Frank Kaminsky III shooting foul  (LeBron James draws the foul),81 - 92
11:33,LeBron James misses free throw 1 of 2,81 - 92
11:33,Cavaliers offensive team rebound,81 - 92
11:33,LeBron James makes free throw 2 of 2,81 - 93
11:22,Ramon Sessions  bad pass (Iman Shumpert steals),81 - 93
11:15,Richard Jefferson makes driving dunk (LeBron James assists),81 - 95
11:15,Hornets Full timeout,81 - 95
10:59,Marco Belinelli  misses 18-foot two point jumper,81 - 95
10:59,Frank Kaminsky III offensive rebound,81 - 95
10:59,LeBron James shooting foul  (Frank Kaminsky III draws the foul),81 - 95
10:59,Frank Kaminsky III misses free throw 1 of 2,81 - 95
10:59,Hornets offensive team rebound,81 - 95
10:59,Frank Kaminsky III makes free throw 2 of 2,82 - 95
10:42,DeAndre Liggins  out of bounds lost ball turnover,82 - 95
10:25,Frank Kaminsky III makes layup (Jeremy Lamb assists),84 - 95
9:52,LeBron James makes  step back jumpshot,84 - 98
9:40,Jeremy Lamb makes two point shot,86 - 98
9:40,Richard Jefferson shooting foul  (Jeremy Lamb draws the foul),86 - 98
9:40,Jeremy Lamb makes free throw 1 of 1,87 - 98
9:29,Kyrie Irving  misses 7-foot two point jumper,87 - 98
9:26,Jeremy Lamb defensive rebound,87 - 98
9:11,Jeremy Lamb  misses 25-foot three point jumper,87 - 98
9:11,Cavaliers defensive team rebound,87 - 98
8:52,LeBron James  misses 25-foot three point jumper,87 - 98
8:51,Ramon Sessions defensive rebound,87 - 98
8:37,Jeremy Lamb  misses 5-foot jumper,87 - 98
8:36,Marco Belinelli offensive rebound,87 - 98
8:33,Marco Belinelli  misses 10-foot jumper,87 - 98
8:33,Marvin Williams offensive rebound,87 - 98
8:30,Marvin Williams  misses,87 - 98
8:30,Frank Kaminsky III  misses 1-foot,87 - 98
8:30,Frank Kaminsky III offensive rebound,87 - 98
8:29,Jeremy Lamb offensive rebound,87 - 98
8:12,Frank Kaminsky III  lost ball turnover (LeBron James steals),87 - 98
8:03,LeBron James makes layup (Richard Jefferson assists),87 - 100
7:48,Richard Jefferson shooting foul  (Jeremy Lamb draws the foul),87 - 100
7:48,Jeremy Lamb makes free throw 1 of 2,88 - 100
7:48,Kemba Walker enters the game for Ramon Sessions,88 - 100
7:48,Jeremy Lamb makes free throw 2 of 2,89 - 100
7:33,LeBron James offensive foul  (Kemba Walker draws the foul),89 - 100
7:33,LeBron James  turnover,89 - 100
7:33,J.R. Smith enters the game for DeAndre Liggins,89 - 100
7:18,Jeremy Lamb  misses 7-foot two point shot,89 - 100
7:18,LeBron James defensive rebound,89 - 100
7:13,LeBron James makes two point shot,89 - 102
7:05,Marvin Williams makes layup (Kemba Walker assists),91 - 102
7:05,J.R. Smith shooting foul  (Marvin Williams draws the foul),91 - 102
7:05,Marvin Williams misses free throw 1 of 1,91 - 102
7:00,J.R. Smith defensive rebound,91 - 102
6:50,J.R. Smith  misses 26-foot three point jumper,91 - 102
6:50,Marvin Williams defensive rebound,91 - 102
6:39,Kemba Walker  misses 20-foot step back jumpshot,91 - 102
6:37,Iman Shumpert defensive rebound,91 - 102
6:33,Cavaliers Full timeout,91 - 102
6:33,Kevin Love enters the game for Richard Jefferson,91 - 102
6:33,Cody Zeller enters the game for Frank Kaminsky III,91 - 102
6:26,Marco Belinelli shooting foul  (LeBron James draws the foul),91 - 102
6:26,LeBron James makes free throw 1 of 2,91 - 103
6:26,LeBron James misses free throw 2 of 2,91 - 103
6:24,Kemba Walker defensive rebound,91 - 103
6:15,Marco Belinelli  misses 22-foot jumper,91 - 103
6:13,Jeremy Lamb offensive rebound,91 - 103
6:13,Jeremy Lamb  misses,91 - 103
6:13,LeBron James defensive rebound,91 - 103
6:09,LeBron James offensive foul  (Marco Belinelli draws the foul),91 - 103
6:09,LeBron James  turnover,91 - 103
6:01,Kevin Love personal foul  (Kemba Walker draws the foul),91 - 103
6:01,Kemba Walker makes free throw 1 of 2,92 - 103
6:01,Kemba Walker makes free throw 2 of 2,93 - 103
5:37,LeBron James  misses 25-foot three point jumper,93 - 103
5:37,Jeremy Lamb defensive rebound,93 - 103
5:26,Cody Zeller makes layup (Jeremy Lamb assists),95 - 103
5:03,Kyrie Irving Out-of-Bounds Bad Pass Turnover,95 - 103
5:03,Nicolas Batum enters the game for Jeremy Lamb,95 - 103
4:50,Cody Zeller offensive foul  (Iman Shumpert draws the foul),95 - 103
4:50,Cody Zeller  turnover,95 - 103
4:35,J.R. Smith  misses 25-foot three point jumper,95 - 103
4:33,Marvin Williams defensive rebound,95 - 103
4:18,Kemba Walker  misses 28-foot three point jumper,95 - 103
4:18,Kevin Love defensive rebound,95 - 103
4:09,LeBron James makes driving layup,95 - 105
3:54,Marvin Williams makes 23-foot jumper (Kemba Walker assists),97 - 105
3:38,Marco Belinelli shooting foul  (LeBron James draws the foul),97 - 105
3:38,Hornets Full timeout,97 - 105
3:38,Ramon Sessions enters the game for Kemba Walker,97 - 105
3:38,LeBron James misses free throw 1 of 2,97 - 105
3:38,Cavaliers offensive team rebound,97 - 105
3:38,LeBron James makes free throw 2 of 2,97 - 106
3:23,Marco Belinelli  misses 29-foot three point jumper,97 - 106
3:23,Kevin Love defensive rebound,97 - 106
3:11,LeBron James makes 16-foot two point shot,97 - 108
2:55,Marco Belinelli Out-of-Bounds Bad Pass Turnover,97 - 108
2:31,Iman Shumpert makes 23-foot  three point jumper  (LeBron James assists),97 - 111
2:31,Hornets Full timeout,97 - 111
2:18,Cody Zeller makes dunk (Nicolas Batum assists),99 - 111
1:53,LeBron James  misses 25-foot three point jumper,99 - 111
1:52,Cody Zeller defensive rebound,99 - 111
1:40,Cody Zeller makes layup (Marvin Williams assists),101 - 111
1:15,Iman Shumpert  misses 24-foot three point jumper,101 - 111
1:15,Nicolas Batum defensive rebound,101 - 111
1:08,Nicolas Batum  misses Driving Floating Jump Shot,101 - 111
1:07,Cody Zeller offensive rebound,101 - 111
1:05,Marvin Williams  misses Driving Floating Jump Shot,101 - 111
1:02,Cody Zeller makes tip shot,103 - 111
1:02,Cody Zeller offensive rebound,101 - 111
41.0,Ramon Sessions shooting foul  (Kevin Love draws the foul),103 - 111
41.0,Kevin Love makes free throw 1 of 2,103 - 112
41.0,DeAndre Liggins enters the game for Kyrie Irving,103 - 112
41.0,Kevin Love makes free throw 2 of 2,103 - 113
34.0,Ramon Sessions makes driving dunk,105 - 113
27.0,LeBron James makes two point shot (Iman Shumpert assists),105 - 115
27.0,Marco Belinelli shooting foul  (LeBron James draws the foul),105 - 115
27.0,Richard Jefferson enters the game for Kevin Love,105 - 115
27.0,LeBron James makes free throw 1 of 1,105 - 116
18.0,Marvin Williams  misses 28-foot three point jumper,105 - 116
17.0,LeBron James defensive rebound,105 - 116
0.0,End of the 4th Quarter,105 - 116
