time,play,score
12:00,Cody Zeller vs. Marc Gasol (JaMychal Green gains possession),0 - 0
11:38,Mike Conley  misses 25-foot three point jumper,0 - 0
11:37,Tony Allen offensive rebound,0 - 0
11:26,Marc Gasol  out of bounds lost ball turnover,0 - 0
11:17,Cody Zeller  lost ball turnover (Troy Williams steals),0 - 0
11:06,Tony Allen  misses 5-foot turnaround bank shot,0 - 0
11:04,Tony Allen offensive rebound,0 - 0
11:04,Michael Kidd-Gilchrist blocks Tony Allen 's 1-foot  shot,0 - 0
11:03,Cody Zeller defensive rebound,0 - 0
10:52,Michael Kidd-Gilchrist makes 18-foot jumper (Kemba Walker assists),2 - 0
10:34,Tony Allen  misses 12-foot two point jumper,2 - 0
10:33,Frank Kaminsky III defensive rebound,2 - 0
10:18,Kemba Walker  misses 25-foot three point jumper,2 - 0
10:17,Cody Zeller offensive rebound,2 - 0
10:08,Frank Kaminsky III makes 8-foot two point shot (Michael Kidd-Gilchrist assists),4 - 0
9:51,JaMychal Green  misses layup,4 - 0
9:51,Grizzlies offensive team rebound,4 - 0
9:45,Troy Williams  misses 20-foot jumper,4 - 0
9:45,Cody Zeller defensive rebound,4 - 0
9:30,Kemba Walker  lost ball turnover (Mike Conley steals),4 - 0
9:23,Mike Conley makes 26-foot  three point running jumper  (JaMychal Green assists),4 - 3
9:03,Michael Kidd-Gilchrist makes dunk,6 - 3
8:56,Cody Zeller personal foul  (Marc Gasol draws the foul),6 - 3
8:42,Marc Gasol  misses driving layup,6 - 3
8:41,Frank Kaminsky III defensive rebound,6 - 3
8:38,Tony Allen blocks Michael Kidd-Gilchrist's  shot,6 - 3
8:38,Hornets offensive team rebound,6 - 3
8:33,Kemba Walker makes 23-foot  three point jumper  (Frank Kaminsky III assists),9 - 3
8:18,JaMychal Green  misses three point jumper,9 - 3
8:18,Michael Kidd-Gilchrist defensive rebound,9 - 3
8:07,Frank Kaminsky III makes 7-foot two point shot (Kemba Walker assists),11 - 3
8:02,Grizzlies Full timeout,11 - 3
7:47,Troy Williams  misses 26-foot three point jumper,11 - 3
7:46,Cody Zeller defensive rebound,11 - 3
7:33,Nicolas Batum makes 22-foot jumper (Kemba Walker assists),13 - 3
7:22,Marc Gasol makes 10-foot jumper (Mike Conley assists),13 - 5
7:22,Grizzlies delay of game violation,13 - 5
7:09,Nicolas Batum  lost ball turnover (Tony Allen steals),13 - 5
7:05,Tony Allen makes two point shot,13 - 7
6:48,Kemba Walker  misses 25-foot three point jumper,13 - 7
6:43,Michael Kidd-Gilchrist offensive rebound,13 - 7
6:43,Michael Kidd-Gilchrist  misses 1-foot tip layup,13 - 7
6:43,Michael Kidd-Gilchrist offensive rebound,13 - 7
6:39,Frank Kaminsky III makes 7-foot jumper (Michael Kidd-Gilchrist assists),15 - 7
6:26,Marc Gasol makes 13-foot two point shot (Mike Conley assists),15 - 9
6:13,Kemba Walker  lost ball turnover (Mike Conley steals),15 - 9
6:09,Tony Allen makes two point shot (Troy Williams assists),15 - 11
6:09,Cody Zeller shooting foul  (Tony Allen draws the foul),15 - 11
6:09,Vince Carter enters the game for Troy Williams,15 - 11
6:09,Andrew Harrison enters the game for Mike Conley,15 - 11
6:09,Spencer Hawes enters the game for Cody Zeller,15 - 11
6:09,Tony Allen makes free throw 1 of 1,15 - 12
5:56,Frank Kaminsky III  misses 25-foot three point jumper,15 - 12
5:54,Vince Carter defensive rebound,15 - 12
5:47,JaMychal Green makes driving layup,15 - 14
5:41,Hornets Full timeout,15 - 14
5:28,Frank Kaminsky III  misses two point shot,15 - 14
5:28,Grizzlies defensive team rebound,15 - 14
5:13,Andrew Harrison  misses 23-foot three point jumper,15 - 14
5:13,Nicolas Batum defensive rebound,15 - 14
5:05,Michael Kidd-Gilchrist makes layup (Frank Kaminsky III assists),17 - 14
4:54,Marco Belinelli enters the game for Nicolas Batum,17 - 14
4:47,Marc Gasol  misses 18-foot jumper,17 - 14
4:47,Michael Kidd-Gilchrist defensive rebound,17 - 14
4:24,Michael Kidd-Gilchrist makes 18-foot jumper (Spencer Hawes assists),19 - 14
4:11,Vince Carter  misses 23-foot three point jumper,19 - 14
4:09,Michael Kidd-Gilchrist defensive rebound,19 - 14
4:05,Michael Kidd-Gilchrist  misses two point shot,19 - 14
4:05,Tony Allen defensive rebound,19 - 14
3:56,Tony Allen makes 8-foot two point shot,19 - 16
3:40,Michael Kidd-Gilchrist  misses 17-foot jumper,19 - 16
3:39,JaMychal Green defensive rebound,19 - 16
3:21,Marc Gasol makes 9-foot two point shot,19 - 18
3:04,Tony Allen shooting foul  (Michael Kidd-Gilchrist draws the foul),19 - 18
3:04,Michael Kidd-Gilchrist misses free throw 1 of 2,19 - 18
3:04,Hornets offensive team rebound,19 - 18
3:04,Roy Hibbert enters the game for Frank Kaminsky III,19 - 18
3:04,Jarell Martin enters the game for Tony Allen,19 - 18
3:04,Mike Conley enters the game for JaMychal Green,19 - 18
3:04,Deyonta Davis enters the game for Marc Gasol,19 - 18
3:04,Michael Kidd-Gilchrist misses free throw 2 of 2,19 - 18
3:03,Jarell Martin defensive rebound,19 - 18
2:56,Deyonta Davis offensive foul  (Kemba Walker draws the foul),19 - 18
2:56,Deyonta Davis  turnover,19 - 18
2:56,Jeremy Lamb enters the game for Michael Kidd-Gilchrist,19 - 18
2:47,Kemba Walker  bad pass (Vince Carter steals),19 - 18
2:35,Deyonta Davis makes 5-foot jumper (Mike Conley assists),19 - 20
2:18,Marco Belinelli  misses 23-foot three point jumper,19 - 20
2:17,Vince Carter defensive rebound,19 - 20
2:06,Jarell Martin makes 19-foot jumper (Mike Conley assists),19 - 22
1:54,Kemba Walker  misses 10-foot two point jumper,19 - 22
1:53,Hornets offensive team rebound,19 - 22
1:44,Kemba Walker  misses driving floating jump shot,19 - 22
1:43,Roy Hibbert offensive rebound,19 - 22
1:39,Marco Belinelli  misses 26-foot three point jumper,19 - 22
1:39,Jarell Martin defensive rebound,19 - 22
1:22,Vince Carter makes 25-foot  three point jumper  (Andrew Harrison assists),19 - 25
58.0,Jeremy Lamb makes 26-foot  three point jumper  (Spencer Hawes assists),22 - 25
44.0,Andrew Harrison  misses 18-foot two point jumper,22 - 25
43.0,Jeremy Lamb defensive rebound,22 - 25
36.0,Jeremy Lamb makes 26-foot  three point running jumper,25 - 25
22.0,Jarell Martin  misses 23-foot jumper,25 - 25
22.0,Jeremy Lamb defensive rebound,25 - 25
8.0,Deyonta Davis personal foul  (Roy Hibbert draws the foul),25 - 25
3.0,Marco Belinelli  misses 13-foot jumper,25 - 25
2.0,Andrew Harrison defensive rebound,25 - 25
1.0,Jeremy Lamb blocks Andrew Harrison 's 52-foot three point jumper,25 - 25
0.0,Grizzlies offensive team rebound,25 - 25
0.0,End of the 1st Quarter,25 - 25
11:48,Jeremy Lamb  misses 25-foot three point jumper,25 - 25
11:47,Jarell Martin defensive rebound,25 - 25
11:33,Vince Carter  misses 10-foot two point shot,25 - 25
11:30,Roy Hibbert defensive rebound,25 - 25
11:12,Marco Belinelli  misses driving floating jump shot,25 - 25
11:11,Jarell Martin defensive rebound,25 - 25
11:00,Andrew Harrison makes 23-foot  three point jumper  (Mike Conley assists),25 - 28
10:44,Spencer Hawes  bad pass (Vince Carter steals),25 - 28
10:44,Marco Belinelli loose ball foul  (Vince Carter draws the foul),25 - 28
10:44,Troy Williams enters the game for Andrew Harrison,25 - 28
10:21,Jarell Martin  misses 5-foot two point shot,25 - 28
10:19,Deyonta Davis offensive rebound,25 - 28
10:19,Deyonta Davis  misses tip layup,25 - 28
10:18,Spencer Hawes defensive rebound,25 - 28
10:11,Spencer Hawes  misses 26-foot three point running jumper,25 - 28
10:07,Mike Conley defensive rebound,25 - 28
10:02,Deyonta Davis  misses 18-foot jumper,25 - 28
10:00,Jeremy Lamb defensive rebound,25 - 28
9:42,Mike Conley shooting foul  (Jeremy Lamb draws the foul),25 - 28
9:42,Jeremy Lamb misses free throw 1 of 2,25 - 28
9:42,Hornets offensive team rebound,25 - 28
9:42,JaMychal Green enters the game for Deyonta Davis,25 - 28
9:42,Jeremy Lamb makes free throw 2 of 2,26 - 28
9:27,Mike Conley makes 11-foot two point shot,26 - 30
9:11,Ramon Sessions  misses 15-foot jumper,26 - 30
9:10,Jarell Martin defensive rebound,26 - 30
8:56,Vince Carter  misses 11-foot two point shot,26 - 30
8:56,Roy Hibbert defensive rebound,26 - 30
8:40,Roy Hibbert  misses 12-foot two point shot,26 - 30
8:38,Troy Williams defensive rebound,26 - 30
8:21,Mike Conley  misses 26-foot three point jumper,26 - 30
8:19,Roy Hibbert defensive rebound,26 - 30
8:14,Ramon Sessions makes two point shot,28 - 30
8:14,Jarell Martin shooting foul  (Ramon Sessions draws the foul),28 - 30
8:14,Official timeout,28 - 30
8:14,Andrew Harrison enters the game for Mike Conley,28 - 30
8:14,Ramon Sessions makes free throw 1 of 1,29 - 30
8:04,Vince Carter  bad pass (Jeremy Lamb steals),29 - 30
8:03,Jarell Martin shooting foul  (Jeremy Lamb draws the foul),29 - 30
8:03,Jeremy Lamb makes free throw 1 of 2,30 - 30
8:03,Tony Allen enters the game for Vince Carter,30 - 30
8:03,Marc Gasol enters the game for Jarell Martin,30 - 30
8:03,Jeremy Lamb makes free throw 2 of 2,31 - 30
7:52,Roy Hibbert shooting block foul  (Troy Williams draws the foul),31 - 30
7:52,Troy Williams misses free throw 1 of 2,31 - 30
7:52,Grizzlies offensive team rebound,31 - 30
7:52,Troy Williams makes free throw 2 of 2,31 - 31
7:41,Marco Belinelli  misses 20-foot jumper,31 - 31
7:39,JaMychal Green defensive rebound,31 - 31
7:20,Andrew Harrison  misses 25-foot three point jumper,31 - 31
7:20,Hornets defensive team rebound,31 - 31
7:20,Frank Kaminsky III enters the game for Roy Hibbert,31 - 31
7:03,Jeremy Lamb makes 1-foot layup (Spencer Hawes assists),33 - 31
6:47,Tony Allen makes layup (Troy Williams assists),33 - 33
6:20,Ramon Sessions makes 4-foot two point shot,35 - 33
6:13,Marc Gasol  misses 8-foot two point shot,35 - 33
6:11,Jeremy Lamb defensive rebound,35 - 33
5:58,Spencer Hawes makes 1-foot two point shot (Ramon Sessions assists),37 - 33
5:52,Grizzlies Full timeout,37 - 33
5:52,Nicolas Batum enters the game for Marco Belinelli,37 - 33
5:31,Troy Williams makes driving dunk,37 - 35
5:11,Frank Kaminsky III  misses layup,37 - 35
5:07,Marc Gasol defensive rebound,37 - 35
5:00,Tony Allen  bad pass (Ramon Sessions steals),37 - 35
4:56,JaMychal Green personal foul  (Spencer Hawes draws the foul),37 - 35
4:56,Kemba Walker enters the game for Jeremy Lamb,37 - 35
4:50,Nicolas Batum  misses 25-foot three point jumper,37 - 35
4:50,Marc Gasol defensive rebound,37 - 35
4:33,Troy Williams  misses 27-foot three point jumper,37 - 35
4:31,Kemba Walker defensive rebound,37 - 35
4:20,Frank Kaminsky III makes 8-foot two point shot (Ramon Sessions assists),39 - 35
4:03,Marc Gasol  misses 27-foot three point jumper,39 - 35
4:00,JaMychal Green offensive rebound,39 - 35
4:00,JaMychal Green  misses tip layup,39 - 35
3:58,Frank Kaminsky III defensive rebound,39 - 35
3:47,JaMychal Green personal foul  (Frank Kaminsky III draws the foul),39 - 35
3:47,Frank Kaminsky III makes free throw 1 of 2,40 - 35
3:47,Cody Zeller enters the game for Spencer Hawes,40 - 35
3:47,Mike Conley enters the game for Andrew Harrison,40 - 35
3:47,Vince Carter enters the game for JaMychal Green,40 - 35
3:47,Frank Kaminsky III makes free throw 2 of 2,41 - 35
3:40,Kemba Walker kicked ball violation,41 - 35
3:40,Michael Kidd-Gilchrist enters the game for Ramon Sessions,41 - 35
3:24,Mike Conley  misses 26-foot three point jumper,41 - 35
3:23,Cody Zeller defensive rebound,41 - 35
3:05,Michael Kidd-Gilchrist makes layup (Cody Zeller assists),43 - 35
2:47,Vince Carter  misses 27-foot three point jumper,43 - 35
2:47,Cody Zeller defensive rebound,43 - 35
2:40,Vince Carter shooting foul  (Nicolas Batum draws the foul),43 - 35
2:40,Hornets Full timeout,43 - 35
2:40,Spencer Hawes enters the game for Cody Zeller,43 - 35
2:40,Andrew Harrison enters the game for Troy Williams,43 - 35
2:40,Nicolas Batum makes free throw 1 of 3,44 - 35
2:40,Nicolas Batum makes free throw 2 of 3,45 - 35
2:40,Nicolas Batum makes free throw 3 of 3,46 - 35
2:26,Mike Conley  misses 12-foot two point shot,46 - 35
2:24,Michael Kidd-Gilchrist defensive rebound,46 - 35
2:11,Andrew Harrison shooting foul  (Michael Kidd-Gilchrist draws the foul),46 - 35
2:11,Michael Kidd-Gilchrist makes free throw 1 of 2,47 - 35
2:11,JaMychal Green enters the game for Tony Allen,47 - 35
2:11,Michael Kidd-Gilchrist makes free throw 2 of 2,48 - 35
1:51,Marc Gasol makes 9-foot two point shot,48 - 37
1:30,Kemba Walker makes 26-foot  three point jumper  (Nicolas Batum assists),51 - 37
1:14,Mike Conley  misses 23-foot three point jumper,51 - 37
1:14,Frank Kaminsky III defensive rebound,51 - 37
1:00,Michael Kidd-Gilchrist makes layup,53 - 37
57.0,Grizzlies 20 Sec. timeout,53 - 37
50.0,Vince Carter steps out of bounds turnover,53 - 37
50.0,Jarell Martin enters the game for JaMychal Green,53 - 37
40.0,Kemba Walker makes 26-foot  three point jumper  (Nicolas Batum assists),56 - 37
33.0,Mike Conley makes two point shot,56 - 39
10.0,Frank Kaminsky III  misses 27-foot three point jumper,56 - 39
9.0,Marc Gasol defensive rebound,56 - 39
2.0,Vince Carter  misses 26-foot three point jumper,56 - 39
1.0,Jarell Martin offensive rebound,56 - 39
0.0,Jarell Martin  misses 2-foot tip layup,56 - 39
0.0,Grizzlies offensive team rebound,56 - 39
0.0,End of the 2nd Quarter,56 - 39
11:37,Nicolas Batum  misses 19-foot jumper,56 - 39
11:33,Cody Zeller offensive rebound,56 - 39
11:33,Cody Zeller makes tip shot,58 - 39
11:11,Tony Allen  traveling,58 - 39
10:52,Nicolas Batum  misses 25-foot three point jumper,58 - 39
10:52,Marc Gasol defensive rebound,58 - 39
10:32,Mike Conley makes driving layup,58 - 41
10:15,Nicolas Batum  bad pass (Tony Allen steals),58 - 41
10:11,Troy Williams makes two point shot,58 - 43
9:55,Kemba Walker  misses 8-foot two point jumper,58 - 43
9:52,Troy Williams defensive rebound,58 - 43
9:48,Mike Conley makes 26-foot  three point running jumper  (Troy Williams assists),58 - 46
9:23,Cody Zeller  misses 19-foot jumper,58 - 46
9:22,Tony Allen defensive rebound,58 - 46
9:12,Nicolas Batum personal foul  (Marc Gasol draws the foul),58 - 46
9:12,Marc Gasol technical foul(1st technical foul),58 - 46
9:12,Nicolas Batum makes technical free throw,59 - 46
9:00,Mike Conley makes 21-foot jumper (JaMychal Green assists),59 - 48
8:48,Mike Conley shooting foul  (Kemba Walker draws the foul),59 - 48
8:48,Kemba Walker makes free throw 1 of 2,60 - 48
8:48,Kemba Walker makes free throw 2 of 2,61 - 48
8:30,Troy Williams  bad pass (Michael Kidd-Gilchrist steals),61 - 48
8:25,Michael Kidd-Gilchrist offensive Charge  (Mike Conley draws the foul),61 - 48
8:25,Michael Kidd-Gilchrist  turnover,61 - 48
8:25,Grizzlies Full timeout,61 - 48
8:25,Andrew Harrison enters the game for Mike Conley,61 - 48
8:11,Tony Allen  misses cutting layup,61 - 48
8:11,Marc Gasol offensive rebound,61 - 48
8:11,Marc Gasol  misses tip layup,61 - 48
8:08,Frank Kaminsky III defensive rebound,61 - 48
8:03,JaMychal Green personal foul  (Cody Zeller draws the foul),61 - 48
7:54,Frank Kaminsky III makes 8-foot two point shot (Nicolas Batum assists),63 - 48
7:31,Marc Gasol makes 12-foot two point shot (Andrew Harrison assists),63 - 50
7:18,Frank Kaminsky III  misses 26-foot three point jumper,63 - 50
7:16,Marc Gasol defensive rebound,63 - 50
7:05,Marc Gasol makes 27-foot  three point jumper  (Andrew Harrison assists),63 - 53
6:46,Nicolas Batum  misses 13-foot two point shot,63 - 53
6:45,Marc Gasol defensive rebound,63 - 53
6:24,Troy Williams  misses 20-foot jumper,63 - 53
6:24,Michael Kidd-Gilchrist defensive rebound,63 - 53
6:13,Kemba Walker makes 21-foot two point shot,65 - 53
5:50,Troy Williams offensive Charge  (Kemba Walker draws the foul),65 - 53
5:50,Troy Williams  turnover,65 - 53
5:50,Vince Carter enters the game for Tony Allen,65 - 53
5:37,Frank Kaminsky III  misses 8-foot two point shot,65 - 53
5:35,Marc Gasol defensive rebound,65 - 53
5:31,Andrew Harrison offensive Charge  (Kemba Walker draws the foul),65 - 53
5:31,Andrew Harrison  turnover,65 - 53
5:31,Marco Belinelli enters the game for Nicolas Batum,65 - 53
5:31,Wade Baldwin IV enters the game for Andrew Harrison,65 - 53
5:11,Kemba Walker  misses 18-foot step back jumpshot,65 - 53
5:09,JaMychal Green defensive rebound,65 - 53
4:52,Wade Baldwin IV steps out of bounds turnover,65 - 53
4:26,Kemba Walker makes 5-foot two point shot,67 - 53
4:26,Grizzlies Full timeout,67 - 53
4:26,Jeremy Lamb enters the game for Michael Kidd-Gilchrist,67 - 53
4:16,Vince Carter makes 17-foot jumper (Marc Gasol assists),67 - 55
3:54,Kemba Walker  misses 26-foot three point jumper,67 - 55
3:53,Jeremy Lamb offensive rebound,67 - 55
3:47,Jeremy Lamb makes jumper (Marco Belinelli assists),69 - 55
3:28,Marc Gasol  misses 14-foot jumper,69 - 55
3:28,Jeremy Lamb defensive rebound,69 - 55
3:15,Jeremy Lamb makes 7-foot two point shot,71 - 55
3:15,Wade Baldwin IV shooting foul  (Jeremy Lamb draws the foul),71 - 55
3:15,Spencer Hawes enters the game for Frank Kaminsky III,71 - 55
3:15,Deyonta Davis enters the game for Marc Gasol,71 - 55
3:15,Roy Hibbert enters the game for Cody Zeller,71 - 55
3:15,Jeremy Lamb misses free throw 1 of 1,71 - 55
3:13,Jeremy Lamb offensive rebound,71 - 55
3:05,Marco Belinelli  misses 26-foot three point jumper,71 - 55
3:04,JaMychal Green defensive rebound,71 - 55
2:59,Jeremy Lamb shooting foul  (Wade Baldwin IV draws the foul),71 - 55
2:59,Wade Baldwin IV misses free throw 1 of 2,71 - 55
2:59,Grizzlies offensive team rebound,71 - 55
2:59,Wade Baldwin IV misses free throw 2 of 2,71 - 55
2:58,Jeremy Lamb defensive rebound,71 - 55
2:43,Kemba Walker  bad pass (Vince Carter steals),71 - 55
2:41,Troy Williams makes driving dunk (Vince Carter assists),71 - 57
2:41,Spencer Hawes shooting foul  (Troy Williams draws the foul),71 - 57
2:41,Troy Williams misses free throw 1 of 1,71 - 57
2:33,Marco Belinelli defensive rebound,71 - 57
2:29,JaMychal Green personal foul  (Spencer Hawes draws the foul),71 - 57
2:29,JaMychal Green technical foul(1st technical foul),71 - 57
2:29,Marco Belinelli makes technical free throw,72 - 57
2:17,Roy Hibbert makes two point shot (Marco Belinelli assists),74 - 57
2:01,Vince Carter  misses 25-foot three point jumper,74 - 57
2:01,Hornets defensive team rebound,74 - 57
2:01,JaMychal Green loose ball foul  (Spencer Hawes draws the foul),74 - 57
2:01,Spencer Hawes makes free throw 1 of 2,75 - 57
2:01,Jarell Martin enters the game for JaMychal Green,75 - 57
2:01,Troy Daniels enters the game for Troy Williams,75 - 57
2:01,Ramon Sessions enters the game for Kemba Walker,75 - 57
2:01,Spencer Hawes makes free throw 2 of 2,76 - 57
1:50,Troy Daniels  misses 22-foot jumper,76 - 57
1:50,Ramon Sessions defensive rebound,76 - 57
1:34,Roy Hibbert makes two point shot (Spencer Hawes assists),78 - 57
1:20,Vince Carter  misses 25-foot three point jumper,78 - 57
1:20,Ramon Sessions defensive rebound,78 - 57
1:12,Troy Daniels blocks Ramon Sessions 's 9-foot  shot,78 - 57
1:12,Hornets offensive team rebound,78 - 57
1:08,Jeremy Lamb makes 12-foot two point shot,80 - 57
53.0,Jarell Martin makes 23-foot  three point jumper  (Wade Baldwin IV assists),80 - 60
41.0,Marco Belinelli  misses 22-foot jumper,80 - 60
41.0,Deyonta Davis defensive rebound,80 - 60
33.0,Troy Daniels  misses 23-foot three point running jumper,80 - 60
31.0,Jarell Martin offensive rebound,80 - 60
28.0,Jarell Martin  misses 4-foot hook shot,80 - 60
26.0,Marco Belinelli defensive rebound,80 - 60
9.0,Ramon Sessions  misses 13-foot jumper,80 - 60
9.0,Jarell Martin defensive rebound,80 - 60
5.0,Vince Carter offensive foul  (Marco Belinelli draws the foul),80 - 60
5.0,Vince Carter  turnover,80 - 60
5.0,David Fizdale technical foul(1st technical foul),80 - 60
5.0,Marco Belinelli makes technical free throw,81 - 60
5.0,Frank Kaminsky III enters the game for Roy Hibbert,81 - 60
0.0,Frank Kaminsky III  misses 30-foot three point jumper,81 - 60
0.0,Hornets offensive team rebound,81 - 60
0.0,End of the 3rd Quarter,81 - 60
11:47,Roy Hibbert shooting foul  (Vince Carter draws the foul),81 - 60
11:47,Vince Carter misses free throw 1 of 2,81 - 60
11:47,Grizzlies offensive team rebound,81 - 60
11:47,Vince Carter makes free throw 2 of 2,81 - 61
11:36,Roy Hibbert offensive foul  (Deyonta Davis draws the foul),81 - 61
11:36,Roy Hibbert  turnover,81 - 61
11:36,Marc Gasol enters the game for Deyonta Davis,81 - 61
11:25,Spencer Hawes shooting foul  (Vince Carter draws the foul),81 - 61
11:25,Vince Carter makes free throw 1 of 2,81 - 62
11:25,Vince Carter makes free throw 2 of 2,81 - 63
11:23,Wade Baldwin IV personal take foul  (Marco Belinelli draws the foul),81 - 63
11:23,Andrew Harrison enters the game for Vince Carter,81 - 63
11:11,Wade Baldwin IV blocks Ramon Sessions 's 6-foot  shot,81 - 63
11:11,Roy Hibbert offensive rebound,81 - 63
11:11,Marc Gasol shooting foul  (Roy Hibbert draws the foul),81 - 63
11:11,Roy Hibbert misses free throw 1 of 2,81 - 63
11:11,Hornets offensive team rebound,81 - 63
11:11,Roy Hibbert misses free throw 2 of 2,81 - 63
11:10,Jarell Martin defensive rebound,81 - 63
11:00,Jarell Martin  misses 22-foot jumper,81 - 63
11:00,Marco Belinelli defensive rebound,81 - 63
10:45,Marco Belinelli makes layup (Spencer Hawes assists),83 - 63
10:33,Wade Baldwin IV makes 12-foot two point shot,83 - 65
10:30,Ramon Sessions  traveling,83 - 65
10:30,Kemba Walker enters the game for Ramon Sessions,83 - 65
10:17,Roy Hibbert personal foul  (Andrew Harrison draws the foul),83 - 65
10:04,Spencer Hawes blocks Jarell Martin's  shot,83 - 65
10:03,Jeremy Lamb defensive rebound,83 - 65
9:48,Jeremy Lamb  misses 21-foot two point jumper,83 - 65
9:47,Roy Hibbert offensive rebound,83 - 65
9:47,Hornets Full timeout,83 - 65
9:38,Troy Daniels personal foul  (Marco Belinelli draws the foul),83 - 65
9:30,Jeremy Lamb  misses 23-foot three point jumper,83 - 65
9:29,Wade Baldwin IV defensive rebound,83 - 65
9:19,Jarell Martin makes layup (Troy Daniels assists),83 - 67
8:53,Spencer Hawes  misses 25-foot three point jumper,83 - 67
8:52,Troy Daniels defensive rebound,83 - 67
8:36,Jarell Martin  back court turnover,83 - 67
8:25,Andrew Harrison shooting foul  (Jeremy Lamb draws the foul),83 - 67
8:25,Jeremy Lamb makes free throw 1 of 2,84 - 67
8:25,Jeremy Lamb makes free throw 2 of 2,85 - 67
8:11,Andrew Harrison  misses 25-foot three point jumper,85 - 67
8:11,Kemba Walker defensive rebound,85 - 67
7:56,Roy Hibbert  misses 18-foot jumper,85 - 67
7:54,Wade Baldwin IV defensive rebound,85 - 67
7:35,Jarell Martin makes 7-foot two point shot,85 - 69
7:18,Marco Belinelli makes 21-foot jumper,87 - 69
7:18,Troy Williams enters the game for Wade Baldwin IV,87 - 69
7:18,Nicolas Batum enters the game for Marco Belinelli,87 - 69
7:18,Wade Baldwin IV loose ball foul  (Roy Hibbert draws the foul),87 - 69
7:18,Roy Hibbert makes free throw 1 of 1,88 - 69
7:07,Roy Hibbert blocks Andrew Harrison 's 1-foot  layup,88 - 69
7:07,Grizzlies offensive team rebound,88 - 69
6:56,Marc Gasol makes 6-foot two point shot,88 - 71
6:41,Jeremy Lamb  misses 25-foot three point jumper,88 - 71
6:39,Jarell Martin defensive rebound,88 - 71
6:33,Marc Gasol makes 26-foot  three point jumper  (Andrew Harrison assists),88 - 74
6:33,Spencer Hawes shooting foul  (Marc Gasol draws the foul),88 - 74
6:33,JaMychal Green enters the game for Jarell Martin,88 - 74
6:33,Marc Gasol makes free throw 1 of 1,88 - 75
6:03,Kemba Walker makes 26-foot  three point jumper  (Spencer Hawes assists),91 - 75
5:52,Troy Williams  misses driving floating bank jump shot,91 - 75
5:48,Kemba Walker defensive rebound,91 - 75
5:39,Official timeout,91 - 75
5:39,Frank Kaminsky III enters the game for Spencer Hawes,91 - 75
5:39,Cody Zeller enters the game for Roy Hibbert,91 - 75
5:26,Kemba Walker makes 27-foot  three point jumper,94 - 75
5:13,Marc Gasol  misses 26-foot three point jumper,94 - 75
5:13,Nicolas Batum defensive rebound,94 - 75
5:03,Kemba Walker  lost ball turnover (Marc Gasol steals),94 - 75
4:58,Andrew Harrison  misses 22-foot running jumper,94 - 75
4:56,Hornets defensive team rebound,94 - 75
4:56,Deyonta Davis enters the game for Marc Gasol,94 - 75
4:46,Deyonta Davis shooting foul  (Cody Zeller draws the foul),94 - 75
4:46,Cody Zeller misses free throw 1 of 2,94 - 75
4:46,Hornets offensive team rebound,94 - 75
4:46,Jarell Martin enters the game for JaMychal Green,94 - 75
4:46,Wade Baldwin IV enters the game for Andrew Harrison,94 - 75
4:46,Cody Zeller makes free throw 2 of 2,95 - 75
4:28,Troy Daniels  misses 25-foot three point jumper,95 - 75
4:26,Hornets defensive team rebound,95 - 75
4:16,Jeremy Lamb makes two point shot (Nicolas Batum assists),97 - 75
3:57,Jarell Martin  misses driving dunk,97 - 75
3:53,Wade Baldwin IV offensive rebound,97 - 75
3:50,Jarell Martin  misses jumper,97 - 75
3:49,Frank Kaminsky III defensive rebound,97 - 75
3:44,Hornets 20 Sec. timeout,97 - 75
3:44,Brian Roberts enters the game for Nicolas Batum,97 - 75
3:44,Aaron Harrison enters the game for Kemba Walker,97 - 75
3:44,Treveon Graham enters the game for Jeremy Lamb,97 - 75
3:30,Treveon Graham makes  three point jumper  (Aaron Harrison assists),100 - 75
3:03,Wade Baldwin IV  misses 26-foot three point jumper,100 - 75
3:02,Grizzlies offensive team rebound,100 - 75
2:55,Jarell Martin makes driving layup (Wade Baldwin IV assists),100 - 77
2:38,Treveon Graham  lost ball turnover (Troy Williams steals),100 - 77
2:34,Troy Williams makes two point shot,100 - 79
2:18,Cody Zeller  misses 6-foot turnaround bank shot,100 - 79
2:17,Jarell Martin defensive rebound,100 - 79
2:15,Treveon Graham shooting foul  (Jarell Martin draws the foul),100 - 79
2:15,Grizzlies Full timeout,100 - 79
2:15,Jarell Martin misses free throw 1 of 2,100 - 79
2:15,Grizzlies offensive team rebound,100 - 79
2:15,Jarell Martin misses free throw 2 of 2,100 - 79
2:15,Cody Zeller defensive rebound,100 - 79
2:02,Jarell Martin shooting foul  (Aaron Harrison draws the foul),100 - 79
2:02,Aaron Harrison makes free throw 1 of 2,101 - 79
2:02,Aaron Harrison misses free throw 2 of 2,101 - 79
