time,play,score
12:00,Rudy Gobert vs. Pau Gasol (Tony Parker gains possession),0 - 0
11:37,Pau Gasol makes 18-foot jumper (Tony Parker assists),0 - 2
11:18,Rodney Hood  misses 26-foot three point jumper,0 - 2
11:18,Kawhi Leonard defensive rebound,0 - 2
11:17,Derrick Favors loose ball foul  (Kawhi Leonard draws the foul),0 - 2
10:55,Kawhi Leonard makes 17-foot two point shot,0 - 4
10:40,Rudy Gobert makes two point shot (Derrick Favors assists),2 - 4
10:22,LaMarcus Aldridge  misses 19-foot jumper,2 - 4
10:22,Rudy Gobert defensive rebound,2 - 4
10:07,George Hill makes 23-foot  three point jumper  (Derrick Favors assists),5 - 4
9:47,Pau Gasol  misses 20-foot jumper,5 - 4
9:45,Joe Johnson defensive rebound,5 - 4
9:37,Joe Johnson  misses two point jumper,5 - 4
9:37,Rudy Gobert vs. Pau Gasol (Joe Johnson gains possession),5 - 4
9:37,Jazz offensive team rebound,5 - 4
9:18,Joe Johnson makes 25-foot  three point jumper  (George Hill assists),8 - 4
8:51,Derrick Favors blocks Jonathon Simmons 's 2-foot  layup,8 - 4
8:48,Rodney Hood defensive rebound,8 - 4
8:44,Rodney Hood  misses,8 - 4
8:42,Kawhi Leonard defensive rebound,8 - 4
8:37,Kawhi Leonard makes 25-foot  three pointer,8 - 7
8:12,Derrick Favors makes 19-foot jumper (George Hill assists),10 - 7
7:58,LaMarcus Aldridge makes 17-foot jumper (Tony Parker assists),10 - 9
7:43,Pau Gasol shooting foul  (Rodney Hood draws the foul),10 - 9
7:43,Rodney Hood makes free throw 1 of 2,11 - 9
7:43,Rodney Hood makes free throw 2 of 2,12 - 9
7:28,Tony Parker  misses 20-foot two point jumper,12 - 9
7:28,Rudy Gobert defensive rebound,12 - 9
7:18,George Hill makes 26-foot  three point jumper  (Joe Johnson assists),15 - 9
7:00,Kawhi Leonard makes 24-foot  three point jumper  (Jonathon Simmons assists),15 - 12
6:41,Rodney Hood makes two point shot (Derrick Favors assists),17 - 12
6:41,Spurs Full timeout,17 - 12
6:20,Pau Gasol  misses jumper,17 - 12
6:18,Derrick Favors defensive rebound,17 - 12
6:03,Derrick Favors  misses jumper,17 - 12
6:01,Pau Gasol defensive rebound,17 - 12
5:48,George Hill personal foul  (Tony Parker draws the foul),17 - 12
5:48,Manu Ginobili enters the game for Jonathon Simmons,17 - 12
5:35,LaMarcus Aldridge makes 14-foot two point shot,17 - 14
5:11,Derrick Favors makes 16-foot jumper (Joe Johnson assists),19 - 14
4:52,LaMarcus Aldridge  misses 19-foot jumper,19 - 14
4:52,Rodney Hood defensive rebound,19 - 14
4:37,Rodney Hood makes 25-foot  three point jumper  (Joe Johnson assists),22 - 14
4:26,Pau Gasol makes layup (Manu Ginobili assists),22 - 16
4:09,Derrick Favors makes 19-foot jumper (Rodney Hood assists),24 - 16
3:43,Manu Ginobili makes 25-foot  three point jumper  (Tony Parker assists),24 - 19
3:36,Jazz Full timeout,24 - 19
3:36,Patty Mills enters the game for Tony Parker,24 - 19
3:36,David Lee enters the game for Pau Gasol,24 - 19
3:36,Dante Exum enters the game for George Hill,24 - 19
3:36,Shelvin Mack enters the game for Joe Johnson,24 - 19
3:36,Trey Lyles enters the game for Derrick Favors,24 - 19
3:20,Rodney Hood makes 24-foot,27 - 19
3:09,Rodney Hood personal foul  (Kawhi Leonard draws the foul),27 - 19
3:04,Trey Lyles kicked ball violation,27 - 19
2:57,Kawhi Leonard  misses 26-foot three point jumper,27 - 19
2:56,Rudy Gobert defensive rebound,27 - 19
2:46,Dante Exum offensive foul  (Manu Ginobili draws the foul),27 - 19
2:46,Dante Exum  turnover,27 - 19
2:46,Dewayne Dedmon enters the game for LaMarcus Aldridge,27 - 19
2:33,Manu Ginobili  misses 11-foot jump bank shot,27 - 19
2:32,Rudy Gobert defensive rebound,27 - 19
2:25,Trey Lyles makes 19-foot two point shot (Dante Exum assists),29 - 19
2:11,Manu Ginobili  out of bounds lost ball turnover,29 - 19
2:11,Jeff Withey enters the game for Rudy Gobert,29 - 19
2:11,Kyle Anderson enters the game for Kawhi Leonard,29 - 19
1:59,Dewayne Dedmon defensive 3-seconds (Technical Foul),29 - 19
1:59,Rodney Hood makes technical free throw,30 - 19
1:50,Rodney Hood  lost ball turnover (Patty Mills steals),30 - 19
1:44,Patty Mills makes two point shot,30 - 21
1:25,Shelvin Mack makes 25-foot  three point jumper  (Trey Lyles assists),33 - 21
1:12,Patty Mills  misses 25-foot three point jumper,33 - 21
1:10,Dante Exum defensive rebound,33 - 21
1:01,Dante Exum  bad pass (David Lee steals),33 - 21
59.0,Patty Mills makes two point shot (Manu Ginobili assists),33 - 23
55.0,Kyle Anderson blocks Jeff Withey's  layup,33 - 23
54.0,Jazz offensive team rebound,33 - 23
54.0,Joe Ingles enters the game for Rodney Hood,33 - 23
54.0,5 sec inbound turnover,33 - 23
41.0,David Lee makes 8-foot two point shot,33 - 25
41.0,Trey Lyles shooting foul  (David Lee draws the foul),33 - 25
41.0,David Lee makes free throw 1 of 1,33 - 26
32.0,Dewayne Dedmon personal foul  (Jeff Withey draws the foul),33 - 26
32.0,Jeff Withey makes free throw 1 of 2,34 - 26
32.0,Jeff Withey makes free throw 2 of 2,35 - 26
14.0,Joe Ingles personal foul  (Kyle Anderson draws the foul),35 - 26
14.0,Kyle Anderson makes free throw 1 of 2,35 - 27
14.0,Kyle Anderson makes free throw 2 of 2,35 - 28
2.0,Shelvin Mack makes 28-foot  three point jumper  (Dante Exum assists),38 - 28
0.0,Dante Exum blocks Patty Mills 's 28-foot   three point jumper,38 - 28
0.0,Patty Mills offensive rebound,38 - 28
0.0,End of the 1st Quarter,38 - 28
11:41,Trey Lyles  misses 26-foot three point jumper,38 - 28
11:41,Dewayne Dedmon defensive rebound,38 - 28
11:25,Trey Lyles blocks Dewayne Dedmon 's 1-foot  layup,38 - 28
11:23,Trey Lyles defensive rebound,38 - 28
11:11,Shelvin Mack makes two point shot,40 - 28
10:59,Dante Exum shooting foul  (Manu Ginobili draws the foul),40 - 30
10:59,Manu Ginobili makes free throw 1 of 3,40 - 29
10:59,Manu Ginobili makes free throw 2 of 3,40 - 30
10:59,Manu Ginobili makes free throw 3 of 3,40 - 31
10:52,David Lee shooting foul  (Jeff Withey draws the foul),40 - 31
10:52,Jeff Withey makes free throw 1 of 2,41 - 31
10:52,Tony Parker enters the game for Patty Mills,41 - 31
10:52,Jonathon Simmons enters the game for Manu Ginobili,41 - 31
10:52,Jeff Withey makes free throw 2 of 2,42 - 31
10:33,Kyle Anderson  misses 14-foot jumper,42 - 31
10:32,David Lee offensive rebound,42 - 31
10:30,Trey Lyles blocks David Lee 's 2-foot  shot,42 - 31
10:30,Shelvin Mack defensive rebound,42 - 31
10:15,Shelvin Mack makes 20-foot two point shot,44 - 31
9:52,Jeff Withey blocks Dewayne Dedmon's  layup,44 - 31
9:52,Jeff Withey defensive rebound,44 - 31
9:44,Joe Ingles  misses 26-foot three point jumper,44 - 31
9:42,Jonathon Simmons defensive rebound,44 - 31
9:21,Dewayne Dedmon 3 second turnover,44 - 31
9:02,Joe Ingles makes 24-foot  three point jumper  (Trey Lyles assists),47 - 31
8:52,Trey Lyles defensive 3-seconds (Technical Foul),47 - 31
8:52,Official timeout,47 - 31
8:52,Kawhi Leonard enters the game for Kyle Anderson,47 - 31
8:52,LaMarcus Aldridge enters the game for David Lee,47 - 31
8:52,Derrick Favors enters the game for Jeff Withey,47 - 31
8:52,Tony Parker misses technical free throw,47 - 31
8:52,Spurs offensive team rebound,47 - 31
8:37,LaMarcus Aldridge  misses,47 - 31
8:36,Dewayne Dedmon offensive rebound,47 - 31
8:27,Dante Exum blocks Jonathon Simmons's   three point jumper,47 - 31
8:26,Trey Lyles defensive rebound,47 - 31
8:03,Trey Lyles  misses 10-foot jumper,47 - 31
8:02,Kawhi Leonard defensive rebound,47 - 31
7:58,Joe Ingles shooting foul  (Dewayne Dedmon draws the foul),47 - 31
7:58,Dewayne Dedmon misses free throw 1 of 2,47 - 31
7:58,Spurs offensive team rebound,47 - 31
7:58,George Hill enters the game for Dante Exum,47 - 31
7:58,Joe Johnson enters the game for Joe Ingles,47 - 31
7:58,Dewayne Dedmon makes free throw 2 of 2,47 - 32
7:39,Shelvin Mack  misses driving layup,47 - 32
7:37,Dewayne Dedmon defensive rebound,47 - 32
7:28,LaMarcus Aldridge makes 17-foot jumper (Jonathon Simmons assists),47 - 34
7:03,Trey Lyles  misses two point jumper,47 - 34
7:01,Tony Parker defensive rebound,47 - 34
6:39,Kawhi Leonard  misses 20-foot two point jumper,47 - 34
6:37,Trey Lyles defensive rebound,47 - 34
6:30,Jonathon Simmons personal foul  (Derrick Favors draws the foul),47 - 34
6:30,Rudy Gobert enters the game for Trey Lyles,47 - 34
6:30,Rodney Hood enters the game for Shelvin Mack,47 - 34
6:30,Pau Gasol enters the game for Dewayne Dedmon,47 - 34
6:16,Joe Johnson  misses 26-foot three point pullup jump shot,47 - 34
6:15,Pau Gasol defensive rebound,47 - 34
6:05,Kawhi Leonard makes 26-foot  three point jumper  (Tony Parker assists),47 - 37
6:03,Jazz Full timeout,47 - 37
5:43,Pau Gasol blocks Derrick Favors 's 2-foot  shot,47 - 37
5:43,Pau Gasol defensive rebound,47 - 37
5:31,George Hill personal foul  (Tony Parker draws the foul),47 - 37
5:26,Kawhi Leonard makes 19-foot jumper (Tony Parker assists),47 - 39
5:11,Derrick Favors  misses jumper,47 - 39
5:11,Tony Parker defensive rebound,47 - 39
4:54,Kawhi Leonard makes  three point jumper,47 - 42
4:35,Rodney Hood  misses driving layup,47 - 42
4:35,Kawhi Leonard defensive rebound,47 - 42
4:26,Tony Parker makes 18-foot two point shot,47 - 44
4:26,Jazz 20 Sec. timeout,47 - 44
4:11,Kawhi Leonard personal foul  (Rudy Gobert draws the foul),47 - 44
4:01,Pau Gasol blocks Rudy Gobert's  layup,47 - 44
4:00,Spurs defensive team rebound,47 - 44
3:44,Kawhi Leonard makes 16-foot two point shot,47 - 46
3:19,George Hill  misses 26-foot three point jumper,47 - 46
3:18,Rudy Gobert offensive rebound,47 - 46
3:18,Pau Gasol shooting foul  (Rudy Gobert draws the foul),47 - 46
3:18,Rudy Gobert misses free throw 1 of 2,47 - 46
3:18,Jazz offensive team rebound,47 - 46
3:18,Trey Lyles enters the game for Derrick Favors,47 - 46
3:18,Rudy Gobert makes free throw 2 of 2,48 - 46
3:16,Joe Johnson personal take foul  (Tony Parker draws the foul),48 - 46
3:16,Derrick Favors enters the game for Rudy Gobert,48 - 46
2:59,LaMarcus Aldridge makes 18-foot two point shot (Kawhi Leonard assists),48 - 48
2:41,Rodney Hood makes 26-foot  three point jumper  (Trey Lyles assists),51 - 48
2:20,LaMarcus Aldridge  misses,51 - 48
2:19,Derrick Favors defensive rebound,51 - 48
2:03,Rodney Hood  misses 25-foot,51 - 48
2:02,Kawhi Leonard defensive rebound,51 - 48
1:47,Pau Gasol  misses 9-foot two point shot,51 - 48
1:47,Derrick Favors defensive rebound,51 - 48
1:37,George Hill makes two point shot,53 - 48
1:37,Spurs Full timeout,53 - 48
1:37,Dewayne Dedmon enters the game for Pau Gasol,53 - 48
1:37,Patty Mills enters the game for Tony Parker,53 - 48
1:37,Manu Ginobili enters the game for Jonathon Simmons,53 - 48
1:37,Rudy Gobert enters the game for Derrick Favors,53 - 48
1:19,LaMarcus Aldridge makes layup (Manu Ginobili assists),53 - 50
1:05,Patty Mills personal foul  (Rudy Gobert draws the foul),53 - 50
1:05,Rudy Gobert misses free throw 1 of 2,53 - 50
1:05,Jazz offensive team rebound,53 - 50
1:05,Rudy Gobert makes free throw 2 of 2,54 - 50
49.0,LaMarcus Aldridge  misses 24-foot three point jumper,54 - 50
48.0,Rudy Gobert defensive rebound,54 - 50
43.0,Rudy Gobert offensive foul  (Manu Ginobili draws the foul),54 - 50
43.0,Rudy Gobert  turnover,54 - 50
32.0,Spurs 20 Sec. timeout,54 - 50
32.0,Manu Ginobili  misses 19-foot two point jumper,54 - 50
28.0,Rodney Hood defensive rebound,54 - 50
6.0,Joe Johnson  misses 23-foot three point jumper,54 - 50
2.0,Dewayne Dedmon defensive rebound,54 - 50
0.0,Manu Ginobili  misses 47-foot three point jumper,54 - 50
0.0,Spurs offensive team rebound,54 - 50
0.0,End of the 2nd Quarter,54 - 50
11:38,George Hill  misses 20-foot jumper,54 - 50
11:37,Pau Gasol defensive rebound,54 - 50
11:18,Kawhi Leonard makes 10-foot two point shot,54 - 52
10:59,Trey Lyles  misses 24-foot three point jumper,54 - 52
10:56,Jonathon Simmons defensive rebound,54 - 52
10:51,LaMarcus Aldridge makes two point shot (Pau Gasol assists),54 - 54
10:51,Trey Lyles shooting foul  (LaMarcus Aldridge draws the foul),54 - 54
10:51,LaMarcus Aldridge makes free throw 1 of 1,54 - 55
10:34,Tony Parker personal foul  (George Hill draws the foul),54 - 55
10:21,Rodney Hood  misses 25-foot,54 - 55
10:19,Kawhi Leonard defensive rebound,54 - 55
10:11,Kawhi Leonard  misses 14-foot two point jumper,54 - 55
10:10,Joe Johnson defensive rebound,54 - 55
9:56,Trey Lyles  misses 25-foot three point jumper,54 - 55
9:55,LaMarcus Aldridge defensive rebound,54 - 55
9:41,LaMarcus Aldridge makes 20-foot jumper (Tony Parker assists),54 - 57
9:19,George Hill makes two point shot (Rudy Gobert assists),56 - 57
9:03,Rudy Gobert shooting foul  (LaMarcus Aldridge draws the foul),56 - 57
9:03,LaMarcus Aldridge makes free throw 1 of 2,56 - 58
9:03,LaMarcus Aldridge makes free throw 2 of 2,56 - 59
8:52,Joe Johnson  misses 23-foot three point jumper,56 - 59
8:49,LaMarcus Aldridge defensive rebound,56 - 59
8:41,LaMarcus Aldridge  misses jumper,56 - 59
8:40,Rodney Hood defensive rebound,56 - 59
8:30,Pau Gasol blocks Rodney Hood's  shot,56 - 59
8:27,Kawhi Leonard defensive rebound,56 - 59
8:15,Jonathon Simmons  misses 26-foot three point jumper,56 - 59
8:14,George Hill defensive rebound,56 - 59
8:07,George Hill makes two point shot,58 - 59
7:41,Pau Gasol  misses 25-foot three point jumper,58 - 59
7:39,Trey Lyles defensive rebound,58 - 59
7:24,Trey Lyles makes 10-foot two point shot,60 - 59
7:00,Kawhi Leonard  misses two point jumper,60 - 59
6:58,Rudy Gobert defensive rebound,60 - 59
6:54,George Hill  misses 26-foot three point pullup jump shot,60 - 59
6:52,Pau Gasol defensive rebound,60 - 59
6:48,Spurs Full timeout,60 - 59
6:48,Joe Ingles enters the game for Joe Johnson,60 - 59
6:48,Spurs 20 Sec. timeout,60 - 59
6:39,Jonathon Simmons  misses 19-foot two point jumper,60 - 59
6:39,Rudy Gobert defensive rebound,60 - 59
6:24,LaMarcus Aldridge blocks Trey Lyles's  layup,60 - 59
6:22,LaMarcus Aldridge defensive rebound,60 - 59
6:16,Tony Parker makes 9-foot two point shot,60 - 61
5:56,Trey Lyles  misses 15-foot jumper,60 - 61
5:54,Tony Parker defensive rebound,60 - 61
5:48,Tony Parker makes layup,60 - 63
5:24,Trey Lyles  bad pass (Kawhi Leonard steals),60 - 63
5:24,Rodney Hood personal take foul  (Jonathon Simmons draws the foul),60 - 63
5:24,Shelvin Mack enters the game for Rodney Hood,60 - 63
5:24,Manu Ginobili enters the game for Jonathon Simmons,60 - 63
5:24,David Lee enters the game for Pau Gasol,60 - 63
5:03,Tony Parker  misses 15-foot two point jumper,60 - 63
5:01,Rudy Gobert defensive rebound,60 - 63
4:43,Trey Lyles makes 25-foot  three point jumper  (George Hill assists),63 - 63
4:22,Manu Ginobili  bad pass (Shelvin Mack steals),63 - 63
4:11,Shelvin Mack makes layup (George Hill assists),65 - 63
3:53,LaMarcus Aldridge  misses 20-foot jumper,65 - 63
3:51,Joe Ingles defensive rebound,65 - 63
3:43,Trey Lyles makes 5-foot two point shot (George Hill assists),68 - 63
3:43,David Lee shooting foul  (Trey Lyles draws the foul),68 - 63
3:43,Kyle Anderson enters the game for Kawhi Leonard,67 - 63
3:43,Patty Mills enters the game for Tony Parker,67 - 63
3:43,Trey Lyles makes free throw 1 of 1,68 - 63
3:32,Patty Mills  misses 25-foot three point jumper,68 - 63
3:31,Trey Lyles defensive rebound,68 - 63
3:20,Trey Lyles makes 20-foot two point shot (George Hill assists),70 - 63
3:04,Rudy Gobert shooting foul  (LaMarcus Aldridge draws the foul),70 - 63
3:04,LaMarcus Aldridge makes free throw 1 of 2,70 - 64
3:04,Dante Exum enters the game for George Hill,70 - 64
3:04,LaMarcus Aldridge makes free throw 2 of 2,70 - 65
2:55,Trey Lyles  misses 26-foot three point pullup jump shot,70 - 65
2:54,David Lee defensive rebound,70 - 65
2:28,Kyle Anderson  misses two point jumper,70 - 65
2:27,Rudy Gobert defensive rebound,70 - 65
2:19,Shelvin Mack  misses driving layup,70 - 65
2:17,Rudy Gobert offensive rebound,70 - 65
2:14,Dante Exum  misses 24-foot three point jumper,70 - 65
2:13,LaMarcus Aldridge defensive rebound,70 - 65
1:59,Patty Mills makes 18-foot jumper,70 - 67
1:52,Jazz Full timeout,70 - 67
1:52,Jonathon Simmons enters the game for David Lee,70 - 67
1:52,Dewayne Dedmon enters the game for LaMarcus Aldridge,70 - 67
1:35,Dante Exum  lost ball turnover (Manu Ginobili steals),70 - 67
1:29,Jonathon Simmons makes two point shot (Patty Mills assists),70 - 69
1:09,Trey Lyles  misses three point jumper,70 - 69
1:08,Dewayne Dedmon defensive rebound,70 - 69
47.0,Dante Exum blocks Dewayne Dedmon's  layup,70 - 69
44.0,Dante Exum defensive rebound,70 - 69
44.0,Dante Exum makes layup,73 - 69
44.0,Dewayne Dedmon shooting foul  (Dante Exum draws the foul),73 - 69
44.0,Joe Johnson enters the game for Rudy Gobert,72 - 69
44.0,Jeff Withey enters the game for Trey Lyles,72 - 69
44.0,Dante Exum makes free throw 1 of 1,73 - 69
27.0,Jeff Withey shooting foul  (Manu Ginobili draws the foul),73 - 69
27.0,Manu Ginobili makes free throw 1 of 2,73 - 70
27.0,Manu Ginobili makes free throw 2 of 2,73 - 71
9.0,Shelvin Mack  bad pass (Kyle Anderson steals),73 - 71
5.0,Patty Mills  bad pass,73 - 71
0.0,Shelvin Mack  misses layup,73 - 71
0.0,Jazz offensive team rebound,73 - 71
0.0,End of the 3rd Quarter,73 - 71
11:44,Patty Mills  misses 25-foot three point jumper,73 - 71
11:41,Dante Exum defensive rebound,73 - 71
11:29,Dewayne Dedmon shooting foul  (Dante Exum draws the foul),73 - 71
11:29,Dante Exum misses free throw 1 of 2,73 - 71
11:29,Jazz offensive team rebound,73 - 71
11:29,David Lee enters the game for Dewayne Dedmon,73 - 71
11:29,Dante Exum makes free throw 2 of 2,74 - 71
11:12,Jonathon Simmons  misses 18-foot two point jumper,74 - 71
11:11,Jeff Withey defensive rebound,74 - 71
10:52,Joe Ingles makes 22-foot two point shot,76 - 71
10:40,David Lee  bad pass (Joe Johnson steals),76 - 71
10:40,David Lee personal take foul  (Joe Johnson draws the foul),76 - 71
10:29,Jeff Withey  misses 5-foot hook shot,76 - 71
10:26,Kyle Anderson defensive rebound,76 - 71
10:11,David Lee makes layup (Patty Mills assists),76 - 73
10:02,Joe Ingles makes  three pointer,79 - 73
9:34,Dante Exum blocks Jonathon Simmons 's 24-foot   three point jumper,79 - 73
9:33,Spurs offensive team rebound,79 - 73
9:33,shot clock turnover,79 - 73
9:33,Kawhi Leonard enters the game for Manu Ginobili,79 - 73
9:22,Shelvin Mack makes 3-foot two point shot,81 - 73
9:08,Kawhi Leonard makes driving layup,81 - 75
8:51,Joe Johnson  bad pass (Kawhi Leonard steals),81 - 75
8:51,Shelvin Mack personal foul  (Kawhi Leonard draws the foul),81 - 75
8:51,Official timeout,81 - 75
8:51,Rodney Hood enters the game for Dante Exum,81 - 75
8:36,Kawhi Leonard  lost ball turnover (Joe Ingles steals),81 - 75
8:23,Rodney Hood makes 10-foot two point shot (Joe Johnson assists),83 - 75
8:03,Patty Mills makes 14-foot jumper (Jonathon Simmons assists),83 - 77
7:41,Shelvin Mack Out-of-Bounds Bad Pass Turnover,83 - 77
7:41,LaMarcus Aldridge enters the game for David Lee,83 - 77
7:26,Joe Johnson shooting foul  (Kawhi Leonard draws the foul),83 - 77
7:26,Kawhi Leonard makes free throw 1 of 3,83 - 78
7:26,Kawhi Leonard makes free throw 2 of 3,83 - 79
7:26,George Hill enters the game for Shelvin Mack,83 - 79
7:26,Rudy Gobert enters the game for Jeff Withey,83 - 79
7:26,Pau Gasol enters the game for Jonathon Simmons,83 - 79
7:26,Tony Parker enters the game for Patty Mills,83 - 79
7:26,Manu Ginobili enters the game for Kyle Anderson,83 - 79
7:26,Kawhi Leonard makes free throw 3 of 3,83 - 80
7:07,Joe Johnson makes 24-foot  three point jumper  (George Hill assists),86 - 80
6:50,Joe Ingles shooting foul  (Kawhi Leonard draws the foul),86 - 80
6:50,Kawhi Leonard makes free throw 1 of 2,86 - 81
6:50,Kawhi Leonard makes free throw 2 of 2,86 - 82
6:33,Joe Johnson  misses 17-foot jumper,86 - 82
6:31,Manu Ginobili defensive rebound,86 - 82
6:26,Manu Ginobili  bad pass (George Hill steals),86 - 82
6:20,George Hill  misses two point shot,86 - 82
6:18,Pau Gasol defensive rebound,86 - 82
6:11,LaMarcus Aldridge makes layup (Pau Gasol assists),86 - 84
5:47,George Hill makes layup,88 - 84
5:26,Kawhi Leonard  misses,88 - 84
5:24,Pau Gasol makes dunk,88 - 86
5:24,Pau Gasol offensive rebound,88 - 84
5:09,Tony Parker personal foul  (George Hill draws the foul),88 - 86
5:09,Spurs Full timeout,88 - 86
5:09,Trey Lyles enters the game for Joe Ingles,88 - 86
5:01,George Hill makes 25-foot  three pointer,91 - 86
4:39,Pau Gasol makes layup (Kawhi Leonard assists),91 - 88
4:24,George Hill makes 15-foot two point shot,93 - 88
4:09,Kawhi Leonard  misses 11-foot two point jumper,93 - 88
4:09,Trey Lyles defensive rebound,93 - 88
4:05,George Hill makes driving layup,95 - 88
4:05,Tony Parker shooting foul  (George Hill draws the foul),95 - 88
4:05,George Hill makes free throw 1 of 1,96 - 88
3:47,Kawhi Leonard makes  three point jumper  (LaMarcus Aldridge assists),96 - 91
3:21,Joe Johnson makes 12-foot jumper,98 - 91
3:03,Kawhi Leonard  misses 16-foot jumper,98 - 91
3:01,George Hill defensive rebound,98 - 91
2:56,Rudy Gobert  misses,98 - 91
2:56,Spurs defensive team rebound,98 - 91
2:56,Jazz Full timeout,98 - 91
2:43,LaMarcus Aldridge  misses alley oop dunk shot,98 - 91
2:41,Joe Johnson defensive rebound,98 - 91
2:21,Rudy Gobert  offensive goaltending turnover,98 - 91
2:05,Kawhi Leonard  misses 24-foot three point jumper,98 - 91
2:03,Rodney Hood defensive rebound,98 - 91
1:45,Rudy Gobert  misses 9-foot two point shot,98 - 91
1:44,Spurs defensive team rebound,98 - 91
1:44,Rudy Gobert personal foul  (LaMarcus Aldridge draws the foul),98 - 91
1:37,Tony Parker  bad pass (Rodney Hood steals),98 - 91
1:30,Trey Lyles makes  three point jumper  (Joe Johnson assists),101 - 91
1:15,Kawhi Leonard  out of bounds lost ball turnover,101 - 91
58.0,Rodney Hood  misses 25-foot three point jumper,101 - 91
57.0,Pau Gasol defensive rebound,101 - 91
46.0,Manu Ginobili  misses three point jumper,101 - 91
44.0,Rudy Gobert defensive rebound,101 - 91
44.0,Pau Gasol personal take foul  (Rudy Gobert draws the foul),101 - 91
44.0,Rudy Gobert makes free throw 1 of 2,102 - 91
44.0,Kyle Anderson enters the game for Kawhi Leonard,102 - 91
44.0,Nicolas Laprovittola enters the game for LaMarcus Aldridge,102 - 91
44.0,Dejounte Murray enters the game for Pau Gasol,102 - 91
44.0,Jonathon Simmons enters the game for Tony Parker,102 - 91
44.0,Bryn Forbes enters the game for Manu Ginobili,102 - 91
44.0,Rudy Gobert makes free throw 2 of 2,103 - 91
34.0,Kyle Anderson  misses three point jumper,103 - 91
32.0,Trey Lyles defensive rebound,103 - 91
11.0,Rodney Hood makes 27-foot,106 - 91
0.0,End of the 4th Quarter,106 - 91
0.0,End of Game,106 - 91
