time,play,score
12:00,Timofey Mozgov vs. Mason Plumlee (Julius Randle gains possession),0 - 0
11:41,Nick Young makes 19-foot two point shot,2 - 0
11:19,Damian Lillard makes 21-foot two point shot,2 - 2
11:03,Jose Calderon  misses 17-foot two point jumper,2 - 2
11:02,Noah Vonleh defensive rebound,2 - 2
10:53,Damian Lillard makes 20-foot two point shot,2 - 4
10:41,Timofey Mozgov  misses jumper,2 - 4
10:41,Noah Vonleh defensive rebound,2 - 4
10:33,Damian Lillard  misses 25-foot three point pullup jump shot,2 - 4
10:33,Luol Deng defensive rebound,2 - 4
10:27,Luol Deng makes 5-foot two point shot,4 - 4
9:57,Evan Turner makes 8-foot jumper,4 - 6
9:51,Julius Randle makes 15-foot two point shot,6 - 6
9:37,Nick Young shooting foul  (C.J. McCollum draws the foul),6 - 6
9:37,C.J. McCollum makes free throw 1 of 2,6 - 7
9:37,C.J. McCollum makes free throw 2 of 2,6 - 8
9:18,Julius Randle  traveling,6 - 8
9:08,Damian Lillard makes 25-foot  three point jumper  (Mason Plumlee assists),6 - 11
8:56,Mason Plumlee personal foul  (Timofey Mozgov draws the foul),6 - 11
8:48,Nick Young makes 15-foot two point shot (Julius Randle assists),8 - 11
8:19,Mason Plumlee  misses 18-foot two point jumper,8 - 11
8:18,Julius Randle defensive rebound,8 - 11
8:12,Timofey Mozgov  misses layup,8 - 11
8:11,Noah Vonleh defensive rebound,8 - 11
8:06,C.J. McCollum  misses 8-foot two point shot,8 - 11
8:04,Luol Deng defensive rebound,8 - 11
7:48,Jose Calderon  misses 15-foot jumper,8 - 11
7:47,Timofey Mozgov offensive rebound,8 - 11
7:45,Nick Young makes 26-foot  three point jumper  (Timofey Mozgov assists),11 - 11
7:26,Timofey Mozgov blocks Mason Plumlee's  shot,11 - 11
7:26,Timofey Mozgov defensive rebound,11 - 11
7:07,Nick Young  misses 25-foot three point pullup jump shot,11 - 11
7:07,Mason Plumlee defensive rebound,11 - 11
6:58,C.J. McCollum makes 24-foot  three point jumper  (Evan Turner assists),11 - 14
6:58,Lakers Full timeout,11 - 14
6:41,Luol Deng makes 14-foot two point shot,13 - 14
6:24,C.J. McCollum  misses 17-foot two point jumper,13 - 14
6:22,Julius Randle defensive rebound,13 - 14
6:18,Julius Randle  out of bounds lost ball turnover,13 - 14
6:03,C.J. McCollum makes driving layup,13 - 16
6:03,Nick Young shooting foul  (C.J. McCollum draws the foul),13 - 16
6:03,Meyers Leonard enters the game for Mason Plumlee,13 - 16
6:03,C.J. McCollum makes free throw 1 of 1,13 - 17
5:46,Jose Calderon  misses 25-foot three point pullup jump shot,13 - 17
5:45,Meyers Leonard defensive rebound,13 - 17
5:33,C.J. McCollum  misses 9-foot,13 - 17
5:33,Noah Vonleh offensive rebound,13 - 17
5:30,Allen Crabbe enters the game for C.J. McCollum,13 - 17
5:30,Jordan Clarkson enters the game for Luol Deng,13 - 17
5:30,Brandon Ingram enters the game for Nick Young,13 - 17
5:22,Damian Lillard  misses three point jumper,13 - 17
5:20,Brandon Ingram defensive rebound,13 - 17
5:09,Jordan Clarkson makes 25-foot  three point jumper  (Jose Calderon assists),16 - 17
4:54,Damian Lillard makes 20-foot two point shot,16 - 19
4:41,Timofey Mozgov  misses 13-foot jumper,16 - 19
4:41,Damian Lillard defensive rebound,16 - 19
4:30,Meyers Leonard  misses 24-foot three point jumper,16 - 19
4:28,Timofey Mozgov defensive rebound,16 - 19
4:18,Julius Randle  misses 21-foot two point shot,16 - 19
4:18,Damian Lillard defensive rebound,16 - 19
4:05,Jose Calderon shooting foul  (Damian Lillard draws the foul),16 - 19
4:05,Damian Lillard makes free throw 1 of 2,16 - 20
4:05,Tarik Black enters the game for Timofey Mozgov,16 - 20
4:05,Ivica Zubac enters the game for Julius Randle,16 - 20
4:05,Al-Farouq Aminu enters the game for Noah Vonleh,16 - 20
4:05,Damian Lillard makes free throw 2 of 2,16 - 21
3:54,Ivica Zubac  misses hook shot,16 - 21
3:53,Meyers Leonard defensive rebound,16 - 21
3:45,Evan Turner  misses 15-foot two point jumper,16 - 21
3:44,Evan Turner offensive rebound,16 - 21
3:43,Tarik Black shooting foul  (Evan Turner draws the foul),16 - 21
3:43,Evan Turner makes free throw 1 of 2,16 - 22
3:43,Louis Williams enters the game for Jose Calderon,16 - 22
3:43,Evan Turner misses free throw 2 of 2,16 - 22
3:42,Tarik Black defensive rebound,16 - 22
3:27,Jordan Clarkson  bad pass (Damian Lillard steals),16 - 22
3:19,Al-Farouq Aminu makes two point shot,16 - 24
3:05,Jordan Clarkson  misses three point jumper,16 - 24
3:04,Brandon Ingram offensive rebound,16 - 24
3:00,Louis Williams makes 24-foot  three point jumper  (Brandon Ingram assists),19 - 24
2:48,Evan Turner makes driving layup,19 - 26
2:48,Tarik Black shooting foul  (Evan Turner draws the foul),19 - 26
2:48,Trail Blazers Full timeout,19 - 26
2:48,C.J. McCollum enters the game for Damian Lillard,19 - 26
2:48,Evan Turner misses free throw 1 of 1,19 - 26
2:47,Brandon Ingram defensive rebound,19 - 26
2:40,Louis Williams makes 24-foot  three point jumper,22 - 26
2:40,C.J. McCollum shooting foul  (Louis Williams draws the foul),21 - 26
2:40,Pat Connaughton enters the game for Evan Turner,21 - 26
2:40,Louis Williams makes free throw 1 of 1,23 - 26
2:24,Al-Farouq Aminu  bad pass (Louis Williams steals),23 - 26
2:15,Tarik Black makes two point shot (Louis Williams assists),25 - 26
2:02,Allen Crabbe  misses 26-foot three point jumper,25 - 26
2:00,Ivica Zubac defensive rebound,25 - 26
1:53,Ivica Zubac  misses driving layup,25 - 26
1:52,Tarik Black offensive rebound,25 - 26
1:49,Tarik Black makes two point shot,27 - 26
1:30,Meyers Leonard  misses three point jumper,27 - 26
1:29,Tarik Black defensive rebound,27 - 26
1:20,Ivica Zubac  misses 3-foot two point shot,27 - 26
1:19,Tarik Black offensive rebound,27 - 26
1:09,Tarik Black  misses 3-foot hook shot,27 - 26
1:08,Pat Connaughton defensive rebound,27 - 26
1:00,Meyers Leonard  misses 25-foot three point jumper,27 - 26
59.0,Tarik Black defensive rebound,27 - 26
47.0,Ivica Zubac makes 2-foot layup (Louis Williams assists),29 - 26
31.0,C.J. McCollum makes 17-foot two point shot,29 - 28
25.0,Louis Williams makes two point shot,31 - 28
4.0,C.J. McCollum makes two point shot,31 - 30
0.0,Louis Williams  misses 25-foot three point pullup jump shot,31 - 30
0.0,Lakers offensive team rebound,31 - 30
0.0,End of the 1st Quarter,31 - 30
11:41,Al-Farouq Aminu  misses 22-foot jumper,31 - 30
11:41,Brandon Ingram defensive rebound,31 - 30
11:37,Brandon Ingram  bad pass (Pat Connaughton steals),31 - 30
11:30,Al-Farouq Aminu  misses layup,31 - 30
11:29,Meyers Leonard offensive rebound,31 - 30
11:26,Mason Plumlee enters the game for Meyers Leonard,31 - 30
11:21,Allen Crabbe makes 20-foot two point shot (Al-Farouq Aminu assists),31 - 32
11:02,Louis Williams makes 2-foot two point shot,33 - 32
10:47,Larry Nance Jr. blocks Allen Crabbe 's 3-foot  layup,33 - 32
10:45,Louis Williams defensive rebound,33 - 32
10:42,Louis Williams  misses 7-foot jumper,33 - 32
10:41,C.J. McCollum defensive rebound,33 - 32
10:38,Pat Connaughton makes 25-foot  three point jumper  (C.J. McCollum assists),33 - 35
10:19,Brandon Ingram  misses layup,33 - 35
10:18,Larry Nance Jr. offensive rebound,33 - 35
10:11,Brandon Ingram  misses 26-foot three point jumper,33 - 35
10:11,C.J. McCollum defensive rebound,33 - 35
10:02,Pat Connaughton  misses 22-foot jumper,33 - 35
10:00,Al-Farouq Aminu offensive rebound,33 - 35
9:56,Mason Plumlee makes two point shot,33 - 37
9:56,Lakers Full timeout,33 - 37
9:56,Ivica Zubac enters the game for Tarik Black,33 - 37
9:40,Jordan Clarkson  misses 26-foot three point pullup jump shot,33 - 37
9:37,Larry Nance Jr. offensive rebound,33 - 37
9:27,Brandon Ingram  misses 24-foot three point pullup jump shot,33 - 37
9:26,Allen Crabbe defensive rebound,33 - 37
9:11,C.J. McCollum makes 6-foot two point shot (Allen Crabbe assists),33 - 39
8:57,Pat Connaughton blocks Brandon Ingram 's 3-foot  jumper,33 - 39
8:56,Al-Farouq Aminu defensive rebound,33 - 39
8:51,Pat Connaughton makes driving layup (Al-Farouq Aminu assists),33 - 41
8:33,Ivica Zubac makes two point shot,35 - 41
8:18,Allen Crabbe makes 21-foot jumper (C.J. McCollum assists),35 - 43
8:04,Mason Plumlee blocks Ivica Zubac's  shot,35 - 43
8:03,Larry Nance Jr. offensive rebound,35 - 43
7:58,Ivica Zubac  misses layup,35 - 43
7:56,Ivica Zubac  misses,35 - 43
7:56,Ivica Zubac offensive rebound,35 - 43
7:56,Jordan Clarkson offensive rebound,35 - 43
7:56,Ivica Zubac offensive rebound,35 - 43
7:56,Ivica Zubac  misses,35 - 43
7:52,Jordan Clarkson makes 7-foot two point shot,37 - 43
7:37,Al-Farouq Aminu  traveling,37 - 43
7:37,Damian Lillard enters the game for C.J. McCollum,37 - 43
7:37,Nick Young enters the game for Brandon Ingram,37 - 43
7:20,Louis Williams makes 23-foot  three point jumper  (Ivica Zubac assists),40 - 43
6:50,Al-Farouq Aminu  lost ball turnover (Louis Williams steals),40 - 43
6:33,Jordan Clarkson makes driving layup,42 - 43
6:33,Trail Blazers Full timeout,42 - 43
6:33,Noah Vonleh enters the game for Al-Farouq Aminu,42 - 43
6:18,Damian Lillard  misses 21-foot jumper,42 - 43
6:16,Ivica Zubac defensive rebound,42 - 43
6:03,Ivica Zubac Out-of-Bounds Bad Pass Turnover,42 - 43
6:03,Evan Turner enters the game for Pat Connaughton,42 - 43
6:03,Julius Randle enters the game for Larry Nance Jr.,42 - 43
5:50,Mason Plumlee makes driving layup (Evan Turner assists),42 - 45
5:37,Louis Williams makes 8-foot Driving Floating Jump Shot,44 - 45
5:26,Mason Plumlee makes driving dunk,44 - 47
5:26,Ivica Zubac shooting foul  (Mason Plumlee draws the foul),44 - 47
5:26,Luol Deng enters the game for Louis Williams,44 - 47
5:26,Mason Plumlee makes free throw 1 of 1,44 - 48
5:13,Noah Vonleh shooting foul  (Ivica Zubac draws the foul),44 - 48
5:13,Ivica Zubac makes free throw 1 of 2,45 - 48
5:13,Ivica Zubac makes free throw 2 of 2,46 - 48
5:01,Noah Vonleh makes dunk (Mason Plumlee assists),46 - 50
4:47,Nick Young  misses driving layup,46 - 50
4:46,Allen Crabbe defensive rebound,46 - 50
4:37,Damian Lillard  misses driving layup,46 - 50
4:37,Julius Randle defensive rebound,46 - 50
4:33,Julius Randle makes two point shot,48 - 50
4:16,Evan Turner makes 19-foot two point shot,48 - 52
4:01,Jordan Clarkson makes 7-foot Driving Floating Jump Shot (Ivica Zubac assists),50 - 52
3:39,Damian Lillard  misses 13-foot jumper,50 - 52
3:39,Julius Randle defensive rebound,50 - 52
3:30,Ivica Zubac makes dunk (Jordan Clarkson assists),52 - 52
3:11,Evan Turner  bad pass (Luol Deng steals),52 - 52
3:05,Damian Lillard shooting foul  (Nick Young draws the foul),52 - 52
3:05,Nick Young makes free throw 1 of 2,53 - 52
3:05,Timofey Mozgov enters the game for Ivica Zubac,53 - 52
3:05,C.J. McCollum enters the game for Allen Crabbe,53 - 52
3:05,Nick Young makes free throw 2 of 2,54 - 52
2:55,Evan Turner makes 15-foot two point shot,54 - 54
2:40,Timofey Mozgov offensive foul  (Damian Lillard draws the foul),54 - 54
2:40,Timofey Mozgov  turnover,54 - 54
2:40,Official timeout,54 - 54
2:27,Timofey Mozgov shooting foul  (Mason Plumlee draws the foul),54 - 54
2:27,Mason Plumlee misses free throw 1 of 2,54 - 54
2:27,Mason Plumlee makes free throw 2 of 2,54 - 55
2:27,Trail Blazers offensive team rebound,54 - 54
2:15,Jordan Clarkson  misses Driving Floating Jump Shot,54 - 55
2:15,C.J. McCollum defensive rebound,54 - 55
2:05,C.J. McCollum makes 4-foot two point shot,54 - 57
1:47,Luol Deng  misses three point jumper,54 - 57
1:47,Timofey Mozgov offensive rebound,54 - 57
1:37,Nick Young  misses 23-foot three point jumper,54 - 57
1:36,Mason Plumlee defensive rebound,54 - 57
1:29,Damian Lillard  misses 24-foot three point pullup jump shot,54 - 57
1:29,Jordan Clarkson defensive rebound,54 - 57
1:15,Julius Randle makes 3-foot Driving Floating Jump Shot,56 - 57
1:15,Mason Plumlee shooting foul  (Julius Randle draws the foul),56 - 57
1:15,Julius Randle misses free throw 1 of 1,56 - 57
1:13,Evan Turner defensive rebound,56 - 57
1:00,Damian Lillard makes driving layup,56 - 59
46.0,Jordan Clarkson makes 16-foot two point shot,58 - 59
35.0,Noah Vonleh offensive foul  (Nick Young draws the foul),58 - 59
35.0,Noah Vonleh  turnover,58 - 59
14.0,Julius Randle  misses 11-foot jumper,58 - 59
13.0,Mason Plumlee defensive rebound,58 - 59
2.0,Damian Lillard  misses 25-foot three point pullup jump shot,58 - 59
1.0,Luol Deng defensive rebound,58 - 59
0.0,Luol Deng  misses 60-foot three point jumper,58 - 59
0.0,Lakers offensive team rebound,58 - 59
0.0,End of the 2nd Quarter,58 - 59
11:48,Nick Young in bound foul  (C.J. McCollum draws the foul),58 - 59
11:48,C.J. McCollum makes free throw 1 of 1,58 - 60
11:45,Noah Vonleh makes 22-foot jumper (Evan Turner assists),58 - 62
11:22,Julius Randle makes 22-foot jumper (Jose Calderon assists),60 - 62
11:00,Evan Turner  misses 25-foot three point jumper,60 - 62
10:59,Noah Vonleh makes tip shot,60 - 64
10:59,Noah Vonleh offensive rebound,60 - 62
10:30,shot clock turnover,60 - 64
10:08,Noah Vonleh  misses 5-foot jumper,60 - 64
10:08,Timofey Mozgov defensive rebound,60 - 64
9:51,Luol Deng  misses 25-foot three point jumper,60 - 64
9:51,Noah Vonleh defensive rebound,60 - 64
9:41,Damian Lillard makes 3-foot Driving Floating Jump Shot,60 - 66
9:30,Jose Calderon Out-of-Bounds Bad Pass Turnover,60 - 66
9:30,Lakers Full timeout,60 - 66
9:30,Jordan Clarkson enters the game for Luol Deng,60 - 66
9:30,Ivica Zubac enters the game for Julius Randle,60 - 66
9:30,Tarik Black enters the game for Timofey Mozgov,60 - 66
9:30,Brandon Ingram enters the game for Nick Young,60 - 66
9:30,Louis Williams enters the game for Jose Calderon,60 - 66
9:10,Mason Plumlee  bad pass (Jordan Clarkson steals),60 - 66
9:03,Louis Williams  misses 24-foot three point running jumper,60 - 66
9:03,Noah Vonleh defensive rebound,60 - 66
8:53,Ivica Zubac blocks Damian Lillard 's 1-foot  layup,60 - 66
8:52,Tarik Black defensive rebound,60 - 66
8:45,Jordan Clarkson  misses two point shot,60 - 66
8:44,Noah Vonleh defensive rebound,60 - 66
8:38,Mason Plumlee makes layup (C.J. McCollum assists),60 - 68
8:38,Tarik Black shooting foul  (Mason Plumlee draws the foul),60 - 68
8:38,Mason Plumlee misses free throw 1 of 1,60 - 68
8:38,Lakers defensive team rebound,60 - 68
8:29,Ivica Zubac  lost ball turnover (Mason Plumlee steals),60 - 68
8:25,Mason Plumlee makes two point shot,60 - 70
8:03,Ivica Zubac  out of bounds lost ball turnover,60 - 70
7:50,Brandon Ingram blocks C.J. McCollum 's 16-foot  shot,60 - 70
7:50,Ivica Zubac defensive rebound,60 - 70
7:43,Louis Williams  misses 24-foot three point pullup jump shot,60 - 70
7:41,Mason Plumlee defensive rebound,60 - 70
7:31,Tarik Black shooting foul  (Damian Lillard draws the foul),60 - 70
7:31,Damian Lillard makes free throw 1 of 2,60 - 71
7:31,Larry Nance Jr. enters the game for Tarik Black,60 - 71
7:31,Damian Lillard makes free throw 2 of 2,60 - 72
7:16,Ivica Zubac makes 9-foot two point shot (Louis Williams assists),62 - 72
7:03,Ivica Zubac blocks Mason Plumlee's  layup,62 - 72
7:01,Louis Williams defensive rebound,62 - 72
7:01,Noah Vonleh offensive rebound,62 - 72
7:01,Noah Vonleh  misses 3-foot,62 - 72
6:52,Louis Williams  bad pass (Evan Turner steals),62 - 72
6:48,Evan Turner  misses two point shot,62 - 72
6:48,Noah Vonleh offensive rebound,62 - 72
6:45,Noah Vonleh makes two point shot,62 - 74
6:28,Larry Nance Jr.  misses 20-foot jumper,62 - 74
6:26,Evan Turner defensive rebound,62 - 74
6:18,C.J. McCollum  misses 25-foot three point jumper,62 - 74
6:18,Lakers defensive team rebound,62 - 74
6:03,C.J. McCollum shooting foul  (Jordan Clarkson draws the foul),62 - 74
6:03,Jordan Clarkson makes free throw 1 of 2,63 - 74
6:03,Allen Crabbe enters the game for C.J. McCollum,63 - 74
6:03,Al-Farouq Aminu enters the game for Noah Vonleh,63 - 74
6:03,Jordan Clarkson makes free throw 2 of 2,64 - 74
5:48,Evan Turner makes two point shot,64 - 76
5:28,Brandon Ingram  misses 25-foot three point jumper,64 - 76
5:26,Al-Farouq Aminu defensive rebound,64 - 76
5:18,Mason Plumlee makes dunk (Damian Lillard assists),64 - 78
4:52,Jordan Clarkson makes 6-foot two point shot,66 - 78
4:37,Ivica Zubac shooting foul  (Mason Plumlee draws the foul),66 - 78
4:37,Mason Plumlee misses free throw 1 of 2,66 - 78
4:37,Trail Blazers offensive team rebound,66 - 78
4:37,Mason Plumlee makes free throw 2 of 2,66 - 79
4:20,Ivica Zubac makes 9-foot two point shot (Louis Williams assists),68 - 79
4:05,Damian Lillard makes two point shot (Mason Plumlee assists),68 - 81
3:44,Louis Williams  misses 11-foot step back jumpshot,68 - 81
3:43,Mason Plumlee defensive rebound,68 - 81
3:33,Allen Crabbe Out-of-Bounds Bad Pass Turnover,68 - 81
3:33,Lakers 20 Sec. timeout,68 - 81
3:33,Meyers Leonard enters the game for Mason Plumlee,68 - 81
3:33,Pat Connaughton enters the game for Evan Turner,68 - 81
3:18,Jordan Clarkson  misses Driving Floating Jump Shot,68 - 81
3:17,Al-Farouq Aminu defensive rebound,68 - 81
3:10,Allen Crabbe Out-of-Bounds Bad Pass Turnover,68 - 81
2:59,Louis Williams makes driving layup,70 - 81
2:43,Allen Crabbe  traveling,70 - 81
2:43,Trail Blazers Full timeout,70 - 81
2:43,C.J. McCollum enters the game for Damian Lillard,70 - 81
2:27,Brandon Ingram offensive Charge  (Al-Farouq Aminu draws the foul),70 - 81
2:27,Brandon Ingram  turnover,70 - 81
2:08,Louis Williams kicked ball violation,70 - 81
1:58,Al-Farouq Aminu  bad pass (Louis Williams steals),70 - 81
1:46,C.J. McCollum shooting foul  (Louis Williams draws the foul),70 - 81
1:46,Louis Williams makes free throw 1 of 2,71 - 81
1:46,Nick Young enters the game for Larry Nance Jr.,71 - 81
1:46,Louis Williams makes free throw 2 of 2,72 - 81
1:31,Allen Crabbe makes 22-foot jumper,72 - 83
1:17,Jordan Clarkson makes 25-foot  three point jumper  (Brandon Ingram assists),75 - 83
1:02,C.J. McCollum  misses 3-foot jumper,75 - 83
1:02,Ivica Zubac defensive rebound,75 - 83
45.0,Ivica Zubac  traveling,75 - 83
30.0,C.J. McCollum  misses layup,75 - 83
29.0,Trail Blazers offensive team rebound,75 - 83
25.0,Meyers Leonard  misses 3-foot hook shot,75 - 83
24.0,Nick Young defensive rebound,75 - 83
4.0,Meyers Leonard blocks Ivica Zubac's  layup,75 - 83
2.0,Ivica Zubac offensive rebound,75 - 83
2.0,shot clock turnover,75 - 83
2.0,Damian Lillard enters the game for Meyers Leonard,75 - 83
2.0,Luol Deng enters the game for Ivica Zubac,75 - 83
0.0,End of the 3rd Quarter,75 - 83
11:45,Allen Crabbe shooting foul  (Jordan Clarkson draws the foul),75 - 83
11:45,Jordan Clarkson makes free throw 1 of 2,76 - 83
11:45,Jordan Clarkson makes free throw 2 of 2,77 - 83
11:33,Allen Crabbe makes 19-foot jumper (C.J. McCollum assists),77 - 85
11:11,Jordan Clarkson  misses driving layup,77 - 85
11:10,Allen Crabbe defensive rebound,77 - 85
11:03,Luol Deng blocks Al-Farouq Aminu 's 2-foot  shot,77 - 85
11:03,Nick Young defensive rebound,77 - 85
10:56,Nick Young  misses 20-foot jumper,77 - 85
10:56,Meyers Leonard defensive rebound,77 - 85
10:45,C.J. McCollum makes Driving Floating Jump Shot,77 - 87
10:44,Lakers Full timeout,77 - 87
10:33,Louis Williams  misses 21-foot two point jumper,77 - 87
10:32,Meyers Leonard defensive rebound,77 - 87
10:22,Meyers Leonard  misses,77 - 87
10:22,Lakers defensive team rebound,77 - 87
10:06,Louis Williams makes 25-foot  three pointer,80 - 87
9:52,Ivica Zubac blocks Pat Connaughton 's 1-foot  layup,80 - 87
9:51,Jordan Clarkson defensive rebound,80 - 87
9:47,Louis Williams makes 26-foot  three point jumper  (Jordan Clarkson assists),83 - 87
9:30,Allen Crabbe makes 21-foot jumper (Meyers Leonard assists),83 - 89
9:07,Louis Williams makes 25-foot  three pointer,86 - 89
9:06,Trail Blazers Full timeout,86 - 89
9:06,Evan Turner enters the game for C.J. McCollum,86 - 89
9:06,Damian Lillard enters the game for Pat Connaughton,86 - 89
9:06,Jose Calderon enters the game for Jordan Clarkson,86 - 89
8:48,Evan Turner  misses 15-foot jumper,86 - 89
8:47,Ivica Zubac defensive rebound,86 - 89
8:40,Evan Turner shooting foul  (Louis Williams draws the foul),86 - 89
8:40,Louis Williams makes free throw 1 of 2,87 - 89
8:40,Louis Williams makes free throw 2 of 2,88 - 89
8:30,Damian Lillard  misses 18-foot two point jumper,88 - 89
8:29,Jose Calderon defensive rebound,88 - 89
8:22,Louis Williams  misses 25-foot three point pullup jump shot,88 - 89
8:22,Ivica Zubac offensive rebound,88 - 89
8:22,Meyers Leonard personal foul  (Ivica Zubac draws the foul),88 - 89
8:22,Mason Plumlee enters the game for Meyers Leonard,88 - 89
8:03,Louis Williams  misses,88 - 89
8:03,Al-Farouq Aminu defensive rebound,88 - 89
7:52,Al-Farouq Aminu  misses 25-foot three point jumper,88 - 89
7:52,Nick Young defensive rebound,88 - 89
7:30,Ivica Zubac  misses 8-foot two point shot,88 - 89
7:28,Damian Lillard defensive rebound,88 - 89
7:18,Mason Plumlee  misses 6-foot two point shot,88 - 89
7:16,Luol Deng defensive rebound,88 - 89
7:03,Al-Farouq Aminu blocks Ivica Zubac 's 3-foot  jumper,88 - 89
7:03,Damian Lillard defensive rebound,88 - 89
6:56,Damian Lillard  misses Driving Floating Jump Shot,88 - 89
6:54,Louis Williams defensive rebound,88 - 89
6:48,Nick Young  bad pass (Mason Plumlee steals),88 - 89
6:39,Allen Crabbe makes 17-foot two point shot,88 - 91
6:37,Lakers Full timeout,88 - 91
6:37,Julius Randle enters the game for Ivica Zubac,88 - 91
6:37,Larry Nance Jr. enters the game for Louis Williams,88 - 91
6:22,Nick Young makes 24-foot  three pointer  (Larry Nance Jr. assists),91 - 91
6:07,Julius Randle personal foul  (Allen Crabbe draws the foul),91 - 91
5:58,Larry Nance Jr. blocks Allen Crabbe's  layup,91 - 91
5:56,Larry Nance Jr. defensive rebound,91 - 91
5:41,Nick Young makes 25-foot  three pointer,94 - 91
5:18,Evan Turner  misses 17-foot two point jumper,94 - 91
5:18,Nick Young defensive rebound,94 - 91
4:56,Julius Randle  misses layup,94 - 91
4:54,Julius Randle offensive rebound,94 - 91
4:48,Julius Randle  misses layup,94 - 91
4:47,Mason Plumlee defensive rebound,94 - 91
4:41,Jose Calderon shooting foul  (Damian Lillard draws the foul),94 - 91
4:41,Damian Lillard makes free throw 1 of 3,94 - 94
4:41,Jordan Clarkson enters the game for Jose Calderon,94 - 93
4:41,Damian Lillard makes free throw 2 of 3,94 - 94
4:41,C.J. McCollum enters the game for Allen Crabbe,94 - 93
4:41,Damian Lillard makes free throw 3 of 3,94 - 94
4:26,Nick Young  misses 23-foot three point jumper,94 - 94
4:24,Mason Plumlee defensive rebound,94 - 94
4:13,Damian Lillard  misses 23-foot two point jumper,94 - 94
4:13,Larry Nance Jr. defensive rebound,94 - 94
4:07,Julius Randle  misses,94 - 94
4:07,Trail Blazers defensive team rebound,94 - 94
3:53,Damian Lillard  traveling,94 - 94
3:31,Luol Deng  misses 25-foot three point jumper,94 - 94
3:31,Lakers offensive team rebound,94 - 94
3:31,Al-Farouq Aminu loose ball foul  (Larry Nance Jr. draws the foul),94 - 94
3:25,Jordan Clarkson  misses 17-foot two point jumper,94 - 94
3:23,C.J. McCollum defensive rebound,94 - 94
3:14,C.J. McCollum makes 25-foot  step back jumpshot,94 - 97
2:56,Larry Nance Jr.  misses layup,94 - 97
2:56,Mason Plumlee defensive rebound,94 - 97
2:56,Julius Randle personal foul  (Mason Plumlee draws the foul),94 - 97
2:56,Louis Williams enters the game for Julius Randle,94 - 97
2:40,C.J. McCollum makes two point shot,94 - 99
2:27,Larry Nance Jr.  misses 16-foot jumper,94 - 99
2:27,Mason Plumlee defensive rebound,94 - 99
2:08,Mason Plumlee  misses layup,94 - 99
2:08,Mason Plumlee offensive rebound,94 - 99
2:05,Larry Nance Jr. blocks Mason Plumlee's  shot,94 - 99
2:03,Louis Williams defensive rebound,94 - 99
2:00,Larry Nance Jr. makes dunk (Louis Williams assists),96 - 99
1:54,Mason Plumlee makes dunk (Damian Lillard assists),96 - 101
1:54,Lakers Full timeout,96 - 101
1:54,Ivica Zubac enters the game for Larry Nance Jr.,96 - 101
1:43,Louis Williams  misses 7-foot two point shot,96 - 101
1:42,Al-Farouq Aminu defensive rebound,96 - 101
1:27,Damian Lillard  misses two point shot,96 - 101
1:25,Mason Plumlee  misses,96 - 101
1:25,Mason Plumlee offensive rebound,96 - 101
1:24,Ivica Zubac defensive rebound,96 - 101
1:17,Louis Williams  misses 25-foot three point pullup jump shot,96 - 101
1:16,Mason Plumlee defensive rebound,96 - 101
1:00,Louis Williams personal foul  (Evan Turner draws the foul),96 - 101
48.0,Damian Lillard makes 12-foot Driving Floating Jump Shot,96 - 103
41.0,Jordan Clarkson makes driving layup,98 - 103
27.0,Mason Plumlee makes dunk (Al-Farouq Aminu assists),98 - 105
13.0,Luol Deng  misses 20-foot jumper,98 - 105
12.0,Mason Plumlee defensive rebound,98 - 105
0.0,End of the 4th Quarter,98 - 105
