time,play,score
1:25,DeAndre Jordan misses free throw 1 of 1,104 - 100
1:23,Blake Griffin  misses 2-foot jumper,104 - 100
1:23,Blake Griffin offensive rebound,104 - 100
1:21,Monta Ellis defensive rebound,104 - 100
1:00,Paul George makes 25-foot  three point jumper  (Myles Turner assists),107 - 100
1:00,Clippers Full timeout,107 - 100
1:00,Jamal Crawford enters the game for Luc Mbah a Moute,107 - 100
1:00,J.J. Redick enters the game for Austin Rivers,107 - 100
49.0,Blake Griffin  misses 23-foot jumper,107 - 100
48.0,Pacers defensive team rebound,107 - 100
48.0,DeAndre Jordan loose ball foul  (Myles Turner draws the foul),107 - 100
48.0,Myles Turner makes free throw 1 of 2,108 - 100
48.0,Marreese Speights enters the game for DeAndre Jordan,108 - 100
48.0,Myles Turner makes free throw 2 of 2,109 - 100
41.0,Chris Paul  misses 27-foot three point jumper,109 - 100
40.0,Paul George defensive rebound,109 - 100
34.0,J.J. Redick kicked ball violation,109 - 100
34.0,Pacers Full timeout,109 - 100
34.0,Austin Rivers enters the game for Marreese Speights,109 - 100
34.0,C.J. Miles enters the game for Thaddeus Young,109 - 100
30.0,Jamal Crawford personal take foul  (Jeff Teague draws the foul),109 - 100
30.0,Jeff Teague makes free throw 1 of 2,110 - 100
30.0,Thaddeus Young enters the game for Myles Turner,110 - 100
30.0,Jeff Teague makes free throw 2 of 2,111 - 100
24.0,Chris Paul makes two point shot,111 - 102
0.0,shot clock turnover,111 - 102
0.0,End of the 4th Quarter,111 - 102
0.0,End of Game,111 - 102
