time,play,score
12:00,Anthony Davis vs. Clint Capela (Patrick Beverley gains possession),0 - 0
11:51,Patrick Beverley  bad pass (Solomon Hill steals),0 - 0
11:40,DeMarcus Cousins  bad pass,0 - 0
11:21,Trevor Ariza  misses 24-foot three point jumper,0 - 0
11:19,Anthony Davis defensive rebound,0 - 0
11:04,Anthony Davis  misses 15-foot jumper,0 - 0
11:03,James Harden defensive rebound,0 - 0
10:55,Patrick Beverley makes 24-foot  three point jumper  (James Harden assists),0 - 3
10:41,Tim Frazier  misses 26-foot three point jumper,0 - 3
10:40,Trevor Ariza defensive rebound,0 - 3
10:32,Clint Capela makes dunk (James Harden assists),0 - 5
10:18,Jrue Holiday  misses 27-foot three point jumper,0 - 5
10:18,Patrick Beverley defensive rebound,0 - 5
10:07,Clint Capela makes two point shot (James Harden assists),0 - 7
9:57,Jrue Holiday  bad pass,0 - 7
9:42,Patrick Beverley  misses 26-foot three point jumper,0 - 7
9:41,Ryan Anderson offensive rebound,0 - 7
9:34,Clint Capela  offensive goaltending turnover,0 - 7
9:30,Pelicans Full timeout,0 - 7
9:22,Solomon Hill  misses 23-foot three point jumper,0 - 7
9:21,Clint Capela defensive rebound,0 - 7
9:07,Clint Capela  misses two point shot,0 - 7
9:04,DeMarcus Cousins defensive rebound,0 - 7
8:52,Jrue Holiday  misses two point shot,0 - 7
8:52,Ryan Anderson defensive rebound,0 - 7
8:45,Patrick Beverley makes two point shot (James Harden assists),0 - 9
8:33,DeMarcus Cousins makes 25-foot  three point jumper  (Jrue Holiday assists),3 - 9
8:18,Ryan Anderson offensive Charge  (DeMarcus Cousins draws the foul),3 - 9
8:18,Ryan Anderson  turnover,3 - 9
8:03,DeMarcus Cousins  misses layup,3 - 9
8:02,Clint Capela defensive rebound,3 - 9
7:56,James Harden makes driving layup,3 - 11
7:43,Tim Frazier  lost ball turnover (James Harden steals),3 - 11
7:39,Patrick Beverley Out-of-Bounds Bad Pass Turnover,3 - 11
7:24,DeMarcus Cousins makes 7-foot two point shot,5 - 11
7:24,Clint Capela shooting foul  (DeMarcus Cousins draws the foul),5 - 11
7:24,DeMarcus Cousins makes free throw 1 of 1,6 - 11
7:18,Clint Capela offensive Charge  (DeMarcus Cousins draws the foul),6 - 11
7:18,Clint Capela  turnover,6 - 11
7:18,Nene  enters the game for Clint Capela,6 - 11
7:05,Anthony Davis makes 20-foot jumper (Jrue Holiday assists),8 - 11
6:50,Ryan Anderson Out-of-Bounds Bad Pass Turnover,8 - 11
6:39,DeMarcus Cousins  misses 19-foot jumper,8 - 11
6:39,Nene  defensive rebound,8 - 11
6:33,James Harden  misses 26-foot three point pullup jump shot,8 - 11
6:31,Solomon Hill defensive rebound,8 - 11
6:18,Solomon Hill makes 27-foot  three point jumper  (Tim Frazier assists),11 - 11
6:05,James Harden  bad pass (Anthony Davis steals),11 - 11
6:00,Solomon Hill makes 25-foot  three point jumper  (Anthony Davis assists),14 - 11
5:48,Ryan Anderson  misses 29-foot three point jumper,14 - 11
5:46,Solomon Hill defensive rebound,14 - 11
5:31,DeMarcus Cousins makes 26-foot  three point jumper  (Jrue Holiday assists),17 - 11
5:31,Rockets Full timeout,17 - 11
5:31,Eric Gordon enters the game for Patrick Beverley,17 - 11
5:20,James Harden makes layup (Nene  assists),17 - 13
5:07,DeMarcus Cousins  misses cutting layup,17 - 13
5:07,Anthony Davis offensive rebound,17 - 13
5:07,Anthony Davis makes tip shot,19 - 13
4:48,DeMarcus Cousins blocks Trevor Ariza's  jumper,19 - 13
4:47,Nene  offensive rebound,19 - 13
4:43,Eric Gordon  misses 24-foot three point jumper,19 - 13
4:43,Rockets offensive team rebound,19 - 13
4:43,E'Twaun Moore enters the game for Tim Frazier,19 - 13
4:43,Lou Williams enters the game for Ryan Anderson,19 - 13
4:43,Tim Frazier enters the game for Jrue Holiday,19 - 13
4:37,James Harden makes 25-foot  three point jumper  (Nene  assists),19 - 16
4:24,E'Twaun Moore makes 2-foot layup (DeMarcus Cousins assists),21 - 16
4:11,Trevor Ariza  misses 13-foot turnaround fadeaway shot,21 - 16
4:09,Anthony Davis defensive rebound,21 - 16
4:01,Anthony Davis  misses 20-foot jumper,21 - 16
4:00,Nene  defensive rebound,21 - 16
3:46,Lou Williams  misses driving floating jump shot,21 - 16
3:45,Lou Williams offensive rebound,21 - 16
3:41,Trevor Ariza  misses 24-foot three point jumper,21 - 16
3:40,DeMarcus Cousins defensive rebound,21 - 16
3:29,DeMarcus Cousins  misses 7-foot jumper,21 - 16
3:27,Anthony Davis offensive rebound,21 - 16
3:26,Anthony Davis  misses 7-foot hook shot,21 - 16
3:24,Trevor Ariza defensive rebound,21 - 16
3:13,Nene   misses 17-foot jumper,21 - 16
3:12,DeMarcus Cousins defensive rebound,21 - 16
3:05,Solomon Hill  misses 26-foot three point jumper,21 - 16
3:04,Nene  defensive rebound,21 - 16
2:56,James Harden makes 6-foot two point shot,21 - 18
2:35,Nene  personal foul  (DeMarcus Cousins draws the foul),21 - 18
2:35,Sam Dekker enters the game for Trevor Ariza,21 - 18
2:35,Dante Cunningham enters the game for Anthony Davis,21 - 18
2:30,DeMarcus Cousins makes 26-foot  three point jumper  (Tim Frazier assists),24 - 18
2:30,Nene  shooting foul  (DeMarcus Cousins draws the foul),24 - 18
2:30,DeMarcus Cousins makes free throw 1 of 1,25 - 18
2:18,Nene  makes dunk (Lou Williams assists),25 - 20
2:00,Tim Frazier  misses 11-foot two point shot,25 - 20
2:00,Eric Gordon defensive rebound,25 - 20
1:52,Eric Gordon Out-of-Bounds Bad Pass Turnover,25 - 20
1:38,Dante Cunningham  misses 24-foot three point jumper,25 - 20
1:37,Sam Dekker defensive rebound,25 - 20
1:31,DeMarcus Cousins shooting foul  (James Harden draws the foul),25 - 20
1:31,James Harden makes free throw 1 of 2,25 - 21
1:31,Anthony Davis enters the game for DeMarcus Cousins,25 - 21
1:31,Jrue Holiday enters the game for Tim Frazier,25 - 21
1:31,James Harden makes free throw 2 of 2,25 - 22
1:15,Solomon Hill makes 25-foot  three point jumper  (Jrue Holiday assists),28 - 22
1:02,James Harden makes 26-foot  three pointer,28 - 25
47.0,Anthony Davis  misses 7-foot driving hook shot,28 - 25
45.0,James Harden defensive rebound,28 - 25
40.0,James Harden makes  three pointer,28 - 28
31.0,Jrue Holiday makes 26-foot  three point jumper  (Solomon Hill assists),31 - 28
26.0,James Harden  misses driving layup,31 - 28
25.0,Dante Cunningham defensive rebound,31 - 28
5.0,Jrue Holiday makes 20-foot jumper,33 - 28
1.0,Lou Williams  misses 24-foot three point jumper,33 - 28
0.0,Anthony Davis defensive rebound,33 - 28
0.0,End of the 1st Quarter,33 - 28
11:48,Clint Capela blocks Anthony Davis 's 4-foot  layup,33 - 28
11:45,Clint Capela defensive rebound,33 - 28
11:37,Lou Williams makes 13-foot two point shot,33 - 30
11:23,Jordan Crawford  misses 27-foot three point jumper,33 - 30
11:22,Clint Capela defensive rebound,33 - 30
11:10,Lou Williams  bad pass (Jrue Holiday steals),33 - 30
11:03,Jordan Crawford  misses 21-foot jumper,33 - 30
11:02,Eric Gordon defensive rebound,33 - 30
10:56,Eric Gordon makes driving layup,33 - 32
10:56,E'Twaun Moore shooting foul  (Eric Gordon draws the foul),33 - 32
10:56,Eric Gordon misses free throw 1 of 1,33 - 32
10:55,Anthony Davis defensive rebound,33 - 32
10:41,E'Twaun Moore  misses two point shot,33 - 32
10:41,Eric Gordon defensive rebound,33 - 32
10:33,Eric Gordon  misses 26-foot three point jumper,33 - 32
10:32,Clint Capela offensive rebound,33 - 32
10:22,Patrick Beverley  bad pass (Jrue Holiday steals),33 - 32
10:17,E'Twaun Moore makes two point shot (Jrue Holiday assists),35 - 32
10:07,Patrick Beverley  traveling,35 - 32
9:56,Anthony Davis makes 17-foot jumper (E'Twaun Moore assists),37 - 32
9:36,Eric Gordon turnover (Anthony Davis steals),37 - 32
9:23,E'Twaun Moore  misses 25-foot three point jumper,37 - 32
9:22,Anthony Davis offensive rebound,37 - 32
9:22,Patrick Beverley personal foul  (Anthony Davis draws the foul),37 - 32
9:06,Anthony Davis  misses 20-foot jumper,37 - 32
9:04,Sam Dekker defensive rebound,37 - 32
8:53,Lou Williams  misses 12-foot two point shot,37 - 32
8:52,Clint Capela offensive rebound,37 - 32
8:51,Clint Capela  misses dunk,37 - 32
8:49,Sam Dekker offensive rebound,37 - 32
8:48,Sam Dekker  misses putback layup,37 - 32
8:48,Anthony Davis defensive rebound,37 - 32
8:37,Anthony Davis makes layup (Jordan Crawford assists),39 - 32
8:11,shot clock turnover,39 - 32
8:11,Official timeout,39 - 32
8:11,Ryan Anderson enters the game for Sam Dekker,39 - 32
8:11,DeMarcus Cousins enters the game for Dante Cunningham,39 - 32
7:52,Anthony Davis makes driving layup (DeMarcus Cousins assists),41 - 32
7:39,Eric Gordon  misses three point jumper,41 - 32
7:39,Jordan Crawford defensive rebound,41 - 32
7:28,DeMarcus Cousins  misses three point jumper,41 - 32
7:26,Clint Capela defensive rebound,41 - 32
7:16,Ryan Anderson makes 26-foot  three point jumper  (Eric Gordon assists),41 - 35
7:01,DeMarcus Cousins offensive foul  (Ryan Anderson draws the foul),41 - 35
7:01,DeMarcus Cousins  turnover,41 - 35
6:43,Jrue Holiday blocks Eric Gordon 's 8-foot  2-pt jumper,41 - 35
6:43,Rockets offensive team rebound,41 - 35
6:43,Dante Cunningham enters the game for Anthony Davis,41 - 35
6:43,Solomon Hill enters the game for E'Twaun Moore,41 - 35
6:37,Eric Gordon  traveling,41 - 35
6:24,DeMarcus Cousins  misses 18-foot jumper,41 - 35
6:22,Patrick Beverley defensive rebound,41 - 35
6:15,Ryan Anderson  misses three point jumper,41 - 35
6:13,Clint Capela offensive rebound,41 - 35
6:07,Clint Capela makes layup (Eric Gordon assists),41 - 37
6:00,Jordan Crawford  lost ball turnover (Eric Gordon steals),41 - 37
5:54,Eric Gordon  bad pass (Jrue Holiday steals),41 - 37
5:41,Jrue Holiday  misses 24-foot three point jumper,41 - 37
5:39,Clint Capela defensive rebound,41 - 37
5:24,Ryan Anderson  misses 5-foot jumper,41 - 37
5:22,Dante Cunningham defensive rebound,41 - 37
5:16,Jordan Crawford makes 15-foot jumper,43 - 37
5:16,Rockets Full timeout,43 - 37
5:16,Tim Frazier enters the game for Jrue Holiday,43 - 37
5:16,Nene  enters the game for Clint Capela,43 - 37
5:16,James Harden enters the game for Eric Gordon,43 - 37
5:16,Trevor Ariza enters the game for Lou Williams,43 - 37
4:58,James Harden  misses 26-foot three point jumper,43 - 37
4:58,Pelicans defensive team rebound,43 - 37
4:33,Jordan Crawford  misses 25-foot three point jumper,43 - 37
4:33,Trevor Ariza defensive rebound,43 - 37
4:18,DeMarcus Cousins blocks Patrick Beverley's  shot,43 - 37
4:16,Tim Frazier defensive rebound,43 - 37
4:11,Jordan Crawford makes 24-foot  three point jumper  (Solomon Hill assists),46 - 37
3:55,Nene  makes 9-foot two point shot (James Harden assists),46 - 39
3:42,Nene  personal foul  (DeMarcus Cousins draws the foul),46 - 39
3:42,Anthony Davis enters the game for DeMarcus Cousins,46 - 39
3:42,Eric Gordon enters the game for Patrick Beverley,46 - 39
3:42,Clint Capela enters the game for Nene,46 - 39
3:31,Tim Frazier  misses 26-foot three point jumper,46 - 39
3:30,Clint Capela defensive rebound,46 - 39
3:26,Solomon Hill shooting foul  (James Harden draws the foul),46 - 39
3:26,James Harden makes free throw 1 of 3,46 - 40
3:26,James Harden makes free throw 2 of 3,46 - 41
3:26,James Harden misses free throw 3 of 3,46 - 41
3:26,Solomon Hill defensive rebound,46 - 41
3:16,Anthony Davis  misses 8-foot turnaround fadeaway shot,46 - 41
3:15,James Harden defensive rebound,46 - 41
3:13,Solomon Hill kicked ball violation,46 - 41
3:01,Ryan Anderson makes 13-foot two point shot (James Harden assists),46 - 43
2:46,Anthony Davis offensive Charge  (Clint Capela draws the foul),46 - 43
2:46,Anthony Davis  turnover,46 - 43
2:46,Pelicans Full timeout,46 - 43
2:26,James Harden makes 16-foot two point shot,46 - 45
2:02,Trevor Ariza shooting foul  (Jordan Crawford draws the foul),46 - 45
2:02,Jordan Crawford makes free throw 1 of 2,47 - 45
2:02,Jrue Holiday enters the game for Tim Frazier,47 - 45
2:02,Jordan Crawford makes free throw 2 of 2,48 - 45
1:53,Eric Gordon makes layup (James Harden assists),48 - 47
1:39,Jordan Crawford  misses 27-foot three point jumper,48 - 47
1:38,Clint Capela defensive rebound,48 - 47
1:30,James Harden  misses 13-foot two point shot,48 - 47
1:29,James Harden offensive rebound,48 - 47
1:23,James Harden  misses 23-foot three point jumper,48 - 47
1:22,Clint Capela offensive rebound,48 - 47
1:12,Eric Gordon  lost ball turnover (Anthony Davis steals),48 - 47
1:05,Anthony Davis makes 2-foot layup (Jordan Crawford assists),50 - 47
46.0,Ryan Anderson  misses 8-foot two point shot,50 - 47
45.0,Ryan Anderson offensive rebound,50 - 47
43.0,Jrue Holiday blocks James Harden's  layup,50 - 47
43.0,Rockets offensive team rebound,50 - 47
43.0,E'Twaun Moore enters the game for Jordan Crawford,50 - 47
33.0,Eric Gordon makes driving layup,50 - 49
17.0,Eric Gordon personal foul  (Anthony Davis draws the foul),50 - 49
17.0,Pelicans 20 Sec. timeout,50 - 49
17.0,Jordan Crawford enters the game for Dante Cunningham,50 - 49
3.0,Jordan Crawford  bad pass (James Harden steals),50 - 49
0.0,End of the 2nd Quarter,50 - 49
11:47,DeMarcus Cousins  misses 20-foot jumper,50 - 49
11:45,James Harden defensive rebound,50 - 49
11:32,Ryan Anderson  misses 28-foot three point jumper,50 - 49
11:30,Rockets offensive team rebound,50 - 49
11:22,James Harden makes 8-foot driving floating jump shot (Clint Capela assists),50 - 51
10:57,Jrue Holiday makes 28-foot  three point jumper  (Solomon Hill assists),53 - 51
10:48,Tim Frazier personal foul  (Clint Capela draws the foul),53 - 51
10:33,Patrick Beverley  misses 24-foot three point jumper,53 - 51
10:32,Tim Frazier defensive rebound,53 - 51
10:19,DeMarcus Cousins  misses driving layup,53 - 51
10:18,Clint Capela defensive rebound,53 - 51
10:10,Clint Capela makes two point shot (James Harden assists),53 - 53
9:51,Anthony Davis  misses jumper,53 - 53
9:49,DeMarcus Cousins offensive rebound,53 - 53
9:47,DeMarcus Cousins  misses two point shot,53 - 53
9:47,DeMarcus Cousins offensive rebound,53 - 53
9:47,James Harden shooting foul  (DeMarcus Cousins draws the foul),53 - 53
9:47,DeMarcus Cousins makes free throw 1 of 2,54 - 53
9:47,DeMarcus Cousins misses free throw 2 of 2,54 - 53
9:47,Trevor Ariza defensive rebound,54 - 53
9:23,James Harden makes 18-foot two point shot,54 - 55
9:17,Solomon Hill  misses 25-foot three point jumper,54 - 55
9:15,Patrick Beverley defensive rebound,54 - 55
9:07,DeMarcus Cousins personal foul  (Ryan Anderson draws the foul),54 - 55
9:07,Dante Cunningham enters the game for DeMarcus Cousins,54 - 55
8:56,Trevor Ariza makes driving layup (James Harden assists),54 - 57
8:37,Jrue Holiday makes 19-foot two point shot,56 - 57
8:26,Ryan Anderson makes 28-foot  three point jumper  (James Harden assists),56 - 60
8:12,Jrue Holiday makes 28-foot  three point jumper,59 - 60
7:52,Dante Cunningham shooting foul  (James Harden draws the foul),59 - 60
7:52,James Harden misses free throw 1 of 3,59 - 60
7:52,Rockets offensive team rebound,59 - 60
7:52,James Harden makes free throw 2 of 3,59 - 61
7:52,James Harden makes free throw 3 of 3,59 - 62
7:41,Solomon Hill  misses 27-foot three point jumper,59 - 62
7:39,Trevor Ariza defensive rebound,59 - 62
7:30,James Harden  misses 29-foot three point jumper,59 - 62
7:28,Anthony Davis defensive rebound,59 - 62
7:24,Trevor Ariza personal block  (Solomon Hill draws the foul),59 - 62
7:22,James Harden personal foul  (Solomon Hill draws the foul),59 - 62
7:20,Trevor Ariza personal foul  (Jrue Holiday draws the foul),59 - 62
7:13,Anthony Davis makes 22-foot jumper (Solomon Hill assists),61 - 62
6:54,Trevor Ariza  misses 7-foot driving bank shot,61 - 62
6:54,Pelicans defensive team rebound,61 - 62
6:54,Clint Capela loose ball foul  (Anthony Davis draws the foul),61 - 62
6:54,Anthony Davis misses free throw 1 of 2,61 - 62
6:54,Pelicans offensive team rebound,61 - 62
6:54,Nene  enters the game for Clint Capela,61 - 62
6:54,Anthony Davis makes free throw 2 of 2,62 - 62
6:41,Jrue Holiday personal foul  (Trevor Ariza draws the foul),62 - 62
6:33,James Harden  misses 19-foot step back jumpshot,62 - 62
6:31,Dante Cunningham defensive rebound,62 - 62
6:20,Solomon Hill  lost ball turnover (Patrick Beverley steals),62 - 62
6:13,Patrick Beverley  misses 25-foot three point jumper,62 - 62
6:11,Ryan Anderson offensive rebound,62 - 62
6:09,Ryan Anderson makes two point shot,62 - 64
5:47,Anthony Davis  misses 26-foot three point jumper,62 - 64
5:46,Nene  defensive rebound,62 - 64
5:31,James Harden  misses 25-foot three point jumper,62 - 64
5:30,Anthony Davis defensive rebound,62 - 64
5:18,Patrick Beverley personal foul  (Anthony Davis draws the foul),62 - 64
5:18,Rockets Full timeout,62 - 64
5:18,Eric Gordon enters the game for Patrick Beverley,62 - 64
5:18,Anthony Davis makes free throw 1 of 2,63 - 64
5:18,Anthony Davis makes free throw 2 of 2,64 - 64
5:03,Nene  makes 2-foot layup (James Harden assists),64 - 66
4:47,Anthony Davis makes 18-foot jumper (Jrue Holiday assists),66 - 66
4:35,Eric Gordon  misses cutting layup,66 - 66
4:33,Eric Gordon offensive rebound,66 - 66
4:33,Anthony Davis shooting foul  (Eric Gordon draws the foul),66 - 66
4:33,Eric Gordon makes free throw 1 of 2,66 - 67
4:33,E'Twaun Moore enters the game for Jrue Holiday,66 - 67
4:33,Lou Williams enters the game for Ryan Anderson,66 - 67
4:33,Eric Gordon makes free throw 2 of 2,66 - 68
4:18,Tim Frazier  misses 25-foot three point jumper,66 - 68
4:16,Eric Gordon defensive rebound,66 - 68
4:09,Nene  makes 2-foot layup (Eric Gordon assists),66 - 70
3:55,Nene  shooting foul  (Anthony Davis draws the foul),66 - 70
3:55,Anthony Davis makes free throw 1 of 2,67 - 70
3:55,Clint Capela enters the game for Nene,67 - 70
3:55,Anthony Davis makes free throw 2 of 2,68 - 70
3:46,Lou Williams  misses 26-foot three point jumper,68 - 70
3:45,Anthony Davis defensive rebound,68 - 70
3:32,Anthony Davis makes 16-foot jumper (E'Twaun Moore assists),70 - 70
3:21,Trevor Ariza  misses 25-foot three point jumper,70 - 70
3:20,Tim Frazier defensive rebound,70 - 70
3:14,Anthony Davis makes two point shot (E'Twaun Moore assists),72 - 70
2:53,Clint Capela makes 6-foot two point shot (James Harden assists),72 - 72
2:31,Tim Frazier  misses 25-foot three point jumper,72 - 72
2:30,Trevor Ariza defensive rebound,72 - 72
2:19,Trevor Ariza  misses three point jumper,72 - 72
2:18,Anthony Davis defensive rebound,72 - 72
2:10,Anthony Davis makes 17-foot two point shot (Tim Frazier assists),74 - 72
2:00,Solomon Hill kicked ball violation,74 - 72
2:00,Pelicans Full timeout,74 - 72
1:47,Trevor Ariza makes 5-foot two point shot (Eric Gordon assists),74 - 74
1:31,Anthony Davis makes 18-foot two point shot (E'Twaun Moore assists),76 - 74
1:22,E'Twaun Moore personal foul  (Lou Williams draws the foul),76 - 74
1:22,Lou Williams makes free throw 1 of 2,76 - 75
1:22,Jrue Holiday enters the game for Tim Frazier,76 - 75
1:22,Jordan Crawford enters the game for Solomon Hill,76 - 75
1:22,Lou Williams misses free throw 2 of 2,76 - 75
1:22,E'Twaun Moore defensive rebound,76 - 75
1:07,Jordan Crawford  misses 19-foot two point shot,76 - 75
1:07,Rockets defensive team rebound,76 - 75
53.0,James Harden makes 27-foot  three point jumper,76 - 78
36.0,Anthony Davis  misses 21-foot jumper,76 - 78
35.0,Trevor Ariza defensive rebound,76 - 78
29.0,Trevor Ariza makes layup (James Harden assists),76 - 80
15.0,Jordan Crawford makes 27-foot  three point jumper,79 - 80
0.0,James Harden  lost ball turnover (Jordan Crawford steals),79 - 80
0.0,End of the 3rd Quarter,79 - 80
11:45,Lou Williams makes driving layup (Clint Capela assists),79 - 82
11:26,Clint Capela blocks DeMarcus Cousins's  shot,79 - 82
11:23,Lou Williams defensive rebound,79 - 82
11:15,Patrick Beverley makes 25-foot  three point jumper  (Lou Williams assists),79 - 85
11:12,Pelicans Full timeout,79 - 85
11:12,Nene  enters the game for Clint Capela,79 - 85
10:51,Jordan Crawford makes driving layup,81 - 85
10:33,E'Twaun Moore personal foul  (Eric Gordon draws the foul),81 - 85
10:26,Lou Williams  misses 25-foot three point jumper,81 - 85
10:25,Dante Cunningham defensive rebound,81 - 85
10:15,Jrue Holiday makes  three point jumper  (DeMarcus Cousins assists),84 - 85
10:02,DeMarcus Cousins shooting foul  (Trevor Ariza draws the foul),84 - 85
10:02,Trevor Ariza makes free throw 1 of 2,84 - 86
10:02,Trevor Ariza makes free throw 2 of 2,84 - 87
9:51,DeMarcus Cousins  misses layup,84 - 87
9:49,Nene  defensive rebound,84 - 87
9:41,Eric Gordon makes 26-foot  three point jumper  (Patrick Beverley assists),84 - 90
9:26,DeMarcus Cousins  misses 26-foot three point jumper,84 - 90
9:26,Trevor Ariza defensive rebound,84 - 90
9:12,Nene   misses 17-foot jumper,84 - 90
9:11,Jrue Holiday defensive rebound,84 - 90
8:59,DeMarcus Cousins makes 25-foot  three point jumper  (Jrue Holiday assists),87 - 90
8:57,Patrick Beverley technical foul(1st technical foul),87 - 90
8:57,Jrue Holiday misses technical free throw,87 - 90
8:57,Rockets offensive team rebound,87 - 90
8:57,Anthony Davis enters the game for Dante Cunningham,87 - 90
8:45,DeMarcus Cousins blocks Lou Williams 's 3-foot  layup,87 - 90
8:45,Rockets offensive team rebound,87 - 90
8:41,Nene   offensive goaltending turnover,87 - 90
8:29,DeMarcus Cousins makes 6-foot two point shot,89 - 90
8:29,Trevor Ariza shooting foul  (DeMarcus Cousins draws the foul),89 - 90
8:29,James Harden enters the game for Trevor Ariza,89 - 90
8:29,Ryan Anderson enters the game for Lou Williams,89 - 90
8:29,DeMarcus Cousins makes free throw 1 of 1,90 - 90
8:14,Nene  makes dunk (James Harden assists),90 - 92
8:00,Jordan Crawford  misses 25-foot three point jumper,90 - 92
8:00,James Harden defensive rebound,90 - 92
7:52,James Harden  misses 26-foot three point pullup jump shot,90 - 92
7:48,Nene  offensive rebound,90 - 92
7:31,Anthony Davis blocks James Harden 's 2-foot  layup,90 - 92
7:28,Ryan Anderson offensive rebound,90 - 92
7:24,Patrick Beverley  misses 23-foot jumper,90 - 92
7:22,Anthony Davis defensive rebound,90 - 92
7:16,Jrue Holiday  misses 26-foot three point jumper,90 - 92
7:13,Patrick Beverley defensive rebound,90 - 92
7:05,Patrick Beverley makes 24-foot  three point jumper  (James Harden assists),90 - 95
6:48,DeMarcus Cousins  misses 26-foot three point jumper,90 - 95
6:47,Nene  defensive rebound,90 - 95
6:41,Ryan Anderson  misses 28-foot three point jumper,90 - 95
6:39,Patrick Beverley offensive rebound,90 - 95
6:39,Patrick Beverley makes tip shot,90 - 97
6:39,Pelicans Full timeout,90 - 97
6:39,Solomon Hill enters the game for Jordan Crawford,90 - 97
6:28,Jrue Holiday makes two point shot (E'Twaun Moore assists),92 - 97
6:07,Nene   misses cutting finger roll layup,92 - 97
6:07,DeMarcus Cousins defensive rebound,92 - 97
5:58,Solomon Hill  bad pass (Nene  steals),92 - 97
5:52,Ryan Anderson makes 27-foot  three point jumper  (James Harden assists),92 - 100
5:35,Anthony Davis makes 20-foot two point shot (DeMarcus Cousins assists),94 - 100
5:09,Nene  makes 5-foot two point shot,94 - 102
4:54,Anthony Davis makes driving dunk (Jrue Holiday assists),96 - 102
4:33,Eric Gordon makes 24-foot  three point jumper  (Patrick Beverley assists),96 - 105
4:13,DeMarcus Cousins makes 8-foot two point shot,98 - 105
4:07,DeMarcus Cousins blocks Nene 's  shot,98 - 105
3:59,Anthony Davis defensive rebound,98 - 105
3:56,DeMarcus Cousins  misses driving layup,98 - 105
3:55,James Harden defensive rebound,98 - 105
3:46,James Harden  bad pass (DeMarcus Cousins steals),98 - 105
3:43,James Harden blocks Solomon Hill's  shot,98 - 105
3:41,E'Twaun Moore offensive rebound,98 - 105
3:39,E'Twaun Moore makes layup,100 - 105
3:39,Rockets Full timeout,100 - 105
3:39,Trevor Ariza enters the game for Patrick Beverley,100 - 105
3:39,Clint Capela enters the game for Nene,100 - 105
3:21,James Harden  misses 25-foot three point jumper,100 - 105
3:20,Anthony Davis defensive rebound,100 - 105
3:15,Ryan Anderson personal foul  (DeMarcus Cousins draws the foul),100 - 105
3:00,Jrue Holiday  misses three point jumper,100 - 105
2:59,Ryan Anderson defensive rebound,100 - 105
2:38,Ryan Anderson  misses 31-foot three point jumper,100 - 105
2:36,Anthony Davis defensive rebound,100 - 105
2:29,Ryan Anderson personal foul  (DeMarcus Cousins draws the foul),100 - 105
2:17,DeMarcus Cousins makes 26-foot  three point jumper  (Jrue Holiday assists),103 - 105
2:04,James Harden makes driving layup,103 - 107
1:45,DeMarcus Cousins makes 7-foot two point shot,105 - 107
1:36,Solomon Hill shooting foul  (James Harden draws the foul),105 - 107
1:36,James Harden makes free throw 1 of 3,105 - 108
1:36,James Harden makes free throw 2 of 3,105 - 109
1:36,Patrick Beverley enters the game for Eric Gordon,105 - 109
1:36,James Harden makes free throw 3 of 3,105 - 110
1:23,DeMarcus Cousins  out of bounds lost ball turnover,105 - 110
1:23,Eric Gordon enters the game for Ryan Anderson,105 - 110
1:08,James Harden makes 26-foot  three point jumper,105 - 113
52.0,E'Twaun Moore  misses three point jumper,105 - 113
51.0,Patrick Beverley defensive rebound,105 - 113
50.0,Solomon Hill personal take foul  (Patrick Beverley draws the foul),105 - 113
50.0,Patrick Beverley misses free throw 1 of 2,105 - 113
50.0,Rockets offensive team rebound,105 - 113
50.0,Patrick Beverley makes free throw 2 of 2,105 - 114
50.0,Pelicans Full timeout,105 - 114
40.0,DeMarcus Cousins makes 18-foot jumper,107 - 114
21.0,Patrick Beverley makes 23-foot  three point jumper  (James Harden assists),107 - 117
10.0,DeMarcus Cousins  misses 26-foot three point jumper,107 - 117
9.0,Trevor Ariza defensive rebound,107 - 117
0.0,End of the 4th Quarter,107 - 117
