time,play,score
12:00,Andre Drummond vs. Rudy Gobert (George Hill gains possession),0 - 0
11:37,Derrick Favors  misses jumper,0 - 0
11:37,Rudy Gobert offensive rebound,0 - 0
11:33,Rudy Gobert  lost ball turnover (Andre Drummond steals),0 - 0
11:26,Marcus Morris  misses 19-foot jumper,0 - 0
11:25,Rudy Gobert defensive rebound,0 - 0
11:15,George Hill  misses 17-foot two point jumper,0 - 0
11:14,Reggie Jackson defensive rebound,0 - 0
10:56,Andre Drummond  misses 10-foot jumper,0 - 0
10:56,George Hill defensive rebound,0 - 0
10:47,Derrick Favors  misses 14-foot jumper,0 - 0
10:45,Andre Drummond defensive rebound,0 - 0
10:40,Reggie Jackson Out-of-Bounds Bad Pass Turnover,0 - 0
10:25,Gordon Hayward  misses 25-foot three point jumper,0 - 0
10:25,Andre Drummond defensive rebound,0 - 0
10:00,Reggie Jackson  misses 18-foot two point shot,0 - 0
10:00,Gordon Hayward defensive rebound,0 - 0
9:45,George Hill makes Driving Floating Jump Shot,0 - 2
9:45,Marcus Morris shooting foul  (George Hill draws the foul),0 - 2
9:45,George Hill misses free throw 1 of 1,0 - 2
9:45,Rudy Gobert offensive rebound,0 - 2
9:30,Gordon Hayward  misses 24-foot three point jumper,0 - 2
9:29,Marcus Morris defensive rebound,0 - 2
9:21,Marcus Morris  bad pass (Gordon Hayward steals),0 - 2
9:18,Gordon Hayward makes two point shot,0 - 4
8:59,Reggie Jackson  misses 20-foot jumper,0 - 4
8:59,Rudy Gobert defensive rebound,0 - 4
8:48,Rodney Hood makes 24-foot  three point jumper,0 - 7
8:23,Reggie Jackson  misses 18-foot two point shot,0 - 7
8:23,Jazz defensive team rebound,0 - 7
8:03,George Hill makes 25-foot  three point jumper  (Rudy Gobert assists),0 - 10
7:56,Pistons Full timeout,0 - 10
7:48,Marcus Morris makes 14-foot jumper (Andre Drummond assists),2 - 10
7:35,George Hill Out-of-Bounds Bad Pass Turnover,2 - 10
7:22,Rudy Gobert blocks Andre Drummond 's 3-foot  layup,2 - 10
7:22,George Hill defensive rebound,2 - 10
7:15,Rodney Hood  misses 26-foot three point jumper,2 - 10
7:15,Andre Drummond defensive rebound,2 - 10
6:56,Tobias Harris  misses 4-foot two point shot,2 - 10
6:56,Rudy Gobert defensive rebound,2 - 10
6:46,Derrick Favors  misses 17-foot jumper,2 - 10
6:45,Andre Drummond defensive rebound,2 - 10
6:37,Tobias Harris makes 25-foot  three point jumper  (Reggie Jackson assists),5 - 10
6:09,Aron Baynes blocks Derrick Favors 's 4-foot  jumper,5 - 10
6:09,Marcus Morris defensive rebound,5 - 10
5:54,Andre Drummond makes 7-foot two point shot,7 - 10
5:39,Gordon Hayward  misses 25-foot three point jumper,7 - 10
5:37,Andre Drummond defensive rebound,7 - 10
5:28,Reggie Jackson  misses driving layup,7 - 10
5:28,Derrick Favors defensive rebound,7 - 10
5:16,Rudy Gobert  misses 10-foot two point shot,7 - 10
5:16,Derrick Favors offensive rebound,7 - 10
5:09,George Hill  misses 22-foot jumper,7 - 10
5:07,Derrick Favors offensive rebound,7 - 10
4:52,George Hill makes driving layup,7 - 12
4:37,Gordon Hayward shooting foul  (Tobias Harris draws the foul),7 - 12
4:37,Tobias Harris makes free throw 1 of 2,8 - 12
4:37,Shelvin Mack enters the game for George Hill,8 - 12
4:37,Trey Lyles enters the game for Derrick Favors,8 - 12
4:37,Joe Ingles enters the game for Rodney Hood,8 - 12
4:37,Stanley Johnson enters the game for Aron Baynes,8 - 12
4:37,Tobias Harris makes free throw 2 of 2,9 - 12
4:18,Trey Lyles  misses 25-foot three point jumper,9 - 12
4:18,Marcus Morris defensive rebound,9 - 12
4:07,Tobias Harris makes 4-foot two point shot,11 - 12
4:07,Trey Lyles shooting foul  (Tobias Harris draws the foul),11 - 12
4:07,Tobias Harris misses free throw 1 of 1,11 - 12
4:05,Andre Drummond offensive rebound,11 - 12
3:57,Marcus Morris  misses 19-foot jumper,11 - 12
3:57,Shelvin Mack defensive rebound,11 - 12
3:49,Andre Drummond personal foul  (Shelvin Mack draws the foul),11 - 12
3:49,Joe Johnson enters the game for Gordon Hayward,11 - 12
3:38,Shelvin Mack  misses Driving Floating Jump Shot,11 - 12
3:38,Tobias Harris defensive rebound,11 - 12
3:23,Andre Drummond makes dunk (Marcus Morris assists),13 - 12
3:18,Jazz Full timeout,13 - 12
3:18,Reggie Bullock enters the game for Marcus Morris,13 - 12
3:18,Beno Udrih enters the game for Reggie Jackson,13 - 12
3:10,Shelvin Mack Out-of-Bounds Bad Pass Turnover,13 - 12
2:57,Joe Johnson shooting foul  (Tobias Harris draws the foul),13 - 12
2:57,Tobias Harris makes free throw 1 of 2,14 - 12
2:57,Tobias Harris makes free throw 2 of 2,15 - 12
2:45,Shelvin Mack makes 11-foot two point shot,15 - 14
2:32,Reggie Bullock  bad pass (Joe Ingles steals),15 - 14
2:14,Joe Ingles  misses 9-foot,15 - 14
2:13,Andre Drummond defensive rebound,15 - 14
2:01,Beno Udrih makes driving layup,17 - 14
1:54,Joe Johnson  misses layup,17 - 14
1:54,Andre Drummond defensive rebound,17 - 14
1:39,Reggie Bullock  misses 23-foot three point jumper,17 - 14
1:39,Shelvin Mack defensive rebound,17 - 14
1:28,Joe Johnson  misses 23-foot three point jumper,17 - 14
1:28,Andre Drummond defensive rebound,17 - 14
1:15,Tobias Harris  misses 24-foot three point jumper,17 - 14
1:14,Joe Johnson defensive rebound,17 - 14
55.0,Trey Lyles  misses 23-foot three point jumper,17 - 14
55.0,Andre Drummond defensive rebound,17 - 14
44.0,Andre Drummond  misses 4-foot hook shot,17 - 14
43.0,Rudy Gobert defensive rebound,17 - 14
35.0,Shelvin Mack  misses three point jumper,17 - 14
35.0,Reggie Bullock defensive rebound,17 - 14
18.0,Beno Udrih makes 22-foot two point shot,19 - 14
0.0,End of the 1st Quarter,19 - 14
11:45,Boban Marjanovic makes dunk (Beno Udrih assists),21 - 14
11:25,George Hill makes 15-foot Driving Floating Jump Shot,21 - 16
11:06,Marcus Morris  misses 12-foot,21 - 16
11:04,Trey Lyles defensive rebound,21 - 16
10:42,Joe Johnson  misses 22-foot jumper,21 - 16
10:41,Jazz offensive team rebound,21 - 16
10:41,shot clock turnover,21 - 16
10:32,Marcus Morris  misses layup,21 - 16
10:32,Trey Lyles defensive rebound,21 - 16
10:25,Rodney Hood makes 25-foot  three point jumper  (Trey Lyles assists),21 - 19
10:11,Trey Lyles shooting foul  (Marcus Morris draws the foul),21 - 19
10:11,Marcus Morris makes free throw 1 of 2,22 - 19
10:11,Boris Diaw enters the game for Trey Lyles,22 - 19
10:11,Marcus Morris makes free throw 2 of 2,23 - 19
9:56,Rodney Hood makes 26-foot  three point jumper  (Boris Diaw assists),23 - 22
9:42,Beno Udrih  misses 16-foot two point jumper,23 - 22
9:41,Joe Johnson defensive rebound,23 - 22
9:32,Joe Johnson Out-of-Bounds Bad Pass Turnover,23 - 22
9:15,Derrick Favors blocks Reggie Bullock's  jumper,23 - 22
9:15,Derrick Favors defensive rebound,23 - 22
9:07,Rodney Hood  misses 10-foot two point shot,23 - 22
9:07,Boban Marjanovic defensive rebound,23 - 22
8:59,Beno Udrih  misses 11-foot two point shot,23 - 22
8:57,Rodney Hood defensive rebound,23 - 22
8:37,Rodney Hood makes 18-foot two point shot,23 - 24
8:26,Pistons Full timeout,23 - 24
8:26,Dante Exum enters the game for George Hill,23 - 24
8:19,Boban Marjanovic makes 4-foot two point shot (Beno Udrih assists),25 - 24
8:03,Rodney Hood makes 24-foot  three point jumper  (Joe Johnson assists),25 - 27
7:45,Derrick Favors personal foul  (Boban Marjanovic draws the foul),25 - 27
7:28,Marcus Morris  misses 26-foot three point jumper,25 - 27
7:28,Derrick Favors defensive rebound,25 - 27
7:16,Dante Exum makes driving layup,25 - 29
7:07,Beno Udrih  lost ball turnover (Dante Exum steals),25 - 29
7:03,Rodney Hood  out of bounds lost ball turnover,25 - 29
7:03,Tobias Harris enters the game for Reggie Bullock,25 - 29
7:03,Reggie Jackson enters the game for Beno Udrih,25 - 29
6:43,Marcus Morris  misses 8-foot jumper,25 - 29
6:41,Boban Marjanovic offensive rebound,25 - 29
6:39,Boban Marjanovic makes tip shot,27 - 29
6:31,Rodney Hood Out-of-Bounds Bad Pass Turnover,27 - 29
6:31,Gordon Hayward enters the game for Joe Johnson,27 - 29
6:31,Andre Drummond enters the game for Boban Marjanovic,27 - 29
6:13,Reggie Jackson makes 4-foot Driving Floating Jump Shot,29 - 29
5:58,Tobias Harris shooting foul  (Boris Diaw draws the foul),29 - 29
5:58,Official timeout,29 - 29
5:58,Joe Ingles enters the game for Rodney Hood,29 - 29
5:58,Rudy Gobert enters the game for Derrick Favors,29 - 29
5:58,Boris Diaw makes free throw 1 of 2,29 - 30
5:58,Boris Diaw makes free throw 2 of 2,29 - 31
5:35,Reggie Jackson  misses 18-foot jumper,29 - 31
5:35,Andre Drummond offensive rebound,29 - 31
5:28,Reggie Jackson makes driving layup,31 - 31
5:28,Boris Diaw shooting foul  (Reggie Jackson draws the foul),31 - 31
5:28,Reggie Jackson misses free throw 1 of 1,31 - 31
5:28,Rudy Gobert defensive rebound,31 - 31
5:09,Boris Diaw  bad pass (Reggie Jackson steals),31 - 31
5:01,Marcus Morris makes 25-foot  three point jumper  (Reggie Jackson assists),34 - 31
4:43,Marcus Morris personal foul  (Gordon Hayward draws the foul),34 - 31
4:43,George Hill enters the game for Dante Exum,34 - 31
4:43,Aron Baynes enters the game for Marcus Morris,34 - 31
4:37,Gordon Hayward makes 7-foot Driving Floating Jump Shot,34 - 33
4:16,Stanley Johnson makes 16-foot jumper,36 - 33
3:57,Boris Diaw  misses 13-foot jumper,36 - 33
3:57,Andre Drummond defensive rebound,36 - 33
3:47,Aron Baynes makes two point shot (Tobias Harris assists),38 - 33
3:24,Gordon Hayward makes 25-foot  three point jumper  (Joe Ingles assists),38 - 36
3:10,Tobias Harris makes 16-foot two point shot,40 - 36
3:02,Jazz Full timeout,40 - 36
2:51,George Hill  misses 11-foot two point shot,40 - 36
2:50,Rudy Gobert offensive rebound,40 - 36
2:49,Reggie Jackson personal foul  (Rudy Gobert draws the foul),40 - 36
2:49,Rodney Hood enters the game for Joe Ingles,40 - 36
2:36,Boris Diaw makes 11-foot two point shot,40 - 38
2:15,Tobias Harris  misses two point shot,40 - 38
2:15,Jazz defensive team rebound,40 - 38
1:55,Rodney Hood makes dunk (Boris Diaw assists),40 - 40
1:31,Stanley Johnson  bad pass (Gordon Hayward steals),40 - 40
1:27,Gordon Hayward makes two point shot,40 - 42
1:25,Pistons 20 Sec. timeout,40 - 42
1:07,Tobias Harris  misses 9-foot,40 - 42
1:06,Pistons offensive team rebound,40 - 42
57.0,Rudy Gobert blocks Aron Baynes's  layup,40 - 42
56.0,Rodney Hood defensive rebound,40 - 42
56.0,Aron Baynes personal foul  (Rodney Hood draws the foul),40 - 42
39.0,Jazz 20 Sec. timeout,40 - 42
31.0,Gordon Hayward makes  three point jumper  (Boris Diaw assists),40 - 45
10.0,Reggie Jackson  misses 9-foot two point shot,40 - 45
9.0,Pistons offensive team rebound,40 - 45
8.0,Reggie Bullock enters the game for Aron Baynes,40 - 45
0.0,Reggie Jackson makes 25-foot  three point jumper,43 - 45
0.0,Rudy Gobert  bad pass (Stanley Johnson steals),43 - 45
0.0,Stanley Johnson  misses 28-foot three point jumper,43 - 45
0.0,Pistons offensive team rebound,43 - 45
0.0,End of the 2nd Quarter,43 - 45
11:42,Reggie Jackson  bad pass (Derrick Favors steals),43 - 45
11:22,Andre Drummond shooting foul  (Derrick Favors draws the foul),43 - 45
11:22,Derrick Favors misses free throw 1 of 2,43 - 45
11:22,Derrick Favors misses free throw 2 of 2,43 - 45
11:22,Jazz offensive team rebound,43 - 45
11:21,Andre Drummond defensive rebound,43 - 45
11:00,Tobias Harris makes 7-foot two point shot,45 - 45
10:37,Derrick Favors makes 7-foot two point shot (Rodney Hood assists),45 - 47
10:15,Aron Baynes  misses 13-foot jumper,45 - 47
10:14,Gordon Hayward defensive rebound,45 - 47
9:57,Aron Baynes blocks Derrick Favors's  layup,45 - 47
9:56,Andre Drummond defensive rebound,45 - 47
9:45,Tobias Harris  misses 24-foot three point jumper,45 - 47
9:45,Rodney Hood defensive rebound,45 - 47
9:34,Tobias Harris shooting foul  (George Hill draws the foul),45 - 47
9:34,George Hill makes free throw 1 of 2,45 - 48
9:34,George Hill misses free throw 2 of 2,45 - 48
9:34,Andre Drummond defensive rebound,45 - 48
9:19,Rodney Hood blocks Marcus Morris 's 3-foot  jumper,45 - 48
9:18,George Hill defensive rebound,45 - 48
9:08,Aron Baynes blocks Derrick Favors's  shot,45 - 48
9:07,George Hill offensive rebound,45 - 48
9:07,Aron Baynes blocks George Hill's  shot,45 - 48
9:07,Tobias Harris defensive rebound,45 - 48
8:45,Marcus Morris  misses Driving Floating Jump Shot,45 - 48
8:42,Derrick Favors defensive rebound,45 - 48
8:30,Gordon Hayward makes 15-foot Driving Floating Jump Shot,45 - 50
8:29,Pistons Full timeout,45 - 50
8:04,Andre Drummond makes 11-foot two point shot,47 - 50
7:39,Rudy Gobert makes layup (Derrick Favors assists),47 - 52
7:30,Andre Drummond offensive foul  (George Hill draws the foul),47 - 52
7:30,Andre Drummond  turnover,47 - 52
7:18,Gordon Hayward makes 25-foot  three point jumper  (George Hill assists),47 - 55
7:01,Marcus Morris makes 18-foot two point shot,49 - 55
6:43,Rodney Hood  misses jumper,49 - 55
6:43,Andre Drummond defensive rebound,49 - 55
6:35,Reggie Jackson  misses 20-foot jumper,49 - 55
6:35,Gordon Hayward defensive rebound,49 - 55
6:22,Gordon Hayward Out-of-Bounds Bad Pass Turnover,49 - 55
6:13,Marcus Morris  misses 7-foot jumper,49 - 55
6:13,Derrick Favors defensive rebound,49 - 55
6:03,George Hill makes 25-foot  three point jumper,49 - 58
5:50,George Hill personal foul  (Reggie Jackson draws the foul),49 - 58
5:50,Trey Lyles enters the game for Derrick Favors,49 - 58
5:50,Joe Ingles enters the game for Rodney Hood,49 - 58
5:50,Reggie Bullock enters the game for Aron Baynes,49 - 58
5:43,Trey Lyles shooting foul  (Marcus Morris draws the foul),49 - 58
5:43,Marcus Morris makes free throw 1 of 2,50 - 58
5:43,Marcus Morris makes free throw 2 of 2,51 - 58
5:31,Reggie Jackson personal foul  (George Hill draws the foul),51 - 58
5:20,Gordon Hayward  misses 24-foot three point jumper,51 - 58
5:20,Andre Drummond defensive rebound,51 - 58
5:11,Marcus Morris  bad pass (Gordon Hayward steals),51 - 58
5:07,George Hill makes 25-foot  three point jumper  (Gordon Hayward assists),51 - 61
4:52,Pistons Full timeout,51 - 61
4:52,Stanley Johnson enters the game for Marcus Morris,51 - 61
4:37,Tobias Harris  misses driving layup,51 - 61
4:37,Joe Ingles defensive rebound,51 - 61
4:33,Tobias Harris technical foul(1st technical foul),51 - 61
4:33,Gordon Hayward misses technical free throw,51 - 61
4:33,Jazz offensive team rebound,51 - 61
4:24,Gordon Hayward  traveling,51 - 61
4:13,Reggie Jackson  misses 3-foot two point shot,51 - 61
4:13,Joe Ingles defensive rebound,51 - 61
3:59,George Hill makes 24-foot  three point jumper  (Gordon Hayward assists),51 - 64
3:31,Rudy Gobert shooting foul  (Andre Drummond draws the foul),51 - 64
3:31,Andre Drummond misses free throw 1 of 2,51 - 64
3:31,Pistons offensive team rebound,51 - 64
3:31,Beno Udrih enters the game for Reggie Jackson,51 - 64
3:31,Dante Exum enters the game for George Hill,51 - 64
3:31,Andre Drummond misses free throw 2 of 2,51 - 64
3:31,Trey Lyles defensive rebound,51 - 64
3:21,Gordon Hayward makes driving layup,51 - 66
3:21,Stanley Johnson shooting foul  (Gordon Hayward draws the foul),51 - 66
3:21,Gordon Hayward makes free throw 1 of 1,51 - 67
3:02,Stanley Johnson  bad pass (Dante Exum steals),51 - 67
3:00,Gordon Hayward  bad pass (Reggie Bullock steals),51 - 67
2:54,Stanley Johnson makes 24-foot  three point jumper  (Reggie Bullock assists),54 - 67
2:41,Trey Lyles  misses 25-foot three point jumper,54 - 67
2:40,Andre Drummond defensive rebound,54 - 67
2:28,Rudy Gobert blocks Tobias Harris's  shot,54 - 67
2:27,Gordon Hayward defensive rebound,54 - 67
2:23,Trey Lyles makes dunk (Gordon Hayward assists),54 - 69
2:00,Beno Udrih makes 23-foot  three point jumper  (Reggie Bullock assists),57 - 69
2:00,Jazz Full timeout,57 - 69
2:00,Rodney Hood enters the game for Joe Ingles,57 - 69
2:00,Joe Johnson enters the game for Gordon Hayward,57 - 69
2:00,Derrick Favors enters the game for Rudy Gobert,57 - 69
1:49,Trey Lyles makes layup (Dante Exum assists),57 - 71
1:31,Beno Udrih  out of bounds lost ball turnover,57 - 71
1:19,Dante Exum makes driving layup,57 - 73
1:00,Andre Drummond makes layup (Beno Udrih assists),59 - 73
43.0,Rodney Hood makes 12-foot two point shot,59 - 75
33.0,Reggie Bullock makes 15-foot jumper,61 - 75
33.0,Rodney Hood shooting foul  (Reggie Bullock draws the foul),61 - 75
33.0,Reggie Bullock makes free throw 1 of 1,62 - 75
10.0,Rodney Hood  misses 16-foot jumper,62 - 75
9.0,Andre Drummond defensive rebound,62 - 75
2.0,Rodney Hood shooting foul  (Andre Drummond draws the foul),62 - 75
2.0,Andre Drummond misses free throw 1 of 2,62 - 75
2.0,Pistons offensive team rebound,62 - 75
2.0,Andre Drummond makes free throw 2 of 2,63 - 75
0.0,Joe Johnson makes  three point jumper,63 - 78
0.0,End of the 3rd Quarter,63 - 78
11:42,Joe Johnson  misses 6-foot two point shot,63 - 78
11:41,Marcus Morris defensive rebound,63 - 78
11:33,Stanley Johnson makes 24-foot  three point jumper  (Beno Udrih assists),66 - 78
11:18,Rodney Hood makes 25-foot  three point jumper  (Trey Lyles assists),66 - 81
10:52,Beno Udrih  misses three point jumper,66 - 81
10:52,Rodney Hood defensive rebound,66 - 81
10:42,Rodney Hood makes 25-foot  three pointer,66 - 84
10:37,Pistons 20 Sec. timeout,66 - 84
10:23,Reggie Bullock makes two point shot (Beno Udrih assists),68 - 84
10:12,Dante Exum  bad pass (Reggie Bullock steals),68 - 84
10:08,Stanley Johnson makes two point shot (Reggie Bullock assists),70 - 84
9:49,Derrick Favors makes layup (Dante Exum assists),70 - 86
9:49,Marcus Morris shooting foul  (Derrick Favors draws the foul),70 - 86
9:49,Derrick Favors makes free throw 1 of 1,70 - 87
9:42,Trey Lyles personal foul  (Marcus Morris draws the foul),70 - 87
9:37,Beno Udrih  bad pass (Dante Exum steals),70 - 87
9:36,Beno Udrih personal foul  (Trey Lyles draws the foul),70 - 87
9:36,Boris Diaw enters the game for Trey Lyles,70 - 87
9:17,Derrick Favors makes two point shot (Rodney Hood assists),70 - 89
9:00,Marcus Morris  misses 24-foot three point jumper,70 - 89
9:00,Derrick Favors defensive rebound,70 - 89
8:37,Rodney Hood makes 25-foot  step back jumpshot,70 - 92
8:17,Reggie Bullock makes layup (Beno Udrih assists),72 - 92
7:52,Derrick Favors makes jumper (Dante Exum assists),72 - 94
7:41,Rodney Hood personal foul  (Reggie Bullock draws the foul),72 - 94
7:41,Full timeout,72 - 94
7:41,Joe Ingles enters the game for Rodney Hood,72 - 94
7:41,Rudy Gobert enters the game for Derrick Favors,72 - 94
7:41,Tobias Harris enters the game for Beno Udrih,72 - 94
7:41,Andre Drummond enters the game for Boban Marjanovic,72 - 94
7:41,Reggie Jackson enters the game for Stanley Johnson,72 - 94
7:41,Pistons delay of game violation,72 - 94
7:28,Reggie Bullock  misses 16-foot jumper,72 - 94
7:28,Boris Diaw defensive rebound,72 - 94
7:09,Rudy Gobert makes layup (Dante Exum assists),72 - 96
6:50,Reggie Jackson  bad pass (Rudy Gobert steals),72 - 96
6:41,Dante Exum  misses 25-foot three point jumper,72 - 96
6:41,Reggie Bullock defensive rebound,72 - 96
6:24,Tobias Harris  misses 13-foot jumper,72 - 96
6:24,Rudy Gobert defensive rebound,72 - 96
6:22,Marcus Morris loose ball foul  (Rudy Gobert draws the foul),72 - 96
6:22,George Hill enters the game for Dante Exum,72 - 96
6:22,Gordon Hayward enters the game for Joe Johnson,72 - 96
6:03,George Hill  misses 23-foot three point jumper,72 - 96
6:03,Marcus Morris defensive rebound,72 - 96
5:54,Marcus Morris  misses 12-foot jumper,72 - 96
5:54,Rudy Gobert defensive rebound,72 - 96
5:30,Boris Diaw makes 13-foot two point shot,72 - 98
5:05,Marcus Morris  misses 25-foot three point jumper,72 - 98
5:03,Rudy Gobert defensive rebound,72 - 98
4:46,Rudy Gobert makes dunk (Boris Diaw assists),72 - 100
4:43,Pistons Full timeout,72 - 100
4:43,Henry Ellenson enters the game for Tobias Harris,72 - 100
4:43,Beno Udrih enters the game for Andre Drummond,72 - 100
4:43,Boban Marjanovic enters the game for Marcus Morris,72 - 100
4:43,Darrun Hilliard enters the game for Reggie Jackson,72 - 100
4:43,Alec Burks enters the game for Gordon Hayward,72 - 100
4:41,Derrick Favors enters the game for Rudy Gobert,72 - 100
4:26,Boban Marjanovic  misses 6-foot jumper,72 - 100
4:24,Joe Ingles defensive rebound,72 - 100
4:03,George Hill makes 24-foot  three point jumper,72 - 103
3:34,Beno Udrih  misses 24-foot three point jumper,72 - 103
3:34,Joe Ingles defensive rebound,72 - 103
3:23,Jazz Full timeout,72 - 103
3:23,Jeff Withey enters the game for Derrick Favors,72 - 103
3:23,Dante Exum enters the game for George Hill,72 - 103
3:17,Alec Burks  misses two point shot,72 - 103
3:16,Boban Marjanovic defensive rebound,72 - 103
3:13,Henry Ellenson makes layup (Beno Udrih assists),74 - 103
3:13,Joe Ingles shooting foul  (Henry Ellenson draws the foul),74 - 103
3:13,Henry Ellenson makes free throw 1 of 1,75 - 103
2:54,Alec Burks  misses 25-foot three point jumper,75 - 103
2:54,Beno Udrih defensive rebound,75 - 103
2:36,Henry Ellenson  lost ball turnover (Joe Ingles steals),75 - 103
2:11,Henry Ellenson  misses 26-foot three point jumper,75 - 105
2:11,Dante Exum defensive rebound,75 - 105
2:00,Jeff Withey makes layup (Boris Diaw assists),75 - 107
2:00,Boban Marjanovic shooting foul  (Jeff Withey draws the foul),75 - 107
2:00,Trey Lyles enters the game for Boris Diaw,75 - 107
2:00,Jeff Withey makes free throw 1 of 1,75 - 108
1:44,Beno Udrih makes driving layup,77 - 108
1:28,Dante Exum  misses three point jumper,77 - 108
1:27,Darrun Hilliard defensive rebound,77 - 108
1:15,Henry Ellenson  misses 13-foot jumper,77 - 108
1:13,Dante Exum defensive rebound,77 - 108
58.0,Joe Ingles  misses 27-foot three point jumper,77 - 108
58.0,Boban Marjanovic defensive rebound,77 - 108
48.0,Henry Ellenson  misses 25-foot three point jumper,77 - 108
47.0,Trey Lyles defensive rebound,77 - 108
34.0,Alec Burks  misses,77 - 108
34.0,Jeff Withey offensive rebound,77 - 108
34.0,Henry Ellenson shooting foul  (Jeff Withey draws the foul),77 - 108
34.0,Jeff Withey makes free throw 1 of 2,77 - 109
34.0,Jeff Withey makes free throw 2 of 2,77 - 110
19.0,Trey Lyles blocks Boban Marjanovic 's 1-foot  layup,77 - 110
17.0,Trey Lyles defensive rebound,77 - 110
0.0,End of the 4th Quarter,77 - 110
0.0,End of Game,77 - 110
