time,play,score
12:00,Jonas Valanciunas vs. Mason Plumlee (Kyle Lowry gains possession),0 - 0
11:40,Pascal Siakam  misses 7-foot jumper,0 - 0
11:40,Raptors offensive team rebound,0 - 0
11:40,Mason Plumlee loose ball foul  (Jonas Valanciunas draws the foul),0 - 0
11:33,DeMarre Carroll  misses 22-foot jumper,0 - 0
11:30,DeMar DeRozan offensive rebound,0 - 0
11:22,DeMar DeRozan  misses jumper,0 - 0
11:22,Maurice Harkless defensive rebound,0 - 0
11:11,Al-Farouq Aminu  misses 24-foot three point jumper,0 - 0
11:11,Mason Plumlee offensive rebound,0 - 0
11:08,DeMar DeRozan personal foul  (Mason Plumlee draws the foul),0 - 0
11:03,C.J. McCollum makes two point shot,0 - 2
10:48,DeMar DeRozan  misses,0 - 2
10:47,Mason Plumlee defensive rebound,0 - 2
10:38,Maurice Harkless makes layup (Mason Plumlee assists),0 - 4
10:23,Jonas Valanciunas makes layup (DeMar DeRozan assists),2 - 4
10:06,Allen Crabbe  misses 18-foot two point jumper,2 - 4
10:04,Kyle Lowry defensive rebound,2 - 4
10:00,Kyle Lowry  misses Running Pullup Jump Shot,2 - 4
9:59,Mason Plumlee defensive rebound,2 - 4
9:51,Allen Crabbe  misses 13-foot two point shot,2 - 4
9:49,Jonas Valanciunas defensive rebound,2 - 4
9:45,Kyle Lowry Out-of-Bounds Bad Pass Turnover,2 - 4
9:26,Jonas Valanciunas shooting foul  (Mason Plumlee draws the foul),2 - 4
9:26,Mason Plumlee makes free throw 1 of 2,2 - 5
9:26,Mason Plumlee makes free throw 2 of 2,2 - 6
9:14,DeMar DeRozan  misses Driving Floating Jump Shot,2 - 6
9:12,Mason Plumlee defensive rebound,2 - 6
9:07,Maurice Harkless  misses,2 - 6
9:07,DeMarre Carroll defensive rebound,2 - 6
8:56,Jonas Valanciunas  misses 11-foot jumper,2 - 6
8:56,Mason Plumlee defensive rebound,2 - 6
8:47,C.J. McCollum  misses 25-foot three point jumper,2 - 6
8:47,C.J. McCollum offensive rebound,2 - 6
8:42,C.J. McCollum makes layup,2 - 8
8:26,Allen Crabbe personal foul  (DeMar DeRozan draws the foul),2 - 8
8:19,Jonas Valanciunas makes layup (Kyle Lowry assists),4 - 8
8:07,C.J. McCollum  lost ball turnover (DeMar DeRozan steals),4 - 8
8:02,DeMar DeRozan makes 3-foot Running Pullup Jump Shot,6 - 8
7:48,Maurice Harkless offensive foul  (Kyle Lowry draws the foul),6 - 8
7:48,Maurice Harkless  turnover,6 - 8
7:35,Kyle Lowry makes 17-foot two point shot,8 - 8
7:22,Allen Crabbe  misses 19-foot two point jumper,8 - 8
7:22,Jonas Valanciunas defensive rebound,8 - 8
7:16,Kyle Lowry  misses 26-foot three point pullup jump shot,8 - 8
7:16,Al-Farouq Aminu defensive rebound,8 - 8
7:03,Maurice Harkless  misses two point shot,8 - 8
7:01,Mason Plumlee makes dunk,8 - 10
7:01,Mason Plumlee offensive rebound,8 - 8
6:41,DeMarre Carroll  misses 26-foot three point jumper,8 - 10
6:39,Al-Farouq Aminu defensive rebound,8 - 10
6:28,Al-Farouq Aminu  misses 12-foot two point jumper,8 - 10
6:28,DeMar DeRozan defensive rebound,8 - 10
6:22,DeMar DeRozan  out of bounds lost ball turnover,8 - 10
6:05,C.J. McCollum makes 24-foot  three point jumper  (Al-Farouq Aminu assists),8 - 13
5:52,C.J. McCollum shooting foul  (Kyle Lowry draws the foul),8 - 13
5:52,Trail Blazers Full timeout,8 - 13
5:52,Patrick Patterson enters the game for Pascal Siakam,8 - 13
5:52,Evan Turner enters the game for Allen Crabbe,8 - 13
5:52,Kyle Lowry makes free throw 1 of 2,9 - 13
5:52,Kyle Lowry makes free throw 2 of 2,10 - 13
5:33,Mason Plumlee makes 4-foot two point shot (Evan Turner assists),10 - 15
5:16,DeMarre Carroll  misses three point jumper,10 - 15
5:16,Al-Farouq Aminu defensive rebound,10 - 15
5:09,C.J. McCollum  misses Running Pullup Jump Shot,10 - 15
5:09,Jonas Valanciunas defensive rebound,10 - 15
4:58,Patrick Patterson  misses 23-foot three point jumper,10 - 15
4:56,Mason Plumlee defensive rebound,10 - 15
4:50,Maurice Harkless  lost ball turnover (Jonas Valanciunas steals),10 - 15
4:35,Jonas Valanciunas makes 3-foot two point shot,12 - 15
4:20,Mason Plumlee  misses two point shot,12 - 15
4:20,Jonas Valanciunas defensive rebound,12 - 15
4:09,Patrick Patterson  misses 23-foot three point jumper,12 - 15
4:07,Maurice Harkless defensive rebound,12 - 15
4:01,C.J. McCollum makes 24-foot Running Pullup Jump Shot (Maurice Harkless assists),12 - 18
3:45,DeMar DeRozan makes two point shot (Kyle Lowry assists),14 - 18
3:28,Evan Turner makes two point shot (Mason Plumlee assists),14 - 20
3:14,DeMar DeRozan  lost ball turnover (Maurice Harkless steals),14 - 20
3:09,Maurice Harkless  bad pass (Kyle Lowry steals),14 - 20
3:03,Patrick Patterson  misses three point jumper,14 - 20
3:03,Al-Farouq Aminu defensive rebound,14 - 20
2:55,C.J. McCollum  bad pass (DeMar DeRozan steals),14 - 20
2:43,Jonas Valanciunas makes 2-foot layup (DeMar DeRozan assists),16 - 20
2:24,Mason Plumlee makes layup (Evan Turner assists),16 - 22
2:17,Raptors Full timeout,16 - 22
2:17,Cory Joseph enters the game for DeMarre Carroll,16 - 22
2:17,Lucas Nogueira enters the game for Jonas Valanciunas,16 - 22
2:17,Terrence Ross enters the game for Kyle Lowry,16 - 22
2:17,Shabazz Napier enters the game for Maurice Harkless,16 - 22
2:17,Meyers Leonard enters the game for Al-Farouq Aminu,16 - 22
2:17,Allen Crabbe enters the game for Mason Plumlee,16 - 22
2:17,Noah Vonleh enters the game for C.J. McCollum,16 - 22
2:03,DeMar DeRozan makes 16-foot two point shot,18 - 22
1:47,Shabazz Napier  misses 25-foot three point jumper,18 - 22
1:47,DeMar DeRozan defensive rebound,18 - 22
1:28,Patrick Patterson  misses Driving Floating Jump Shot,18 - 22
1:27,Patrick Patterson offensive rebound,18 - 22
1:16,Noah Vonleh shooting foul  (DeMar DeRozan draws the foul),18 - 22
1:16,DeMar DeRozan misses free throw 1 of 2,18 - 22
1:16,Raptors offensive team rebound,18 - 22
1:16,DeMar DeRozan makes free throw 2 of 2,19 - 22
1:00,Allen Crabbe makes driving layup (Noah Vonleh assists),19 - 24
52.0,Lucas Nogueira  offensive goaltending turnover,19 - 24
38.0,Evan Turner  misses two point jumper,19 - 24
37.0,Terrence Ross defensive rebound,19 - 24
27.0,DeMar DeRozan makes 15-foot two point shot (Cory Joseph assists),21 - 24
2.0,Evan Turner  misses 17-foot two point jumper,21 - 24
1.0,Noah Vonleh offensive rebound,21 - 24
0.0,Noah Vonleh  misses layup,21 - 24
0.0,Cory Joseph defensive rebound,21 - 24
0.0,End of the 1st Quarter,21 - 24
11:41,Shabazz Napier  misses driving layup,21 - 24
11:40,Patrick Patterson defensive rebound,21 - 24
11:26,Cory Joseph  misses driving layup,21 - 24
11:26,Meyers Leonard defensive rebound,21 - 24
11:04,Meyers Leonard  misses three point jumper,21 - 24
11:04,Lucas Nogueira defensive rebound,21 - 24
10:48,Terrence Ross  misses 19-foot jumper,21 - 24
10:48,Noah Vonleh defensive rebound,21 - 24
10:38,Meyers Leonard  lost ball turnover (Terrence Ross steals),21 - 24
10:38,Patrick Patterson  bad pass (Shabazz Napier steals),21 - 24
10:38,Terrence Ross personal foul  (Shabazz Napier draws the foul),21 - 24
10:30,Shabazz Napier  bad pass (Terrence Ross steals),21 - 24
10:26,Terrence Ross makes two point shot,23 - 24
10:07,Allen Crabbe makes 20-foot two point shot,23 - 26
9:45,Cory Joseph  misses 16-foot two point jumper,23 - 26
9:45,Lucas Nogueira offensive rebound,23 - 26
9:41,Patrick Patterson makes 24-foot  three point jumper  (Lucas Nogueira assists),26 - 26
9:26,Shabazz Napier  bad pass (Terrence Ross steals),26 - 26
9:23,Terrence Ross  lost ball turnover (Evan Turner steals),26 - 26
9:19,Allen Crabbe  misses 24-foot three point jumper,26 - 26
9:18,Noah Vonleh offensive rebound,26 - 26
9:15,Evan Turner makes 24-foot  three point jumper  (Noah Vonleh assists),26 - 29
8:57,Terrence Ross  misses Driving Floating Jump Shot,26 - 29
8:56,Noah Vonleh defensive rebound,26 - 29
8:52,Evan Turner Out-of-Bounds Bad Pass Turnover,26 - 29
8:52,Official timeout,26 - 29
8:40,Meyers Leonard shooting foul  (Lucas Nogueira draws the foul),26 - 29
8:40,Lucas Nogueira makes free throw 1 of 2,27 - 29
8:40,Lucas Nogueira makes free throw 2 of 2,28 - 29
8:19,Evan Turner makes 11-foot two point shot,28 - 31
8:00,Terrence Ross  misses 26-foot three point pullup jump shot,28 - 31
7:58,Evan Turner defensive rebound,28 - 31
7:48,Noah Vonleh  misses two point shot,28 - 31
7:47,Lucas Nogueira defensive rebound,28 - 31
7:35,Cory Joseph makes 4-foot Driving Floating Jump Shot,30 - 31
7:16,Shabazz Napier makes 28-foot  three point jumper  (Evan Turner assists),30 - 34
6:50,Kyle Lowry  misses 25-foot three point pullup jump shot,30 - 34
6:48,Shabazz Napier defensive rebound,30 - 34
6:37,Lucas Nogueira shooting foul  (Noah Vonleh draws the foul),30 - 34
6:37,Noah Vonleh makes free throw 1 of 2,30 - 35
6:37,Norman Powell enters the game for Cory Joseph,30 - 35
6:37,DeMar DeRozan enters the game for Terrence Ross,30 - 35
6:37,C.J. McCollum enters the game for Shabazz Napier,30 - 35
6:37,Maurice Harkless enters the game for Allen Crabbe,30 - 35
6:37,Noah Vonleh misses free throw 2 of 2,30 - 35
6:37,Lucas Nogueira defensive rebound,30 - 35
6:15,Kyle Lowry makes 24-foot  three point jumper,33 - 35
6:01,Maurice Harkless  misses 25-foot three point jumper,33 - 35
6:00,Lucas Nogueira defensive rebound,33 - 35
5:52,Patrick Patterson makes 24-foot  three point jumper  (Kyle Lowry assists),36 - 35
5:50,Trail Blazers Full timeout,36 - 35
5:50,DeMarre Carroll enters the game for Patrick Patterson,36 - 35
5:50,Jonas Valanciunas enters the game for Lucas Nogueira,36 - 35
5:50,Mason Plumlee enters the game for Meyers Leonard,36 - 35
5:50,Al-Farouq Aminu enters the game for Noah Vonleh,36 - 35
5:33,Mason Plumlee  misses jumper,36 - 35
5:33,Jonas Valanciunas blocks C.J. McCollum 's 3-foot  layup,36 - 35
5:33,C.J. McCollum offensive rebound,36 - 35
5:30,Kyle Lowry defensive rebound,36 - 35
5:24,DeMar DeRozan  misses jumper,36 - 35
5:24,Raptors offensive team rebound,36 - 35
5:07,Norman Powell  misses 22-foot three point jumper,36 - 35
5:07,Raptors offensive team rebound,36 - 35
4:52,Jonas Valanciunas  misses 5-foot hook shot,36 - 35
4:50,Maurice Harkless defensive rebound,36 - 35
4:43,Kyle Lowry personal foul  (Evan Turner draws the foul),36 - 35
4:37,C.J. McCollum  misses 21-foot two point jumper,36 - 35
4:35,Jonas Valanciunas defensive rebound,36 - 35
4:24,DeMar DeRozan makes jumper (Norman Powell assists),38 - 35
4:07,C.J. McCollum makes 21-foot two point shot (Mason Plumlee assists),38 - 37
3:47,DeMar DeRozan  misses,38 - 37
3:47,Al-Farouq Aminu defensive rebound,38 - 37
3:41,C.J. McCollum makes 10-foot jumper (Al-Farouq Aminu assists),38 - 39
3:31,Mason Plumlee personal foul  (Kyle Lowry draws the foul),38 - 39
3:16,Jonas Valanciunas makes two point shot (Kyle Lowry assists),40 - 39
2:51,Al-Farouq Aminu makes 6-foot two point shot,40 - 41
2:32,Norman Powell  lost ball turnover (Evan Turner steals),40 - 41
2:29,Kyle Lowry shooting foul  (Mason Plumlee draws the foul),40 - 41
2:29,Raptors Full timeout,40 - 41
2:29,Cory Joseph enters the game for Kyle Lowry,40 - 41
2:29,Allen Crabbe enters the game for Evan Turner,40 - 41
2:29,Mason Plumlee misses free throw 1 of 2,40 - 41
2:29,Trail Blazers offensive team rebound,40 - 41
2:29,Mason Plumlee makes free throw 2 of 2,40 - 42
2:04,Jonas Valanciunas  misses 8-foot hook shot,40 - 42
2:02,Raptors offensive team rebound,40 - 42
1:54,Maurice Harkless blocks Norman Powell 's 2-foot  shot,40 - 42
1:54,Raptors offensive team rebound,40 - 42
1:44,Jonas Valanciunas  misses 9-foot two point shot,40 - 42
1:44,Allen Crabbe defensive rebound,40 - 42
1:27,Allen Crabbe  misses 20-foot jumper,40 - 42
1:25,Norman Powell defensive rebound,40 - 42
1:12,DeMarre Carroll Out-of-Bounds Bad Pass Turnover,40 - 42
57.0,Maurice Harkless  misses 4-foot,40 - 42
56.0,DeMar DeRozan defensive rebound,40 - 42
50.0,Maurice Harkless personal foul  (DeMar DeRozan draws the foul),40 - 42
35.0,Jonas Valanciunas  misses,40 - 42
33.0,Mason Plumlee defensive rebound,40 - 42
15.0,C.J. McCollum  misses 16-foot two point jumper,40 - 42
15.0,Jonas Valanciunas defensive rebound,40 - 42
1.0,DeMar DeRozan makes 4-foot Driving Floating Jump Shot,42 - 42
1.0,Allen Crabbe shooting foul  (DeMar DeRozan draws the foul),42 - 42
1.0,DeMar DeRozan makes free throw 1 of 1,43 - 42
1.0,Trail Blazers 20 Sec. timeout,43 - 42
1.0,Meyers Leonard enters the game for Mason Plumlee,43 - 42
0.0,End of the 2nd Quarter,43 - 42
11:41,Mason Plumlee  misses Driving Floating Jump Shot,43 - 42
11:41,Mason Plumlee  misses,43 - 42
11:41,Mason Plumlee offensive rebound,43 - 42
11:38,DeMar DeRozan defensive rebound,43 - 42
11:23,DeMar DeRozan makes 10-foot two point shot (Jonas Valanciunas assists),45 - 42
11:02,Allen Crabbe makes Driving Floating Jump Shot (C.J. McCollum assists),45 - 44
10:52,Maurice Harkless blocks DeMarre Carroll's  layup,45 - 44
10:52,Mason Plumlee defensive rebound,45 - 44
10:45,Al-Farouq Aminu  misses layup,45 - 44
10:44,Kyle Lowry defensive rebound,45 - 44
10:33,Patrick Patterson makes 24-foot  three point jumper  (DeMar DeRozan assists),48 - 44
10:21,C.J. McCollum makes 19-foot two point shot,48 - 46
10:02,DeMar DeRozan  misses 20-foot two point jumper,48 - 46
10:00,DeMar DeRozan offensive rebound,48 - 46
9:55,Patrick Patterson makes 23-foot  three point jumper  (DeMar DeRozan assists),51 - 46
9:36,Allen Crabbe  misses 24-foot three point jumper,51 - 46
9:34,Patrick Patterson defensive rebound,51 - 46
9:19,C.J. McCollum shooting foul  (DeMar DeRozan draws the foul),51 - 46
9:19,DeMar DeRozan misses free throw 1 of 2,51 - 46
9:19,Raptors offensive team rebound,51 - 46
9:19,DeMar DeRozan misses free throw 2 of 2,51 - 46
9:15,C.J. McCollum defensive rebound,51 - 46
9:11,C.J. McCollum  misses 25-foot three point pullup jump shot,51 - 46
9:10,Patrick Patterson defensive rebound,51 - 46
9:00,Kyle Lowry  lost ball turnover (C.J. McCollum steals),51 - 46
8:59,Maurice Harkless makes two point shot (C.J. McCollum assists),51 - 48
8:59,Patrick Patterson flagrant foul type 1  (Maurice Harkless draws the foul),51 - 48
8:59,Maurice Harkless misses free throw 2 of 2,51 - 48
8:59,Trail Blazers offensive team rebound,51 - 48
8:59,Maurice Harkless misses free throw 1 of 1,51 - 48
8:59,Trail Blazers offensive team rebound,51 - 48
8:42,Maurice Harkless makes dunk (C.J. McCollum assists),51 - 50
8:22,DeMarre Carroll makes 24-foot  three point jumper  (DeMar DeRozan assists),54 - 50
8:07,Mason Plumlee makes driving dunk (C.J. McCollum assists),54 - 52
7:41,Kyle Lowry makes 22-foot two point shot,56 - 52
7:33,Mason Plumlee makes two point shot (C.J. McCollum assists),56 - 54
7:18,Al-Farouq Aminu personal foul  (Patrick Patterson draws the foul),56 - 54
7:07,Kyle Lowry makes 29-foot  three point jumper  (DeMar DeRozan assists),59 - 54
6:46,Jonas Valanciunas shooting block foul  (Allen Crabbe draws the foul),59 - 54
6:46,Allen Crabbe misses free throw 1 of 2,59 - 54
6:46,Trail Blazers offensive team rebound,59 - 54
6:46,Allen Crabbe makes free throw 2 of 2,59 - 55
6:33,DeMar DeRozan  misses 15-foot,59 - 55
6:31,Al-Farouq Aminu defensive rebound,59 - 55
6:22,C.J. McCollum makes 5-foot two point shot,59 - 57
6:11,DeMar DeRozan  lost ball turnover (Allen Crabbe steals),59 - 57
6:09,Jonas Valanciunas kicked ball violation,59 - 57
5:58,C.J. McCollum makes 16-foot two point shot,59 - 59
5:41,Kyle Lowry makes 25-foot  three pointer,62 - 59
5:28,Al-Farouq Aminu makes 24-foot  three point jumper  (C.J. McCollum assists),62 - 62
5:20,Kyle Lowry makes driving layup,64 - 62
5:20,Mason Plumlee shooting foul  (Kyle Lowry draws the foul),64 - 62
5:20,Trail Blazers Full timeout,64 - 62
5:20,Lucas Nogueira enters the game for Jonas Valanciunas,64 - 62
5:20,Evan Turner enters the game for Mason Plumlee,64 - 62
5:20,Ed Davis enters the game for Allen Crabbe,64 - 62
5:20,Kyle Lowry makes free throw 1 of 1,65 - 62
5:05,Maurice Harkless makes dunk (C.J. McCollum assists),65 - 64
4:50,Kyle Lowry  lost ball turnover (Maurice Harkless steals),65 - 64
4:48,Maurice Harkless offensive foul  (DeMarre Carroll draws the foul),65 - 64
4:48,Maurice Harkless  turnover,65 - 64
4:48,Cory Joseph enters the game for DeMarre Carroll,65 - 64
4:39,Ed Davis personal foul  (Lucas Nogueira draws the foul),65 - 64
4:39,Noah Vonleh enters the game for Al-Farouq Aminu,65 - 64
4:31,DeMar DeRozan  misses 4-foot jump bank shot,65 - 64
4:31,Ed Davis defensive rebound,65 - 64
4:22,Evan Turner  out of bounds lost ball turnover,65 - 64
4:09,DeMar DeRozan  misses Driving Floating Jump Shot,65 - 64
4:09,DeMar DeRozan offensive rebound,65 - 64
3:58,Kyle Lowry  misses 25-foot,65 - 64
3:57,Patrick Patterson offensive rebound,65 - 64
3:48,Kyle Lowry  misses driving layup,65 - 64
3:47,Noah Vonleh defensive rebound,65 - 64
3:41,Lucas Nogueira blocks Evan Turner's  layup,65 - 64
3:40,Lucas Nogueira defensive rebound,65 - 64
3:32,Patrick Patterson  misses three point jumper,65 - 64
3:31,Maurice Harkless defensive rebound,65 - 64
3:19,C.J. McCollum  bad pass (Patrick Patterson steals),65 - 64
3:14,Patrick Patterson  misses 25-foot three point jumper,65 - 64
3:14,Noah Vonleh defensive rebound,65 - 64
2:57,Maurice Harkless makes Driving Floating Jump Shot,65 - 66
2:57,Raptors Full timeout,65 - 66
2:57,Shabazz Napier enters the game for C.J. McCollum,65 - 66
2:57,Allen Crabbe enters the game for Maurice Harkless,65 - 66
2:57,Terrence Ross enters the game for Kyle Lowry,65 - 66
2:45,Lucas Nogueira  misses,65 - 66
2:45,Raptors offensive team rebound,65 - 66
2:45,Ed Davis loose ball foul  (Lucas Nogueira draws the foul),65 - 66
2:45,Lucas Nogueira makes free throw 1 of 2,66 - 66
2:45,Lucas Nogueira makes free throw 2 of 2,67 - 66
2:29,Evan Turner  misses 18-foot two point jumper,67 - 66
2:27,Terrence Ross defensive rebound,67 - 66
2:16,Patrick Patterson makes 25-foot  three point jumper  (DeMar DeRozan assists),70 - 66
1:55,Ed Davis  misses layup,70 - 66
1:54,Noah Vonleh offensive rebound,70 - 66
1:52,Lucas Nogueira blocks Noah Vonleh 's 2-foot  layup,70 - 66
1:51,DeMar DeRozan defensive rebound,70 - 66
1:43,Terrence Ross  misses 26-foot three point jumper,70 - 66
1:40,DeMar DeRozan offensive rebound,70 - 66
1:23,DeMar DeRozan  misses 22-foot two point jumper,70 - 66
1:23,Evan Turner defensive rebound,70 - 66
1:01,Noah Vonleh 3 second turnover,70 - 66
1:01,DeMarre Carroll enters the game for Patrick Patterson,70 - 66
51.0,Terrence Ross  misses Driving Floating Jump Shot,70 - 66
51.0,Allen Crabbe defensive rebound,70 - 66
39.0,Ed Davis  misses 3-foot hook shot,70 - 66
38.0,Lucas Nogueira defensive rebound,70 - 66
29.0,DeMar DeRozan  misses 21-foot two point jumper,70 - 66
28.0,Ed Davis defensive rebound,70 - 66
22.0,Cory Joseph shooting foul  (Shabazz Napier draws the foul),70 - 66
22.0,Shabazz Napier makes free throw 1 of 2,70 - 67
22.0,Al-Farouq Aminu enters the game for Allen Crabbe,70 - 67
22.0,Shabazz Napier makes free throw 2 of 2,70 - 68
0.0,DeMarre Carroll makes 23-foot  three point jumper  (Lucas Nogueira assists),73 - 68
0.0,End of the 3rd Quarter,73 - 68
11:48,Cory Joseph  misses driving layup,73 - 68
11:48,Ed Davis defensive rebound,73 - 68
11:41,Noah Vonleh makes 3-foot two point shot (Evan Turner assists),73 - 70
11:21,Noah Vonleh personal foul  (Cory Joseph draws the foul),73 - 70
11:14,Noah Vonleh blocks Cory Joseph's  layup,73 - 70
11:14,Raptors offensive team rebound,73 - 70
11:07,Kyle Lowry makes 25-foot  three point jumper  (DeMarre Carroll assists),76 - 70
10:52,Kyle Lowry shooting block foul  (Shabazz Napier draws the foul),76 - 70
10:52,Shabazz Napier makes free throw 1 of 2,76 - 71
10:52,Shabazz Napier makes free throw 2 of 2,76 - 72
10:37,Cory Joseph  misses 19-foot two point jumper,76 - 72
10:37,Allen Crabbe defensive rebound,76 - 72
10:25,Shabazz Napier  misses 26-foot three point jumper,76 - 72
10:23,Ed Davis offensive rebound,76 - 72
10:21,Terrence Ross blocks Ed Davis's  shot,76 - 72
10:19,Kyle Lowry defensive rebound,76 - 72
10:17,Cory Joseph  misses two point shot,76 - 72
10:15,Allen Crabbe defensive rebound,76 - 72
10:07,Allen Crabbe  misses 8-foot jumper,76 - 72
10:07,Noah Vonleh offensive rebound,76 - 72
10:06,Noah Vonleh makes two point shot,76 - 74
9:48,DeMarre Carroll  misses 25-foot three point jumper,76 - 74
9:47,Evan Turner defensive rebound,76 - 74
9:42,Lucas Nogueira shooting foul  (Evan Turner draws the foul),76 - 74
9:42,Evan Turner makes free throw 1 of 2,76 - 75
9:42,Al-Farouq Aminu enters the game for Noah Vonleh,76 - 75
9:42,Evan Turner makes free throw 2 of 2,76 - 76
9:32,Terrence Ross  lost ball turnover (Shabazz Napier steals),76 - 76
9:29,Shabazz Napier  lost ball turnover (Terrence Ross steals),76 - 76
9:26,Terrence Ross makes two point shot,78 - 76
9:02,Shabazz Napier makes 25-foot  three point jumper  (Evan Turner assists),78 - 79
8:45,Kyle Lowry  misses 26-foot three point pullup jump shot,78 - 79
8:42,DeMarre Carroll offensive rebound,78 - 79
8:36,Terrence Ross  misses 10-foot two point jumper,78 - 79
8:34,Ed Davis defensive rebound,78 - 79
8:29,Evan Turner  out of bounds lost ball turnover,78 - 79
8:29,Official timeout,78 - 79
8:29,C.J. McCollum enters the game for Shabazz Napier,78 - 79
8:29,Patrick Patterson enters the game for DeMarre Carroll,78 - 79
8:07,Cory Joseph  misses 2-foot,78 - 79
8:07,Al-Farouq Aminu defensive rebound,78 - 79
7:48,Allen Crabbe  misses three point jumper,78 - 79
7:48,Kyle Lowry defensive rebound,78 - 79
7:41,Evan Turner shooting foul  (Kyle Lowry draws the foul),78 - 79
7:41,Kyle Lowry misses free throw 1 of 2,78 - 79
7:41,Raptors offensive team rebound,78 - 79
7:41,Maurice Harkless enters the game for Allen Crabbe,78 - 79
7:41,Jonas Valanciunas enters the game for Lucas Nogueira,78 - 79
7:41,Norman Powell enters the game for Terrence Ross,78 - 79
7:41,Mason Plumlee enters the game for Ed Davis,78 - 79
7:41,Kyle Lowry makes free throw 2 of 2,79 - 79
7:26,Al-Farouq Aminu  misses 25-foot three point jumper,79 - 79
7:24,Mason Plumlee offensive rebound,79 - 79
7:20,Al-Farouq Aminu makes 24-foot  three point jumper  (Mason Plumlee assists),79 - 82
6:56,Jonas Valanciunas  misses,79 - 82
6:56,Maurice Harkless defensive rebound,79 - 82
6:45,Evan Turner  bad pass (Cory Joseph steals),79 - 82
6:39,Al-Farouq Aminu blocks Cory Joseph's  shot,79 - 82
6:37,Kyle Lowry offensive rebound,79 - 82
6:33,Patrick Patterson  misses 25-foot three point jumper,79 - 82
6:33,Mason Plumlee defensive rebound,79 - 82
6:26,C.J. McCollum  misses 19-foot jumper,79 - 82
6:26,Jonas Valanciunas defensive rebound,79 - 82
6:20,Mason Plumlee shooting foul  (Kyle Lowry draws the foul),79 - 82
6:20,Kyle Lowry makes free throw 1 of 2,80 - 82
6:20,DeMar DeRozan enters the game for Cory Joseph,80 - 82
6:20,Kyle Lowry makes free throw 2 of 2,81 - 82
6:01,Evan Turner  misses 25-foot three point jumper,81 - 82
6:01,Jonas Valanciunas defensive rebound,81 - 82
5:50,Kyle Lowry  misses two point jumper,81 - 82
5:50,Jonas Valanciunas  misses,81 - 82
5:50,Jonas Valanciunas offensive rebound,81 - 82
5:50,Jonas Valanciunas offensive rebound,81 - 82
5:50,Maurice Harkless shooting foul  (Jonas Valanciunas draws the foul),81 - 82
5:50,Trail Blazers Full timeout,81 - 82
5:50,Jonas Valanciunas makes free throw 1 of 2,82 - 82
5:50,Jonas Valanciunas makes free throw 2 of 2,83 - 82
5:35,Evan Turner  misses 25-foot three point jumper,83 - 82
5:33,Patrick Patterson defensive rebound,83 - 82
5:30,C.J. McCollum shooting foul  (Norman Powell draws the foul),83 - 82
5:30,Norman Powell misses free throw 1 of 2,83 - 82
5:30,Raptors offensive team rebound,83 - 82
5:30,Norman Powell makes free throw 2 of 2,84 - 82
5:30,Allen Crabbe enters the game for Evan Turner,84 - 82
5:20,Maurice Harkless  lost ball turnover (DeMar DeRozan steals),84 - 82
5:03,DeMar DeRozan makes two point shot,86 - 82
4:46,C.J. McCollum makes driving layup,86 - 84
4:28,DeMar DeRozan  misses 18-foot jumper,86 - 84
4:26,Allen Crabbe defensive rebound,86 - 84
4:15,C.J. McCollum  misses 14-foot jumper,86 - 84
4:15,Patrick Patterson defensive rebound,86 - 84
4:05,Kyle Lowry  misses 25-foot three point jumper,86 - 84
4:03,Patrick Patterson offensive rebound,86 - 84
3:47,DeMar DeRozan  misses 10-foot jumper,86 - 84
3:46,Jonas Valanciunas offensive rebound,86 - 84
3:46,Jonas Valanciunas  misses,86 - 84
3:44,Mason Plumlee defensive rebound,86 - 84
3:35,C.J. McCollum  misses 17-foot two point jumper,86 - 84
3:34,Jonas Valanciunas defensive rebound,86 - 84
3:15,Kyle Lowry makes 25-foot  step back jumpshot,89 - 84
2:55,C.J. McCollum makes 16-foot two point shot,89 - 86
2:50,Raptors Full timeout,89 - 86
2:50,Cory Joseph enters the game for Jonas Valanciunas,89 - 86
2:50,Lucas Nogueira enters the game for Norman Powell,89 - 86
2:33,Kyle Lowry  misses 25-foot three point jumper,89 - 86
2:33,Mason Plumlee defensive rebound,89 - 86
2:20,Mason Plumlee  misses,89 - 86
2:18,Cory Joseph defensive rebound,89 - 86
2:10,Cory Joseph makes driving layup,91 - 86
2:10,Mason Plumlee defensive goaltending violation,91 - 86
1:54,C.J. McCollum  misses 19-foot two point jumper,91 - 86
1:51,Lucas Nogueira defensive rebound,91 - 86
1:30,Cory Joseph  misses 25-foot three point jumper,91 - 86
1:29,Mason Plumlee defensive rebound,91 - 86
1:20,C.J. McCollum  traveling,91 - 86
54.0,Kyle Lowry  misses 24-foot three point jumper,91 - 86
53.0,Al-Farouq Aminu defensive rebound,91 - 86
49.0,C.J. McCollum makes 24-foot  three point jumper  (Al-Farouq Aminu assists),91 - 89
24.0,DeMar DeRozan  misses 29-foot three point jumper,91 - 89
22.0,DeMar DeRozan offensive rebound,91 - 89
17.0,Raptors Full timeout,91 - 89
17.0,Evan Turner enters the game for Mason Plumlee,91 - 89
16.0,Al-Farouq Aminu personal take foul  (Cory Joseph draws the foul),93 - 89
16.0,Cory Joseph makes free throw 1 of 2,92 - 89
16.0,Cory Joseph makes free throw 2 of 2,93 - 89
16.0,Trail Blazers Full timeout,93 - 89
