time,play,score
12:00,Alex Len vs. Marcin Gortat (Markieff Morris gains possession),0 - 0
11:37,John Wall  bad pass (Eric Bledsoe steals),0 - 0
11:30,Devin Booker  misses 22-foot jumper,0 - 0
11:29,Marquese Chriss offensive rebound,0 - 0
11:26,Marquese Chriss  misses layup,0 - 0
11:26,John Wall defensive rebound,0 - 0
11:18,Markieff Morris  misses 26-foot three point jumper,0 - 0
11:18,Eric Bledsoe defensive rebound,0 - 0
11:10,Brandon Knight  misses 18-foot jumper,0 - 0
11:08,John Wall defensive rebound,0 - 0
10:57,John Wall  misses 21-foot jumper,0 - 0
10:56,Markieff Morris offensive rebound,0 - 0
10:52,Otto Porter Jr. makes layup (John Wall assists),0 - 2
10:34,Alex Len  traveling,0 - 2
10:23,Markieff Morris  disc dribble turnover,0 - 2
10:03,Marquese Chriss  lost ball turnover (John Wall steals),0 - 2
9:47,Marcin Gortat makes 14-foot two point shot,0 - 4
9:26,Devin Booker makes 28-foot  three point jumper  (Eric Bledsoe assists),3 - 4
9:14,Markieff Morris  misses jumper,3 - 4
9:12,Alex Len defensive rebound,3 - 4
8:53,Alex Len makes 9-foot two point shot,5 - 4
8:41,Bradley Beal makes 7-foot two point shot (John Wall assists),5 - 6
8:40,Wizards delay of game violation,5 - 6
8:29,Devin Booker makes 19-foot two point shot,7 - 6
8:00,Alex Len blocks Markieff Morris 's 5-foot  jumper,7 - 6
8:00,Wizards offensive team rebound,7 - 6
7:58,shot clock turnover,7 - 6
7:50,Marcin Gortat shooting foul  (Alex Len draws the foul),7 - 6
7:50,Alex Len makes free throw 1 of 2,8 - 6
7:50,Alex Len makes free throw 2 of 2,9 - 6
7:33,Bradley Beal  misses 12-foot jumper,9 - 6
7:31,Brandon Knight defensive rebound,9 - 6
7:31,Bradley Beal personal foul  (Brandon Knight draws the foul),9 - 6
7:16,Marquese Chriss makes dunk (Alex Len assists),11 - 6
7:01,Marquese Chriss shooting foul  (Otto Porter Jr. draws the foul),11 - 6
7:01,Otto Porter Jr. makes free throw 1 of 2,11 - 7
7:01,Otto Porter Jr. makes free throw 2 of 2,11 - 8
6:39,Brandon Knight  misses 26-foot three point jumper,11 - 8
6:39,Otto Porter Jr. defensive rebound,11 - 8
6:33,John Wall  misses 27-foot three point jumper,11 - 8
6:31,Brandon Knight defensive rebound,11 - 8
6:28,John Wall blocks Devin Booker's  layup,11 - 8
6:24,Marcin Gortat defensive rebound,11 - 8
6:20,Otto Porter Jr.  misses 25-foot three point jumper,11 - 8
6:18,Brandon Knight defensive rebound,11 - 8
6:15,Brandon Knight  lost ball turnover (Otto Porter Jr. steals),11 - 8
6:09,Bradley Beal makes 24-foot  three point jumper  (Otto Porter Jr. assists),11 - 11
5:56,Wizards Full timeout,11 - 11
5:50,Eric Bledsoe makes 25-foot  three point jumper  (Devin Booker assists),14 - 11
5:39,Alex Len shooting foul  (Otto Porter Jr. draws the foul),14 - 11
5:39,Otto Porter Jr. makes free throw 1 of 2,14 - 12
5:39,Otto Porter Jr. misses free throw 2 of 2,14 - 12
5:37,Alex Len defensive rebound,14 - 12
5:24,Alex Len  bad pass (Markieff Morris steals),14 - 12
5:18,John Wall makes two point shot (Markieff Morris assists),14 - 14
5:09,Marquese Chriss makes 7-foot two point shot (Brandon Knight assists),16 - 14
4:56,Marcin Gortat makes layup (John Wall assists),16 - 16
4:43,Marquese Chriss  misses layup,16 - 16
4:43,Suns offensive team rebound,16 - 16
4:37,Devin Booker Out-of-Bounds Bad Pass Turnover,16 - 16
4:24,Alex Len defensive 3-seconds (Technical Foul),16 - 16
4:24,Bradley Beal makes technical free throw,16 - 17
4:24,Kelly Oubre Jr. enters the game for Markieff Morris,16 - 17
4:24,P.J. Tucker enters the game for Marquese Chriss,16 - 17
4:16,John Wall  misses 17-foot jumper,16 - 17
4:16,Marcin Gortat offensive rebound,16 - 17
4:15,Marcin Gortat makes tip shot,16 - 19
3:55,John Wall blocks Eric Bledsoe's  layup,16 - 19
3:55,Suns offensive team rebound,16 - 19
3:55,Jared Dudley enters the game for Eric Bledsoe,16 - 19
3:48,Devin Booker makes two point shot (Brandon Knight assists),18 - 19
3:29,Otto Porter Jr.  misses 25-foot three point jumper,18 - 19
3:28,Marcin Gortat offensive rebound,18 - 19
3:25,Marcin Gortat  misses layup,18 - 19
3:24,Brandon Knight defensive rebound,18 - 19
3:13,Brandon Knight  bad pass (Otto Porter Jr. steals),18 - 19
3:12,Jared Dudley personal take foul  (John Wall draws the foul),18 - 19
2:58,Kelly Oubre Jr.  misses 24-foot three point jumper,18 - 19
2:56,John Wall offensive rebound,18 - 19
2:54,Bradley Beal makes 26-foot  three point jumper  (John Wall assists),18 - 22
2:53,Suns Full timeout,18 - 22
2:53,Alan Williams enters the game for Alex Len,18 - 22
2:53,Eric Bledsoe enters the game for Brandon Knight,18 - 22
2:53,Tomas Satoransky enters the game for Bradley Beal,18 - 22
2:35,P.J. Tucker  misses layup,18 - 22
2:34,Alan Williams offensive rebound,18 - 22
2:33,Alan Williams  misses layup,18 - 22
2:31,Marcin Gortat defensive rebound,18 - 22
2:09,John Wall  misses 16-foot jumper,18 - 22
2:08,Alan Williams defensive rebound,18 - 22
1:57,Trey Burke enters the game for John Wall,18 - 22
1:46,Devin Booker  misses 5-foot jumper,18 - 22
1:45,Kelly Oubre Jr. defensive rebound,18 - 22
1:42,Otto Porter Jr. makes two point shot (Kelly Oubre Jr. assists),18 - 24
1:21,Devin Booker  misses 27-foot three point jumper,18 - 24
1:20,Otto Porter Jr. defensive rebound,18 - 24
1:07,Trey Burke  misses 17-foot jumper,18 - 24
1:07,Jared Dudley defensive rebound,18 - 24
49.0,Otto Porter Jr. shooting foul  (Eric Bledsoe draws the foul),18 - 24
49.0,Eric Bledsoe misses free throw 1 of 3,18 - 24
49.0,Suns offensive team rebound,18 - 24
49.0,Eric Bledsoe makes free throw 2 of 3,19 - 24
49.0,Eric Bledsoe makes free throw 3 of 3,20 - 24
37.0,P.J. Tucker shooting foul  (Tomas Satoransky draws the foul),20 - 24
37.0,Tomas Satoransky makes free throw 1 of 2,20 - 25
37.0,Tomas Satoransky makes free throw 2 of 2,20 - 26
31.0,Eric Bledsoe  misses 27-foot three point jumper,20 - 26
29.0,Otto Porter Jr. defensive rebound,20 - 26
11.0,Alan Williams blocks Kelly Oubre Jr. 's 13-foot  jumper,20 - 26
9.0,Otto Porter Jr. offensive rebound,20 - 26
6.0,Otto Porter Jr.  misses 20-foot jumper,20 - 26
5.0,Eric Bledsoe defensive rebound,20 - 26
1.0,Eric Bledsoe  misses layup,20 - 26
0.0,Kelly Oubre Jr. defensive rebound,20 - 26
0.0,End of the 1st Quarter,20 - 26
11:48,Marcus Thornton personal foul  (Alan Williams draws the foul),20 - 26
11:34,Leandro Barbosa Out-of-Bounds Bad Pass Turnover,20 - 26
11:19,Jason Smith  misses 19-foot jumper,20 - 26
11:18,P.J. Tucker defensive rebound,20 - 26
11:03,Tyler Ulis makes two point shot,22 - 26
10:45,Jason Smith  misses 18-foot jumper,22 - 26
10:44,P.J. Tucker defensive rebound,22 - 26
10:37,Jason Smith personal foul  (Alan Williams draws the foul),22 - 26
10:33,Alan Williams offensive foul  (Jason Smith draws the foul),22 - 26
10:33,Alan Williams  turnover,22 - 26
10:19,Alan Williams shooting foul  (Kelly Oubre Jr. draws the foul),22 - 26
10:19,Kelly Oubre Jr. makes free throw 1 of 2,22 - 27
10:19,Kelly Oubre Jr. misses free throw 2 of 2,22 - 27
10:18,Alan Williams defensive rebound,22 - 27
9:57,Jared Dudley  out of bounds lost ball turnover,22 - 27
9:45,Trey Burke  misses layup,22 - 27
9:44,Trey Burke offensive rebound,22 - 27
9:42,Trey Burke  misses layup,22 - 27
9:41,Alan Williams defensive rebound,22 - 27
9:27,Jared Dudley  misses layup,22 - 27
9:26,Jason Smith defensive rebound,22 - 27
9:23,Kelly Oubre Jr. makes dunk (Tomas Satoransky assists),22 - 29
9:15,Alan Williams makes 13-foot two point shot (Leandro Barbosa assists),24 - 29
9:03,Jason Smith makes 20-foot jumper (Trey Burke assists),24 - 31
8:48,Jared Dudley  misses 27-foot three point jumper,24 - 31
8:45,P.J. Tucker offensive rebound,24 - 31
8:45,Jason Smith personal foul  (P.J. Tucker draws the foul),24 - 31
8:45,Official timeout,24 - 31
8:45,Bradley Beal enters the game for Tomas Satoransky,24 - 31
8:38,Tyler Ulis makes 9-foot two point shot,26 - 31
8:19,Marcus Thornton  misses 8-foot jumper,26 - 31
8:18,Leandro Barbosa defensive rebound,26 - 31
8:10,Leandro Barbosa makes 18-foot jumper,28 - 31
7:50,Alan Williams shooting foul  (Kelly Oubre Jr. draws the foul),28 - 31
7:50,Kelly Oubre Jr. misses free throw 1 of 2,28 - 31
7:50,Wizards offensive team rebound,28 - 31
7:50,Eric Bledsoe enters the game for Tyler Ulis,28 - 31
7:50,John Wall enters the game for Trey Burke,28 - 31
7:50,Markieff Morris enters the game for Jason Smith,28 - 31
7:50,Kelly Oubre Jr. misses free throw 2 of 2,28 - 31
7:48,Jared Dudley defensive rebound,28 - 31
7:31,Leandro Barbosa  misses 21-foot jumper,28 - 31
7:31,Kelly Oubre Jr. defensive rebound,28 - 31
7:24,Marcus Thornton makes 27-foot  three point jumper  (John Wall assists),28 - 34
7:16,Eric Bledsoe  back court turnover,28 - 34
7:01,Marcus Thornton  lost ball turnover (P.J. Tucker steals),28 - 34
6:52,Eric Bledsoe  misses 26-foot three point jumper,28 - 34
6:50,P.J. Tucker offensive rebound,28 - 34
6:47,Jared Dudley makes layup (P.J. Tucker assists),30 - 34
6:37,Bradley Beal  out of bounds lost ball turnover,30 - 34
6:24,Jared Dudley  misses layup,30 - 34
6:24,Jared Dudley offensive rebound,30 - 34
6:22,Jared Dudley makes two point shot,32 - 34
6:22,Wizards Full timeout,32 - 34
6:22,Otto Porter Jr. enters the game for Kelly Oubre Jr.,32 - 34
6:05,Markieff Morris offensive foul  (Leandro Barbosa draws the foul),32 - 34
6:05,Markieff Morris  turnover,32 - 34
5:54,Jared Dudley makes jumper (Eric Bledsoe assists),34 - 34
5:37,Marcus Thornton  misses 19-foot jumper,34 - 34
5:35,P.J. Tucker defensive rebound,34 - 34
5:24,Jared Dudley  misses layup,34 - 34
5:24,Otto Porter Jr. defensive rebound,34 - 34
5:18,Bradley Beal makes two point shot (John Wall assists),34 - 36
5:05,Leandro Barbosa makes 24-foot  three point jumper  (Eric Bledsoe assists),37 - 36
4:54,John Wall  misses 22-foot jumper,37 - 36
4:52,Otto Porter Jr. offensive rebound,37 - 36
4:50,Otto Porter Jr. makes 4-foot two point shot,37 - 38
4:35,Eric Bledsoe makes 24-foot  three point jumper  (Leandro Barbosa assists),40 - 38
4:26,Marcus Thornton  misses 26-foot three point jumper,40 - 38
4:24,P.J. Tucker defensive rebound,40 - 38
4:15,Markieff Morris shooting foul  (Alan Williams draws the foul),40 - 38
4:15,Alan Williams misses free throw 1 of 2,40 - 38
4:15,Suns offensive team rebound,40 - 38
4:15,Marcin Gortat enters the game for Marcus Thornton,40 - 38
4:15,Brandon Knight enters the game for Leandro Barbosa,40 - 38
4:15,Devin Booker enters the game for P.J. Tucker,40 - 38
4:15,Alan Williams makes free throw 2 of 2,41 - 38
4:03,Eric Bledsoe blocks John Wall's  layup,41 - 38
4:03,Wizards offensive team rebound,41 - 38
4:03,Alex Len enters the game for Alan Williams,41 - 38
3:57,Jared Dudley personal block  (Markieff Morris draws the foul),41 - 38
3:51,Bradley Beal makes 26-foot  three pointer,41 - 41
3:40,Eric Bledsoe Out-of-Bounds Bad Pass Turnover,41 - 41
3:30,Bradley Beal makes two point shot (John Wall assists),41 - 43
3:19,Devin Booker makes layup (Jared Dudley assists),43 - 43
3:04,Otto Porter Jr.  bad pass,43 - 43
2:41,Devin Booker makes 26-foot  three point jumper  (Jared Dudley assists),46 - 43
2:32,Markieff Morris makes 2-foot two point shot (John Wall assists),46 - 45
2:19,Devin Booker  misses 15-foot jumper,46 - 45
2:18,Otto Porter Jr. defensive rebound,46 - 45
2:13,John Wall  misses layup,46 - 45
2:10,Brandon Knight defensive rebound,46 - 45
2:01,Brandon Knight  lost ball turnover (Markieff Morris steals),46 - 45
2:00,Suns Full timeout,46 - 45
2:00,Marquese Chriss enters the game for Jared Dudley,46 - 45
2:00,Brandon Knight vs. Markieff Morris (Bradley Beal gains possession),46 - 45
1:47,Marcin Gortat offensive foul  (Brandon Knight draws the foul),46 - 45
1:47,Marcin Gortat  turnover,46 - 45
1:30,Marquese Chriss  lost ball turnover (John Wall steals),46 - 45
1:20,John Wall  misses 11-foot jumper,46 - 45
1:19,Wizards offensive team rebound,46 - 45
1:19,Alex Len loose ball foul  (Marcin Gortat draws the foul),46 - 45
1:17,Bradley Beal  misses layup,46 - 45
1:15,Alex Len defensive rebound,46 - 45
1:10,Eric Bledsoe  misses 19-foot jumper,46 - 45
1:09,Marcin Gortat defensive rebound,46 - 45
1:04,Markieff Morris makes dunk (John Wall assists),46 - 47
44.0,Marquese Chriss  misses 10-foot jumper,46 - 47
43.0,Otto Porter Jr. defensive rebound,46 - 47
37.0,John Wall makes 25-foot  three pointer  (Otto Porter Jr. assists),46 - 50
37.0,Suns 20 Sec. timeout,46 - 50
37.0,Jared Dudley enters the game for Marquese Chriss,46 - 50
37.0,Kelly Oubre Jr. enters the game for Markieff Morris,46 - 50
26.0,Eric Bledsoe  misses 23-foot three point jumper,46 - 50
25.0,Alex Len offensive rebound,46 - 50
1.0,Eric Bledsoe  bad pass,46 - 50
1.0,Wizards 20 Sec. timeout,46 - 50
0.0,John Wall  misses 48-foot three point jumper,46 - 50
0.0,Wizards offensive team rebound,46 - 50
0.0,End of the 2nd Quarter,46 - 50
11:52,Markieff Morris shooting foul  (Alex Len draws the foul),46 - 50
11:52,Alex Len makes free throw 1 of 2,47 - 50
11:52,Alex Len makes free throw 2 of 2,48 - 50
11:38,Markieff Morris  misses jumper,48 - 50
11:33,Marquese Chriss defensive rebound,48 - 50
11:21,Alex Len makes dunk (Eric Bledsoe assists),50 - 50
11:07,John Wall  misses 13-foot jumper,50 - 50
11:07,Eric Bledsoe defensive rebound,50 - 50
11:00,Devin Booker makes layup (Eric Bledsoe assists),52 - 50
10:36,Marquese Chriss personal block  (Bradley Beal draws the foul),52 - 50
10:25,Marcin Gortat makes 8-foot two point shot (John Wall assists),52 - 52
10:12,Marquese Chriss  misses 24-foot three point jumper,52 - 52
10:11,Otto Porter Jr. defensive rebound,52 - 52
10:08,Alex Len blocks Marcin Gortat 's 4-foot  jumper,52 - 52
10:04,Devin Booker defensive rebound,52 - 52
10:02,John Wall personal foul  (Devin Booker draws the foul),52 - 52
9:55,Devin Booker makes 25-foot  three point jumper,55 - 52
9:37,Bradley Beal makes 13-foot jumper (John Wall assists),55 - 54
9:15,Marquese Chriss makes  three point jumper  (Devin Booker assists),58 - 54
9:07,Alex Len shooting foul  (Marcin Gortat draws the foul),58 - 54
9:07,Marcin Gortat misses free throw 1 of 2,58 - 54
9:07,Wizards offensive team rebound,58 - 54
9:07,Marcin Gortat misses free throw 2 of 2,58 - 54
9:06,Markieff Morris offensive rebound,58 - 54
9:02,Marquese Chriss blocks Marcin Gortat 's 3-foot  jumper,58 - 54
8:59,Eric Bledsoe defensive rebound,58 - 54
8:53,Eric Bledsoe  out of bounds lost ball turnover,58 - 54
8:44,John Wall  misses 10-foot jumper,58 - 54
8:42,Wizards offensive team rebound,58 - 54
8:27,Marquese Chriss shooting foul  (Markieff Morris draws the foul),58 - 54
8:27,Markieff Morris misses free throw 1 of 2,58 - 54
8:27,Wizards offensive team rebound,58 - 54
8:27,Markieff Morris makes free throw 2 of 2,58 - 55
8:18,Devin Booker  misses 19-foot jumper,58 - 55
8:17,Bradley Beal defensive rebound,58 - 55
8:10,Otto Porter Jr.  misses 26-foot three point jumper,58 - 55
8:07,Brandon Knight defensive rebound,58 - 55
8:03,Brandon Knight  misses 15-foot jumper,58 - 55
8:03,Marcin Gortat defensive rebound,58 - 55
7:52,John Wall  misses 8-foot jumper,58 - 55
7:50,Eric Bledsoe defensive rebound,58 - 55
7:39,Brandon Knight  misses 25-foot three point jumper,58 - 55
7:39,Markieff Morris defensive rebound,58 - 55
7:35,Eric Bledsoe shooting foul  (John Wall draws the foul),58 - 55
7:35,John Wall makes free throw 1 of 2,58 - 56
7:35,John Wall makes free throw 2 of 2,58 - 57
7:18,Alex Len  misses jumper,58 - 57
7:16,Marcin Gortat defensive rebound,58 - 57
7:11,Marcin Gortat offensive foul  (Eric Bledsoe draws the foul),58 - 57
7:11,Marcin Gortat  turnover,58 - 57
7:11,Kelly Oubre Jr. enters the game for Otto Porter Jr.,58 - 57
6:48,Eric Bledsoe  misses 25-foot three point jumper,58 - 57
6:48,Marcin Gortat defensive rebound,58 - 57
6:37,John Wall  misses layup,58 - 57
6:37,Marcin Gortat offensive rebound,58 - 57
6:31,Bradley Beal makes 27-foot  three point jumper  (Marcin Gortat assists),58 - 60
6:20,Brandon Knight makes layup (Alex Len assists),60 - 60
6:13,Bradley Beal  misses 28-foot three point jumper,60 - 60
6:11,Bradley Beal offensive rebound,60 - 60
6:11,Bradley Beal makes layup,60 - 62
6:11,Suns Full timeout,60 - 62
6:11,Tomas Satoransky enters the game for Markieff Morris,60 - 62
5:54,Devin Booker  misses 21-foot jumper,60 - 62
5:54,Marquese Chriss offensive rebound,60 - 62
5:50,Marquese Chriss  misses layup,60 - 62
5:50,Alex Len offensive rebound,60 - 62
5:43,Alex Len makes 4-foot two point shot,62 - 62
5:35,Bradley Beal  misses 25-foot three point jumper,62 - 62
5:33,Alex Len defensive rebound,62 - 62
5:22,Tomas Satoransky personal foul  (Marquese Chriss draws the foul),62 - 62
5:22,P.J. Tucker enters the game for Marquese Chriss,62 - 62
5:16,Brandon Knight  misses 21-foot jumper,62 - 62
5:15,Alex Len offensive rebound,62 - 62
5:07,Eric Bledsoe makes 24-foot  three point jumper  (Alex Len assists),65 - 62
4:54,Devin Booker shooting foul  (Bradley Beal draws the foul),65 - 62
4:54,Bradley Beal makes free throw 1 of 2,65 - 63
4:54,Bradley Beal makes free throw 2 of 2,65 - 64
4:41,Eric Bledsoe makes layup,67 - 64
4:41,Kelly Oubre Jr. shooting block foul  (Eric Bledsoe draws the foul),68 - 64
4:41,Eric Bledsoe makes free throw 1 of 1,68 - 64
4:24,Bradley Beal  misses layup,68 - 64
4:22,Eric Bledsoe defensive rebound,68 - 64
4:05,P.J. Tucker  lost ball turnover (John Wall steals),68 - 64
4:05,P.J. Tucker personal foul  (Bradley Beal draws the foul),68 - 64
4:05,Bradley Beal makes free throw 1 of 2,68 - 65
4:05,Bradley Beal misses free throw 2 of 2,68 - 65
4:03,Alex Len defensive rebound,68 - 65
3:43,Devin Booker makes 25-foot  three point jumper  (Brandon Knight assists),71 - 65
3:29,Bradley Beal  misses 25-foot three point jumper,71 - 65
3:28,Suns defensive team rebound,71 - 65
3:10,Brandon Knight makes 9-foot jumper,73 - 65
3:10,Wizards Full timeout,73 - 65
2:50,Bradley Beal makes two point shot (Tomas Satoransky assists),73 - 67
2:33,Brandon Knight  out of bounds lost ball turnover,73 - 67
2:26,John Wall  misses 25-foot three point jumper,73 - 67
2:24,P.J. Tucker defensive rebound,73 - 67
2:15,Eric Bledsoe  misses 20-foot jumper,73 - 67
2:13,Wizards defensive team rebound,73 - 67
2:13,Marcus Thornton enters the game for Bradley Beal,73 - 67
2:03,Tomas Satoransky  lost ball turnover (Eric Bledsoe steals),73 - 67
1:58,Eric Bledsoe makes dunk,75 - 67
1:54,John Wall offensive Charge  (Brandon Knight draws the foul),75 - 67
1:54,John Wall  turnover,75 - 67
1:42,Devin Booker makes 25-foot  three point jumper  (Eric Bledsoe assists),78 - 67
1:28,Marcus Thornton makes 25-foot  three point jumper  (John Wall assists),78 - 70
1:16,Eric Bledsoe  misses 16-foot jumper,78 - 70
1:15,Tomas Satoransky defensive rebound,78 - 70
1:08,Marcus Thornton makes 26-foot  three point jumper  (Kelly Oubre Jr. assists),78 - 73
1:06,Suns Full timeout,78 - 73
48.0,Devin Booker  misses layup,78 - 73
48.0,Eric Bledsoe offensive rebound,78 - 73
47.0,Eric Bledsoe makes layup,80 - 73
34.0,John Wall  misses 12-foot jumper,80 - 73
32.0,P.J. Tucker defensive rebound,80 - 73
20.0,Alex Len  misses layup,80 - 73
19.0,Tomas Satoransky defensive rebound,80 - 73
1.0,John Wall makes layup,80 - 75
0.0,End of the 3rd Quarter,80 - 75
11:45,Marcus Thornton  misses layup,80 - 75
11:44,Marcin Gortat offensive rebound,80 - 75
11:42,Marcin Gortat makes layup,80 - 77
11:32,Devin Booker  misses 16-foot jumper,80 - 77
11:30,Marcin Gortat defensive rebound,80 - 77
11:23,Devin Booker shooting foul  (Bradley Beal draws the foul),80 - 77
11:23,Bradley Beal makes free throw 1 of 2,80 - 78
11:23,Alan Williams enters the game for P.J. Tucker,80 - 78
11:23,Bradley Beal makes free throw 2 of 2,80 - 79
11:11,Jared Dudley  misses 25-foot three point jumper,80 - 79
11:11,Marcin Gortat defensive rebound,80 - 79
10:57,Kelly Oubre Jr.  misses 26-foot three point jumper,80 - 79
10:56,Alan Williams defensive rebound,80 - 79
10:45,Leandro Barbosa  misses 26-foot three point jumper,80 - 79
10:44,Wizards defensive team rebound,80 - 79
10:44,Jason Smith enters the game for Marcin Gortat,80 - 79
10:23,Marcus Thornton  misses 7-foot jumper,80 - 79
10:22,Alan Williams defensive rebound,80 - 79
10:18,Devin Booker  misses,80 - 79
10:15,Tomas Satoransky defensive rebound,80 - 79
10:11,Tomas Satoransky makes 26-foot  three point jumper  (Kelly Oubre Jr. assists),80 - 82
9:53,Alan Williams offensive foul  (Tomas Satoransky draws the foul),80 - 82
9:53,Alan Williams  turnover,80 - 82
9:37,Alan Williams shooting foul  (Tomas Satoransky draws the foul),80 - 82
9:37,Tomas Satoransky makes free throw 1 of 2,80 - 83
9:37,Tomas Satoransky misses free throw 2 of 2,80 - 83
9:34,Alan Williams defensive rebound,80 - 83
9:19,Alan Williams makes layup (Tyler Ulis assists),82 - 83
9:02,Bradley Beal  misses 24-foot three point jumper,82 - 83
9:02,Suns defensive team rebound,82 - 83
9:02,Eric Bledsoe enters the game for Devin Booker,82 - 83
8:48,Tyler Ulis  misses layup,82 - 83
8:45,Tomas Satoransky defensive rebound,82 - 83
8:40,Bradley Beal makes layup,82 - 85
8:30,Eric Bledsoe makes layup,84 - 85
8:10,Jason Smith  out of bounds lost ball turnover,84 - 85
8:10,Official timeout,84 - 85
8:10,Marcin Gortat enters the game for Tomas Satoransky,84 - 85
8:10,John Wall enters the game for Jason Smith,84 - 85
7:50,Eric Bledsoe makes two point shot,86 - 85
7:28,Bradley Beal makes 21-foot two point shot,86 - 87
7:09,Eric Bledsoe makes 12-foot two point shot,88 - 87
6:56,Leandro Barbosa personal foul  (Bradley Beal draws the foul),88 - 87
6:48,John Wall  misses 23-foot three point jumper,88 - 87
6:47,Wizards offensive team rebound,88 - 87
6:41,Marcus Thornton  misses 26-foot three point jumper,88 - 87
6:41,Jared Dudley defensive rebound,88 - 87
6:26,Eric Bledsoe makes 11-foot two point shot (Jared Dudley assists),90 - 87
6:15,Kelly Oubre Jr. makes dunk (John Wall assists),90 - 89
6:07,Eric Bledsoe  misses 26-foot three point jumper,90 - 89
6:07,Alan Williams offensive rebound,90 - 89
6:05,John Wall personal foul  (Alan Williams draws the foul),91 - 89
6:05,Wizards delay of game violation,91 - 89
6:05,Eric Bledsoe makes technical free throw,91 - 89
6:05,delay techfoul,91 - 89
5:52,Alan Williams  out of bounds lost ball turnover,91 - 89
5:52,Wizards Full timeout,91 - 89
5:45,Devin Booker enters the game for Alan Williams,91 - 89
5:45,Alex Len enters the game for Leandro Barbosa,91 - 89
5:45,Brandon Knight enters the game for Tyler Ulis,91 - 89
5:45,Markieff Morris enters the game for Kelly Oubre Jr.,91 - 89
5:39,Devin Booker shooting foul  (Bradley Beal draws the foul),91 - 89
5:39,Bradley Beal misses free throw 1 of 2,91 - 89
5:39,Wizards offensive team rebound,91 - 89
5:39,Bradley Beal makes free throw 2 of 2,91 - 90
5:28,Marcin Gortat shooting foul  (Eric Bledsoe draws the foul),91 - 90
5:28,Eric Bledsoe makes free throw 1 of 2,92 - 90
5:28,Eric Bledsoe makes free throw 2 of 2,93 - 90
5:11,Bradley Beal makes 22-foot  three point jumper  (John Wall assists),94 - 92
4:48,Devin Booker  misses 27-foot three point jumper,93 - 93
4:47,Marcin Gortat defensive rebound,93 - 93
4:31,Bradley Beal  misses 27-foot three point jumper,93 - 93
4:28,Markieff Morris offensive rebound,93 - 93
4:22,John Wall makes 14-foot two point shot,93 - 95
4:05,Alex Len  out of bounds lost ball turnover,93 - 95
3:50,Eric Bledsoe blocks John Wall 's 15-foot  jumper,93 - 95
3:47,Jared Dudley defensive rebound,93 - 95
3:45,Eric Bledsoe  misses 6-foot jumper,93 - 95
3:45,Suns offensive team rebound,93 - 95
3:45,Marcin Gortat personal foul  (Alex Len draws the foul),93 - 95
3:28,Bradley Beal shooting foul  (Alex Len draws the foul),93 - 95
3:28,Alex Len misses free throw 1 of 2,93 - 95
3:28,Suns offensive team rebound,93 - 95
3:28,Alex Len makes free throw 2 of 2,94 - 95
3:14,Bradley Beal makes two point shot (John Wall assists),94 - 97
2:56,Devin Booker  misses 22-foot jumper,94 - 97
2:55,Bradley Beal defensive rebound,94 - 97
2:55,Devin Booker personal foul  (Bradley Beal draws the foul),94 - 97
2:55,Suns Full timeout,94 - 97
2:55,Bradley Beal makes free throw 1 of 2,94 - 99
2:55,P.J. Tucker enters the game for Brandon Knight,94 - 98
2:55,Bradley Beal makes free throw 2 of 2,94 - 99
2:23,Eric Bledsoe  misses three point jumper,94 - 99
2:19,Devin Booker offensive rebound,94 - 99
2:17,Devin Booker makes 26-foot  three point jumper,97 - 99
2:08,Markieff Morris  misses 27-foot three point jumper,97 - 99
2:05,Eric Bledsoe defensive rebound,97 - 99
2:02,John Wall blocks Eric Bledsoe's  layup,97 - 99
2:01,Suns offensive team rebound,97 - 99
1:57,Devin Booker makes 18-foot two point shot (Jared Dudley assists),99 - 99
1:44,John Wall  misses 17-foot jumper,99 - 99
1:43,Markieff Morris offensive rebound,99 - 99
1:40,Markieff Morris  misses layup,99 - 99
1:39,Alex Len defensive rebound,99 - 99
1:27,Devin Booker makes 15-foot two point shot,101 - 99
1:27,Wizards Full timeout,101 - 99
1:07,Alex Len blocks Marcin Gortat's  layup,101 - 99
1:07,John Wall offensive rebound,101 - 99
1:07,John Wall makes two point shot,101 - 101
1:07,Eric Bledsoe shooting foul  (John Wall draws the foul),101 - 101
1:07,Kelly Oubre Jr. enters the game for Marcus Thornton,101 - 101
1:07,John Wall makes free throw 1 of 1,101 - 102
56.0,Jared Dudley  misses three point jumper,101 - 102
55.0,Kelly Oubre Jr. defensive rebound,101 - 102
38.0,John Wall makes 17-foot two point shot,101 - 104
38.0,Suns Full timeout,101 - 104
30.0,Marcin Gortat blocks Eric Bledsoe 's 3-foot  jumper,101 - 104
28.0,Suns offensive team rebound,101 - 104
25.0,Devin Booker  misses layup,101 - 104
24.0,Bradley Beal defensive rebound,101 - 104
21.0,Jared Dudley personal take foul  (John Wall draws the foul),101 - 104
21.0,John Wall makes free throw 1 of 2,101 - 105
