time,play,score
12:00,Karl-Anthony Towns vs. Hassan Whiteside (Luke Babbitt gains possession),0 - 0
11:33,Hassan Whiteside makes 5-foot two point shot (Dion Waiters assists),0 - 2
11:12,Karl-Anthony Towns makes 16-foot jumper,2 - 2
10:56,Luke Babbitt  misses 23-foot three point jumper,2 - 2
10:55,Karl-Anthony Towns defensive rebound,2 - 2
10:38,Andrew Wiggins  misses layup,2 - 2
10:37,Dion Waiters defensive rebound,2 - 2
10:25,Rodney McGruder makes two point shot (Hassan Whiteside assists),2 - 4
10:06,Andrew Wiggins  misses 17-foot jumper,2 - 4
10:03,Gorgui Dieng offensive rebound,2 - 4
10:02,Gorgui Dieng  misses 4-foot jump bank shot,2 - 4
10:00,Hassan Whiteside defensive rebound,2 - 4
9:55,Ricky Rubio personal foul  (Hassan Whiteside draws the foul),2 - 4
9:45,Dion Waiters makes 16-foot jumper (Goran Dragic assists),2 - 6
9:30,Hassan Whiteside defensive 3-seconds (Technical Foul),2 - 6
9:30,Ricky Rubio makes technical free throw,3 - 6
9:30,Andrew Wiggins makes dunk (Ricky Rubio assists),5 - 6
9:14,Goran Dragic  misses 24-foot three point jumper,5 - 6
9:12,Gorgui Dieng defensive rebound,5 - 6
9:04,Ricky Rubio  misses 17-foot jumper,5 - 6
9:03,Hassan Whiteside defensive rebound,5 - 6
8:56,Goran Dragic makes driving layup,5 - 8
8:38,Karl-Anthony Towns makes dunk (Ricky Rubio assists),7 - 8
8:14,Luke Babbitt makes 12-foot jumper (Rodney McGruder assists),7 - 10
8:00,Brandon Rush  misses three point jumper,7 - 10
8:00,Hassan Whiteside defensive rebound,7 - 10
7:52,Ricky Rubio blocks Goran Dragic 's 2-foot  layup,7 - 10
7:50,Heat offensive team rebound,7 - 10
7:43,Rodney McGruder  misses 23-foot three point jumper,7 - 10
7:41,Hassan Whiteside offensive rebound,7 - 10
7:37,Hassan Whiteside makes 6-foot two point shot,7 - 12
7:20,Gorgui Dieng  misses 10-foot jumper,7 - 12
7:18,Luke Babbitt defensive rebound,7 - 12
7:13,Rodney McGruder makes two point shot (Dion Waiters assists),7 - 14
6:52,Gorgui Dieng  misses jumper,7 - 14
6:50,Hassan Whiteside defensive rebound,7 - 14
6:41,Dion Waiters  lost ball turnover (Brandon Rush steals),7 - 14
6:33,Ricky Rubio  misses 8-foot jumper,7 - 14
6:33,Dion Waiters defensive rebound,7 - 14
6:28,Gorgui Dieng blocks Goran Dragic 's 2-foot  layup,7 - 14
6:28,Brandon Rush defensive rebound,7 - 14
6:20,Andrew Wiggins makes 23-foot  three point jumper  (Brandon Rush assists),10 - 14
6:07,Dion Waiters makes driving layup,10 - 16
5:41,Andrew Wiggins makes 16-foot two point shot,12 - 16
5:31,Heat Full timeout,12 - 16
5:24,Goran Dragic  misses Driving Floating Jump Shot,12 - 16
5:22,Karl-Anthony Towns defensive rebound,12 - 16
5:13,Rodney McGruder shooting foul  (Brandon Rush draws the foul),12 - 16
5:13,Brandon Rush makes free throw 1 of 2,13 - 16
5:13,Brandon Rush makes free throw 2 of 2,14 - 16
5:05,Rodney McGruder makes 23-foot  three point jumper  (Dion Waiters assists),14 - 19
4:41,Karl-Anthony Towns  misses 7-foot hook shot,14 - 19
4:41,Hassan Whiteside defensive rebound,14 - 19
4:31,Luke Babbitt makes 25-foot  three point jumper  (Goran Dragic assists),14 - 22
4:11,Andrew Wiggins  lost ball turnover (Rodney McGruder steals),14 - 22
4:07,Dion Waiters  out of bounds lost ball turnover,14 - 22
4:07,Cole Aldrich enters the game for Karl-Anthony Towns,14 - 22
4:07,Tyler Johnson enters the game for Goran Dragic,14 - 22
3:44,Andrew Wiggins  misses 17-foot jumper,14 - 22
3:44,Luke Babbitt defensive rebound,14 - 22
3:33,Luke Babbitt offensive foul  (Ricky Rubio draws the foul),14 - 22
3:33,Luke Babbitt  turnover,14 - 22
3:15,Gorgui Dieng  misses 16-foot jumper,14 - 22
3:15,Tyler Johnson defensive rebound,14 - 22
3:08,Tyler Johnson  misses 24-foot three point jumper,14 - 22
3:06,Brandon Rush defensive rebound,14 - 22
2:47,Cole Aldrich makes layup (Ricky Rubio assists),16 - 22
2:47,Hassan Whiteside shooting foul  (Cole Aldrich draws the foul),16 - 22
2:47,Timberwolves Full timeout,16 - 22
2:47,Shabazz Muhammad enters the game for Gorgui Dieng,16 - 22
2:47,James Johnson enters the game for Rodney McGruder,16 - 22
2:47,Josh Richardson enters the game for Luke Babbitt,16 - 22
2:47,Cole Aldrich makes free throw 1 of 1,17 - 22
2:36,Dion Waiters makes dunk (James Johnson assists),17 - 24
2:18,Andrew Wiggins makes 20-foot two point shot,19 - 24
1:59,James Johnson makes 22-foot jumper,19 - 26
1:47,Ricky Rubio  misses 17-foot two point jumper,19 - 26
1:47,Hassan Whiteside defensive rebound,19 - 26
1:37,Hassan Whiteside  misses 19-foot jumper,19 - 26
1:36,Shabazz Muhammad defensive rebound,19 - 26
1:23,Andrew Wiggins makes driving layup,21 - 26
1:07,James Johnson  lost ball turnover (Andrew Wiggins steals),21 - 26
1:05,Shabazz Muhammad Out-of-Bounds Bad Pass Turnover,21 - 26
1:05,Willie Reed enters the game for Hassan Whiteside,21 - 26
1:05,Tyus Jones enters the game for Brandon Rush,21 - 26
1:05,Kris Dunn enters the game for Ricky Rubio,21 - 26
1:05,Wayne Ellington enters the game for Dion Waiters,21 - 26
53.0,Shabazz Muhammad shooting foul  (Josh Richardson draws the foul),21 - 26
53.0,Josh Richardson makes free throw 1 of 2,21 - 27
53.0,Josh Richardson misses free throw 2 of 2,21 - 27
52.0,Cole Aldrich defensive rebound,21 - 27
40.0,Shabazz Muhammad  misses 27-foot three point jumper,21 - 27
39.0,Willie Reed defensive rebound,21 - 27
23.0,Wayne Ellington  misses 25-foot three point jumper,21 - 27
22.0,Andrew Wiggins defensive rebound,21 - 27
2.0,Andrew Wiggins makes 10-foot two point shot,23 - 27
0.0,James Johnson  misses 43-foot three point jumper,23 - 27
0.0,Heat offensive team rebound,23 - 27
0.0,End of the 1st Quarter,23 - 27
11:45,Tyus Jones makes 10-foot two point shot,25 - 27
11:27,Tyler Johnson makes dunk (Josh Richardson assists),25 - 29
11:06,Shabazz Muhammad makes 5-foot two point shot,27 - 29
10:48,James Johnson makes 16-foot two point shot,27 - 31
10:32,Tyus Jones makes 7-foot Driving Floating Jump Shot,29 - 31
10:18,Wayne Ellington  misses 24-foot three point jumper,29 - 31
10:18,Karl-Anthony Towns defensive rebound,29 - 31
10:06,Kris Dunn  misses 17-foot step back jumpshot,29 - 31
10:04,James Johnson defensive rebound,29 - 31
9:57,Karl-Anthony Towns personal foul  (Tyler Johnson draws the foul),29 - 31
9:49,Wayne Ellington makes 19-foot jumper,29 - 33
9:22,Brandon Rush  misses 25-foot three point jumper,29 - 33
9:22,Wayne Ellington defensive rebound,29 - 33
9:11,Tyler Johnson  misses layup,29 - 33
9:11,Willie Reed offensive rebound,29 - 33
9:10,Willie Reed makes dunk,29 - 35
8:51,Shabazz Muhammad  misses 25-foot three point jumper,29 - 35
8:49,Wayne Ellington defensive rebound,29 - 35
8:37,James Johnson makes 8-foot Driving Floating Jump Shot,29 - 37
8:30,Timberwolves Full timeout,29 - 37
8:19,Willie Reed shooting foul  (Karl-Anthony Towns draws the foul),29 - 37
8:19,Karl-Anthony Towns makes free throw 1 of 2,30 - 37
8:19,Karl-Anthony Towns makes free throw 2 of 2,31 - 37
8:10,Kris Dunn kicked ball violation,31 - 37
8:00,Wayne Ellington makes 24-foot  three point jumper  (Tyler Johnson assists),31 - 40
7:48,Tyler Johnson blocks Tyus Jones 's 9-foot  jumper,31 - 40
7:48,Josh Richardson defensive rebound,31 - 40
7:39,James Johnson makes two point shot (Wayne Ellington assists),31 - 42
7:31,Timberwolves 20 Sec. timeout,31 - 42
7:31,Gorgui Dieng enters the game for Brandon Rush,31 - 42
7:31,Ricky Rubio enters the game for Kris Dunn,31 - 42
7:31,Andrew Wiggins enters the game for Tyus Jones,31 - 42
7:22,James Johnson blocks Andrew Wiggins 's 6-foot  jumper,31 - 42
7:22,Josh Richardson defensive rebound,31 - 42
7:16,Willie Reed makes two point shot (James Johnson assists),31 - 44
6:48,Andrew Wiggins  misses 19-foot jumper,31 - 44
6:48,Karl-Anthony Towns offensive rebound,31 - 44
6:43,Karl-Anthony Towns makes layup,33 - 44
6:28,Tyler Johnson makes layup (James Johnson assists),33 - 46
6:11,Karl-Anthony Towns makes 25-foot  three point jumper  (Shabazz Muhammad assists),36 - 46
5:54,Josh Richardson  misses 22-foot jumper,36 - 46
5:54,Karl-Anthony Towns defensive rebound,36 - 46
5:33,Gorgui Dieng  misses 15-foot jumper,36 - 46
5:33,James Johnson defensive rebound,36 - 46
5:30,Ricky Rubio personal foul  (Josh Richardson draws the foul),36 - 46
5:30,Official timeout,36 - 46
5:30,Luke Babbitt enters the game for Tyler Johnson,36 - 46
5:30,Goran Dragic enters the game for James Johnson,36 - 46
5:30,Hassan Whiteside enters the game for Willie Reed,36 - 46
5:20,Wayne Ellington  misses 24-foot three point jumper,36 - 46
5:20,Karl-Anthony Towns defensive rebound,36 - 46
5:07,Ricky Rubio makes 19-foot two point shot,38 - 46
4:48,Wayne Ellington  misses 25-foot three point jumper,38 - 46
4:47,Goran Dragic offensive rebound,38 - 46
4:28,Goran Dragic makes two point shot,38 - 48
4:09,Ricky Rubio makes two point shot,40 - 48
3:57,Shabazz Muhammad personal foul  (Josh Richardson draws the foul),40 - 48
3:57,Dion Waiters enters the game for Wayne Ellington,40 - 48
3:44,Luke Babbitt makes 23-foot  three point jumper  (Goran Dragic assists),40 - 51
3:06,Andrew Wiggins shooting foul  (Dion Waiters draws the foul),42 - 51
3:06,Heat Full timeout,42 - 51
3:06,Willie Reed enters the game for Dion Waiters,42 - 51
3:06,Willie Reed misses free throw 1 of 2,42 - 51
3:06,Heat offensive team rebound,42 - 51
3:06,Willie Reed makes free throw 2 of 2,42 - 52
3:05,Josh Richardson personal foul  (Ricky Rubio draws the foul),42 - 52
3:05,Tyler Johnson enters the game for Willie Reed,42 - 52
2:53,Ricky Rubio makes 13-foot jumper (Shabazz Muhammad assists),44 - 52
2:53,Goran Dragic shooting foul  (Ricky Rubio draws the foul),44 - 52
2:53,Ricky Rubio makes free throw 1 of 1,45 - 52
2:30,Tyler Johnson makes two point shot,45 - 54
2:11,Josh Richardson blocks Andrew Wiggins 's 6-foot  jumper,45 - 54
2:10,Hassan Whiteside defensive rebound,45 - 54
2:00,James Johnson enters the game for Luke Babbitt,45 - 54
1:47,Tyler Johnson  lost ball turnover (Ricky Rubio steals),45 - 54
1:42,Shabazz Muhammad makes two point shot (Ricky Rubio assists),47 - 54
1:31,Ricky Rubio shooting foul  (Goran Dragic draws the foul),47 - 54
1:31,Goran Dragic makes free throw 1 of 3,47 - 55
1:31,Goran Dragic makes free throw 2 of 3,47 - 56
1:31,Tyus Jones enters the game for Ricky Rubio,47 - 56
1:31,Goran Dragic makes free throw 3 of 3,47 - 57
1:20,Shabazz Muhammad makes driving dunk,49 - 57
1:09,Hassan Whiteside makes two point shot (Goran Dragic assists),49 - 59
51.0,Karl-Anthony Towns  misses 24-foot three point jumper,49 - 59
50.0,Hassan Whiteside defensive rebound,49 - 59
35.0,Hassan Whiteside makes two point shot (James Johnson assists),49 - 61
18.0,Andrew Wiggins  misses 17-foot two point shot,49 - 61
17.0,Goran Dragic defensive rebound,49 - 61
1.0,James Johnson makes 23-foot  three point jumper  (Goran Dragic assists),49 - 64
0.0,Tyus Jones  misses 45-foot three point jumper,49 - 64
0.0,Timberwolves offensive team rebound,49 - 64
0.0,End of the 2nd Quarter,49 - 64
11:45,Karl-Anthony Towns  misses 5-foot hook shot,49 - 64
11:45,Karl-Anthony Towns offensive rebound,49 - 64
11:41,Karl-Anthony Towns makes 6-foot two point shot,51 - 64
11:30,Goran Dragic offensive foul  (Ricky Rubio draws the foul),51 - 64
11:30,Goran Dragic  turnover,51 - 64
11:17,Andrew Wiggins makes two point shot,53 - 64
10:55,Hassan Whiteside makes 17-foot jumper,53 - 66
10:38,Karl-Anthony Towns  misses 10-foot jumper,53 - 66
10:37,Rodney McGruder defensive rebound,53 - 66
10:30,Gorgui Dieng blocks Luke Babbitt 's 2-foot  layup,53 - 66
10:30,Brandon Rush defensive rebound,53 - 66
10:22,Ricky Rubio  misses layup,53 - 66
10:21,Karl-Anthony Towns offensive rebound,53 - 66
10:18,Karl-Anthony Towns makes tip shot,55 - 66
9:55,Rodney McGruder  misses three point jumper,55 - 66
9:53,Gorgui Dieng defensive rebound,55 - 66
9:34,Ricky Rubio makes driving layup,57 - 66
9:10,Hassan Whiteside 3 second turnover,57 - 66
8:48,Ricky Rubio makes 22-foot jumper (Gorgui Dieng assists),59 - 66
8:36,Goran Dragic  misses 25-foot three point jumper,59 - 66
8:34,Gorgui Dieng defensive rebound,59 - 66
8:27,Karl-Anthony Towns offensive foul  (Luke Babbitt draws the foul),59 - 66
8:27,Karl-Anthony Towns  turnover,59 - 66
8:12,Hassan Whiteside makes two point shot (Goran Dragic assists),59 - 68
8:00,Karl-Anthony Towns offensive foul  (Luke Babbitt draws the foul),59 - 68
8:00,Karl-Anthony Towns  turnover,59 - 68
7:47,Wayne Ellington  misses 25-foot three point jumper,59 - 68
7:46,Rodney McGruder offensive rebound,59 - 68
7:41,Wayne Ellington makes two point shot (Goran Dragic assists),59 - 70
7:26,Karl-Anthony Towns makes layup (Ricky Rubio assists),61 - 70
6:58,Rodney McGruder  misses 7-foot two point shot,61 - 70
6:56,Andrew Wiggins defensive rebound,61 - 70
6:50,Andrew Wiggins makes two point shot,63 - 70
6:39,Luke Babbitt  out of bounds lost ball turnover,63 - 70
6:24,Karl-Anthony Towns makes 8-foot two point shot (Ricky Rubio assists),65 - 70
6:24,Heat Full timeout,65 - 70
6:24,Josh Richardson enters the game for Luke Babbitt,65 - 70
6:24,Tyler Johnson enters the game for Goran Dragic,65 - 70
6:24,James Johnson enters the game for Wayne Ellington,65 - 70
6:11,Tyler Johnson  traveling,65 - 70
5:58,Ricky Rubio makes 20-foot two point shot,67 - 70
5:46,James Johnson  misses 18-foot jumper,67 - 70
5:45,Heat offensive team rebound,67 - 70
5:45,Gorgui Dieng loose ball foul  (Hassan Whiteside draws the foul),67 - 70
5:31,Rodney McGruder  misses 24-foot three point jumper,67 - 70
5:31,Hassan Whiteside offensive rebound,67 - 70
5:28,Hassan Whiteside makes two point shot,67 - 72
5:11,Hassan Whiteside shooting foul  (Andrew Wiggins draws the foul),67 - 72
5:11,Andrew Wiggins makes free throw 1 of 2,68 - 72
5:11,Andrew Wiggins makes free throw 2 of 2,69 - 72
4:56,Brandon Rush blocks Josh Richardson 's 19-foot  jumper,69 - 72
4:54,Heat offensive team rebound,69 - 72
4:48,Tyler Johnson makes 21-foot two point shot (Josh Richardson assists),69 - 74
4:28,Karl-Anthony Towns makes 15-foot two point shot,71 - 74
4:11,Tyler Johnson makes driving dunk (Josh Richardson assists),71 - 76
4:11,Gorgui Dieng shooting foul  (Tyler Johnson draws the foul),71 - 76
4:11,Tyler Johnson makes free throw 1 of 1,71 - 77
4:11,Cole Aldrich enters the game for Karl-Anthony Towns,71 - 77
4:07,Josh Richardson blocks Andrew Wiggins 's 9-foot  shot,71 - 77
4:05,Josh Richardson defensive rebound,71 - 77
4:00,Josh Richardson  misses 10-foot jumper,71 - 77
3:59,Gorgui Dieng defensive rebound,71 - 77
3:47,Hassan Whiteside personal foul  (Gorgui Dieng draws the foul),71 - 77
3:47,Shabazz Muhammad enters the game for Gorgui Dieng,71 - 77
3:42,Ricky Rubio offensive foul  (Josh Richardson draws the foul),71 - 77
3:42,Ricky Rubio  turnover,71 - 77
3:42,Kris Dunn enters the game for Ricky Rubio,71 - 77
3:25,Rodney McGruder  misses 23-foot three point jumper,71 - 77
3:23,Tyler Johnson offensive rebound,71 - 77
3:21,Tyler Johnson makes tip shot,71 - 79
3:08,Andrew Wiggins  misses 25-foot three point jumper,71 - 79
3:06,Hassan Whiteside defensive rebound,71 - 79
2:51,Tyler Johnson  out of bounds lost ball turnover,71 - 79
2:51,Timberwolves Full timeout,71 - 79
2:51,Tyus Jones enters the game for Brandon Rush,71 - 79
2:51,Goran Dragic enters the game for Rodney McGruder,71 - 79
2:51,Willie Reed enters the game for Hassan Whiteside,71 - 79
2:43,Cole Aldrich offensive foul  (Josh Richardson draws the foul),71 - 79
2:43,Cole Aldrich  turnover,71 - 79
2:24,Andrew Wiggins shooting foul  (Willie Reed draws the foul),71 - 79
2:24,Willie Reed makes free throw 1 of 2,71 - 80
2:24,Willie Reed misses free throw 2 of 2,71 - 80
2:23,Cole Aldrich defensive rebound,71 - 80
2:15,Andrew Wiggins makes two point shot,73 - 80
2:01,Tyler Johnson makes 25-foot  three point jumper  (James Johnson assists),73 - 83
1:47,Andrew Wiggins  misses 5-foot jumper,73 - 83
1:47,Andrew Wiggins offensive rebound,73 - 83
1:46,Andrew Wiggins makes tip shot,75 - 83
1:30,Tyler Johnson makes 25-foot  three point jumper  (Goran Dragic assists),75 - 86
1:16,Willie Reed shooting foul  (Andrew Wiggins draws the foul),75 - 86
1:16,Andrew Wiggins makes free throw 1 of 2,76 - 86
1:16,Andrew Wiggins makes free throw 2 of 2,77 - 86
1:13,Goran Dragic  lost ball turnover (Kris Dunn steals),77 - 86
1:09,Kris Dunn makes layup,79 - 86
49.0,Tyus Jones personal foul  (Josh Richardson draws the foul),79 - 86
44.0,Tyler Johnson makes layup (Goran Dragic assists),79 - 88
31.0,Josh Richardson blocks Andrew Wiggins 's 13-foot  jumper,79 - 88
30.0,Willie Reed defensive rebound,79 - 88
22.0,Goran Dragic  misses 13-foot jumper,79 - 88
20.0,Willie Reed offensive rebound,79 - 88
16.0,Josh Richardson makes two point shot (Tyler Johnson assists),79 - 90
2.0,Tyus Jones makes 11-foot jumper,81 - 90
0.0,Goran Dragic  misses 30-foot three point jumper,81 - 90
0.0,Heat offensive team rebound,81 - 90
0.0,End of the 3rd Quarter,81 - 90
11:44,Goran Dragic  lost ball turnover (Kris Dunn steals),81 - 90
11:40,Kris Dunn  lost ball turnover (James Johnson steals),81 - 90
11:34,Josh Richardson  misses two point shot,81 - 90
11:33,Josh Richardson offensive rebound,81 - 90
11:29,Brandon Rush blocks James Johnson's  layup,81 - 90
11:27,Heat offensive team rebound,81 - 90
11:25,Kris Dunn shooting foul  (Josh Richardson draws the foul),81 - 90
11:25,Josh Richardson makes free throw 1 of 2,81 - 91
11:25,Josh Richardson makes free throw 2 of 2,81 - 92
11:04,Tyler Johnson shooting foul  (Karl-Anthony Towns draws the foul),81 - 92
11:04,Karl-Anthony Towns makes free throw 1 of 2,82 - 92
11:04,Karl-Anthony Towns makes free throw 2 of 2,83 - 92
10:53,James Johnson makes driving dunk,83 - 94
10:40,Shabazz Muhammad makes driving layup,85 - 94
10:40,Josh Richardson shooting foul  (Shabazz Muhammad draws the foul),85 - 94
10:40,Wayne Ellington enters the game for Josh Richardson,85 - 94
10:40,Shabazz Muhammad makes free throw 1 of 1,86 - 94
10:25,James Johnson makes 8-foot two point shot,86 - 96
10:04,Karl-Anthony Towns makes 8-foot two point shot,88 - 96
9:45,James Johnson  misses 12-foot jumper,88 - 96
9:45,Kris Dunn defensive rebound,88 - 96
9:38,Shabazz Muhammad makes dunk (Brandon Rush assists),90 - 96
9:12,Goran Dragic makes 10-foot two point shot,90 - 98
8:56,Willie Reed shooting foul  (Karl-Anthony Towns draws the foul),90 - 98
8:56,Official timeout,90 - 98
8:56,Ricky Rubio enters the game for Tyus Jones,90 - 98
8:56,Josh Richardson enters the game for James Johnson,90 - 98
8:56,Karl-Anthony Towns makes free throw 1 of 2,91 - 98
8:56,Karl-Anthony Towns makes free throw 2 of 2,92 - 98
8:41,Tyler Johnson  misses 25-foot three point jumper,92 - 98
8:40,Heat offensive team rebound,92 - 98
8:40,Hassan Whiteside enters the game for Willie Reed,92 - 98
8:30,Goran Dragic makes 11-foot jumper,92 - 100
8:14,Ricky Rubio makes 16-foot jumper,94 - 100
7:54,Kris Dunn shooting foul  (Goran Dragic draws the foul),94 - 100
7:54,Goran Dragic misses free throw 1 of 2,94 - 100
7:54,Heat offensive team rebound,94 - 100
7:54,Andrew Wiggins enters the game for Kris Dunn,94 - 100
7:54,Goran Dragic makes free throw 2 of 2,94 - 101
7:50,Josh Richardson shooting foul  (Ricky Rubio draws the foul),94 - 101
7:50,Ricky Rubio makes free throw 1 of 2,95 - 101
7:50,James Johnson enters the game for Wayne Ellington,96 - 101
7:50,Ricky Rubio makes free throw 2 of 2,96 - 101
7:39,Hassan Whiteside makes dunk (Tyler Johnson assists),96 - 103
7:20,Ricky Rubio makes driving layup,98 - 103
7:05,Shabazz Muhammad personal foul  (Hassan Whiteside draws the foul),98 - 103
6:54,Goran Dragic makes 25-foot  step back jumpshot,98 - 106
6:37,James Johnson shooting foul  (Karl-Anthony Towns draws the foul),98 - 106
6:37,Karl-Anthony Towns makes free throw 1 of 2,99 - 106
6:37,Gorgui Dieng enters the game for Shabazz Muhammad,99 - 106
6:37,Karl-Anthony Towns makes free throw 2 of 2,100 - 106
6:26,Gorgui Dieng shooting foul  (Hassan Whiteside draws the foul),100 - 106
6:26,Hassan Whiteside makes free throw 1 of 2,100 - 107
6:26,Hassan Whiteside makes free throw 2 of 2,100 - 108
6:16,Ricky Rubio  misses 17-foot jumper,100 - 108
6:15,Karl-Anthony Towns offensive rebound,100 - 108
6:11,Karl-Anthony Towns  bad pass (Goran Dragic steals),100 - 108
6:01,Hassan Whiteside makes two point shot (Goran Dragic assists),100 - 110
6:00,Timberwolves Full timeout,100 - 110
5:48,Tyler Johnson blocks Gorgui Dieng's  layup,100 - 110
5:48,Heat defensive team rebound,100 - 110
5:33,James Johnson  traveling,100 - 110
5:18,Hassan Whiteside blocks Andrew Wiggins 's 3-foot  layup,100 - 110
5:18,Hassan Whiteside defensive rebound,100 - 110
5:01,Hassan Whiteside makes driving dunk,100 - 112
5:01,Gorgui Dieng shooting foul  (Hassan Whiteside draws the foul),100 - 112
5:01,Hassan Whiteside makes free throw 1 of 1,100 - 113
4:46,Andrew Wiggins  bad pass (Goran Dragic steals),100 - 113
4:43,Ricky Rubio shooting foul  (Tyler Johnson draws the foul),100 - 115
4:43,Tyler Johnson makes free throw 1 of 2,100 - 114
4:43,Tyler Johnson makes free throw 2 of 2,100 - 115
4:33,Ricky Rubio  bad pass (James Johnson steals),100 - 115
4:28,Tyler Johnson  bad pass (Ricky Rubio steals),100 - 115
4:24,Hassan Whiteside blocks Gorgui Dieng's  shot,100 - 115
4:22,Karl-Anthony Towns offensive rebound,100 - 115
4:20,Karl-Anthony Towns  misses putback layup,100 - 115
4:18,Goran Dragic defensive rebound,100 - 115
4:01,Tyler Johnson  misses three point jumper,100 - 115
4:01,Timberwolves defensive team rebound,100 - 115
4:01,Shabazz Muhammad enters the game for Gorgui Dieng,100 - 115
3:45,Karl-Anthony Towns  misses three point jumper,100 - 115
3:44,Hassan Whiteside defensive rebound,100 - 115
3:27,Goran Dragic makes two point shot,100 - 117
3:00,Andrew Wiggins  misses 18-foot jumper,100 - 117
3:00,Karl-Anthony Towns offensive rebound,100 - 117
2:56,Shabazz Muhammad makes 9-foot two point shot (Karl-Anthony Towns assists),102 - 117
2:33,Goran Dragic  misses 14-foot jumper,102 - 117
2:32,Brandon Rush defensive rebound,102 - 117
2:25,Shabazz Muhammad  misses 26-foot three point jumper,102 - 117
2:24,Goran Dragic defensive rebound,102 - 117
2:20,Heat Full timeout,102 - 117
2:05,Andrew Wiggins blocks Goran Dragic 's 6-foot  jumper,102 - 117
2:04,Hassan Whiteside offensive rebound,102 - 117
2:03,Hassan Whiteside  out of bounds lost ball turnover,102 - 117
1:54,Hassan Whiteside blocks Ricky Rubio 's 5-foot  jumper,102 - 117
1:53,Goran Dragic defensive rebound,102 - 117
1:44,Goran Dragic makes two point shot (James Johnson assists),102 - 119
1:36,Ricky Rubio  bad pass (Goran Dragic steals),102 - 119
1:19,James Johnson makes two point shot,102 - 121
1:19,Timberwolves Full timeout,102 - 121
1:19,Rodney McGruder enters the game for Hassan Whiteside,102 - 121
1:19,Willie Reed enters the game for Goran Dragic,102 - 121
1:12,Willie Reed shooting foul  (Andrew Wiggins draws the foul),102 - 121
1:12,Andrew Wiggins misses free throw 1 of 2,102 - 121
1:12,Timberwolves offensive team rebound,102 - 121
1:12,Okaro White enters the game for James Johnson,102 - 121
1:12,Cole Aldrich enters the game for Karl-Anthony Towns,102 - 121
1:12,Tyus Jones enters the game for Ricky Rubio,102 - 121
1:12,Jordan Hill enters the game for Brandon Rush,102 - 121
1:12,Andrew Wiggins makes free throw 2 of 2,103 - 121
54.0,Kris Dunn enters the game for Andrew Wiggins,103 - 121
47.0,Willie Reed  misses 24-foot three point jumper,103 - 121
46.0,Rodney McGruder offensive rebound,103 - 121
30.0,Willie Reed makes two point shot (Rodney McGruder assists),103 - 123
22.0,Tyus Jones  misses 26-foot three point jumper,103 - 123
21.0,Kris Dunn offensive rebound,103 - 123
19.0,Shabazz Muhammad makes 6-foot two point shot (Kris Dunn assists),105 - 123
0.0,End of the 4th Quarter,105 - 123
0.0,End of Game,105 - 123
