time,play,score
12:00,Zaza Pachulia vs. Dwight Howard (Patrick McCaw gains possession),0 - 0
11:45,Stephen Curry  misses 23-foot three point jumper,0 - 0
11:44,Dwight Howard defensive rebound,0 - 0
11:22,Dwight Howard makes dunk (Thabo Sefolosha assists),0 - 2
11:07,Draymond Green makes 25-foot  three point jumper  (Zaza Pachulia assists),3 - 2
10:48,Dennis Schroder  misses 24-foot three point pullup jump shot,3 - 2
10:45,Zaza Pachulia defensive rebound,3 - 2
10:36,Zaza Pachulia makes jumper (Klay Thompson assists),5 - 2
10:11,Paul Millsap makes 17-foot two point shot (Dennis Schroder assists),5 - 4
9:56,Draymond Green makes driving layup (Klay Thompson assists),7 - 4
9:51,Dwight Howard offensive foul  (Zaza Pachulia draws the foul),7 - 4
9:51,Dwight Howard  turnover,7 - 4
9:42,Patrick McCaw  traveling,7 - 4
9:32,Dennis Schroder makes driving layup,7 - 6
9:17,Patrick McCaw  misses 24-foot,7 - 6
9:15,Hawks defensive team rebound,7 - 6
9:03,Kent Bazemore makes 19-foot two point shot,7 - 8
8:56,Draymond Green  out of bounds lost ball turnover,7 - 8
8:45,Klay Thompson blocks Dennis Schroder 's 7-foot  shot,7 - 8
8:42,Zaza Pachulia defensive rebound,7 - 8
8:40,Paul Millsap blocks Patrick McCaw's  layup,7 - 8
8:37,Patrick McCaw offensive rebound,7 - 8
8:36,Thabo Sefolosha blocks Patrick McCaw 's 1-foot  shot,7 - 8
8:34,Thabo Sefolosha defensive rebound,7 - 8
8:30,Dennis Schroder makes 26-foot  three point running jumper  (Thabo Sefolosha assists),7 - 11
8:17,Klay Thompson  misses 26-foot three point jumper,7 - 11
8:15,Paul Millsap defensive rebound,7 - 11
8:08,Kent Bazemore  misses 18-foot two point jumper,7 - 11
8:07,Dwight Howard offensive rebound,7 - 11
8:07,Zaza Pachulia shooting foul  (Dwight Howard draws the foul),7 - 11
8:07,Dwight Howard misses free throw 1 of 2,7 - 11
8:07,Hawks offensive team rebound,7 - 11
8:07,Dwight Howard makes free throw 2 of 2,7 - 12
7:50,Klay Thompson  misses 25-foot three point jumper,7 - 12
7:50,Dennis Schroder defensive rebound,7 - 12
7:39,Kent Bazemore makes driving layup (Paul Millsap assists),7 - 14
7:39,Warriors Full timeout,7 - 14
7:26,Stephen Curry  misses 21-foot two point jumper,7 - 14
7:24,Dwight Howard defensive rebound,7 - 14
7:11,Paul Millsap  misses 25-foot three point jumper,7 - 14
7:09,Patrick McCaw defensive rebound,7 - 14
7:03,Draymond Green makes two point shot (Zaza Pachulia assists),9 - 14
6:50,Kent Bazemore  misses 25-foot three point jumper,9 - 14
6:48,Paul Millsap offensive rebound,9 - 14
6:46,Paul Millsap  misses 5-foot jumper,9 - 14
6:45,Zaza Pachulia defensive rebound,9 - 14
6:41,Klay Thompson  traveling,9 - 14
6:24,Zaza Pachulia personal foul  (Dwight Howard draws the foul),9 - 14
6:24,JaVale McGee enters the game for Zaza Pachulia,9 - 14
6:24,Andre Iguodala enters the game for Patrick McCaw,9 - 14
6:13,Andre Iguodala shooting foul  (Paul Millsap draws the foul),9 - 14
6:13,Paul Millsap makes free throw 1 of 2,9 - 15
6:13,Paul Millsap makes free throw 2 of 2,9 - 16
6:01,Kent Bazemore blocks Draymond Green's  layup,9 - 16
6:01,Draymond Green offensive rebound,9 - 16
6:01,Paul Millsap shooting foul  (Draymond Green draws the foul),9 - 16
6:01,Draymond Green makes free throw 1 of 2,10 - 16
6:01,Tim Hardaway Jr. enters the game for Kent Bazemore,10 - 16
6:01,Draymond Green makes free throw 2 of 2,11 - 16
5:50,Dennis Schroder makes 24-foot  three point jumper  (Tim Hardaway Jr. assists),11 - 19
5:37,JaVale McGee makes two point shot (Draymond Green assists),13 - 19
5:26,Draymond Green shooting foul  (Dwight Howard draws the foul),13 - 19
5:26,Dwight Howard makes free throw 1 of 2,13 - 20
5:26,Dwight Howard misses free throw 2 of 2,13 - 20
5:24,Tim Hardaway Jr. offensive rebound,13 - 20
5:20,Thabo Sefolosha makes 25-foot  three point jumper  (Dennis Schroder assists),13 - 23
5:01,JaVale McGee makes driving layup,15 - 23
4:54,Klay Thompson personal foul  (Paul Millsap draws the foul),15 - 23
4:54,Paul Millsap makes free throw 1 of 2,15 - 24
4:54,Paul Millsap makes free throw 2 of 2,15 - 25
4:43,Andre Iguodala makes 24-foot  three point jumper  (Stephen Curry assists),18 - 25
4:20,Thabo Sefolosha Out-of-Bounds Bad Pass Turnover,18 - 25
4:13,Stephen Curry  misses 26-foot three point pullup jump shot,18 - 25
4:11,Paul Millsap defensive rebound,18 - 25
4:05,Dwight Howard 3 second turnover,18 - 25
4:05,Patrick McCaw enters the game for Draymond Green,18 - 25
4:05,Matt Barnes enters the game for Klay Thompson,18 - 25
4:05,Taurean Prince enters the game for Thabo Sefolosha,18 - 25
4:05,Ersan Ilyasova enters the game for Dwight Howard,18 - 25
3:48,Matt Barnes makes 24-foot  three point jumper  (JaVale McGee assists),21 - 25
3:33,Paul Millsap  misses driving layup,21 - 25
3:31,JaVale McGee defensive rebound,21 - 25
3:28,Andre Iguodala makes two point shot (Stephen Curry assists),23 - 25
3:27,Hawks Full timeout,23 - 25
3:12,Dennis Schroder makes driving layup,23 - 27
3:12,JaVale McGee shooting foul  (Dennis Schroder draws the foul),23 - 27
3:12,Dennis Schroder makes free throw 1 of 1,23 - 28
2:59,Taurean Prince shooting foul  (Andre Iguodala draws the foul),23 - 28
2:59,Andre Iguodala misses free throw 1 of 3,23 - 28
2:59,Warriors offensive team rebound,23 - 28
2:59,Andre Iguodala makes free throw 2 of 3,24 - 28
2:59,Malcolm Delaney enters the game for Taurean Prince,24 - 28
2:59,Andre Iguodala makes free throw 3 of 3,25 - 28
2:50,Dennis Schroder makes 25-foot Running Pullup Jump Shot,25 - 31
2:47,Warriors 20 Sec. timeout,25 - 31
2:40,Ersan Ilyasova shooting foul  (Andre Iguodala draws the foul),25 - 31
2:40,Andre Iguodala makes free throw 1 of 2,26 - 31
2:40,Andre Iguodala makes free throw 2 of 2,27 - 31
2:25,Tim Hardaway Jr. makes 19-foot two point shot (Paul Millsap assists),27 - 33
2:03,Matt Barnes  misses 25-foot three point jumper,27 - 33
2:01,Dennis Schroder defensive rebound,27 - 33
1:55,Dennis Schroder makes 22-foot Running Pullup Jump Shot,27 - 35
1:39,Stephen Curry makes 2-foot layup (Matt Barnes assists),29 - 35
1:23,Malcolm Delaney  misses 25-foot three point jumper,29 - 35
1:22,Paul Millsap offensive rebound,29 - 35
1:06,Ersan Ilyasova  misses 23-foot,29 - 35
1:00,Patrick McCaw defensive rebound,29 - 35
54.0,Matt Barnes  bad pass (Ersan Ilyasova steals),29 - 35
54.0,Andre Iguodala personal take foul  (Ersan Ilyasova draws the foul),29 - 37
54.0,Ersan Ilyasova makes free throw 1 of 2,29 - 36
54.0,Draymond Green enters the game for JaVale McGee,29 - 36
54.0,Shaun Livingston enters the game for Andre Iguodala,29 - 36
54.0,Ersan Ilyasova makes free throw 2 of 2,29 - 37
45.0,Stephen Curry makes 24-foot  step back jumpshot,32 - 37
32.0,Stephen Curry kicked ball violation,32 - 37
28.0,Dennis Schroder makes 26-foot  three pointer,32 - 40
15.0,Dennis Schroder personal foul  (Stephen Curry draws the foul),32 - 40
15.0,Klay Thompson enters the game for Patrick McCaw,32 - 40
15.0,Taurean Prince enters the game for Dennis Schroder,32 - 40
15.0,Ian Clark enters the game for Matt Barnes,32 - 40
7.0,Ian Clark makes 24-foot  three point jumper  (Draymond Green assists),35 - 40
0.0,Draymond Green shooting foul  (Tim Hardaway Jr. draws the foul),35 - 41
0.0,Tim Hardaway Jr. makes free throw 1 of 2,35 - 41
0.0,Tim Hardaway Jr. makes free throw 2 of 2,35 - 42
0.0,End of the 1st Quarter,35 - 42
11:45,Dennis Schroder  misses 20-foot two point jumper,35 - 42
11:44,David West defensive rebound,35 - 42
11:26,Shaun Livingston  misses 19-foot two point jumper,35 - 42
11:25,Dwight Howard defensive rebound,35 - 42
11:18,Klay Thompson personal foul  (Dennis Schroder draws the foul),35 - 42
11:10,Tim Hardaway Jr.  lost ball turnover (Andre Iguodala steals),35 - 42
11:03,Klay Thompson Out-of-Bounds Bad Pass Turnover,35 - 42
10:48,Tim Hardaway Jr.  misses 18-foot two point jumper,35 - 42
10:45,Hawks offensive team rebound,35 - 42
10:38,Ersan Ilyasova makes 24-foot  step back jumpshot  (Tim Hardaway Jr. assists),35 - 45
10:23,David West makes 18-foot jumper (Draymond Green assists),37 - 45
10:03,Dennis Schroder makes driving layup,37 - 47
9:57,Draymond Green offensive Charge  (Ersan Ilyasova draws the foul),37 - 47
9:57,Draymond Green  turnover,37 - 47
9:57,Kent Bazemore enters the game for Tim Hardaway Jr.,37 - 47
9:47,Dennis Schroder  misses 18-foot two point jumper,37 - 47
9:45,Hawks offensive team rebound,37 - 47
9:45,Matt Barnes enters the game for Draymond Green,37 - 47
9:45,Tim Hardaway Jr. enters the game for Dennis Schroder,37 - 47
9:44,Tim Hardaway Jr. offensive foul  (Shaun Livingston draws the foul),37 - 47
9:44,Tim Hardaway Jr.  turnover,37 - 47
9:27,David West  misses 19-foot jumper,37 - 47
9:26,Ersan Ilyasova defensive rebound,37 - 47
9:15,Klay Thompson shooting foul  (Ersan Ilyasova draws the foul),37 - 47
9:15,Ersan Ilyasova makes free throw 1 of 2,37 - 48
9:15,Ian Clark enters the game for Klay Thompson,37 - 48
9:15,Ersan Ilyasova misses free throw 2 of 2,37 - 48
9:14,Matt Barnes defensive rebound,37 - 48
9:04,David West  bad pass (Tim Hardaway Jr. steals),37 - 48
9:00,Tim Hardaway Jr. makes two point shot,37 - 50
9:00,Warriors Full timeout,37 - 50
8:44,Shaun Livingston  misses 14-foot two point jumper,37 - 50
8:41,Dwight Howard defensive rebound,37 - 50
8:18,Ersan Ilyasova makes 21-foot two point shot (Malcolm Delaney assists),37 - 52
8:11,Dwight Howard personal foul  (David West draws the foul),37 - 52
8:07,David West makes 20-foot jumper (Shaun Livingston assists),39 - 52
7:54,Malcolm Delaney  misses 18-foot two point jumper,39 - 52
7:52,Matt Barnes defensive rebound,39 - 52
7:41,Shaun Livingston  misses two point shot,39 - 52
7:39,Matt Barnes offensive rebound,39 - 52
7:37,Shaun Livingston makes dunk (Matt Barnes assists),41 - 52
7:26,Shaun Livingston shooting foul  (Kent Bazemore draws the foul),41 - 52
7:26,Kent Bazemore makes free throw 1 of 2,41 - 53
7:26,Thabo Sefolosha enters the game for Ersan Ilyasova,41 - 53
7:26,Kent Bazemore misses free throw 2 of 2,41 - 53
7:24,Matt Barnes defensive rebound,41 - 53
7:09,Andre Iguodala  misses 23-foot three point jumper,41 - 53
7:09,Matt Barnes offensive rebound,41 - 53
7:09,Kent Bazemore shooting foul  (Matt Barnes draws the foul),41 - 53
7:09,Matt Barnes makes free throw 1 of 2,42 - 53
7:09,Matt Barnes makes free throw 2 of 2,43 - 53
6:45,Kent Bazemore  misses 23-foot three point jumper,43 - 53
6:43,Malcolm Delaney offensive rebound,43 - 53
6:39,Tim Hardaway Jr.  misses 25-foot three point jumper,43 - 53
6:37,David West defensive rebound,43 - 53
6:31,Kent Bazemore shooting foul  (Andre Iguodala draws the foul),43 - 53
6:31,Andre Iguodala makes free throw 1 of 2,44 - 53
6:31,Dennis Schroder enters the game for Tim Hardaway Jr.,44 - 53
6:31,Paul Millsap enters the game for Malcolm Delaney,44 - 53
6:31,Andre Iguodala misses free throw 2 of 2,44 - 53
6:26,Dwight Howard defensive rebound,44 - 53
6:22,Hawks Full timeout,44 - 53
6:18,Dennis Schroder  bad pass (Ian Clark steals),44 - 53
6:03,David West makes 20-foot jumper (Matt Barnes assists),46 - 53
5:48,Thabo Sefolosha  misses two point shot,46 - 53
5:46,Dwight Howard makes dunk,46 - 55
5:46,Dwight Howard offensive rebound,46 - 53
5:18,Matt Barnes  misses 19-foot two point jumper,46 - 55
5:18,Dwight Howard defensive rebound,46 - 55
5:03,Dennis Schroder  misses 24-foot three point jumper,46 - 55
5:01,Dwight Howard offensive rebound,46 - 55
5:01,Shaun Livingston shooting foul  (Dwight Howard draws the foul),46 - 55
5:01,Dwight Howard misses free throw 1 of 2,46 - 55
5:01,Hawks offensive team rebound,46 - 55
5:01,Zaza Pachulia enters the game for David West,46 - 55
5:01,Stephen Curry enters the game for Ian Clark,46 - 55
5:01,Dwight Howard misses free throw 2 of 2,46 - 55
4:58,Andre Iguodala defensive rebound,46 - 55
4:48,Andre Iguodala makes 24-foot  three point jumper  (Shaun Livingston assists),49 - 55
4:33,Dwight Howard  misses,49 - 55
4:31,Shaun Livingston defensive rebound,49 - 55
4:24,Zaza Pachulia makes layup (Andre Iguodala assists),51 - 55
4:07,Kent Bazemore makes 24-foot  three pointer,51 - 58
3:53,Zaza Pachulia  misses jumper,51 - 58
3:51,Dwight Howard defensive rebound,51 - 58
3:47,Kent Bazemore  misses 25-foot three point running jumper,51 - 58
3:45,Matt Barnes defensive rebound,51 - 58
3:39,Stephen Curry Out-of-Bounds Bad Pass Turnover,51 - 58
3:39,Ersan Ilyasova enters the game for Dwight Howard,51 - 58
3:25,Paul Millsap makes 8-foot two point shot (Dennis Schroder assists),51 - 60
3:12,Matt Barnes  bad pass (Ersan Ilyasova steals),51 - 60
3:04,Dennis Schroder  misses Driving Floating Jump Shot,51 - 60
3:02,Dennis Schroder offensive rebound,51 - 60
2:54,Thabo Sefolosha  misses 6-foot two point shot,51 - 60
2:50,Andre Iguodala defensive rebound,51 - 60
2:41,Paul Millsap shooting foul  (Stephen Curry draws the foul),51 - 60
2:41,Official timeout,51 - 60
2:41,Tim Hardaway Jr. enters the game for Thabo Sefolosha,51 - 60
2:41,Ian Clark enters the game for Zaza Pachulia,51 - 60
2:41,Patrick McCaw enters the game for Matt Barnes,51 - 60
2:41,James Michael McAdoo enters the game for Shaun Livingston,51 - 60
2:41,Stephen Curry makes free throw 1 of 2,52 - 60
2:41,Stephen Curry makes free throw 2 of 2,53 - 60
2:21,Paul Millsap  misses 10-foot two point shot,53 - 60
2:19,Stephen Curry defensive rebound,53 - 60
2:15,Tim Hardaway Jr. shooting block foul  (Ian Clark draws the foul),53 - 60
2:15,Ian Clark makes free throw 1 of 2,54 - 60
2:15,Ian Clark makes free throw 2 of 2,55 - 60
2:01,Kent Bazemore  lost ball turnover (Andre Iguodala steals),55 - 60
2:01,Kent Bazemore personal foul  (Andre Iguodala draws the foul),55 - 60
2:01,Andre Iguodala makes free throw 1 of 2,56 - 60
2:01,Thabo Sefolosha enters the game for Kent Bazemore,56 - 60
2:01,Andre Iguodala misses free throw 2 of 2,56 - 60
1:59,Dennis Schroder defensive rebound,56 - 60
1:55,Dennis Schroder makes two point shot,56 - 62
1:55,James Michael McAdoo defensive goaltending violation,56 - 62
1:42,Ian Clark makes 24-foot  three point jumper  (Andre Iguodala assists),59 - 62
1:23,Paul Millsap  misses 25-foot three point jumper,59 - 62
1:22,Thabo Sefolosha makes two point shot,59 - 64
1:22,Thabo Sefolosha offensive rebound,59 - 62
1:07,Ian Clark makes layup (Stephen Curry assists),61 - 64
49.0,Paul Millsap  bad pass (James Michael McAdoo steals),61 - 64
47.0,James Michael McAdoo  bad pass (Dennis Schroder steals),61 - 64
43.0,Tim Hardaway Jr.  misses 25-foot three point jumper,61 - 64
41.0,Patrick McCaw defensive rebound,61 - 64
37.0,Stephen Curry  misses Running Pullup Jump Shot,61 - 64
34.0,Thabo Sefolosha defensive rebound,61 - 64
26.0,Ersan Ilyasova makes layup (Thabo Sefolosha assists),61 - 66
4.0,Ian Clark  misses 16-foot two point shot,61 - 66
2.0,Paul Millsap defensive rebound,61 - 66
0.0,Tim Hardaway Jr.  misses 45-foot three point running jumper,61 - 66
0.0,Hawks offensive team rebound,61 - 66
0.0,End of the 2nd Quarter,61 - 66
11:41,Dwight Howard Out-of-Bounds Bad Pass Turnover,61 - 66
11:21,Patrick McCaw makes 24-foot  three point jumper  (Stephen Curry assists),64 - 66
11:11,Kent Bazemore  misses driving layup,64 - 66
11:10,Zaza Pachulia defensive rebound,64 - 66
11:03,Klay Thompson makes 12-foot two point shot,66 - 66
10:40,Stephen Curry personal foul  (Paul Millsap draws the foul),66 - 66
10:30,Dennis Schroder  misses driving layup,66 - 66
10:27,Dwight Howard offensive rebound,66 - 66
10:26,Dwight Howard makes two point shot,66 - 68
10:15,Draymond Green makes 24-foot  three point jumper  (Stephen Curry assists),69 - 68
10:02,Paul Millsap makes 15-foot two point shot,69 - 70
9:53,Stephen Curry vs. Paul Millsap (Zaza Pachulia gains possession),69 - 70
9:45,Draymond Green  misses 24-foot three point jumper,69 - 70
9:42,Dwight Howard defensive rebound,69 - 70
9:41,Dwight Howard Out-of-Bounds Bad Pass Turnover,69 - 70
9:38,Stephen Curry makes 26-foot  three point jumper  (Klay Thompson assists),72 - 70
9:38,Hawks Full timeout,72 - 70
9:19,Dennis Schroder  misses 26-foot three point jumper,72 - 70
9:18,Patrick McCaw defensive rebound,72 - 70
9:14,Patrick McCaw makes 25-foot Running Pullup Jump Shot,75 - 70
8:53,Paul Millsap  misses 8-foot two point shot,75 - 70
8:52,Dwight Howard offensive rebound,75 - 70
8:49,Paul Millsap  misses 5-foot two point shot,75 - 70
8:47,Stephen Curry defensive rebound,75 - 70
8:41,Dwight Howard personal foul  (Zaza Pachulia draws the foul),75 - 70
8:41,Tim Hardaway Jr. enters the game for Dennis Schroder,75 - 70
8:33,Dwight Howard blocks Zaza Pachulia 's 4-foot  hook shot,75 - 70
8:32,Paul Millsap defensive rebound,75 - 70
8:21,Thabo Sefolosha  bad pass (Patrick McCaw steals),75 - 70
8:12,Stephen Curry  misses 25-foot three point pullup jump shot,75 - 70
8:11,Draymond Green offensive rebound,75 - 70
8:03,Zaza Pachulia makes layup (Stephen Curry assists),77 - 70
7:50,Tim Hardaway Jr. makes 1-foot layup (Thabo Sefolosha assists),77 - 72
7:45,Kent Bazemore personal foul  (Klay Thompson draws the foul),77 - 72
7:33,Stephen Curry  misses 25-foot three point pullup jump shot,77 - 72
7:33,Dwight Howard defensive rebound,77 - 72
7:13,Paul Millsap makes driving layup,77 - 74
7:01,Klay Thompson makes 24-foot  three point jumper  (Stephen Curry assists),80 - 74
6:48,Paul Millsap  lost ball turnover (Draymond Green steals),80 - 74
6:43,Paul Millsap kicked ball violation,80 - 74
6:35,Stephen Curry makes 25-foot  three pointer,83 - 74
6:22,Kent Bazemore  bad pass (Draymond Green steals),83 - 74
6:16,Stephen Curry  misses 9-foot two point shot,83 - 74
6:15,Zaza Pachulia  misses,83 - 74
6:15,Zaza Pachulia offensive rebound,83 - 74
6:13,Thabo Sefolosha defensive rebound,83 - 74
6:09,Tim Hardaway Jr. offensive Charge  (Draymond Green draws the foul),83 - 74
6:09,Tim Hardaway Jr.  turnover,83 - 74
5:58,Stephen Curry  misses 25-foot three point pullup jump shot,83 - 74
5:56,Dwight Howard defensive rebound,83 - 74
5:52,Kent Bazemore makes two point shot,83 - 76
5:39,Klay Thompson makes 16-foot two point shot (Draymond Green assists),85 - 76
5:22,Kent Bazemore  misses 21-foot two point jumper,85 - 76
5:20,Paul Millsap offensive rebound,85 - 76
5:16,Tim Hardaway Jr.  out of bounds lost ball turnover,85 - 76
5:16,Malcolm Delaney enters the game for Kent Bazemore,85 - 76
5:05,Paul Millsap personal foul  (Draymond Green draws the foul),85 - 76
5:05,JaVale McGee enters the game for Patrick McCaw,85 - 76
5:05,Andre Iguodala enters the game for Zaza Pachulia,85 - 76
4:54,Draymond Green  misses 4-foot two point shot,85 - 76
4:52,Draymond Green offensive rebound,85 - 76
4:48,JaVale McGee 3 second turnover,85 - 76
4:35,JaVale McGee blocks Thabo Sefolosha's  layup,85 - 76
4:33,Stephen Curry defensive rebound,85 - 76
4:31,Thabo Sefolosha personal foul  (JaVale McGee draws the foul),85 - 76
4:31,Matt Barnes enters the game for Draymond Green,85 - 76
4:31,Taurean Prince enters the game for Thabo Sefolosha,85 - 76
4:31,Ersan Ilyasova enters the game for Dwight Howard,85 - 76
4:28,Klay Thompson makes 20-foot two point shot (Stephen Curry assists),87 - 76
4:03,Tim Hardaway Jr. makes 25-foot  three point jumper  (Taurean Prince assists),87 - 79
3:55,Klay Thompson  misses 26-foot three point jumper,87 - 79
3:55,Hawks defensive team rebound,87 - 79
3:45,Tim Hardaway Jr.  misses 21-foot two point jumper,87 - 79
3:44,Paul Millsap offensive rebound,87 - 79
3:35,Paul Millsap  misses driving layup,87 - 79
3:33,Matt Barnes defensive rebound,87 - 79
3:28,Stephen Curry  misses 23-foot three point jumper,87 - 79
3:26,Andre Iguodala offensive rebound,87 - 79
3:21,Klay Thompson  misses 26-foot three point jumper,87 - 79
3:20,Malcolm Delaney defensive rebound,87 - 79
3:16,Tim Hardaway Jr. makes two point shot (Malcolm Delaney assists),87 - 81
3:13,Warriors Full timeout,87 - 81
3:13,Ian Clark enters the game for Klay Thompson,87 - 81
3:00,JaVale McGee  misses,87 - 81
2:57,Paul Millsap defensive rebound,87 - 81
2:46,JaVale McGee shooting foul  (Paul Millsap draws the foul),87 - 81
2:46,Paul Millsap makes free throw 1 of 2,87 - 82
2:46,Paul Millsap makes free throw 2 of 2,87 - 83
2:23,Andre Iguodala makes 17-foot two point shot,89 - 83
2:03,Matt Barnes blocks Tim Hardaway Jr. 's 2-foot  layup,89 - 83
2:01,Tim Hardaway Jr. offensive rebound,89 - 83
2:00,Tim Hardaway Jr. makes two point shot,89 - 85
1:51,Stephen Curry  misses 21-foot two point jumper,89 - 85
1:49,Stephen Curry offensive rebound,89 - 85
1:46,Stephen Curry  misses 25-foot three point pullup jump shot,89 - 85
1:45,Hawks defensive team rebound,89 - 85
1:45,JaVale McGee loose ball foul  (Ersan Ilyasova draws the foul),89 - 85
1:45,Draymond Green enters the game for JaVale McGee,89 - 85
1:29,Ersan Ilyasova  out of bounds lost ball turnover,89 - 85
1:19,Taurean Prince personal foul  (Andre Iguodala draws the foul),91 - 85
1:19,Andre Iguodala makes free throw 1 of 2,90 - 85
1:19,Andre Iguodala makes free throw 2 of 2,91 - 85
1:01,Tim Hardaway Jr. makes driving layup (Paul Millsap assists),91 - 87
51.0,Matt Barnes  misses 24-foot three point jumper,91 - 87
48.0,Andre Iguodala offensive rebound,91 - 87
45.0,Stephen Curry makes 26-foot  three point jumper  (Andre Iguodala assists),94 - 87
20.0,Taurean Prince makes  three point jumper  (Paul Millsap assists),94 - 90
1.0,Stephen Curry  bad pass (Tim Hardaway Jr. steals),94 - 90
0.0,Tim Hardaway Jr.  misses Running Pullup Jump Shot,94 - 90
0.0,Hawks offensive team rebound,94 - 90
0.0,End of the 3rd Quarter,94 - 90
11:44,David West  lost ball turnover (Ersan Ilyasova steals),94 - 90
11:34,Paul Millsap  misses,94 - 90
11:33,Draymond Green defensive rebound,94 - 90
11:11,Draymond Green  misses 26-foot three point jumper,94 - 90
11:11,Ersan Ilyasova defensive rebound,94 - 90
11:02,Ersan Ilyasova makes 24-foot  three point jumper  (Tim Hardaway Jr. assists),94 - 93
10:33,David West makes two point shot,96 - 93
10:15,Tim Hardaway Jr.  misses 25-foot three point jumper,96 - 93
10:14,Draymond Green defensive rebound,96 - 93
10:08,Klay Thompson makes 24-foot  three point running jumper  (Andre Iguodala assists),99 - 93
9:45,Andre Iguodala blocks Ersan Ilyasova 's 2-foot  shot,99 - 93
9:42,Draymond Green defensive rebound,99 - 93
9:38,Klay Thompson  misses 26-foot three point running jumper,99 - 93
9:36,Andre Iguodala offensive rebound,99 - 93
9:25,David West makes layup (Draymond Green assists),101 - 93
9:23,Hawks Full timeout,101 - 93
9:23,Dwight Howard enters the game for Paul Millsap,101 - 93
9:23,Kent Bazemore enters the game for Tim Hardaway Jr.,101 - 93
9:03,Kent Bazemore  bad pass (Draymond Green steals),101 - 93
8:56,Taurean Prince blocks Draymond Green 's 5-foot  shot,101 - 93
8:56,Warriors offensive team rebound,101 - 93
8:51,Klay Thompson  misses 19-foot two point jumper,101 - 93
8:48,Kent Bazemore defensive rebound,101 - 93
8:33,Malcolm Delaney  misses 18-foot two point jumper,101 - 93
8:32,Shaun Livingston defensive rebound,101 - 93
8:26,Ersan Ilyasova personal foul  (Draymond Green draws the foul),101 - 93
8:19,David West  misses 20-foot jumper,101 - 93
8:18,Taurean Prince defensive rebound,101 - 93
8:03,Kent Bazemore  misses 17-foot two point jumper,101 - 93
8:03,Warriors defensive team rebound,101 - 93
8:03,Dwight Howard loose ball foul  (Andre Iguodala draws the foul),101 - 93
8:03,Tim Hardaway Jr. enters the game for Malcolm Delaney,101 - 93
7:48,Shaun Livingston  misses two point jumper,101 - 93
7:46,Dwight Howard defensive rebound,101 - 93
7:37,David West shooting foul  (Tim Hardaway Jr. draws the foul),101 - 93
7:37,Tim Hardaway Jr. misses free throw 1 of 2,101 - 93
7:37,Hawks offensive team rebound,101 - 93
7:37,Thabo Sefolosha enters the game for Taurean Prince,101 - 93
7:37,Patrick McCaw enters the game for Draymond Green,101 - 93
7:37,Tim Hardaway Jr. makes free throw 2 of 2,101 - 94
7:18,Patrick McCaw makes 25-foot  three point jumper  (Shaun Livingston assists),104 - 94
7:00,Kent Bazemore  misses 10-foot two point jumper,104 - 94
6:56,David West defensive rebound,104 - 94
6:52,Ersan Ilyasova blocks Shaun Livingston's  layup,104 - 94
6:48,Shaun Livingston offensive rebound,104 - 94
6:39,Kent Bazemore shooting foul  (Klay Thompson draws the foul),104 - 94
6:39,Klay Thompson makes free throw 1 of 2,105 - 94
6:39,Klay Thompson misses free throw 2 of 2,105 - 94
6:37,Dwight Howard defensive rebound,105 - 94
6:20,Patrick McCaw shooting foul  (Ersan Ilyasova draws the foul),105 - 94
6:20,Ersan Ilyasova makes free throw 1 of 2,105 - 95
6:20,Paul Millsap enters the game for Dwight Howard,105 - 95
6:20,Malcolm Delaney enters the game for Kent Bazemore,105 - 95
6:20,Ersan Ilyasova makes free throw 2 of 2,105 - 96
6:09,Andre Iguodala makes 25-foot  three point jumper  (David West assists),108 - 96
5:39,Paul Millsap makes 26-foot,108 - 99
5:28,Warriors Full timeout,108 - 99
5:28,Dwight Howard enters the game for Ersan Ilyasova,108 - 99
5:28,Stephen Curry enters the game for Klay Thompson,108 - 99
5:28,Matt Barnes enters the game for Shaun Livingston,108 - 99
5:28,Draymond Green enters the game for David West,108 - 99
5:18,Andre Iguodala  misses 26-foot three point jumper,108 - 99
5:16,Patrick McCaw offensive rebound,108 - 99
5:03,Matt Barnes  misses 23-foot three point jumper,108 - 99
5:03,Dwight Howard defensive rebound,108 - 99
4:58,Dwight Howard  bad pass (Draymond Green steals),108 - 99
4:52,Matt Barnes  traveling,108 - 99
4:48,Hawks 20 Sec. timeout,108 - 99
4:48,Kent Bazemore enters the game for Malcolm Delaney,108 - 99
4:41,Stephen Curry personal foul  (Tim Hardaway Jr. draws the foul),108 - 99
4:31,Paul Millsap  misses 15-foot two point jumper,108 - 99
4:30,Patrick McCaw defensive rebound,108 - 99
4:09,Stephen Curry makes  three point jumper  (Patrick McCaw assists),111 - 99
