time,play,score
12:00,Marcin Gortat vs. Steven Adams (Markieff Morris gains possession),0 - 0
11:38,Markieff Morris makes 12-foot two point shot,2 - 0
11:18,Domantas Sabonis makes 13-foot jumper (Victor Oladipo assists),2 - 2
11:00,John Wall  misses 25-foot three point jumper,2 - 2
11:00,Domantas Sabonis defensive rebound,2 - 2
10:51,Russell Westbrook  misses driving layup,2 - 2
10:49,Thunder offensive team rebound,2 - 2
10:44,Steven Adams  misses 6-foot two point shot,2 - 2
10:44,Marcin Gortat defensive rebound,2 - 2
10:33,Markieff Morris  bad pass (Domantas Sabonis steals),2 - 2
10:30,Russell Westbrook makes two point shot (Domantas Sabonis assists),2 - 4
10:00,Steven Adams shooting foul  (Bradley Beal draws the foul),2 - 4
10:00,Bradley Beal makes free throw 1 of 2,3 - 4
10:00,Bradley Beal misses free throw 2 of 2,3 - 4
10:00,Russell Westbrook defensive rebound,3 - 4
9:55,Andre Roberson makes layup (Russell Westbrook assists),3 - 6
9:41,Bradley Beal makes 2-foot layup (John Wall assists),5 - 6
9:27,Victor Oladipo makes two point shot,5 - 8
9:15,Marcin Gortat  misses dunk,5 - 8
9:15,John Wall offensive rebound,5 - 8
9:11,John Wall makes 25-foot  three pointer,8 - 8
9:04,Marcin Gortat personal block  (Russell Westbrook draws the foul),8 - 8
8:59,Russell Westbrook  misses 15-foot jumper,8 - 8
8:57,Marcin Gortat defensive rebound,8 - 8
8:48,Marcin Gortat  misses layup,8 - 8
8:48,Steven Adams defensive rebound,8 - 8
8:34,Victor Oladipo makes 15-foot jumper (Domantas Sabonis assists),8 - 10
8:15,Markieff Morris  misses 15-foot two point jumper,8 - 10
8:15,Russell Westbrook defensive rebound,8 - 10
7:58,Russell Westbrook  bad pass (Bradley Beal steals),8 - 10
7:52,Bradley Beal  misses jump shot,8 - 10
7:52,Andre Roberson defensive rebound,8 - 10
7:41,Russell Westbrook  misses 17-foot jumper,8 - 10
7:39,Otto Porter Jr. defensive rebound,8 - 10
7:31,Victor Oladipo shooting foul  (Bradley Beal draws the foul),8 - 10
7:31,Bradley Beal misses free throw 1 of 2,8 - 10
7:31,Wizards offensive team rebound,8 - 10
7:31,Joffrey Lauvergne enters the game for Domantas Sabonis,8 - 10
7:31,Bradley Beal misses free throw 2 of 2,8 - 10
7:31,Steven Adams defensive rebound,8 - 10
7:22,Otto Porter Jr. personal foul  (Victor Oladipo draws the foul),8 - 10
7:13,Steven Adams  traveling,8 - 10
7:03,Otto Porter Jr.  misses 25-foot three point jumper,8 - 10
7:03,Joffrey Lauvergne defensive rebound,8 - 10
6:52,Russell Westbrook  misses layup,8 - 10
6:52,Russell Westbrook offensive rebound,8 - 10
6:50,Russell Westbrook  misses layup,8 - 10
6:50,Otto Porter Jr. defensive rebound,8 - 10
6:39,Markieff Morris makes driving dunk,10 - 10
6:35,Thunder Full timeout,10 - 10
6:30,Russell Westbrook  misses,10 - 10
6:28,Wizards defensive team rebound,10 - 10
6:09,John Wall  misses 17-foot two point jumper,12 - 10
6:09,Marcin Gortat offensive rebound,10 - 10
6:09,Marcin Gortat makes layup,12 - 10
5:50,Russell Westbrook  lost ball turnover (John Wall steals),12 - 10
5:48,Russell Westbrook personal foul  (Markieff Morris draws the foul),12 - 10
5:48,Anthony Morrow enters the game for Victor Oladipo,12 - 10
5:33,Joffrey Lauvergne shooting foul  (Markieff Morris draws the foul),12 - 10
5:33,Markieff Morris misses free throw 1 of 2,12 - 10
5:33,Wizards offensive team rebound,12 - 10
5:33,Markieff Morris makes free throw 2 of 2,13 - 10
5:18,Joffrey Lauvergne makes dunk (Anthony Morrow assists),13 - 12
5:07,John Wall  bad pass (Joffrey Lauvergne steals),13 - 12
5:01,Andre Roberson makes dunk,13 - 14
4:41,Bradley Beal  misses 23-foot three point jumper,13 - 14
4:39,Andre Roberson defensive rebound,13 - 14
4:33,Anthony Morrow  misses 22-foot jumper,13 - 14
4:33,Russell Westbrook offensive rebound,13 - 14
4:31,Russell Westbrook  misses layup,13 - 14
4:30,Bradley Beal defensive rebound,13 - 14
4:26,John Wall  bad pass (Andre Roberson steals),13 - 14
4:20,Markieff Morris personal foul  (Russell Westbrook draws the foul),13 - 14
4:20,Jason Smith enters the game for Markieff Morris,13 - 14
4:11,Steven Adams  misses dunk,13 - 14
4:11,Otto Porter Jr. defensive rebound,13 - 14
4:03,Otto Porter Jr.  misses 17-foot jumper,13 - 14
4:01,Andre Roberson defensive rebound,13 - 14
3:49,Jason Smith shooting foul  (Steven Adams draws the foul),13 - 14
3:49,Steven Adams makes free throw 1 of 2,13 - 15
3:49,Tomas Satoransky enters the game for Otto Porter Jr.,13 - 15
3:49,Steven Adams makes free throw 2 of 2,13 - 16
3:42,Bradley Beal  bad pass (Andre Roberson steals),13 - 16
3:31,Joffrey Lauvergne makes 24-foot  three point jumper  (Russell Westbrook assists),13 - 19
3:26,Wizards Full timeout,13 - 19
3:25,Semaj Christon enters the game for Russell Westbrook,13 - 19
3:25,Enes Kanter enters the game for Steven Adams,13 - 19
3:03,Jason Smith  misses 9-foot jumper,13 - 19
3:03,Enes Kanter defensive rebound,13 - 19
3:01,Tomas Satoransky personal foul  (Enes Kanter draws the foul),13 - 19
3:01,Enes Kanter misses free throw 1 of 2,13 - 19
3:01,Thunder offensive team rebound,13 - 19
3:01,Marcus Thornton enters the game for Bradley Beal,13 - 19
3:01,Enes Kanter makes free throw 2 of 2,13 - 20
2:47,Marcin Gortat makes layup (John Wall assists),15 - 20
2:33,Anthony Morrow makes 23-foot  three point jumper  (Joffrey Lauvergne assists),15 - 23
2:18,John Wall  misses 7-foot step back jumpshot,15 - 23
2:18,Marcin Gortat offensive rebound,15 - 23
2:15,Marcin Gortat  misses two point shot,15 - 23
2:15,Andre Roberson defensive rebound,15 - 23
2:00,Enes Kanter makes layup (Anthony Morrow assists),15 - 25
1:42,Jason Smith  misses layup,15 - 25
1:42,Joffrey Lauvergne defensive rebound,15 - 25
1:36,Tomas Satoransky kicked ball violation,15 - 25
1:36,Kelly Oubre Jr. enters the game for John Wall,15 - 25
1:36,Victor Oladipo enters the game for Andre Roberson,15 - 25
1:23,Victor Oladipo makes 24-foot  three point jumper  (Semaj Christon assists),15 - 28
1:07,Marcus Thornton makes driving layup,17 - 28
51.0,Joffrey Lauvergne  traveling,17 - 28
41.0,Marcin Gortat  misses two point shot,17 - 28
41.0,Enes Kanter defensive rebound,17 - 28
31.0,Semaj Christon makes driving layup,17 - 30
13.0,Enes Kanter blocks Marcin Gortat 's 3-foot  shot,17 - 30
13.0,Wizards offensive team rebound,17 - 30
9.0,Tomas Satoransky makes 10-foot two point shot,19 - 30
0.0,Victor Oladipo makes 18-foot two point shot,19 - 32
0.0,End of the 1st Quarter,19 - 32
11:44,Anthony Morrow  bad pass (Markieff Morris steals),19 - 32
11:37,Kelly Oubre Jr.  misses 22-foot three point jumper,19 - 32
11:37,Joffrey Lauvergne defensive rebound,19 - 32
11:22,Markieff Morris kicked ball violation,19 - 32
11:17,Victor Oladipo makes two point shot,19 - 34
11:00,Markieff Morris  misses 15-foot jumper,19 - 34
10:59,Jason Smith offensive rebound,19 - 34
10:53,Marcus Thornton makes  three point jumper  (Tomas Satoransky assists),22 - 34
10:37,Markieff Morris kicked ball violation,22 - 34
10:37,Jerami Grant enters the game for Joffrey Lauvergne,22 - 34
10:34,Jason Smith personal foul  (Enes Kanter draws the foul),22 - 34
10:21,Semaj Christon  misses 25-foot three point jumper,22 - 34
10:21,Markieff Morris defensive rebound,22 - 34
10:10,Markieff Morris makes layup (Tomas Satoransky assists),24 - 34
9:44,Enes Kanter makes 10-foot two point shot,24 - 36
9:29,Marcus Thornton makes 12-foot two point shot,26 - 36
9:11,Victor Oladipo makes 25-foot  three point jumper  (Anthony Morrow assists),26 - 39
8:51,Marcus Thornton  misses 4-foot two point shot,26 - 39
8:49,Enes Kanter defensive rebound,26 - 39
8:44,Anthony Morrow  misses 25-foot three point jumper,26 - 39
8:44,Wizards defensive team rebound,26 - 39
8:44,Enes Kanter loose ball foul  (Jason Smith draws the foul),26 - 39
8:44,Official timeout,26 - 39
8:44,Russell Westbrook enters the game for Semaj Christon,26 - 39
8:44,John Wall enters the game for Tomas Satoransky,26 - 39
8:44,Bradley Beal enters the game for Kelly Oubre Jr.,26 - 39
8:32,Markieff Morris  misses 25-foot three point jumper,26 - 39
8:32,Russell Westbrook defensive rebound,26 - 39
8:26,Enes Kanter makes 6-foot two point shot (Russell Westbrook assists),26 - 41
8:11,Jason Smith makes 12-foot jumper (John Wall assists),28 - 41
7:58,Enes Kanter makes layup (Russell Westbrook assists),28 - 43
7:58,Markieff Morris shooting foul  (Enes Kanter draws the foul),28 - 43
7:58,Andre Roberson enters the game for Anthony Morrow,28 - 43
7:58,Marcin Gortat enters the game for Jason Smith,28 - 43
7:58,Enes Kanter makes free throw 1 of 1,28 - 44
7:41,Markieff Morris makes layup,30 - 44
7:20,Enes Kanter  misses 15-foot jumper,30 - 44
7:20,Jerami Grant offensive rebound,30 - 44
7:18,Victor Oladipo  misses 24-foot three point jumper,30 - 44
7:16,Thunder offensive team rebound,30 - 44
7:16,Marcin Gortat loose ball foul  (Enes Kanter draws the foul),30 - 44
7:09,Russell Westbrook  misses 15-foot jumper,30 - 44
7:05,Bradley Beal defensive rebound,30 - 44
7:00,Bradley Beal  misses two point shot,30 - 44
6:58,John Wall makes two point shot,32 - 44
6:58,John Wall offensive rebound,30 - 44
6:37,Enes Kanter makes driving layup,32 - 46
6:33,Wizards Full timeout,32 - 46
6:33,Steven Adams enters the game for Enes Kanter,32 - 46
6:33,Otto Porter Jr. enters the game for Marcus Thornton,32 - 46
6:20,Jerami Grant personal foul  (Markieff Morris draws the foul),32 - 46
6:16,Bradley Beal makes 23-foot  three point jumper  (John Wall assists),35 - 46
6:09,Thunder Full timeout,35 - 46
6:09,Anthony Morrow enters the game for Andre Roberson,35 - 46
6:03,Anthony Morrow  misses 23-foot three point jumper,35 - 46
6:01,Markieff Morris defensive rebound,35 - 46
5:54,Jerami Grant shooting foul  (Marcin Gortat draws the foul),35 - 46
5:54,Marcin Gortat misses free throw 1 of 2,35 - 46
5:54,Wizards offensive team rebound,35 - 46
5:54,Marcin Gortat misses free throw 2 of 2,35 - 46
5:54,Russell Westbrook defensive rebound,35 - 46
5:41,Victor Oladipo  traveling,35 - 46
5:26,John Wall makes 20-foot two point shot,37 - 46
5:05,Jerami Grant makes 22-foot  three point jumper  (Anthony Morrow assists),37 - 49
4:52,Marcin Gortat makes 5-foot two point shot (Markieff Morris assists),39 - 49
4:41,Russell Westbrook  misses 25-foot three point pullup jump shot,39 - 49
4:41,Marcin Gortat defensive rebound,39 - 49
4:30,John Wall  misses 22-foot jump shot,39 - 49
4:30,Steven Adams defensive rebound,39 - 49
4:24,Russell Westbrook makes 12-foot two point shot,39 - 51
4:11,Bradley Beal makes 19-foot jumper (John Wall assists),41 - 51
3:58,Markieff Morris shooting foul  (Steven Adams draws the foul),41 - 51
3:58,Steven Adams misses free throw 1 of 2,41 - 51
3:58,Thunder offensive team rebound,41 - 51
3:58,Andre Roberson enters the game for Anthony Morrow,41 - 51
3:58,Domantas Sabonis enters the game for Jerami Grant,41 - 51
3:58,Kelly Oubre Jr. enters the game for Markieff Morris,41 - 51
3:58,Steven Adams makes free throw 2 of 2,41 - 52
3:45,Russell Westbrook personal foul  (Bradley Beal draws the foul),41 - 52
3:38,Jerami Grant enters the game for Domantas Sabonis,41 - 52
3:34,Bradley Beal makes 14-foot jumper (John Wall assists),43 - 52
3:24,Otto Porter Jr. shooting foul  (Steven Adams draws the foul),43 - 52
3:24,Steven Adams makes free throw 1 of 2,43 - 53
3:24,Steven Adams makes free throw 2 of 2,43 - 54
3:11,Bradley Beal  bad pass (Victor Oladipo steals),43 - 54
3:05,Russell Westbrook makes two point shot (Victor Oladipo assists),43 - 56
3:05,Kelly Oubre Jr. shooting foul  (Russell Westbrook draws the foul),43 - 56
3:05,Russell Westbrook makes free throw 1 of 1,43 - 57
2:57,John Wall  bad pass (Jerami Grant steals),43 - 57
2:54,Bradley Beal shooting foul  (Jerami Grant draws the foul),43 - 57
2:54,Jerami Grant makes free throw 1 of 2,43 - 58
2:54,Jerami Grant misses free throw 2 of 2,43 - 58
2:53,Otto Porter Jr. defensive rebound,43 - 58
2:42,Otto Porter Jr.  bad pass (Russell Westbrook steals),43 - 58
2:33,Russell Westbrook  misses 22-foot three point jumper,43 - 58
2:33,Otto Porter Jr. defensive rebound,43 - 58
2:31,Wizards 20 Sec. timeout,43 - 58
2:18,Bradley Beal makes 1-foot layup (Marcin Gortat assists),45 - 58
2:18,Andre Roberson defensive goaltending violation,45 - 58
1:59,Jerami Grant  misses 23-foot three point jumper,45 - 58
1:59,Kelly Oubre Jr. defensive rebound,45 - 58
1:51,Otto Porter Jr. makes layup (Kelly Oubre Jr. assists),47 - 58
1:31,Jerami Grant  misses 25-foot three point jumper,47 - 58
1:31,John Wall defensive rebound,47 - 58
1:24,Andre Roberson shooting foul  (Kelly Oubre Jr. draws the foul),47 - 58
1:24,Kelly Oubre Jr. makes free throw 1 of 2,49 - 58
1:24,Kelly Oubre Jr. makes free throw 2 of 2,49 - 58
1:13,Russell Westbrook  bad pass (Otto Porter Jr. steals),49 - 58
1:12,Kelly Oubre Jr.  out of bounds lost ball turnover,49 - 58
1:09,Andre Roberson  bad pass (Kelly Oubre Jr. steals),49 - 58
1:06,Kelly Oubre Jr. makes two point shot,51 - 58
51.0,Russell Westbrook  misses 15-foot jumper,51 - 58
50.0,Kelly Oubre Jr. defensive rebound,51 - 58
42.0,Marcin Gortat makes layup (John Wall assists),53 - 58
42.0,Thunder 20 Sec. timeout,53 - 58
33.0,Russell Westbrook  bad pass (Bradley Beal steals),53 - 58
29.0,Andre Roberson blocks John Wall 's 2-foot  shot,53 - 58
27.0,Bradley Beal offensive rebound,53 - 58
9.0,shot clock turnover,53 - 58
9.0,Tomas Satoransky enters the game for Otto Porter Jr.,53 - 58
9.0,Anthony Morrow enters the game for Andre Roberson,53 - 58
1.0,Russell Westbrook makes driving dunk,53 - 60
0.0,End of the 2nd Quarter,53 - 60
11:42,Steven Adams  misses 5-foot two point shot,53 - 60
11:42,Marcin Gortat defensive rebound,53 - 60
11:21,Markieff Morris makes 7-foot two point shot,55 - 60
11:08,Victor Oladipo  misses 19-foot jumper,55 - 60
11:08,Marcin Gortat defensive rebound,55 - 60
10:57,Andre Roberson personal foul  (Bradley Beal draws the foul),55 - 60
10:42,John Wall  misses 27-foot three point pullup jump shot,55 - 60
10:41,Andre Roberson defensive rebound,55 - 60
10:22,Otto Porter Jr. kicked ball violation,55 - 60
10:14,Russell Westbrook makes 12-foot jumper (Victor Oladipo assists),55 - 62
10:06,Bradley Beal  misses layup,55 - 62
10:06,Steven Adams defensive rebound,55 - 62
9:56,Russell Westbrook  misses 11-foot step back jumpshot,55 - 62
9:56,Steven Adams offensive rebound,55 - 62
9:55,Steven Adams makes tip shot,55 - 64
9:37,Otto Porter Jr. makes 5-foot two point shot (John Wall assists),57 - 64
9:18,Russell Westbrook  misses driving layup,57 - 64
9:18,Steven Adams offensive rebound,57 - 64
9:06,Andre Roberson  misses 16-foot two point jumper,57 - 64
9:06,Thunder offensive team rebound,57 - 64
9:06,shot clock turnover,57 - 64
8:47,Domantas Sabonis shooting foul  (Markieff Morris draws the foul),57 - 64
8:47,Markieff Morris makes free throw 1 of 2,58 - 64
8:47,Markieff Morris makes free throw 2 of 2,59 - 64
8:33,Andre Roberson makes 23-foot  three point jumper  (Victor Oladipo assists),59 - 67
8:22,Bradley Beal  bad pass (Domantas Sabonis steals),59 - 67
8:02,Domantas Sabonis makes layup (Russell Westbrook assists),59 - 69
7:41,Otto Porter Jr. makes 25-foot  three point jumper  (John Wall assists),62 - 69
7:15,Victor Oladipo makes 26-foot  three pointer,62 - 72
6:58,Domantas Sabonis blocks Marcin Gortat's  shot,62 - 72
6:56,Russell Westbrook defensive rebound,62 - 72
6:50,Steven Adams makes dunk (Victor Oladipo assists),62 - 74
6:50,Wizards Full timeout,62 - 74
6:35,Markieff Morris  misses 16-foot two point jumper,62 - 74
6:33,Russell Westbrook defensive rebound,62 - 74
6:13,Andre Roberson  misses 24-foot three point jumper,62 - 74
6:13,Otto Porter Jr. defensive rebound,62 - 74
6:03,Bradley Beal  misses,62 - 74
6:01,Markieff Morris offensive rebound,62 - 74
5:54,Andre Roberson personal foul  (Bradley Beal draws the foul),62 - 74
5:54,Kelly Oubre Jr. enters the game for Markieff Morris,62 - 74
5:48,Bradley Beal makes layup (John Wall assists),64 - 74
5:48,Andre Roberson shooting foul  (Bradley Beal draws the foul),64 - 74
5:48,Bradley Beal makes free throw 1 of 1,65 - 74
5:37,Otto Porter Jr. personal foul  (Domantas Sabonis draws the foul),65 - 74
5:37,Anthony Morrow enters the game for Andre Roberson,65 - 74
5:37,Jerami Grant enters the game for Victor Oladipo,65 - 74
5:28,Steven Adams makes 2-foot layup (Russell Westbrook assists),65 - 76
5:13,Marcin Gortat makes 11-foot jumper,67 - 76
5:00,Anthony Morrow  misses 23-foot three point jumper,67 - 76
5:00,Otto Porter Jr. defensive rebound,67 - 76
4:50,Otto Porter Jr.  misses 17-foot two point jumper,67 - 76
4:48,Thunder defensive team rebound,67 - 76
4:33,Russell Westbrook  misses 13-foot two point jumper,67 - 76
4:33,Kelly Oubre Jr. defensive rebound,67 - 76
4:20,Kelly Oubre Jr. makes driving layup (Otto Porter Jr. assists),69 - 76
4:16,John Wall shooting block foul  (Russell Westbrook draws the foul),69 - 76
4:16,Russell Westbrook makes free throw 1 of 2,69 - 77
4:16,Enes Kanter enters the game for Domantas Sabonis,69 - 77
4:16,Russell Westbrook makes free throw 2 of 2,69 - 78
4:03,John Wall makes driving dunk,71 - 78
3:42,Marcin Gortat shooting foul  (Jerami Grant draws the foul),71 - 78
3:42,Markieff Morris technical foul(1st technical foul),71 - 78
3:42,Russell Westbrook makes technical free throw,71 - 79
3:42,Jerami Grant misses free throw 1 of 2,71 - 79
3:42,Thunder offensive team rebound,71 - 79
3:42,Jerami Grant misses free throw 2 of 2,71 - 79
3:41,Marcin Gortat defensive rebound,71 - 79
3:20,Bradley Beal makes 23-foot  three point jumper  (John Wall assists),74 - 79
3:08,Russell Westbrook  misses driving layup,74 - 79
3:06,Bradley Beal defensive rebound,74 - 79
2:57,Marcin Gortat makes layup (John Wall assists),76 - 79
2:57,Thunder Full timeout,76 - 79
2:57,Victor Oladipo enters the game for Steven Adams,76 - 79
2:45,Anthony Morrow  misses 23-foot three point jumper,76 - 79
2:44,John Wall defensive rebound,76 - 79
2:40,Otto Porter Jr. makes two point shot (Bradley Beal assists),78 - 79
2:23,Marcin Gortat blocks Enes Kanter's  layup,78 - 79
2:21,Kelly Oubre Jr. defensive rebound,78 - 79
2:19,Anthony Morrow shooting foul  (John Wall draws the foul),78 - 79
2:19,John Wall misses free throw 1 of 2,78 - 79
2:19,Wizards offensive team rebound,78 - 79
2:19,Marcus Thornton enters the game for Bradley Beal,78 - 79
2:19,John Wall makes free throw 2 of 2,79 - 79
2:19,Semaj Christon enters the game for Russell Westbrook,79 - 79
1:59,Enes Kanter  misses 14-foot jumper,79 - 79
1:58,Semaj Christon offensive rebound,79 - 79
1:54,Anthony Morrow makes 25-foot  three point jumper  (Semaj Christon assists),79 - 82
1:36,Marcus Thornton  misses 25-foot three point jumper,79 - 82
1:35,Thunder defensive team rebound,79 - 82
1:35,Tomas Satoransky enters the game for John Wall,79 - 82
1:20,Anthony Morrow  misses driving layup,79 - 82
1:19,Kelly Oubre Jr. defensive rebound,79 - 82
59.0,Kelly Oubre Jr. makes 25-foot  three point jumper  (Tomas Satoransky assists),82 - 82
38.0,Enes Kanter makes layup (Semaj Christon assists),82 - 84
24.0,Anthony Morrow personal foul  (Marcus Thornton draws the foul),82 - 84
24.0,Marcus Thornton makes free throw 1 of 2,83 - 84
24.0,Marcus Thornton makes free throw 2 of 2,84 - 84
5.0,Tomas Satoransky personal block  (Semaj Christon draws the foul),84 - 84
5.0,Jason Smith enters the game for Marcin Gortat,84 - 84
2.0,Jerami Grant  lost ball turnover (Otto Porter Jr. steals),84 - 84
0.0,Marcus Thornton  misses 40-foot three point running jumper,84 - 84
0.0,Wizards offensive team rebound,84 - 84
0.0,End of the 3rd Quarter,84 - 84
11:37,Kelly Oubre Jr.  misses two point jumper,84 - 84
11:36,Victor Oladipo defensive rebound,84 - 84
11:11,Victor Oladipo  misses 26-foot three point jumper,84 - 84
11:11,Marcus Thornton defensive rebound,84 - 84
10:59,Tomas Satoransky  misses driving layup,84 - 84
10:59,Joffrey Lauvergne defensive rebound,84 - 84
10:53,Joffrey Lauvergne possession lost ball turnoverOtto Porter Jr.,84 - 84
10:47,Jason Smith  misses 18-foot jumper,84 - 84
10:47,Marcus Thornton offensive rebound,84 - 84
10:45,Marcus Thornton makes layup,86 - 84
10:29,Enes Kanter  misses 3-foot two point shot,86 - 84
10:29,Otto Porter Jr. defensive rebound,86 - 84
10:21,Semaj Christon personal foul  (Jason Smith draws the foul),86 - 84
10:21,Domantas Sabonis enters the game for Enes Kanter,86 - 84
10:11,Tomas Satoransky  misses 22-foot three point jumper,86 - 84
10:11,Domantas Sabonis defensive rebound,86 - 84
9:55,Marcus Thornton personal foul  (Anthony Morrow draws the foul),86 - 84
9:55,Markieff Morris enters the game for Otto Porter Jr.,86 - 84
9:45,Joffrey Lauvergne  misses 14-foot jumper,86 - 84
9:45,Tomas Satoransky defensive rebound,86 - 84
9:33,Markieff Morris  misses 25-foot three point jumper,86 - 84
9:33,Victor Oladipo defensive rebound,86 - 84
9:29,Domantas Sabonis makes two point shot (Victor Oladipo assists),86 - 86
9:07,Markieff Morris  misses 11-foot jumper,86 - 86
9:07,Wizards offensive team rebound,86 - 86
9:07,Domantas Sabonis loose ball foul  (Kelly Oubre Jr. draws the foul),86 - 86
9:07,Russell Westbrook enters the game for Semaj Christon,86 - 86
9:07,John Wall enters the game for Tomas Satoransky,86 - 86
9:07,Bradley Beal enters the game for Jason Smith,86 - 86
8:47,Kelly Oubre Jr. makes 25-foot  three point jumper  (John Wall assists),89 - 86
8:41,Kelly Oubre Jr. personal foul  (Domantas Sabonis draws the foul),89 - 86
8:41,Official timeout,89 - 86
8:41,Andre Roberson enters the game for Joffrey Lauvergne,89 - 86
8:29,Domantas Sabonis makes layup (Russell Westbrook assists),89 - 88
8:10,Andre Roberson blocks Bradley Beal 's 9-foot  shot,89 - 88
8:08,Domantas Sabonis defensive rebound,89 - 88
8:02,Russell Westbrook  misses 25-foot three point jumper,89 - 88
8:00,John Wall defensive rebound,89 - 88
7:50,Anthony Morrow shooting foul  (Bradley Beal draws the foul),89 - 88
7:50,Bradley Beal makes free throw 1 of 2,90 - 88
7:50,Bradley Beal makes free throw 2 of 2,91 - 88
7:31,Domantas Sabonis makes layup (Russell Westbrook assists),91 - 90
7:16,John Wall  misses driving layup,91 - 90
7:16,Russell Westbrook defensive rebound,91 - 90
7:09,Victor Oladipo  misses 25-foot three point jumper,91 - 90
7:09,Marcus Thornton defensive rebound,91 - 90
7:00,Markieff Morris makes two point shot (John Wall assists),93 - 90
6:41,Victor Oladipo  out of bounds lost ball turnover,93 - 90
6:20,John Wall  misses 15-foot two point jumper,93 - 90
6:18,Thunder defensive team rebound,93 - 90
6:18,Jerami Grant enters the game for Victor Oladipo,93 - 90
6:09,John Wall blocks Russell Westbrook 's 1-foot  layup,93 - 90
6:09,Thunder offensive team rebound,93 - 90
6:09,Russell Westbrook technical foul(1st technical foul),93 - 90
6:09,Thunder delay of game violation,93 - 90
6:09,Bradley Beal makes technical free throw,94 - 90
6:07,Russell Westbrook Out-of-Bounds Bad Pass Turnover,94 - 90
5:52,Markieff Morris  misses driving layup,94 - 90
5:52,Anthony Morrow defensive rebound,94 - 90
5:41,Anthony Morrow  misses 23-foot three point jumper,94 - 90
5:39,Thunder offensive team rebound,94 - 90
5:39,Thunder Full timeout,94 - 90
5:39,Steven Adams enters the game for Domantas Sabonis,94 - 90
5:39,Victor Oladipo enters the game for Anthony Morrow,94 - 90
5:39,Otto Porter Jr. enters the game for Marcus Thornton,94 - 90
5:35,Russell Westbrook  misses 17-foot jumper,94 - 90
5:35,Markieff Morris defensive rebound,94 - 90
5:18,Bradley Beal makes  three point jumper  (Markieff Morris assists),97 - 90
5:07,Russell Westbrook  misses 25-foot three point jumper,97 - 90
5:07,Kelly Oubre Jr. defensive rebound,97 - 90
4:48,John Wall  misses,97 - 90
4:48,Thunder defensive team rebound,97 - 90
4:39,Bradley Beal shooting foul  (Steven Adams draws the foul),97 - 90
4:39,Steven Adams misses free throw 1 of 2,97 - 90
4:39,Thunder offensive team rebound,97 - 90
4:39,Steven Adams misses free throw 2 of 2,97 - 90
4:39,Bradley Beal defensive rebound,97 - 90
4:26,Jerami Grant shooting foul  (Markieff Morris draws the foul),97 - 90
4:26,Markieff Morris misses free throw 1 of 2,97 - 90
4:26,Wizards offensive team rebound,97 - 90
4:26,Thunder Full timeout,97 - 90
4:26,Anthony Morrow enters the game for Steven Adams,97 - 90
4:26,Domantas Sabonis enters the game for Jerami Grant,97 - 90
4:26,Markieff Morris misses free throw 2 of 2,97 - 90
4:24,Russell Westbrook defensive rebound,97 - 90
4:05,Markieff Morris blocks Victor Oladipo's  layup,97 - 90
4:05,Markieff Morris defensive rebound,97 - 90
3:47,John Wall  misses 16-foot two point jumper,97 - 90
3:47,Russell Westbrook defensive rebound,97 - 90
3:40,Russell Westbrook  misses 14-foot two point jumper,97 - 90
3:39,Markieff Morris defensive rebound,97 - 90
3:36,Markieff Morris  lost ball turnover (Russell Westbrook steals),97 - 90
3:32,Victor Oladipo  misses 26-foot three point jumper,97 - 90
3:31,Russell Westbrook makes tip shot,97 - 92
3:31,Russell Westbrook offensive rebound,97 - 90
3:10,Domantas Sabonis shooting foul  (Markieff Morris draws the foul),97 - 92
3:10,Markieff Morris makes free throw 1 of 2,98 - 92
3:10,Markieff Morris makes free throw 2 of 2,99 - 92
3:02,Andre Roberson makes 25-foot  three point jumper  (Russell Westbrook assists),99 - 95
3:01,Wizards Full timeout,99 - 95
3:01,Jerami Grant enters the game for Domantas Sabonis,99 - 95
3:01,Semaj Christon enters the game for Anthony Morrow,99 - 95
2:45,Otto Porter Jr. makes 4-foot two point shot (John Wall assists),101 - 95
2:26,Victor Oladipo makes 25-foot  three point jumper  (Jerami Grant assists),101 - 98
2:02,Bradley Beal  lost ball turnover (Semaj Christon steals),101 - 98
2:00,Victor Oladipo makes two point shot (Russell Westbrook assists),101 - 100
