time,play,score
12:00,Marcin Gortat vs. Dirk Nowitzki (John Wall gains possession),0 - 0
11:42,Marcin Gortat  misses 7-foot two point shot,0 - 0
11:42,Dirk Nowitzki defensive rebound,0 - 0
11:26,Dirk Nowitzki makes 19-foot jumper (Harrison Barnes assists),0 - 2
11:14,Dirk Nowitzki shooting foul  (Markieff Morris draws the foul),0 - 2
11:14,Markieff Morris makes free throw 1 of 2,1 - 2
11:14,Markieff Morris makes free throw 2 of 2,2 - 2
11:14,Harrison Barnes makes two point shot,2 - 4
10:57,Markieff Morris  misses 9-foot two point jumper,2 - 4
10:57,Marcin Gortat offensive rebound,2 - 4
10:52,Marcin Gortat  misses 6-foot two point shot,2 - 4
10:52,Markieff Morris  misses 1-foot,2 - 4
10:52,Markieff Morris offensive rebound,2 - 4
10:48,Wizards offensive team rebound,2 - 4
10:23,Bradley Beal  misses Driving Floating Jump Shot,2 - 4
10:22,Dirk Nowitzki defensive rebound,2 - 4
10:06,Dorian Finney-Smith  misses 25-foot three point jumper,2 - 4
10:04,Markieff Morris defensive rebound,2 - 4
9:52,Marcin Gortat  misses 6-foot two point shot,2 - 4
9:52,Dirk Nowitzki defensive rebound,2 - 4
9:47,Dirk Nowitzki  misses 27-foot three point jumper,2 - 4
9:44,Otto Porter Jr. defensive rebound,2 - 4
9:32,Marcin Gortat  misses finger roll layup,2 - 4
9:30,Dirk Nowitzki defensive rebound,2 - 4
9:23,Otto Porter Jr. blocks Harrison Barnes 's 2-foot  shot,2 - 4
9:22,Marcin Gortat defensive rebound,2 - 4
9:10,John Wall makes 15-foot two point shot,4 - 4
8:55,Harrison Barnes makes 18-foot jumper (Deron Williams assists),4 - 6
8:41,Markieff Morris makes layup (John Wall assists),6 - 6
8:26,Dirk Nowitzki  misses 20-foot jumper,6 - 6
8:26,Bradley Beal defensive rebound,6 - 6
8:19,Bradley Beal makes two point shot,8 - 6
8:08,Wesley Matthews makes Driving Floating Jump Shot,8 - 8
7:39,shot clock turnover,8 - 8
7:24,Deron Williams makes 24-foot  three point jumper  (Harrison Barnes assists),8 - 11
7:00,Deron Williams personal foul  (John Wall draws the foul),8 - 11
7:00,Andrew Bogut enters the game for Dirk Nowitzki,8 - 11
6:50,Dorian Finney-Smith shooting foul  (Marcin Gortat draws the foul),9 - 11
6:50,Marcin Gortat makes free throw 1 of 2,9 - 11
6:50,Marcin Gortat makes free throw 2 of 2,10 - 11
6:26,shot clock turnover,10 - 11
6:15,Markieff Morris makes  three point jumper  (Bradley Beal assists),13 - 11
6:05,Deron Williams makes 24-foot  three point jumper,13 - 14
5:52,Otto Porter Jr. makes 23-foot  three point jumper  (John Wall assists),16 - 14
5:52,Mavericks Full timeout,16 - 14
5:43,Deron Williams makes layup (Andrew Bogut assists),16 - 16
5:28,Bradley Beal makes 24-foot  three point jumper  (Marcin Gortat assists),19 - 16
5:15,Wesley Matthews  misses 24-foot three point jumper,19 - 16
5:13,Markieff Morris defensive rebound,19 - 16
4:56,Bradley Beal  misses 23-foot jumper,19 - 16
4:54,Deron Williams defensive rebound,19 - 16
4:48,Bradley Beal shooting foul  (Harrison Barnes draws the foul),19 - 16
4:48,Harrison Barnes makes free throw 1 of 2,19 - 17
4:48,Devin Harris enters the game for Deron Williams,19 - 17
4:48,Seth Curry enters the game for Dorian Finney-Smith,19 - 17
4:48,Harrison Barnes makes free throw 2 of 2,19 - 18
4:48,Kelly Oubre Jr. enters the game for Markieff Morris,19 - 18
4:37,Bradley Beal  misses 25-foot three point jumper,19 - 18
4:37,Harrison Barnes defensive rebound,19 - 18
4:18,Andrew Bogut  bad pass (Otto Porter Jr. steals),19 - 18
4:16,Bradley Beal makes two point shot (Otto Porter Jr. assists),21 - 18
3:51,Andrew Bogut  misses 13-foot jumper,21 - 18
3:50,Mavericks offensive team rebound,21 - 18
3:50,shot clock turnover,21 - 18
3:43,Otto Porter Jr. makes 26-foot  three point jumper  (John Wall assists),24 - 18
3:41,Mavericks 20 Sec. timeout,24 - 18
3:41,Marcus Thornton enters the game for Bradley Beal,24 - 18
3:21,Devin Harris  misses three point jumper,24 - 18
3:21,John Wall defensive rebound,24 - 18
3:14,Otto Porter Jr.  misses 25-foot three point jumper,24 - 18
3:14,Wesley Matthews defensive rebound,24 - 18
3:03,Seth Curry  misses three point jumper,24 - 18
3:01,John Wall defensive rebound,24 - 18
2:55,Andrew Bogut blocks Otto Porter Jr.'s  shot,24 - 18
2:54,Seth Curry defensive rebound,24 - 18
2:47,Devin Harris  misses 25-foot three point jumper,24 - 18
2:47,John Wall defensive rebound,24 - 18
2:31,Marcin Gortat offensive foul  (Devin Harris draws the foul),24 - 18
2:31,Marcin Gortat  turnover,24 - 18
2:31,Wizards Full timeout,24 - 18
2:31,Dwight Powell enters the game for Harrison Barnes,24 - 18
2:31,Sheldon McClellan enters the game for Otto Porter Jr.,24 - 18
2:14,Wesley Matthews makes 5-foot two point shot,24 - 20
1:57,Kelly Oubre Jr. makes driving layup,26 - 20
1:32,Wesley Matthews  misses 16-foot,26 - 20
1:31,Marcin Gortat defensive rebound,26 - 20
1:24,John Wall  misses 18-foot two point shot,26 - 20
1:23,Andrew Bogut defensive rebound,26 - 20
1:08,Wesley Matthews makes 25-foot  three point jumper  (Andrew Bogut assists),26 - 23
50.0,Sheldon McClellan  misses 23-foot three point jumper,26 - 23
49.0,Devin Harris defensive rebound,26 - 23
33.0,Devin Harris makes 24-foot  three pointer,26 - 26
24.0,John Wall  lost ball turnover (Dwight Powell steals),26 - 26
8.0,Devin Harris makes 23-foot two point shot,26 - 28
1.0,John Wall makes 5-foot two point shot,28 - 28
1.0,Andrew Bogut shooting foul  (John Wall draws the foul),29 - 28
1.0,John Wall makes free throw 1 of 1,29 - 28
0.0,End of the 1st Quarter,29 - 28
11:48,Deron Williams  misses 17-foot jumper,29 - 28
11:47,Mavericks offensive team rebound,29 - 28
11:34,Dirk Nowitzki  misses 25-foot three point jumper,29 - 28
11:33,Marcin Gortat defensive rebound,29 - 28
11:21,Marcin Gortat makes two point shot (Trey Burke assists),31 - 28
11:07,Marcus Thornton shooting foul  (Dirk Nowitzki draws the foul),31 - 28
11:07,Dirk Nowitzki makes free throw 1 of 2,31 - 29
11:07,Jason Smith enters the game for Marcin Gortat,31 - 29
11:07,Dirk Nowitzki makes free throw 2 of 2,31 - 30
10:59,Kelly Oubre Jr. makes 24-foot  three point jumper  (Trey Burke assists),34 - 30
10:41,Seth Curry makes 24-foot  three point jumper  (Deron Williams assists),34 - 33
10:19,Jason Smith makes 20-foot jumper (Trey Burke assists),36 - 33
10:00,Dirk Nowitzki makes 13-foot jumper (Dwight Powell assists),36 - 35
9:49,Trey Burke  misses 18-foot two point jumper,36 - 35
9:48,Dwight Powell defensive rebound,36 - 35
9:37,Dirk Nowitzki  misses,36 - 35
9:34,Sheldon McClellan defensive rebound,36 - 35
9:30,Marcus Thornton offensive Charge  (Justin Anderson draws the foul),36 - 35
9:30,Marcus Thornton  turnover,36 - 35
9:30,Markieff Morris enters the game for Sheldon McClellan,36 - 35
9:18,Marcus Thornton personal foul  (Deron Williams draws the foul),36 - 35
9:18,Bradley Beal enters the game for Marcus Thornton,36 - 35
9:15,Deron Williams Out-of-Bounds Bad Pass Turnover,36 - 35
8:59,Jason Smith offensive Charge  (Dwight Powell draws the foul),36 - 35
8:59,Jason Smith  turnover,36 - 35
8:59,Official timeout,36 - 35
8:59,Devin Harris enters the game for Seth Curry,36 - 35
8:36,Jason Smith blocks Dwight Powell's  layup,36 - 35
8:34,Jason Smith defensive rebound,36 - 35
8:26,Trey Burke  misses 25-foot three point jumper,36 - 35
8:26,Justin Anderson defensive rebound,36 - 35
8:11,Dirk Nowitzki makes 13-foot two point shot,36 - 37
7:56,Bradley Beal  misses 17-foot two point jumper,36 - 37
7:56,Devin Harris defensive rebound,36 - 37
7:50,Devin Harris makes two point shot,36 - 39
7:50,Bradley Beal shooting block foul  (Devin Harris draws the foul),36 - 40
7:50,Devin Harris makes free throw 1 of 1,36 - 40
7:39,Bradley Beal  misses 24-foot three point jumper,36 - 40
7:37,Justin Anderson defensive rebound,36 - 40
7:33,Jason Smith blocks Devin Harris 's 2-foot  shot,36 - 40
7:31,Bradley Beal defensive rebound,36 - 40
7:26,Kelly Oubre Jr. makes 23-foot  three point jumper  (Trey Burke assists),39 - 40
7:07,Dwight Powell makes 2-foot two point shot (Deron Williams assists),39 - 42
7:07,Markieff Morris shooting foul  (Dwight Powell draws the foul),39 - 42
7:07,John Wall enters the game for Trey Burke,39 - 42
7:07,Wesley Matthews enters the game for Dirk Nowitzki,39 - 42
7:07,Andrew Bogut enters the game for Justin Anderson,39 - 42
7:07,Seth Curry enters the game for Deron Williams,39 - 42
7:07,Dwight Powell makes free throw 1 of 1,39 - 43
6:58,John Wall  bad pass (Seth Curry steals),39 - 43
6:35,Devin Harris  misses 26-foot three point pullup jump shot,39 - 43
6:35,Dwight Powell offensive rebound,39 - 43
6:35,Markieff Morris loose ball foul  (Dwight Powell draws the foul),39 - 43
6:35,Dwight Powell makes free throw 1 of 2,39 - 44
6:35,Pierre Jackson enters the game for Devin Harris,39 - 44
6:35,Dwight Powell makes free throw 2 of 2,39 - 45
6:28,Pierre Jackson personal take foul  (John Wall draws the foul),39 - 45
6:28,Harrison Barnes enters the game for Dwight Powell,39 - 45
6:18,Jason Smith  misses 18-foot jumper,39 - 45
6:18,Andrew Bogut defensive rebound,39 - 45
6:09,Kelly Oubre Jr. shooting foul  (Pierre Jackson draws the foul),39 - 45
6:09,Pierre Jackson makes free throw 1 of 2,39 - 46
6:09,Marcin Gortat enters the game for Jason Smith,39 - 46
6:09,Otto Porter Jr. enters the game for Kelly Oubre Jr.,39 - 46
6:09,Wizards Full timeout,39 - 46
6:09,Pierre Jackson makes free throw 2 of 2,39 - 47
5:54,Marcin Gortat makes two point shot (Bradley Beal assists),41 - 47
5:39,John Wall blocks Pierre Jackson 's 17-foot  shot,41 - 47
5:37,John Wall defensive rebound,41 - 47
5:31,Bradley Beal  misses 25-foot three point jumper,41 - 47
5:30,Wesley Matthews defensive rebound,41 - 47
5:26,Seth Curry makes 24-foot  three point jumper  (Wesley Matthews assists),41 - 50
5:01,Otto Porter Jr. makes 21-foot two point shot (Marcin Gortat assists),43 - 50
4:43,Harrison Barnes makes two point shot,43 - 52
4:33,Otto Porter Jr.  misses 10-foot jumper,43 - 52
4:33,Seth Curry defensive rebound,43 - 52
4:31,Markieff Morris personal foul  (Seth Curry draws the foul),43 - 53
4:31,Seth Curry makes free throw 1 of 2,43 - 53
4:31,Kelly Oubre Jr. enters the game for Markieff Morris,43 - 53
4:31,Seth Curry makes free throw 2 of 2,43 - 54
4:18,John Wall  misses 10-foot two point shot,43 - 54
4:18,Andrew Bogut defensive rebound,43 - 54
4:05,Wesley Matthews  misses 16-foot step back jumpshot,43 - 54
4:05,Otto Porter Jr. defensive rebound,43 - 54
3:59,Harrison Barnes personal foul  (John Wall draws the foul),43 - 54
3:59,Deron Williams enters the game for Seth Curry,43 - 54
3:45,John Wall makes 2-foot two point shot,45 - 54
3:33,Deron Williams makes 19-foot two point shot,45 - 56
3:16,Dorian Finney-Smith enters the game for Pierre Jackson,45 - 56
3:15,Bradley Beal makes 8-foot Driving Floating Jump Shot (Kelly Oubre Jr. assists),47 - 56
3:15,Harrison Barnes shooting foul  (Bradley Beal draws the foul),47 - 56
3:15,Dirk Nowitzki enters the game for Andrew Bogut,47 - 56
3:15,Bradley Beal misses free throw 1 of 1,47 - 56
3:14,Dirk Nowitzki defensive rebound,47 - 56
3:00,Harrison Barnes  misses 18-foot jumper,47 - 56
3:00,Kelly Oubre Jr. defensive rebound,47 - 56
2:49,John Wall  misses Running Pullup Jump Shot,47 - 56
2:48,Dirk Nowitzki defensive rebound,47 - 56
2:36,Wesley Matthews makes 11-foot two point shot,47 - 58
2:29,Bradley Beal makes two point shot,49 - 58
2:25,Mavericks Full timeout,49 - 58
2:20,Deron Williams  lost ball turnover (John Wall steals),49 - 58
2:20,Deron Williams personal take foul  (John Wall draws the foul),49 - 58
2:08,Otto Porter Jr. makes 23-foot   (Bradley Beal assists),52 - 58
1:52,Harrison Barnes  misses 25-foot three point jumper,52 - 58
1:51,Kelly Oubre Jr. defensive rebound,52 - 58
1:43,John Wall makes driving layup,54 - 58
1:20,Deron Williams  out of bounds lost ball turnover,54 - 58
1:17,Bradley Beal makes 16-foot jumper (John Wall assists),56 - 58
1:08,Deron Williams  lost ball turnover (John Wall steals),56 - 58
1:07,John Wall makes two point shot (Bradley Beal assists),58 - 58
1:07,Dirk Nowitzki shooting foul  (John Wall draws the foul),58 - 58
1:07,John Wall makes free throw 1 of 1,59 - 58
57.0,Harrison Barnes makes driving dunk (Deron Williams assists),59 - 60
49.0,Bradley Beal  misses 23-foot jumper,59 - 60
48.0,Dirk Nowitzki defensive rebound,59 - 60
42.0,Otto Porter Jr. blocks Wesley Matthews 's 3-foot  shot,59 - 60
41.0,Marcin Gortat defensive rebound,60 - 60
41.0,Harrison Barnes loose ball foul  (John Wall draws the foul),59 - 60
41.0,John Wall makes free throw 1 of 2,60 - 60
41.0,Sheldon McClellan enters the game for Bradley Beal,60 - 60
41.0,John Wall makes free throw 2 of 2,61 - 60
35.0,Marcin Gortat blocks Deron Williams 's 3-foot  layup,61 - 60
33.0,Marcin Gortat defensive rebound,61 - 60
30.0,John Wall makes 25-foot  three pointer  (Marcin Gortat assists),64 - 60
21.0,Kelly Oubre Jr. personal foul  (Harrison Barnes draws the foul),64 - 60
21.0,Harrison Barnes misses free throw 1 of 2,64 - 60
21.0,Mavericks offensive team rebound,64 - 60
21.0,Dwight Powell enters the game for Dirk Nowitzki,64 - 60
21.0,Bradley Beal enters the game for Kelly Oubre Jr.,64 - 60
21.0,Harrison Barnes makes free throw 2 of 2,64 - 61
2.0,John Wall makes driving layup,66 - 61
2.0,Dwight Powell shooting foul  (John Wall draws the foul),67 - 61
2.0,Kelly Oubre Jr. enters the game for Bradley Beal,66 - 61
2.0,John Wall makes free throw 1 of 1,67 - 61
1.0,Deron Williams  misses 47-foot three point running jumper,67 - 61
0.0,Mavericks offensive team rebound,67 - 61
0.0,End of the 2nd Quarter,67 - 61
11:47,Otto Porter Jr. shooting foul  (Harrison Barnes draws the foul),67 - 61
11:47,Harrison Barnes makes free throw 1 of 2,67 - 62
11:47,Harrison Barnes makes free throw 2 of 2,67 - 63
11:38,Markieff Morris makes dunk (John Wall assists),69 - 63
11:23,Wesley Matthews  misses 25-foot three point jumper,69 - 63
11:22,Otto Porter Jr. defensive rebound,69 - 63
11:07,Otto Porter Jr.  misses,69 - 63
11:07,Dirk Nowitzki defensive rebound,69 - 63
10:49,Deron Williams  misses driving layup,69 - 63
10:48,Markieff Morris defensive rebound,69 - 63
10:40,Markieff Morris  misses 23-foot three point jumper,69 - 63
10:38,Harrison Barnes defensive rebound,69 - 63
10:19,Dorian Finney-Smith  traveling,69 - 63
10:03,Bradley Beal  misses 24-foot three point jumper,69 - 63
10:03,Harrison Barnes defensive rebound,69 - 63
9:53,Deron Williams  bad pass (John Wall steals),69 - 63
9:52,Deron Williams shooting foul  (Bradley Beal draws the foul),69 - 63
9:52,Bradley Beal makes free throw 1 of 2,70 - 63
9:52,Bradley Beal makes free throw 2 of 2,71 - 63
9:36,Deron Williams makes 25-foot  three pointer,71 - 66
9:21,Bradley Beal  misses 24-foot three point jumper,71 - 66
9:21,Marcin Gortat offensive rebound,71 - 66
9:14,Marcin Gortat  misses 8-foot two point shot,71 - 66
9:12,Dorian Finney-Smith defensive rebound,71 - 66
9:08,Dorian Finney-Smith steps out of bounds turnover,71 - 66
8:59,John Wall  misses 20-foot two point jumper,71 - 66
8:57,Wizards offensive team rebound,71 - 66
8:52,Markieff Morris makes 8-foot two point shot (Bradley Beal assists),73 - 66
8:36,Harrison Barnes  misses 23-foot three point jumper,73 - 66
8:34,Marcin Gortat defensive rebound,73 - 66
8:17,Wesley Matthews blocks Markieff Morris 's 4-foot  shot,73 - 66
8:17,Wizards offensive team rebound,73 - 66
8:14,Bradley Beal makes two point shot (Otto Porter Jr. assists),75 - 66
8:12,Mavericks Full timeout,75 - 66
8:12,Devin Harris enters the game for Dorian Finney-Smith,75 - 66
7:54,Devin Harris makes 24-foot  three point jumper  (Harrison Barnes assists),75 - 69
7:31,Markieff Morris  misses 9-foot,75 - 69
7:31,Devin Harris defensive rebound,75 - 69
7:16,Harrison Barnes  misses Driving Floating Jump Shot,75 - 69
7:15,Marcin Gortat defensive rebound,75 - 69
7:00,Bradley Beal  misses driving layup,75 - 69
6:58,Marcin Gortat offensive rebound,75 - 69
6:56,Marcin Gortat makes two point shot,77 - 69
6:37,Dirk Nowitzki makes 24-foot  three point jumper  (Deron Williams assists),77 - 72
6:16,Deron Williams personal foul  (Marcin Gortat draws the foul),77 - 72
6:09,Otto Porter Jr.  lost ball turnover (Devin Harris steals),77 - 72
6:05,Otto Porter Jr. blocks Devin Harris 's 3-foot  shot,77 - 72
6:03,Bradley Beal defensive rebound,77 - 72
5:56,Marcin Gortat makes layup (Otto Porter Jr. assists),79 - 72
5:35,Marcin Gortat shooting block foul  (Deron Williams draws the foul),79 - 72
5:35,Deron Williams makes free throw 1 of 2,79 - 73
5:35,Andrew Bogut enters the game for Dirk Nowitzki,79 - 73
5:35,Kelly Oubre Jr. enters the game for Markieff Morris,79 - 73
5:35,Deron Williams makes free throw 2 of 2,79 - 74
5:24,Bradley Beal  misses 25-foot three point jumper,79 - 74
5:24,Harrison Barnes defensive rebound,79 - 74
5:15,Harrison Barnes  out of bounds lost ball turnover,79 - 74
5:03,John Wall makes 11-foot two point shot,81 - 74
4:41,Devin Harris makes 23-foot  three point jumper  (Harrison Barnes assists),81 - 77
4:16,Kelly Oubre Jr.  misses 24-foot three point jumper,81 - 77
4:15,Devin Harris defensive rebound,81 - 77
4:05,Kelly Oubre Jr. personal foul  (Harrison Barnes draws the foul),81 - 77
4:05,Seth Curry enters the game for Deron Williams,81 - 77
4:05,Marcus Thornton enters the game for Bradley Beal,81 - 77
3:56,Otto Porter Jr. shooting foul  (Harrison Barnes draws the foul),81 - 77
3:56,Harrison Barnes makes free throw 1 of 2,81 - 78
3:56,Harrison Barnes makes free throw 2 of 2,81 - 79
3:47,John Wall  misses 20-foot two point jumper,81 - 79
3:46,Harrison Barnes defensive rebound,81 - 79
3:31,Seth Curry  bad pass (Otto Porter Jr. steals),81 - 79
3:20,Seth Curry personal foul  (Marcus Thornton draws the foul),81 - 79
3:09,Marcus Thornton  misses 24-foot three point jumper,81 - 79
3:08,Marcin Gortat makes tip shot,83 - 79
3:08,Marcin Gortat offensive rebound,81 - 79
2:53,Seth Curry makes 24-foot  three pointer,83 - 82
2:50,Wizards Full timeout,83 - 82
2:31,Harrison Barnes blocks Marcin Gortat's  shot,83 - 82
2:31,Harrison Barnes defensive rebound,83 - 82
2:08,Devin Harris makes 24-foot  three point jumper  (Harrison Barnes assists),83 - 85
1:42,Otto Porter Jr. makes 11-foot Driving Floating Jump Shot (Kelly Oubre Jr. assists),85 - 85
1:15,Harrison Barnes makes jumper (Seth Curry assists),85 - 87
1:01,Marcus Thornton makes 24-foot  three point jumper  (John Wall assists),88 - 87
49.0,Seth Curry  misses Driving Floating Jump Shot,88 - 87
48.0,Andrew Bogut  misses,88 - 87
48.0,Andrew Bogut offensive rebound,88 - 87
47.0,Andrew Bogut  misses,88 - 87
47.0,Andrew Bogut offensive rebound,88 - 87
46.0,Otto Porter Jr. defensive rebound,88 - 87
31.0,John Wall  misses Running Pullup Jump Shot,88 - 87
30.0,Harrison Barnes defensive rebound,88 - 87
11.0,Harrison Barnes  misses 19-foot two point shot,88 - 87
10.0,Kelly Oubre Jr. defensive rebound,88 - 87
4.0,Seth Curry personal take foul  (John Wall draws the foul),88 - 87
4.0,Dorian Finney-Smith enters the game for Harrison Barnes,88 - 87
0.0,John Wall  misses driving layup,88 - 87
0.0,Wizards offensive team rebound,88 - 87
0.0,End of the 3rd Quarter,88 - 87
11:45,Trey Burke  misses 17-foot two point jumper,88 - 87
11:45,Dwight Powell defensive rebound,88 - 87
11:27,Dwight Powell makes layup (Devin Harris assists),88 - 89
11:18,Devin Harris personal foul  (Marcus Thornton draws the foul),88 - 89
11:12,Devin Harris personal foul  (Marcin Gortat draws the foul),88 - 89
11:03,Marcus Thornton  misses 25-foot,88 - 89
11:03,Dwight Powell defensive rebound,88 - 89
10:41,Seth Curry makes 11-foot Driving Floating Jump Shot,88 - 91
10:25,Otto Porter Jr.  misses 18-foot two point jumper,88 - 91
10:23,Mavericks defensive team rebound,88 - 91
10:23,Deron Williams enters the game for Devin Harris,88 - 91
10:07,Otto Porter Jr. shooting foul  (Dwight Powell draws the foul),88 - 91
10:07,Dwight Powell misses free throw 1 of 2,88 - 91
10:07,Mavericks offensive team rebound,88 - 91
10:07,Bradley Beal enters the game for Marcin Gortat,88 - 91
10:07,Jason Smith enters the game for Otto Porter Jr.,88 - 91
10:07,Dwight Powell makes free throw 2 of 2,88 - 92
9:45,Kelly Oubre Jr.  misses 25-foot three point jumper,88 - 92
9:44,Dirk Nowitzki defensive rebound,88 - 92
9:29,Dirk Nowitzki  misses 25-foot three point jumper,88 - 92
9:27,Bradley Beal defensive rebound,88 - 92
9:12,Bradley Beal  misses 14-foot,88 - 92
9:11,Mavericks defensive team rebound,88 - 92
8:52,Deron Williams  misses 24-foot three point jumper,88 - 92
8:51,Wizards defensive team rebound,88 - 92
8:51,Official timeout,88 - 92
8:27,Bradley Beal  misses 19-foot two point jumper,88 - 92
8:27,Mavericks defensive team rebound,88 - 92
8:27,Jason Smith loose ball foul  (Dirk Nowitzki draws the foul),88 - 92
8:14,Deron Williams makes 7-foot two point shot,88 - 94
8:14,Trey Burke shooting foul  (Deron Williams draws the foul),88 - 95
8:14,Deron Williams makes free throw 1 of 1,88 - 95
8:14,John Wall enters the game for Trey Burke,88 - 95
7:58,Jason Smith makes driving layup (Bradley Beal assists),90 - 95
7:41,Dwight Powell offensive Charge  (Kelly Oubre Jr. draws the foul),90 - 95
7:41,Dwight Powell  turnover,90 - 95
7:24,John Wall Out-of-Bounds Bad Pass Turnover,90 - 95
7:24,Otto Porter Jr. enters the game for Marcus Thornton,90 - 95
7:05,Seth Curry makes 25-foot  three point jumper  (Deron Williams assists),90 - 98
7:05,Wizards Full timeout,90 - 98
7:05,Wesley Matthews enters the game for Dirk Nowitzki,90 - 98
7:05,Andrew Bogut enters the game for Deron Williams,90 - 98
7:05,Harrison Barnes enters the game for Dwight Powell,90 - 98
7:03,Markieff Morris enters the game for Kelly Oubre Jr.,90 - 98
7:03,Marcin Gortat enters the game for Jason Smith,90 - 98
6:48,Otto Porter Jr.  misses 23-foot three point jumper,90 - 98
6:47,Dorian Finney-Smith defensive rebound,90 - 98
6:22,Seth Curry  misses 11-foot,90 - 98
6:20,Marcin Gortat defensive rebound,90 - 98
6:18,Bradley Beal makes dunk (John Wall assists),92 - 98
6:16,Bradley Beal hanging techfoul,92 - 98
6:16,Harrison Barnes makes technical free throw,92 - 99
5:54,Wesley Matthews makes 23-foot  step back jumpshot,92 - 102
5:31,Bradley Beal makes 25-foot  three point jumper  (Marcin Gortat assists),95 - 102
5:13,Harrison Barnes makes 12-foot Driving Floating Jump Shot (Seth Curry assists),95 - 104
5:03,Bradley Beal  lost ball turnover (Dorian Finney-Smith steals),95 - 104
4:50,Wesley Matthews  misses 23-foot jump bank shot,95 - 104
4:50,Marcin Gortat defensive rebound,95 - 104
4:37,Markieff Morris makes 4-foot two point shot,97 - 104
4:37,Harrison Barnes shooting foul  (Markieff Morris draws the foul),97 - 104
4:37,Deron Williams enters the game for Seth Curry,97 - 104
4:37,Markieff Morris misses free throw 1 of 1,97 - 104
4:35,Andrew Bogut defensive rebound,97 - 104
4:18,Harrison Barnes  bad pass (Otto Porter Jr. steals),97 - 104
4:13,John Wall  out of bounds lost ball turnover,97 - 104
3:53,Deron Williams makes 25-foot  three pointer,97 - 107
3:51,Wizards Full timeout,97 - 107
3:51,Salah Mejri enters the game for Andrew Bogut,97 - 107
3:44,Bradley Beal  misses Running Pullup Jump Shot,97 - 107
3:43,Salah Mejri defensive rebound,97 - 107
3:20,Harrison Barnes  misses 22-foot jumper,97 - 107
3:19,Marcin Gortat defensive rebound,97 - 107
3:12,Harrison Barnes personal foul  (Markieff Morris draws the foul),97 - 107
3:05,John Wall makes driving layup,99 - 107
3:05,Salah Mejri shooting block foul  (John Wall draws the foul),99 - 107
3:05,John Wall makes free throw 1 of 1,100 - 107
2:50,Harrison Barnes makes 23-foot  three point jumper  (Dorian Finney-Smith assists),100 - 110
2:38,John Wall makes 8-foot Running Pullup Jump Shot,102 - 110
2:25,Harrison Barnes  misses 17-foot jumper,102 - 110
2:24,Markieff Morris defensive rebound,102 - 110
2:15,Bradley Beal makes 24-foot  three point jumper  (John Wall assists),105 - 110
1:54,Harrison Barnes  misses 14-foot two point shot,105 - 110
1:53,Marcin Gortat defensive rebound,105 - 110
1:45,Bradley Beal  misses 25-foot three point jumper,105 - 110
1:44,Dorian Finney-Smith defensive rebound,105 - 110
1:29,Deron Williams  misses 22-foot three point jumper,105 - 110
1:28,Marcin Gortat defensive rebound,105 - 110
1:23,John Wall  misses 25-foot three point pullup jump shot,105 - 110
1:21,Dorian Finney-Smith defensive rebound,105 - 110
58.0,Harrison Barnes  misses 16-foot,105 - 110
58.0,Mavericks offensive team rebound,105 - 110
58.0,shot clock turnover,105 - 110
44.0,John Wall  misses 25-foot three point jumper,105 - 110
42.0,Dorian Finney-Smith defensive rebound,105 - 110
24.0,Harrison Barnes makes 24-foot  three point jumper  (Wesley Matthews assists),105 - 113
24.0,Wizards Full timeout,105 - 113
19.0,Bradley Beal  misses 24-foot three point jumper,105 - 113
18.0,Dorian Finney-Smith defensive rebound,105 - 113
0.0,End of the 4th Quarter,105 - 113
